"Status","Start Time","Stop Time","Duration in ms","Parent Suite","Suite","Sub Suite","Test Class","Test Method","Name","Description"
"passed","Thu Sep 26 00:04:31 GMT 2024","Thu Sep 26 00:04:32 GMT 2024","1400","","Positive tests →","","Single activity with 5 web-app available item types (Text, Slider, SingleSelect, MultiSelect, NumberSelection)","","Applet builder tests → Create applet → Positive tests → Single activity with 5 web-app available item types (Text, Slider, SingleSelect, MultiSelect, NumberSelection)",""
"passed","Thu Sep 26 00:09:28 GMT 2024","Thu Sep 26 00:09:29 GMT 2024","1529","","Remove Activity →","","Get applet version by id","","Applet versions endpoints tests → Update Applet → Add Activity → Remove Activity → Get applet version by id",""
"passed","Thu Sep 26 00:05:08 GMT 2024","Thu Sep 26 00:05:10 GMT 2024","2554","","Update applet →","","Add activity","","Applet builder tests → Update applet → Add activity",""
"passed","Thu Sep 26 00:02:06 GMT 2024","Thu Sep 26 00:02:06 GMT 2024","372","","Get flow submissions list & Flow answers of respondent tests →","","404 Not Found (Get flow submission with not existing activityFlowId)","","Answers CRUD tests → Answers handling after invitation acceptance by respondent → Get flow submissions list & Flow answers of respondent tests → 404 Not Found (Get flow submission with not existing activityFlowId)",""
"passed","Thu Sep 26 00:10:01 GMT 2024","Thu Sep 26 00:10:02 GMT 2024","1263","","Upload File →","","200 OK","","Files upload/download tests → Upload File → 200 OK",""
"passed","Wed Sep 25 23:59:30 GMT 2024","Wed Sep 25 23:59:30 GMT 2024","148","","Edit Note tests →","","401 Unauthorized (Update Note with not existing token)","","Answer Notes tests → Edit Note tests → 401 Unauthorized (Update Note with not existing token)",""
"passed","Thu Sep 26 00:01:03 GMT 2024","Thu Sep 26 00:01:03 GMT 2024","339","","Retrieve latest report negative tests →","","404 Not Found (Get summary latest report with not existing Subject)","","Retrieve latest report negative tests → 404 Not Found (Get summary latest report with not existing Subject)",""
"passed","Thu Sep 26 00:11:51 GMT 2024","Thu Sep 26 00:11:51 GMT 2024","333","","Invitation Reviewer Send →","","404 - Applet does not exist","","Invitations endpoints tests → Send invitation → Invitation Reviewer Send → 404 - Applet does not exist",""
"passed","Thu Sep 26 00:09:36 GMT 2024","Thu Sep 26 00:09:36 GMT 2024","366","","Remove Activity Item →","","Get applet version changes","","Applet versions endpoints tests → Update Applet → Add Activity → Remove Activity → Add Activity Flow → Remove Activity Flow → Add Activity Item → Remove Activity Item → Get applet version changes",""
"passed","Thu Sep 26 00:11:39 GMT 2024","Thu Sep 26 00:11:39 GMT 2024","244","","Accept invitation →","","422 - invalid invitation key","","Invitations endpoints tests → Accept invitation → 422 - invalid invitation key",""
"passed","Thu Sep 26 00:01:43 GMT 2024","Thu Sep 26 00:01:43 GMT 2024","440","","Answers CRUD tests →","","Applet owner should not get any Answers in activity answers list before invitation acceptance by respondent","","Answers CRUD tests → Applet owner should not get any Answers in activity answers list before invitation acceptance by respondent",""
"passed","Thu Sep 26 00:18:36 GMT 2024","Thu Sep 26 00:18:36 GMT 2024","148","","Pin user (respondent) on workspace →","","401 Unauthorized","","Workspaces endpoints tests → Workspaces created → Pin user (respondent) on workspace → 401 Unauthorized",""
"passed","Thu Sep 26 00:13:02 GMT 2024","Thu Sep 26 00:13:02 GMT 2024","369","","Accept invitation by already registered user →","","Verify Invitation key expires after accepting the invite","","Shell account invitation scenario tests → Accept invitation by already registered user → Verify Invitation key expires after accepting the invite",""
"passed","Thu Sep 26 00:13:02 GMT 2024","Thu Sep 26 00:13:02 GMT 2024","338","","Accept invitation by already registered user →","","New user can access invitation by key","","Shell account invitation scenario tests → Accept invitation by already registered user → New user can access invitation by key",""
"passed","Thu Sep 26 00:18:12 GMT 2024","Thu Sep 26 00:18:12 GMT 2024","328","","Get user workspaces →","","Second applet owner","","Workspaces endpoints tests → Workspaces created → Get user workspaces → Second applet owner",""
"passed","Thu Sep 26 00:11:00 GMT 2024","Thu Sep 26 00:11:00 GMT 2024","150","","Logs URL","","401 Unauthorized","","Files upload/download directly to S3 bucket tests → Generate presigned links EPs negative tests Logs URL 401 Unauthorized",""
"passed","Thu Sep 26 00:17:33 GMT 2024","Thu Sep 26 00:17:33 GMT 2024","353","","Remove manager access →","","403 Forbidden (try to remove access to not-related applet)","","Workspaces managers access tests → Remove manager access → 403 Forbidden (try to remove access to not-related applet)",""
"passed","Thu Sep 26 00:07:51 GMT 2024","Thu Sep 26 00:07:51 GMT 2024","815","","Applets ""report configuration"" endpoint tests →","","200 OK","","Applets ""report configuration"" endpoint tests → 200 OK",""
"passed","Thu Sep 26 00:09:26 GMT 2024","Thu Sep 26 00:09:26 GMT 2024","340","","Add Activity →","","Get applet versions","","Applet versions endpoints tests → Update Applet → Add Activity → Get applet versions",""
"passed","Thu Sep 26 00:11:46 GMT 2024","Thu Sep 26 00:11:46 GMT 2024","148","","Invitation Respondent Send →","","401 Unauthorized (invalid token)","","Invitations endpoints tests → Send invitation → Invitation Respondent Send → 401 Unauthorized (invalid token)",""
"passed","Thu Sep 26 00:08:57 GMT 2024","Thu Sep 26 00:08:57 GMT 2024","150","","Transfer Initiate →","","401 Unauthorized","","Applet ""Transfer Ownership"" endpoints tests → Transfer Initiate → 401 Unauthorized",""
"passed","Thu Sep 26 00:00:21 GMT 2024","Thu Sep 26 00:00:23 GMT 2024","2692","","Create Answers for different item types tests →","","Multiselect item","","Create Answers for different item types tests → Multiselect item",""
"passed","Thu Sep 26 00:14:26 GMT 2024","Thu Sep 26 00:14:26 GMT 2024","392","","Export data tests →","","200 OK (Reviewer with no assigned respondents can export his own data)","","Administration tests → Applets tests → Export & view data in workspace of Applet owner tests → Export data tests → 200 OK (Reviewer with no assigned respondents can export his own data)",""
"passed","Thu Sep 26 00:02:59 GMT 2024","Thu Sep 26 00:02:59 GMT 2024","410","","Get Identifiers tests →","","404 Not Found (not existing activityId)","","Activity Versions & Identifiers tests → Get Identifiers tests → 404 Not Found (not existing activityId)",""
"passed","Thu Sep 26 00:04:21 GMT 2024","Thu Sep 26 00:04:21 GMT 2024","761","","Delete applet →","","204 No Content","","Applets CRUD endpoints tests → Delete applet → 204 No Content",""
"passed","Thu Sep 26 00:18:25 GMT 2024","Thu Sep 26 00:18:25 GMT 2024","396","","Test for filters (query params) →","","Search by secretUserId","","Workspaces endpoints tests → Workspaces created → Get workspace respondents → Test for filters (query params) → Search by secretUserId",""
"passed","Thu Sep 26 00:06:56 GMT 2024","Thu Sep 26 00:06:56 GMT 2024","254","","Create cross-day events tests →","","422 (Cross-day Event with WEEKLY periodicity type and availability range: 15:30:00-15:30:00)","","Applet Events CRUD tests → Create cross-day events tests → 422 (Cross-day Event with WEEKLY periodicity type and availability range: 15:30:00-15:30:00)",""
"passed","Thu Sep 26 00:01:32 GMT 2024","Thu Sep 26 00:01:32 GMT 2024","377","","Activity, completed within the activity flow: get activity answers list & Answers of respondent tests →","","Get Answer of respondent, created within the activity flow","","Answers scenario tests → Activity, completed within the activity flow: get activity answers list & Answers of respondent tests → Get Answer of respondent, created within the activity flow",""
"passed","Thu Sep 26 00:01:43 GMT 2024","Thu Sep 26 00:01:43 GMT 2024","324","","Answers CRUD tests →","","Respondent should not be able to submit Answer before invitation acceptance","","Answers CRUD tests → Respondent should not be able to submit Answer before invitation acceptance",""
"passed","Thu Sep 26 00:09:16 GMT 2024","Thu Sep 26 00:09:16 GMT 2024","324","","Applets ""unique_name"" endpoint tests →","","200 OK: not unique name with non-existent excludingAppletId","","Applets ""unique_name"" endpoint tests → 200 OK: not unique name with non-existent excludingAppletId",""
"passed","Wed Sep 25 23:59:27 GMT 2024","Wed Sep 25 23:59:27 GMT 2024","371","","Create Notes tests →","","403 Forbidden (Create Note by respondent)","","Answer Notes tests → Create Notes tests → 403 Forbidden (Create Note by respondent)",""
"passed","Thu Sep 26 00:16:42 GMT 2024","Thu Sep 26 00:16:42 GMT 2024","323","","Get Folders →","","200 OK (empty list)","","""Workspace Folders"" endpoints tests → Workspace is created → Get Folders → 200 OK (empty list)",""
"passed","Thu Sep 26 00:16:46 GMT 2024","Thu Sep 26 00:16:46 GMT 2024","247","","Delete Folder →","","404 Not Found (non-existent folder)","","""Workspace Folders"" endpoints tests → Workspace is created → Delete Folder → 404 Not Found (non-existent folder)",""
"passed","Thu Sep 26 00:03:46 GMT 2024","Thu Sep 26 00:03:46 GMT 2024","312","","Get Library items list","","200 OK (search by description)","","Applet Library tests → Applet is added to the library → Get Library items list 200 OK (search by description)",""
"passed","Wed Sep 25 23:59:34 GMT 2024","Wed Sep 25 23:59:34 GMT 2024","160","","Delete Note tests →","","401 Unauthorized (Delete Note with not existing token)","","Answer Notes tests → Delete Note tests → 401 Unauthorized (Delete Note with not existing token)",""
"passed","Wed Sep 25 23:59:27 GMT 2024","Wed Sep 25 23:59:27 GMT 2024","151","","Create Notes tests →","","401 Unauthorized (Create Note with not existing token)","","Answer Notes tests → Create Notes tests → 401 Unauthorized (Create Note with not existing token)",""
"passed","Thu Sep 26 00:09:39 GMT 2024","Thu Sep 26 00:09:39 GMT 2024","370","","Update Activity Item →","","Get applet version by id","","Applet versions endpoints tests → Update Applet → Add Activity → Remove Activity → Add Activity Flow → Remove Activity Flow → Add Activity Item → Remove Activity Item → Update Activity → Update Activity Item → Get applet version by id",""
"passed","Thu Sep 26 00:12:46 GMT 2024","Thu Sep 26 00:12:51 GMT 2024","5505","","Accept invitation by unregistered user →","","New user should receive an e-mail with invitation","","Shell account invitation scenario tests → Accept invitation by unregistered user → New user should receive an e-mail with invitation",""
"passed","Thu Sep 26 00:11:36 GMT 2024","Thu Sep 26 00:11:36 GMT 2024","148","","Get invitations for invitor →","","401 Unauthorized (invalid token)","","Invitations endpoints tests → Get invitations → No Invitations created → Get invitations for invitor → 401 Unauthorized (invalid token)",""
"passed","Thu Sep 26 00:06:56 GMT 2024","Thu Sep 26 00:06:56 GMT 2024","261","","Create cross-day events tests →","","422 (Cross-day Event with ONCE periodicity type and availability range: 23:59:00-23:59:00)","","Applet Events CRUD tests → Create cross-day events tests → 422 (Cross-day Event with ONCE periodicity type and availability range: 23:59:00-23:59:00)",""
"passed","Thu Sep 26 00:15:32 GMT 2024","Thu Sep 26 00:15:32 GMT 2024","475","","Delete User tests →","","401 Unauthorized (Delete User with not existing token)","","Delete User tests → 401 Unauthorized (Delete User with not existing token)",""
"passed","Thu Sep 26 00:01:56 GMT 2024","Thu Sep 26 00:01:56 GMT 2024","318","","Check answer existence tests →","","422 Unprocessable Entity (missing body params)","","Answers CRUD tests → Answers handling after invitation acceptance by respondent → Check answer existence tests → 422 Unprocessable Entity (missing body params)",""
"passed","Thu Sep 26 00:11:56 GMT 2024","Thu Sep 26 00:11:56 GMT 2024","270","","422 Missing attributes","","Missing firstName","","Invitations endpoints tests → Send invitation → Invitation Reviewer Send → 422 Missing attributes Missing firstName",""
"passed","Thu Sep 26 00:02:06 GMT 2024","Thu Sep 26 00:02:06 GMT 2024","344","","Get flow submissions list & Flow answers of respondent tests →","","404 Not Found (Get flow submission of not existing Applet)","","Answers CRUD tests → Answers handling after invitation acceptance by respondent → Get flow submissions list & Flow answers of respondent tests → 404 Not Found (Get flow submission of not existing Applet)",""
"passed","Wed Sep 25 23:59:24 GMT 2024","Wed Sep 25 23:59:24 GMT 2024","430","","Get Notes list tests →","","200 OK (Get empty Notes list)","","Answer Notes tests → Get Notes list tests → 200 OK (Get empty Notes list)",""
"passed","Thu Sep 26 00:08:08 GMT 2024","Thu Sep 26 00:08:08 GMT 2024","410","","Transfer Accept →","","First receiver accepts transfer request","","Applet ""Transfer Ownership"" scenario tests → Transfer Accept → First receiver accepts transfer request",""
"passed","Thu Sep 26 00:02:42 GMT 2024","Thu Sep 26 00:02:42 GMT 2024","386","","Get flow Versions tests →","","200 OK (default version after Applet creation)","","Flow Versions & Identifiers tests → Get flow Versions tests → 200 OK (default version after Applet creation)",""
"passed","Thu Sep 26 00:10:40 GMT 2024","Thu Sep 26 00:10:40 GMT 2024","832","","Upload answer files directly to storage (S3 bucket)","","Upload answer file directly to generated link","","Files upload/download directly to S3 bucket tests → Upload answer files directly to storage (S3 bucket) Upload answer file directly to generated link",""
"passed","Thu Sep 26 00:16:44 GMT 2024","Thu Sep 26 00:16:44 GMT 2024","377","","Update Folder →","","200 OK","","""Workspace Folders"" endpoints tests → Workspace is created → Update Folder → 200 OK",""
"passed","Thu Sep 26 00:11:09 GMT 2024","Thu Sep 26 00:11:09 GMT 2024","720","","Decline invitation positive flow →","","Invitor can see invitation before it declined","","Invitations scenario tests → Decline invitation positive flow → Invitor can see invitation before it declined",""
"passed","Thu Sep 26 00:10:26 GMT 2024","Thu Sep 26 00:10:26 GMT 2024","151","","Check logs existence →","","401 Unauthorized","","Logs upload/download tests → Check logs existence → 401 Unauthorized",""
"passed","Thu Sep 26 00:15:59 GMT 2024","Thu Sep 26 00:16:01 GMT 2024","2330","","Update Password tests →","","401 Unauthorized (User login with previous password)","","Update Password tests → 401 Unauthorized (User login with previous password)",""
"passed","Thu Sep 26 00:12:17 GMT 2024","Thu Sep 26 00:12:17 GMT 2024","746","","Accept Public invitation tests →","","404 Not found (Accept Public Invitation of deleted Applet)","","Applet public links tests → Accept Public invitation tests → 404 Not found (Accept Public Invitation of deleted Applet)",""
"passed","Thu Sep 26 00:04:17 GMT 2024","Thu Sep 26 00:04:17 GMT 2024","922","","Update applet →","","400 Bad Request (duplicate name)","","Applets CRUD endpoints tests → Update applet → 400 Bad Request (duplicate name)",""
"passed","Thu Sep 26 00:18:20 GMT 2024","Thu Sep 26 00:18:20 GMT 2024","366","","Search workspace Applets →","","200 OK (no result)","","Workspaces endpoints tests → Workspaces created → Search workspace Applets → 200 OK (no result)",""
"passed","Thu Sep 26 00:00:20 GMT 2024","Thu Sep 26 00:00:20 GMT 2024","379","","Get dates after Answer submit →","","200 OK (Get all submit dates)","","Get submit dates & exported Answers data tests → Get exported data & dates after answer submit → Get dates after Answer submit → 200 OK (Get all submit dates)",""
"passed","Thu Sep 26 00:06:42 GMT 2024","Thu Sep 26 00:06:44 GMT 2024","2408","","Count scheduled Applet Events tests →","","Count general scheduled Events after their creation and deletion","","Applet Events CRUD tests → Count scheduled Applet Events tests → Count general scheduled Events after their creation and deletion",""
"passed","Thu Sep 26 00:11:39 GMT 2024","Thu Sep 26 00:11:39 GMT 2024","339","","Accept invitation →","","404 - non-existent invitation key","","Invitations endpoints tests → Accept invitation → 404 - non-existent invitation key",""
"passed","Thu Sep 26 00:18:33 GMT 2024","Thu Sep 26 00:18:33 GMT 2024","149","","Get managers priority role →","","401 Unauthorized","","Workspaces endpoints tests → Workspaces created → Get managers priority role → 401 Unauthorized",""
"passed","Thu Sep 26 00:13:02 GMT 2024","Thu Sep 26 00:13:02 GMT 2024","494","","Accept invitation by already registered user →","","New user can accept invitation","","Shell account invitation scenario tests → Accept invitation by already registered user → New user can accept invitation",""
"passed","Thu Sep 26 00:17:27 GMT 2024","Thu Sep 26 00:17:27 GMT 2024","352","","Set workspace managers applet access list →","","404 Not Found (incorrect appletId)","","Workspaces managers access tests → Set workspace managers applet access list → 404 Not Found (incorrect appletId)",""
"passed","Thu Sep 26 00:03:21 GMT 2024","Thu Sep 26 00:03:21 GMT 2024","388","","Get Summary and Review Activities (empty list) tests →","","Get Review Activities (empty list) →","","Summary & Review activities tests → Get Summary and Review Activities (empty list) tests → Get Review Activities (empty list) →",""
"passed","Thu Sep 26 00:15:09 GMT 2024","Thu Sep 26 00:15:09 GMT 2024","424","","Get subjects","","200 OK: manager","","""Subjects"" endpoints CRUD tests → Get subjects 200 OK: manager",""
"passed","Thu Sep 26 00:01:53 GMT 2024","Thu Sep 26 00:01:53 GMT 2024","333","","422 Unprocessable Entity →","","Create Answer with missing srartTime param","","Answers CRUD tests → Answers handling after invitation acceptance by respondent → Create Answer tests → 422 Unprocessable Entity → Create Answer with missing srartTime param",""
"passed","Thu Sep 26 00:06:56 GMT 2024","Thu Sep 26 00:06:56 GMT 2024","278","","Create cross-day events tests →","","422 (Cross-day Event with MONTHLY periodicity type and availability range: 00:00:00-00:00:00)","","Applet Events CRUD tests → Create cross-day events tests → 422 (Cross-day Event with MONTHLY periodicity type and availability range: 00:00:00-00:00:00)",""
"passed","Thu Sep 26 00:15:27 GMT 2024","Thu Sep 26 00:15:27 GMT 2024","149","","422 Unprocessable Entity","","Create user with missing email param","","Create User tests → 422 Unprocessable Entity Create user with missing email param",""
"passed","Thu Sep 26 00:02:06 GMT 2024","Thu Sep 26 00:02:06 GMT 2024","394","","Get flow submissions list & Flow answers of respondent tests →","","200 OK (Get flow submission of respondent)","","Answers CRUD tests → Answers handling after invitation acceptance by respondent → Get flow submissions list & Flow answers of respondent tests → 200 OK (Get flow submission of respondent)",""
"passed","Thu Sep 26 00:07:55 GMT 2024","Thu Sep 26 00:07:55 GMT 2024","649","","Applets ""setFolder"" endpoint tests →","","422 (incorrect folderId)","","Applets ""setFolder"" endpoint tests → 422 (incorrect folderId)",""
"passed","Thu Sep 26 00:06:08 GMT 2024","Thu Sep 26 00:06:08 GMT 2024","249","","422 Unprocessable Entity →","","Create Event with missing accessBeforeSchedule (periodicity type: WEEKDAYS) param","","Applet Events CRUD tests → Create Events tests → 422 Unprocessable Entity → Create Event with missing accessBeforeSchedule (periodicity type: WEEKDAYS) param",""
"passed","Thu Sep 26 00:07:48 GMT 2024","Thu Sep 26 00:07:48 GMT 2024","242","","Invite link with { requireLogin: true } created →","","Get public applet events: 404 Not found","","Applet public access tests → Invite link with { requireLogin: true } created → Get public applet events: 404 Not found",""
"passed","Thu Sep 26 00:14:06 GMT 2024","Thu Sep 26 00:14:06 GMT 2024","452","","Invite new respondent tests →","","200 OK (Manager can invite new respondent)","","Administration tests → Respondents tests → Invite new respondent tests → 200 OK (Manager can invite new respondent)",""
"passed","Thu Sep 26 00:06:47 GMT 2024","Thu Sep 26 00:06:47 GMT 2024","381","","Delete individual scheduled Applet Events negative tests →","","404 Not Found (Delete scheduled Events of not existing user)","","Applet Events CRUD tests → Delete individual scheduled Applet Events negative tests → 404 Not Found (Delete scheduled Events of not existing user)",""
"passed","Thu Sep 26 00:03:35 GMT 2024","Thu Sep 26 00:03:35 GMT 2024","397","","Get Summary activity flow tests →","","200 OK (non-empty list)","","Summary & Review activity flow tests → Get Summary activity flow tests → 200 OK (non-empty list)",""
"passed","Wed Sep 25 23:59:38 GMT 2024","Wed Sep 25 23:59:38 GMT 2024","366","","Get applet completed activities tests →","","403 Forbidden (for another user)","","Get applet completed activities tests → 403 Forbidden (for another user)",""
"passed","Thu Sep 26 00:11:03 GMT 2024","Thu Sep 26 00:11:03 GMT 2024","368","","Accept invitation positive flow →","","Invitation can't be sent again after it acceptance by the user","","Invitations scenario tests → Accept invitation positive flow → Invitation can't be sent again after it acceptance by the user",""
"passed","Thu Sep 26 00:14:22 GMT 2024","Thu Sep 26 00:14:22 GMT 2024","489","","View General calendar in workspace of Applet owner tests →","","200 OK (Manager can view General calendar)","","Administration tests → Applets tests → View General calendar in workspace of Applet owner tests → 200 OK (Manager can view General calendar)",""
"passed","Thu Sep 26 00:09:16 GMT 2024","Thu Sep 26 00:09:16 GMT 2024","149","","Applets ""unique_name"" endpoint tests →","","401 Unauthorized","","Applets ""unique_name"" endpoint tests → 401 Unauthorized",""
"passed","Thu Sep 26 00:18:25 GMT 2024","Thu Sep 26 00:18:25 GMT 2024","387","","Test for filters (query params) →","","Search by nickname is not allowed","","Workspaces endpoints tests → Workspaces created → Get workspace respondents → Test for filters (query params) → Search by nickname is not allowed",""
"passed","Wed Sep 25 23:59:15 GMT 2024","Wed Sep 25 23:59:15 GMT 2024","400","","Create Assignments →","","403 Forbidden","","Activity Assignments tests → Negative tests → Create Assignments → 403 Forbidden",""
"passed","Thu Sep 26 00:03:03 GMT 2024","Thu Sep 26 00:03:03 GMT 2024","336","","Multiinformant assessment validate tests →","","200 OK: invalid source subject Id","","Multiinformant assessment validate tests → 200 OK: invalid source subject Id",""
"passed","Thu Sep 26 00:14:22 GMT 2024","Thu Sep 26 00:14:22 GMT 2024","467","","View General calendar in workspace of Applet owner tests →","","403 Forbidden (Reviewer can NOT view General calendar)","","Administration tests → Applets tests → View General calendar in workspace of Applet owner tests → 403 Forbidden (Reviewer can NOT view General calendar)",""
"passed","Thu Sep 26 00:07:06 GMT 2024","Thu Sep 26 00:07:10 GMT 2024","4685","","Applet Events scenario tests →","","End-To-End scenario (General scheduled flow Event)","","Applet Events scenario tests → End-To-End scenario (General scheduled flow Event)",""
"passed","Thu Sep 26 00:04:08 GMT 2024","Thu Sep 26 00:04:08 GMT 2024","900","","Get applets list →","","200 OK (not-empty list)","","Applets CRUD endpoints tests → Get applets list → 200 OK (not-empty list)",""
"passed","Thu Sep 26 00:17:45 GMT 2024","Thu Sep 26 00:17:46 GMT 2024","1568","","Change user's role (E2E scenario) →","","Change user's role from manager to reviewer","","Workspaces managers access tests → Change user's role (E2E scenario) → Change user's role from manager to reviewer",""
"passed","Thu Sep 26 00:15:11 GMT 2024","Thu Sep 26 00:15:11 GMT 2024","149","","Update subjects","","401: Unauthorized","","""Subjects"" endpoints CRUD tests → Update subjects 401: Unauthorized",""
"passed","Thu Sep 26 00:02:46 GMT 2024","Thu Sep 26 00:02:46 GMT 2024","348","","Get flow Identifiers tests →","","200 OK (empty list of flow identifiers)","","Flow Versions & Identifiers tests → Get flow Identifiers tests → 200 OK (empty list of flow identifiers)",""
"passed","Thu Sep 26 00:07:55 GMT 2024","Thu Sep 26 00:07:55 GMT 2024","355","","Applets ""setFolder"" endpoint tests →","","200 OK (set folder)","","Applets ""setFolder"" endpoint tests → 200 OK (set folder)",""
"passed","Thu Sep 26 00:09:46 GMT 2024","Thu Sep 26 00:09:46 GMT 2024","845","","Get Token →","","200 OK","","""Authentication"" endpoints tests → Get Token → 200 OK",""
"passed","Thu Sep 26 00:12:04 GMT 2024","Thu Sep 26 00:12:04 GMT 2024","245","","422 Missing attributes","","Missing email","","Invitations endpoints tests → Send invitation → Invitation Managers Send → 422 Missing attributes Missing email",""
"passed","Thu Sep 26 00:05:33 GMT 2024","Thu Sep 26 00:05:33 GMT 2024","342","","200 OK →","","1 indefinitely","","Applets ""retentions"" endpoint tests → 200 OK → 1 indefinitely",""
