"DESCRIPTION","DURATION IN MS","NAME","PARENT SUITE","START TIME","STATUS","STOP TIME","SUB SUITE","SUITE","TEST CLASS","TEST METHOD"
"","844","Administration tests → Respondents tests → Set schedule for respondents tests → 403 Forbidden (Editor can NOT schedule Event)","","Fri May 30 19:48:33 GMT 2025","passed","Fri May 30 19:48:33 GMT 2025","","Set schedule for respondents tests →","403 Forbidden (Editor can NOT schedule Event)",""
"","1","Answers scenario tests → Activity, completed within the activity flow: get activity answers list & Answers of respondent tests → Get activity answers list with answer, created within the activity flow","","Fri May 30 19:31:41 GMT 2025","failed","Fri May 30 19:31:41 GMT 2025","","Activity, completed within the activity flow: get activity answers list & Answers of respondent tests →","Get activity answers list with answer, created within the activity flow",""
"","2188","Administration tests → Applets tests → Duplicate Applet in workspace of Applet owner tests → 403 Forbidden (Reviewer can NOT duplicate Applet)","","Fri May 30 19:50:10 GMT 2025","passed","Fri May 30 19:50:12 GMT 2025","","Duplicate Applet in workspace of Applet owner tests →","403 Forbidden (Reviewer can NOT duplicate Applet)",""
"","15709","Files upload/download directly to S3 bucket tests → Upload files with format conversion "".webm"" media file should be converted to .mp3","","Fri May 30 19:43:14 GMT 2025","passed","Fri May 30 19:43:29 GMT 2025","","Upload files with format conversion",""".webm"" media file should be converted to .mp3",""
"","311","Get submit dates & exported Answers data tests → Get exported data & dates after answer submit → 200 OK (Get exported data by editor - should see only his own data)","","Fri May 30 19:30:30 GMT 2025","passed","Fri May 30 19:30:30 GMT 2025","","Get exported data & dates after answer submit →","200 OK (Get exported data by editor - should see only his own data)",""
"","13","Invitations endpoints tests → Invite Shell account → 401: Unauthorized","","Fri May 30 19:45:54 GMT 2025","passed","Fri May 30 19:45:54 GMT 2025","","Invite Shell account →","401: Unauthorized",""
"","13","Update Password tests → 401 Unauthorized (Update password with not existing token)","","Fri May 30 19:54:18 GMT 2025","passed","Fri May 30 19:54:18 GMT 2025","","Update Password tests →","401 Unauthorized (Update password with not existing token)",""
"","371","Files upload/download tests → Download File → 404 file not found","","Fri May 30 19:42:33 GMT 2025","passed","Fri May 30 19:42:33 GMT 2025","","Download File →","404 file not found",""
"","12","Workspaces endpoints tests → Workspaces created → Pin user (respondent) on workspace → 401 Unauthorized","","Fri May 30 19:56:41 GMT 2025","passed","Fri May 30 19:56:41 GMT 2025","","Pin user (respondent) on workspace →","401 Unauthorized",""
"","257","Answers CRUD tests → Answers handling after invitation acceptance by respondent → Get activity answers list & Answers of respondent tests → 404 Not Found (Get Answer with not existing activityId)","","Fri May 30 19:32:12 GMT 2025","passed","Fri May 30 19:32:12 GMT 2025","","Get activity answers list & Answers of respondent tests →","404 Not Found (Get Answer with not existing activityId)",""
"","835","Applets ""report configuration"" endpoint tests → 404 Not Found (invalid applet id)","","Fri May 30 19:37:43 GMT 2025","passed","Fri May 30 19:37:43 GMT 2025","","Applets ""report configuration"" endpoint tests →","404 Not Found (invalid applet id)",""
"","137","Applet Events CRUD tests → Update Applet Event tests → 422 Unprocessable Entity → Update Event with missing startTime (periodicity type: ONCE) param","","Fri May 30 19:36:48 GMT 2025","passed","Fri May 30 19:36:48 GMT 2025","","422 Unprocessable Entity →","Update Event with missing startTime (periodicity type: ONCE) param",""
"","372","Applet public links tests → Accept Public invitation tests → Status of Public Invitation has not changed after its acceptance","","Fri May 30 19:46:02 GMT 2025","passed","Fri May 30 19:46:02 GMT 2025","","Accept Public invitation tests →","Status of Public Invitation has not changed after its acceptance",""
"","652","Delete and remove individual Events scenario tests → Remove individual scheduled user Events scenario tests → Third respondent should have general Always Available activity/flow Events after removal of individual scheduled activity Event","","Fri May 30 19:36:19 GMT 2025","passed","Fri May 30 19:36:19 GMT 2025","","Remove individual scheduled user Events scenario tests →","Third respondent should have general Always Available activity/flow Events after removal of individual scheduled activity Event",""
"","992","""Authentication"" endpoints tests → Get Token → 200 OK","","Fri May 30 19:41:58 GMT 2025","passed","Fri May 30 19:41:58 GMT 2025","","Get Token →","200 OK",""
"","244","Workspaces endpoints tests → Workspaces created → Get workspace Applets → Test for filters (query params) → Ordering","","Fri May 30 19:56:29 GMT 2025","passed","Fri May 30 19:56:29 GMT 2025","","Test for filters (query params) →","Ordering",""
"","225","""Workspace Folders"" endpoints tests → Workspace is created → Pin/Unpin Folder → Pin Folder → 404 Not Found (non-existent applet)","","Fri May 30 19:55:22 GMT 2025","passed","Fri May 30 19:55:22 GMT 2025","","Pin Folder →","404 Not Found (non-existent applet)",""
"","887","Invitations endpoints tests → Get invitations → Invitation created → Get invitation by key → 200 OK","","Fri May 30 19:44:41 GMT 2025","passed","Fri May 30 19:44:41 GMT 2025","","Get invitation by key →","200 OK",""
"","889","Applet Library tests → Applet is added to the library → Get Library items list 200 OK (get the whole list)","","Fri May 30 19:34:11 GMT 2025","passed","Fri May 30 19:34:11 GMT 2025","","Get Library items list","200 OK (get the whole list)",""
"","198","Workspaces endpoints tests → Workspaces created → Get workspace Folder Applets → 404 Not Found (not existing workspace)","","Fri May 30 19:56:31 GMT 2025","passed","Fri May 30 19:56:31 GMT 2025","","Get workspace Folder Applets →","404 Not Found (not existing workspace)",""
"","397","Activity Assessment & Review CRUD tests → Get Assessment & Review tests → Get Reviews tests → 403 Forbidden (Get Review by respondent)","","Fri May 30 19:32:49 GMT 2025","passed","Fri May 30 19:32:49 GMT 2025","","Get Reviews tests →","403 Forbidden (Get Review by respondent)",""
"","31","Activity Assignments tests → Negative tests → Get Assignments list → 401 Unauthorised","","Fri May 30 19:29:39 GMT 2025","passed","Fri May 30 19:29:39 GMT 2025","","Get Assignments list →","401 Unauthorised",""
"","7115","Administration tests → Respondents tests → Set schedule for respondents tests → 201 (Manager can schedule Event)","","Fri May 30 19:48:33 GMT 2025","passed","Fri May 30 19:48:40 GMT 2025","","Set schedule for respondents tests →","201 (Manager can schedule Event)",""
"","3010","Applet Events scenario tests → End-To-End scenario (General scheduled flow Event)","","Fri May 30 19:37:07 GMT 2025","passed","Fri May 30 19:37:10 GMT 2025","","Applet Events scenario tests →","End-To-End scenario (General scheduled flow Event)",""
"","350","Applet ""Transfer Ownership"" scenario tests → Transfer Accept → Old applet owner should no longer have access to the applet","","Fri May 30 19:38:15 GMT 2025","passed","Fri May 30 19:38:15 GMT 2025","","Transfer Accept →","Old applet owner should no longer have access to the applet",""
"","226","Answers CRUD tests → Answers handling after invitation acceptance by respondent → Create Answer tests → 422 Unprocessable Entity → Create Answer with missing itemIds param","","Fri May 30 19:32:08 GMT 2025","passed","Fri May 30 19:32:08 GMT 2025","","422 Unprocessable Entity →","Create Answer with missing itemIds param",""
"","131","Workspaces managers access tests → Remove manager access → 422 Missing attribute (appletIds)","","Fri May 30 19:55:54 GMT 2025","passed","Fri May 30 19:55:54 GMT 2025","","Remove manager access →","422 Missing attribute (appletIds)",""
"","774","Logs upload/download tests → Download Logs → 200 OK (empty list)","","Fri May 30 19:42:55 GMT 2025","passed","Fri May 30 19:42:55 GMT 2025","","Download Logs →","200 OK (empty list)",""
"","267","Workspaces endpoints tests → Workspaces created → Search workspace Applets → 200 OK (search by full applet name)","","Fri May 30 19:56:30 GMT 2025","passed","Fri May 30 19:56:30 GMT 2025","","Search workspace Applets →","200 OK (search by full applet name)",""
"","119","Applet Library tests → Applet is added to the library → Get Library Applet by id → 404 Not found  (invalid applet item id)","","Fri May 30 19:34:10 GMT 2025","passed","Fri May 30 19:34:10 GMT 2025","","Get Library Applet by id →","404 Not found  (invalid applet item id)",""
"","152","Applets CRUD endpoints tests → Create applet → 400 Bad request: activity key is invalid","","Fri May 30 19:34:35 GMT 2025","passed","Fri May 30 19:34:35 GMT 2025","","Create applet →","400 Bad request: activity key is invalid",""
"","507","Applet Events scenario tests → General Always Available activity & General Always Available flow Events should appear automatically after Applet creation","","Fri May 30 19:37:07 GMT 2025","passed","Fri May 30 19:37:07 GMT 2025","","Applet Events scenario tests →","General Always Available activity & General Always Available flow Events should appear automatically after Applet creation",""
"","132","Applet Events CRUD tests → Create Events tests → 422 Unprocessable Entity → Create Event with missing endTime (periodicity type: MONTHLY) param","","Fri May 30 19:36:26 GMT 2025","passed","Fri May 30 19:36:26 GMT 2025","","422 Unprocessable Entity →","Create Event with missing endTime (periodicity type: MONTHLY) param",""
"","77","Applet ""Transfer Ownership"" endpoints tests → Transfer Initiate → 401 Unauthorized","","Fri May 30 19:39:02 GMT 2025","passed","Fri May 30 19:39:02 GMT 2025","","Transfer Initiate →","401 Unauthorized",""
"","508","Summary & Review activities tests → Get Summary and Review Activities (non-empty list) tests → Get Review Activities list tests → 404 Not Found (Get Review Activities list of not existing Applet)","","Fri May 30 19:33:42 GMT 2025","passed","Fri May 30 19:33:42 GMT 2025","","Get Review Activities list tests →","404 Not Found (Get Review Activities list of not existing Applet)",""
"","14","Activity Versions & Identifiers tests → Get Identifiers tests → 401 Unauthorized (Get identifiers with not existing token)","","Fri May 30 19:33:20 GMT 2025","passed","Fri May 30 19:33:20 GMT 2025","","Get Identifiers tests →","401 Unauthorized (Get identifiers with not existing token)",""
"","135","Applets ""unique_name"" endpoint tests → 422 missing attribute (name)","","Fri May 30 19:39:20 GMT 2025","passed","Fri May 30 19:39:20 GMT 2025","","Applets ""unique_name"" endpoint tests →","422 missing attribute (name)",""
"","223","Activity Assessment & Review CRUD tests → Delete Assessment tests → 404 Not Found (Delete submitted assessment for not existing answer)","","Fri May 30 19:32:56 GMT 2025","passed","Fri May 30 19:32:56 GMT 2025","","Delete Assessment tests →","404 Not Found (Delete submitted assessment for not existing answer)",""
"","351","Workspaces endpoints tests → Workspaces created → Get workspace respondents → Test for filters (query params) → Search by nickname is not allowed","","Fri May 30 19:56:34 GMT 2025","passed","Fri May 30 19:56:34 GMT 2025","","Test for filters (query params) →","Search by nickname is not allowed",""
"","247","Invitations scenario tests → Accept invitation positive flow → Invited user can't see invitation anymore","","Fri May 30 19:43:36 GMT 2025","passed","Fri May 30 19:43:36 GMT 2025","","Accept invitation positive flow →","Invited user can't see invitation anymore",""
"","1312","Invitations endpoints tests → Send invitation → Invitation Reviewer Send → 200 OK (send to unregistered user) With workspace prefix, language: fr","","Fri May 30 19:45:36 GMT 2025","passed","Fri May 30 19:45:37 GMT 2025","","200 OK (send to unregistered user)","With workspace prefix, language: fr",""
"","207","Workspace folder for different users tests → Manager is invited to the applet → Manager creates own folder in the same workspace Applet Owner and Manager add the same applet in their folders Applet Owner creates another folder Get folders (applet owner)","","Fri May 30 19:55:33 GMT 2025","passed","Fri May 30 19:55:33 GMT 2025","","Applet Owner creates another folder","Get folders (applet owner)",""
"","872","Applet ""Transfer Ownership"" scenario tests → Transfer Decline → Applet owner should remain the same after first user has declined transfer request","","Fri May 30 19:38:38 GMT 2025","passed","Fri May 30 19:38:38 GMT 2025","","Transfer Decline →","Applet owner should remain the same after first user has declined transfer request",""
"","107","Applet Events CRUD tests → Update Applet Event tests → 422 Unprocessable Entity → Update Event with missing startTime (periodicity type: WEEKDAYS) param","","Fri May 30 19:36:48 GMT 2025","passed","Fri May 30 19:36:48 GMT 2025","","422 Unprocessable Entity →","Update Event with missing startTime (periodicity type: WEEKDAYS) param",""
"","803","Workspaces endpoints tests → Workspaces created → Pin user (respondent) on workspace → 200 OK","","Fri May 30 19:56:41 GMT 2025","failed","Fri May 30 19:56:41 GMT 2025","","Pin user (respondent) on workspace →","200 OK",""
"","437","Files upload/download tests → Upload/Download answers (applet files) → Check answer (file) uploaded → 422 Unprocessable entity","","Fri May 30 19:42:47 GMT 2025","passed","Fri May 30 19:42:47 GMT 2025","","Check answer (file) uploaded →","422 Unprocessable entity",""
"","1323","Applet ""Transfer Ownership"" scenario tests → Transfer Decline → Second receiver should become the owner","","Fri May 30 19:38:38 GMT 2025","passed","Fri May 30 19:38:39 GMT 2025","","Transfer Decline →","Second receiver should become the owner",""
"","129","Applet Events CRUD tests → Update Applet Event tests → 422 Unprocessable Entity → Update Event with missing accessBeforeSchedule (periodicity type: DAILY) param","","Fri May 30 19:36:48 GMT 2025","passed","Fri May 30 19:36:48 GMT 2025","","422 Unprocessable Entity →","Update Event with missing accessBeforeSchedule (periodicity type: DAILY) param",""
"","1197","Applet versions endpoints tests → Update Applet → Add Activity → Get applet version by id","","Fri May 30 19:39:28 GMT 2025","passed","Fri May 30 19:39:29 GMT 2025","","Add Activity →","Get applet version by id",""
"","556","Administration tests → Transfer ownership of Applet tests → 403 Forbidden (Editor can not transfer ownership)","","Fri May 30 19:47:59 GMT 2025","passed","Fri May 30 19:47:59 GMT 2025","","Transfer ownership of Applet tests →","403 Forbidden (Editor can not transfer ownership)",""
"","13","Create User tests → 422 Unprocessable Entity Create user with empty firstName param","","Fri May 30 19:54:04 GMT 2025","passed","Fri May 30 19:54:04 GMT 2025","","422 Unprocessable Entity","Create user with empty firstName param",""
"","289","Workspaces endpoints tests → Workspaces created → Get workspace applet respondent by id → 404 not found (invalid applet id)","","Fri May 30 19:56:44 GMT 2025","passed","Fri May 30 19:56:44 GMT 2025","","Get workspace applet respondent by id →","404 not found (invalid applet id)",""
"","701","Activity Assessment & Review CRUD tests → Submit Assessment tests → 401 Not Found (Submit Assessment in not existing Applet)","","Fri May 30 19:32:51 GMT 2025","passed","Fri May 30 19:32:51 GMT 2025","","Submit Assessment tests →","401 Not Found (Submit Assessment in not existing Applet)",""
"","237","Workspaces endpoints tests → Workspaces created → Update workspace applet respondent → 404 Not Found (invalid respondent id)","","Fri May 30 19:56:46 GMT 2025","passed","Fri May 30 19:56:46 GMT 2025","","Update workspace applet respondent →","404 Not Found (invalid respondent id)",""
"","259","Applet Events CRUD tests → Get general and individual Applet Events → 200 OK (without respondentId in the query)","","Fri May 30 19:36:29 GMT 2025","passed","Fri May 30 19:36:29 GMT 2025","","Get general and individual Applet Events →","200 OK (without respondentId in the query)",""
"","243","Applet Events CRUD tests → Remove individual scheduled Applet Events negative tests → 404 Not Found (Remove scheduled Events of not existing user)","","Fri May 30 19:36:55 GMT 2025","passed","Fri May 30 19:36:55 GMT 2025","","Remove individual scheduled Applet Events negative tests →","404 Not Found (Remove scheduled Events of not existing user)",""
"","14","Get User Device Information → 401 Unathorized error","","Fri May 30 19:54:32 GMT 2025","passed","Fri May 30 19:54:32 GMT 2025","","Get User Device Information →","401 Unathorized error",""
"","751","Administration tests → Respondents tests → Invite new respondent tests → 403 Forbidden (Reviewer can NOT invite new respondent)","","Fri May 30 19:48:20 GMT 2025","passed","Fri May 30 19:48:20 GMT 2025","","Invite new respondent tests →","403 Forbidden (Reviewer can NOT invite new respondent)",""
"","248","Applet Events CRUD tests → Delete all general scheduled Applet Events tests → 404 Not Found (Delete all general scheduled Events of not existing Applet)","","Fri May 30 19:36:34 GMT 2025","passed","Fri May 30 19:36:34 GMT 2025","","Delete all general scheduled Applet Events tests →","404 Not Found (Delete all general scheduled Events of not existing Applet)",""
"","130","Activity Assignments tests → Negative tests → Create Assignments → 422 Unprocessable entity: missing attribute","","Fri May 30 19:29:38 GMT 2025","passed","Fri May 30 19:29:38 GMT 2025","","Create Assignments →","422 Unprocessable entity: missing attribute",""
"","30026","Administration tests → Applets tests → Export & view data in workspace of Applet owner tests → View respondent's data tests → 200 OK (Reviewer with assigned respondents can view their data)","","Fri May 30 19:50:43 GMT 2025","failed","Fri May 30 19:51:13 GMT 2025","","View respondent's data tests →","200 OK (Reviewer with assigned respondents can view their data)",""
"","269","Get submit dates & exported Answers data tests → Get dates before Answer submit → 200 OK (Get empty submit dates)","","Fri May 30 19:30:30 GMT 2025","passed","Fri May 30 19:30:30 GMT 2025","","Get dates before Answer submit →","200 OK (Get empty submit dates)",""
"","3567","Administration tests → Applets tests → Update Applet in workspace of Applet owner tests → 403 Forbidden (Reviewer can NOT update Applet)","","Fri May 30 19:48:56 GMT 2025","passed","Fri May 30 19:48:59 GMT 2025","","Update Applet in workspace of Applet owner tests →","403 Forbidden (Reviewer can NOT update Applet)",""
"","155","Applet Events CRUD tests → Create cross-day events tests → 422 (Cross-day Event with WEEKDAYS periodicity type and availability range: 00:00:00-00:00:00)","","Fri May 30 19:36:59 GMT 2025","passed","Fri May 30 19:36:59 GMT 2025","","Create cross-day events tests →","422 (Cross-day Event with WEEKDAYS periodicity type and availability range: 00:00:00-00:00:00)",""
"","227","Answers CRUD tests → Answers handling after invitation acceptance by respondent → Check answer existence tests → 200 OK (exists = true, check by applet owner with submitId)","","Fri May 30 19:32:09 GMT 2025","passed","Fri May 30 19:32:09 GMT 2025","","Check answer existence tests →","200 OK (exists = true, check by applet owner with submitId)",""
"","213","Applet Library tests → Applet is added to the library → Update Library item → 403 Forbidden","","Fri May 30 19:34:16 GMT 2025","passed","Fri May 30 19:34:16 GMT 2025","","Update Library item →","403 Forbidden",""
"","198","Workspace folder for different users tests → Manager is invited to the applet → Manager creates own folder in the same workspace Applet Owner and Manager add the same applet in their folders Get folders (applet owner)","","Fri May 30 19:55:32 GMT 2025","passed","Fri May 30 19:55:32 GMT 2025","","Applet Owner and Manager add the same applet in their folders","Get folders (applet owner)",""
"","261","Retrieve latest report negative tests → 404 Not Found (Get summary latest report with not existing Subject)","","Fri May 30 19:31:07 GMT 2025","passed","Fri May 30 19:31:07 GMT 2025","","Retrieve latest report negative tests →","404 Not Found (Get summary latest report with not existing Subject)",""
"","610","Files upload/download directly to S3 bucket tests → Upload media files directly to storage (S3 bucket) Verify GET /fileLink returns 403 error before file is uploaded","","Fri May 30 19:43:08 GMT 2025","passed","Fri May 30 19:43:08 GMT 2025","","Upload media files directly to storage (S3 bucket)","Verify GET /fileLink returns 403 error before file is uploaded",""
"","251","Activity Assessment & Review CRUD tests → Get Assessment & Review tests → Get Reviews tests → 404 Not Found (Get Review of not existing Answer)","","Fri May 30 19:32:49 GMT 2025","passed","Fri May 30 19:32:49 GMT 2025","","Get Reviews tests →","404 Not Found (Get Review of not existing Answer)",""
"","15","Invitations endpoints tests → Send invitation → Invitation Reviewer Send → 401 Unauthorized (invalid token)","","Fri May 30 19:45:32 GMT 2025","passed","Fri May 30 19:45:32 GMT 2025","","Invitation Reviewer Send →","401 Unauthorized (invalid token)",""
"","644","Delete and remove individual Events scenario tests → Remove individual scheduled user Events scenario tests → Fourth respondent should have general Always Available activity/flow Events after removal of individual scheduled flow Event","","Fri May 30 19:36:19 GMT 2025","passed","Fri May 30 19:36:19 GMT 2025","","Remove individual scheduled user Events scenario tests →","Fourth respondent should have general Always Available activity/flow Events after removal of individual scheduled flow Event",""
"","233","Flow Versions & Identifiers tests → Get flow Identifiers tests → 200 OK (empty list of flow identifiers)","","Fri May 30 19:33:08 GMT 2025","passed","Fri May 30 19:33:08 GMT 2025","","Get flow Identifiers tests →","200 OK (empty list of flow identifiers)",""
"","596","Activity Assignments tests → Positive tests → Assign activity to full account with target limited account","","Fri May 30 19:29:35 GMT 2025","passed","Fri May 30 19:29:35 GMT 2025","","Positive tests →","Assign activity to full account with target limited account",""
"","577","Workspaces endpoints tests → Workspaces created → Get workspace applet details → 200 OK","","Fri May 30 19:56:32 GMT 2025","passed","Fri May 30 19:56:32 GMT 2025","","Get workspace applet details →","200 OK",""
"","378","Files upload/download directly to S3 bucket tests → Upload answer files directly to storage (S3 bucket) Generate presigned answer url","","Fri May 30 19:43:13 GMT 2025","passed","Fri May 30 19:43:13 GMT 2025","","Upload answer files directly to storage (S3 bucket)","Generate presigned answer url",""
"","12","Applets CRUD endpoints tests → Delete applet → 401 Unauthorized","","Fri May 30 19:34:51 GMT 2025","passed","Fri May 30 19:34:51 GMT 2025","","Delete applet →","401 Unauthorized",""
"","216","Answers CRUD tests → Answers handling after invitation acceptance by respondent → Create Answer tests → 422 Unprocessable Entity → Create Answer with missing activityId param","","Fri May 30 19:32:08 GMT 2025","passed","Fri May 30 19:32:08 GMT 2025","","422 Unprocessable Entity →","Create Answer with missing activityId param",""
"","3493","Applet builder tests → Update applet → Change item type","","Fri May 30 19:35:30 GMT 2025","passed","Fri May 30 19:35:33 GMT 2025","","Update applet →","Change item type",""
"","15","Multiinformant assessment validate tests → 401: Unauthorized","","Fri May 30 19:33:24 GMT 2025","passed","Fri May 30 19:33:24 GMT 2025","","Multiinformant assessment validate tests →","401: Unauthorized",""
"","208","Workspaces managers access tests → Set workspace managers applet access list → 403 Access denied (role = super_admin)","","Fri May 30 19:55:51 GMT 2025","passed","Fri May 30 19:55:51 GMT 2025","","Set workspace managers applet access list →","403 Access denied (role = super_admin)",""
"","727","Shell account invitation scenario tests → Accept invitation by already registered user → Send invitation to the shell account","","Fri May 30 19:46:55 GMT 2025","passed","Fri May 30 19:46:55 GMT 2025","","Accept invitation by already registered user →","Send invitation to the shell account",""
"","2995","Applet Events scenario tests → End-To-End scenario (Individual scheduled flow Event)","","Fri May 30 19:37:07 GMT 2025","passed","Fri May 30 19:37:09 GMT 2025","","Applet Events scenario tests →","End-To-End scenario (Individual scheduled flow Event)",""
"","258","Workspaces endpoints tests → Workspaces created → Get workspace managers → Test for filters (query params) → Search → Search by lastName","","Fri May 30 19:56:38 GMT 2025","passed","Fri May 30 19:56:38 GMT 2025","","Search →","Search by lastName",""
