"DESCRIPTION","DURATION IN MS","NAME","PARENT SUITE","START TIME","STATUS","STOP TIME","SUB SUITE","SUITE","TEST CLASS","TEST METHOD"
"","45","""Authentication"" endpoints tests → Get Token → 422 Unprocessable Entity (missing attribute)","","Fri May 30 19:41:58 GMT 2025","passed","Fri May 30 19:41:58 GMT 2025","","Get Token →","422 Unprocessable Entity (missing attribute)",""
"","279","Answer Notes tests → Create Notes tests → 404 Not Found (Create Note for not existing activity)","","Fri May 30 19:29:48 GMT 2025","passed","Fri May 30 19:29:48 GMT 2025","","Create Notes tests →","404 Not Found (Create Note for not existing activity)",""
"","416","Applet Events CRUD tests → Create cross-day events tests → 201 Created (Cross-day Event with WEEKDAYS periodicity type and availability range: 23:59:00-23:58:00)","","Fri May 30 19:36:59 GMT 2025","passed","Fri May 30 19:36:59 GMT 2025","","Create cross-day events tests →","201 Created (Cross-day Event with WEEKDAYS periodicity type and availability range: 23:59:00-23:58:00)",""
"","728","Applet builder tests → Create applet → Positive tests → Applet with all hidden items","","Fri May 30 19:35:09 GMT 2025","passed","Fri May 30 19:35:09 GMT 2025","","Positive tests →","Applet with all hidden items",""
"","705","Invitations endpoints tests → Send invitation → Invitation Reviewer Send → 200 OK (send to unregistered user) All properties, language: en","","Fri May 30 19:45:36 GMT 2025","passed","Fri May 30 19:45:36 GMT 2025","","200 OK (send to unregistered user)","All properties, language: en",""
"","454","Applet Events CRUD tests → Create cross-day events tests → 201 Created (Cross-day Event with MONTHLY periodicity type and availability range: 23:59:00-23:58:00)","","Fri May 30 19:36:59 GMT 2025","passed","Fri May 30 19:36:59 GMT 2025","","Create cross-day events tests →","201 Created (Cross-day Event with MONTHLY periodicity type and availability range: 23:59:00-23:58:00)",""
"","130","Applet Events CRUD tests → Create cross-day events tests → 422 (Cross-day Event with ONCE periodicity type and availability range: 00:00:00-00:00:00)","","Fri May 30 19:36:59 GMT 2025","passed","Fri May 30 19:36:59 GMT 2025","","Create cross-day events tests →","422 (Cross-day Event with ONCE periodicity type and availability range: 00:00:00-00:00:00)",""
"","386","Applet ""Transfer Ownership"" endpoints tests → Transfer Decline → 403 Forbidden (for applet owner)","","Fri May 30 19:39:11 GMT 2025","passed","Fri May 30 19:39:11 GMT 2025","","Transfer Decline →","403 Forbidden (for applet owner)",""
"","5046","Shell account invitation scenario tests → Accept invitation by unregistered user → New user should receive an e-mail with invitation","","Fri May 30 19:46:33 GMT 2025","failed","Fri May 30 19:46:38 GMT 2025","","Accept invitation by unregistered user →","New user should receive an e-mail with invitation",""
"","15","Workspaces endpoints tests → Workspaces created → Get workspace by ownerId → 401 Unauthorized","","Fri May 30 19:56:26 GMT 2025","passed","Fri May 30 19:56:26 GMT 2025","","Get workspace by ownerId →","401 Unauthorized",""
"","556","Applet Library tests → Applet is added to the library → Get Library items list 200 OK (search by name)","","Fri May 30 19:34:11 GMT 2025","passed","Fri May 30 19:34:11 GMT 2025","","Get Library items list","200 OK (search by name)",""
"","1237","Shell account invitation scenario tests → Decline invitation by unregistered user → Verify shell account remains the same in the list of respondents","","Fri May 30 19:46:45 GMT 2025","failed","Fri May 30 19:46:46 GMT 2025","","Decline invitation by unregistered user →","Verify shell account remains the same in the list of respondents",""
"","2171","Administration tests → Applets tests → View General calendar in workspace of Applet owner tests → 403 Forbidden (Respondent can NOT view General calendar)","","Fri May 30 19:50:27 GMT 2025","passed","Fri May 30 19:50:29 GMT 2025","","View General calendar in workspace of Applet owner tests →","403 Forbidden (Respondent can NOT view General calendar)",""
"","133","Update Password tests → 422 Unprocessable Entity Update password with missing prevPassword param","","Fri May 30 19:54:26 GMT 2025","passed","Fri May 30 19:54:26 GMT 2025","","422 Unprocessable Entity","Update password with missing prevPassword param",""
"","556","Workspaces endpoints tests → Workspaces created → Update workspace applet respondent → 200 OK","","Fri May 30 19:56:46 GMT 2025","failed","Fri May 30 19:56:46 GMT 2025","","Update workspace applet respondent →","200 OK",""
"","15","Files upload/download directly to S3 bucket tests → Generate presigned links EPs negative tests Answer URL 401 Unauthorized","","Fri May 30 19:43:30 GMT 2025","passed","Fri May 30 19:43:30 GMT 2025","","Answer URL","401 Unauthorized",""
"","165","Applet Events CRUD tests → Create cross-day events tests → 422 (Cross-day Event with DAILY periodicity type and availability range: 00:00:00-00:00:00)","","Fri May 30 19:36:59 GMT 2025","passed","Fri May 30 19:36:59 GMT 2025","","Create cross-day events tests →","422 (Cross-day Event with DAILY periodicity type and availability range: 00:00:00-00:00:00)",""
"","1484","Applet ""Transfer Ownership"" scenario tests → Transfer Ownership to unregistered user → New user registers in the app","","Fri May 30 19:38:49 GMT 2025","passed","Fri May 30 19:38:50 GMT 2025","","Transfer Ownership to unregistered user →","New user registers in the app",""
"","467","Invitations scenario tests → Re-send invitation flow → User accepts new invitation","","Fri May 30 19:44:05 GMT 2025","passed","Fri May 30 19:44:05 GMT 2025","","Re-send invitation flow →","User accepts new invitation",""
"","6325","Applet ""Transfer Ownership"" scenario tests → Transfer Decline → Send transfer request to two different users","","Fri May 30 19:38:38 GMT 2025","passed","Fri May 30 19:38:44 GMT 2025","","Transfer Decline →","Send transfer request to two different users",""
"","288","Activity Versions & Identifiers tests → Get Versions tests → 200 OK (default version after Applet creation)","","Fri May 30 19:33:14 GMT 2025","passed","Fri May 30 19:33:14 GMT 2025","","Get Versions tests →","200 OK (default version after Applet creation)",""
"","224","Invitations endpoints tests → Send invitation → Invitation Managers Send → 422 Missing attributes Missing firstName","","Fri May 30 19:45:47 GMT 2025","passed","Fri May 30 19:45:47 GMT 2025","","422 Missing attributes","Missing firstName",""
"","395","Shell account invitation scenario tests → Accept invitation by unregistered user → Shell account should be present in the list of respondents with ""not invited"" status before invitation is sent","","Fri May 30 19:46:33 GMT 2025","failed","Fri May 30 19:46:33 GMT 2025","","Accept invitation by unregistered user →","Shell account should be present in the list of respondents with ""not invited"" status before invitation is sent",""
"","11","User Password tests → Password recovery approve tests → 422 Unprocessable Entity Approve user password recovery with missing password param","","Fri May 30 19:54:18 GMT 2025","passed","Fri May 30 19:54:18 GMT 2025","","422 Unprocessable Entity","Approve user password recovery with missing password param",""
"","275","Workspaces endpoints tests → Workspaces created → Get workspace applet managers → First workspace applet managers","","Fri May 30 19:56:38 GMT 2025","passed","Fri May 30 19:56:38 GMT 2025","","Get workspace applet managers →","First workspace applet managers",""
"","950","Files upload/download directly to S3 bucket tests → Generate presigned links EPs negative tests Answer URL 403 Forbidden (invalid applet id)","","Fri May 30 19:43:30 GMT 2025","passed","Fri May 30 19:43:30 GMT 2025","","Answer URL","403 Forbidden (invalid applet id)",""
"","285","Applet Library tests → Applet is added to the library → Update Library item → 404 Not Found (library item)","","Fri May 30 19:34:16 GMT 2025","passed","Fri May 30 19:34:16 GMT 2025","","Update Library item →","404 Not Found (library item)",""
"","235","Invitations endpoints tests → Send invitation → Invitation Reviewer Send → 422 Missing attributes Missing email","","Fri May 30 19:45:39 GMT 2025","passed","Fri May 30 19:45:39 GMT 2025","","422 Missing attributes","Missing email",""
"","235","Applet Events CRUD tests → Delete scheduled Applet Event by Id tests → 404 Not Found (Delete individual scheduled activity Event with not existing Id)","","Fri May 30 19:36:41 GMT 2025","passed","Fri May 30 19:36:41 GMT 2025","","Delete scheduled Applet Event by Id tests →","404 Not Found (Delete individual scheduled activity Event with not existing Id)",""
"","227","Retrieve latest report negative tests → 400 Bad request (Get summary latest report with not existing Activity)","","Fri May 30 19:31:07 GMT 2025","passed","Fri May 30 19:31:07 GMT 2025","","Retrieve latest report negative tests →","400 Bad request (Get summary latest report with not existing Activity)",""
"","2533","Administration tests → Organizers tests → Invite new organizer tests → 403 Forbidden (Coordinator can NOT invite manager, coordinator, editor)","","Fri May 30 19:48:00 GMT 2025","passed","Fri May 30 19:48:02 GMT 2025","","Invite new organizer tests →","403 Forbidden (Coordinator can NOT invite manager, coordinator, editor)",""
"","3014","Applet Events scenario tests → End-To-End scenario (Individual activity Always Available Event)","","Fri May 30 19:37:07 GMT 2025","passed","Fri May 30 19:37:10 GMT 2025","","Applet Events scenario tests →","End-To-End scenario (Individual activity Always Available Event)",""
"","219","Workspaces endpoints tests → Workspaces created → Pin user (manager) on workspace → 403 Forbidden (invalid manager_id)","","Fri May 30 19:56:43 GMT 2025","passed","Fri May 30 19:56:43 GMT 2025","","Pin user (manager) on workspace →","403 Forbidden (invalid manager_id)",""
"","914","Get applet completed activities tests → 403 Forbidden (for another user)","","Fri May 30 19:29:55 GMT 2025","passed","Fri May 30 19:29:55 GMT 2025","","Get applet completed activities tests →","403 Forbidden (for another user)",""
"","637","Invitations scenario tests → Invite unregistered user flow → New user can see the applet","","Fri May 30 19:44:12 GMT 2025","passed","Fri May 30 19:44:12 GMT 2025","","Invite unregistered user flow →","New user can see the applet",""
"","14","Applets CRUD endpoints tests → Update applet → 401 Unauthorized","","Fri May 30 19:34:40 GMT 2025","passed","Fri May 30 19:34:40 GMT 2025","","Update applet →","401 Unauthorized",""
"","199","Applet Library tests → Applet is added to the library → Get Library Applet by id → 200 OK","","Fri May 30 19:34:10 GMT 2025","passed","Fri May 30 19:34:10 GMT 2025","","Get Library Applet by id →","200 OK",""
"","144","Applet Events CRUD tests → Create Events tests → 422 Unprocessable Entity → Create Event with missing timer param (timer type: TIMER)","","Fri May 30 19:36:26 GMT 2025","passed","Fri May 30 19:36:26 GMT 2025","","422 Unprocessable Entity →","Create Event with missing timer param (timer type: TIMER)",""
"","10","Create User tests → 422 Unprocessable Entity Create user with missing email param","","Fri May 30 19:54:04 GMT 2025","passed","Fri May 30 19:54:04 GMT 2025","","422 Unprocessable Entity","Create user with missing email param",""
"","113","""Workspace Folders"" endpoints tests → Workspace is created → Delete Folder → 404 Not Found (non-existent folder)","","Fri May 30 19:55:21 GMT 2025","passed","Fri May 30 19:55:21 GMT 2025","","Delete Folder →","404 Not Found (non-existent folder)",""
"","981","Administration tests → Respondents tests → View all respondents tests → 200 OK (Reviewer can NOT view respondents not assigned to him)","","Fri May 30 19:48:25 GMT 2025","passed","Fri May 30 19:48:25 GMT 2025","","View all respondents tests →","200 OK (Reviewer can NOT view respondents not assigned to him)",""
"","45","Applet versions endpoints tests → Get applet version by id → 401 Unauthorized","","Fri May 30 19:39:26 GMT 2025","passed","Fri May 30 19:39:26 GMT 2025","","Get applet version by id →","401 Unauthorized",""
"","2538","Administration tests → Applets tests → Export & view data in workspace of Applet owner tests → Export data tests → 200 OK (Manager can export data)","","Fri May 30 19:50:39 GMT 2025","passed","Fri May 30 19:50:41 GMT 2025","","Export data tests →","200 OK (Manager can export data)",""
"","416","Applet ""Transfer Ownership"" scenario tests → Transfer Accept → First receiver accepts transfer request","","Fri May 30 19:38:15 GMT 2025","passed","Fri May 30 19:38:15 GMT 2025","","Transfer Accept →","First receiver accepts transfer request",""
"","227","Workspaces endpoints tests → Workspaces created → Get user workspaces → First applet owner","","Fri May 30 19:56:25 GMT 2025","passed","Fri May 30 19:56:25 GMT 2025","","Get user workspaces →","First applet owner",""
"","377","Invitations endpoints tests → Send invitation → Invitation Reviewer Send → 400 - Incorrect respondents list","","Fri May 30 19:45:32 GMT 2025","passed","Fri May 30 19:45:32 GMT 2025","","Invitation Reviewer Send →","400 - Incorrect respondents list",""
"","1379","Administration tests → Organizers tests → Invite new organizer tests → 403 Forbidden (Editor can NOT invite manager, coordinator, editor, reviewer)","","Fri May 30 19:48:00 GMT 2025","passed","Fri May 30 19:48:01 GMT 2025","","Invite new organizer tests →","403 Forbidden (Editor can NOT invite manager, coordinator, editor, reviewer)",""
"","1524","Applet Events CRUD tests → Count scheduled Applet Events tests → Count general scheduled Events after their creation and deletion","","Fri May 30 19:36:50 GMT 2025","passed","Fri May 30 19:36:51 GMT 2025","","Count scheduled Applet Events tests →","Count general scheduled Events after their creation and deletion",""
"","126","Invitations endpoints tests → Invite Shell account → 422: Missing attribute","","Fri May 30 19:45:54 GMT 2025","passed","Fri May 30 19:45:54 GMT 2025","","Invite Shell account →","422: Missing attribute",""
"","128","Answers CRUD tests → Answers handling after invitation acceptance by respondent → Check answer existence tests → 422 Unprocessable Entity (missing body params)","","Fri May 30 19:32:09 GMT 2025","passed","Fri May 30 19:32:09 GMT 2025","","Check answer existence tests →","422 Unprocessable Entity (missing body params)",""
"","129","Applet Events CRUD tests → Create Events tests → 422 Unprocessable Entity → Create Event with missing endTime (periodicity type: ONCE) param","","Fri May 30 19:36:26 GMT 2025","passed","Fri May 30 19:36:26 GMT 2025","","422 Unprocessable Entity →","Create Event with missing endTime (periodicity type: ONCE) param",""
"","151","Invitations endpoints tests → Send invitation → Invitation Managers Send → 422 Missing attributes Missing role","","Fri May 30 19:45:47 GMT 2025","passed","Fri May 30 19:45:47 GMT 2025","","422 Missing attributes","Missing role",""
"","540","Summary & Review activities tests → Get Summary and Review Activities (non-empty list) tests → Get Review Activities list tests → 200 OK (non-empty list)","","Fri May 30 19:33:42 GMT 2025","passed","Fri May 30 19:33:42 GMT 2025","","Get Review Activities list tests →","200 OK (non-empty list)",""
"","539","Multiinformant assessment validate tests → 200 OK: invalid activity or flow id","","Fri May 30 19:33:24 GMT 2025","passed","Fri May 30 19:33:24 GMT 2025","","Multiinformant assessment validate tests →","200 OK: invalid activity or flow id",""
"","0","Answers CRUD tests → Answers handling after invitation acceptance by respondent → Get flow submissions list & Flow answers of respondent tests → 200 OK (Get flow submissions list)","","Fri May 30 19:32:16 GMT 2025","passed","Fri May 30 19:32:16 GMT 2025","","Get flow submissions list & Flow answers of respondent tests →","200 OK (Get flow submissions list)",""
"","895","Applets CRUD endpoints tests → Update applet → 404 Applet not found","","Fri May 30 19:34:40 GMT 2025","passed","Fri May 30 19:34:40 GMT 2025","","Update applet →","404 Applet not found",""
"","120","Applets ""retentions"" endpoint tests → 400 / 422 Bad Request → Invalid retention value","","Fri May 30 19:36:01 GMT 2025","passed","Fri May 30 19:36:01 GMT 2025","","400 / 422 Bad Request →","Invalid retention value",""
"","1284","Applet builder tests → Create applet → Positive tests → Applet with maximum items settings","","Fri May 30 19:35:09 GMT 2025","passed","Fri May 30 19:35:10 GMT 2025","","Positive tests →","Applet with maximum items settings",""
"","5107","Applet ""Transfer Ownership"" scenario tests → Transfer Ownership to unregistered user → Unregistered user should receive invitation e-mail","","Fri May 30 19:38:49 GMT 2025","passed","Fri May 30 19:38:54 GMT 2025","","Transfer Ownership to unregistered user →","Unregistered user should receive invitation e-mail",""
"","269","Workspace folder for different users tests → Manager is invited to the applet → Manager creates own folder in the same workspace Applet Owner and Manager add the same applet in their folders Applet Owner creates another folder Get folders (manager)","","Fri May 30 19:55:33 GMT 2025","passed","Fri May 30 19:55:33 GMT 2025","","Applet Owner creates another folder","Get folders (manager)",""
"","253","Workspaces endpoints tests → Workspaces created → Get workspace applet managers → Second workspace second applet managers","","Fri May 30 19:56:38 GMT 2025","passed","Fri May 30 19:56:38 GMT 2025","","Get workspace applet managers →","Second workspace second applet managers",""
"","16","Invitations endpoints tests → Get invitations → No Invitations created → Get invitations for invitor → 401 Unauthorized (invalid token)","","Fri May 30 19:44:34 GMT 2025","passed","Fri May 30 19:44:34 GMT 2025","","Get invitations for invitor →","401 Unauthorized (invalid token)",""
"","472","Files upload/download tests → Upload/Download answers (applet files) → Download Answer → 404 file not found","","Fri May 30 19:42:41 GMT 2025","passed","Fri May 30 19:42:41 GMT 2025","","Download Answer →","404 file not found",""
"","270","Get submit dates & exported Answers data tests → Get exported data before Answer submit → 200 OK (Get empty exported data)","","Fri May 30 19:30:29 GMT 2025","passed","Fri May 30 19:30:29 GMT 2025","","Get exported data before Answer submit →","200 OK (Get empty exported data)",""
"","116","Applet Events CRUD tests → Create Events tests → 422 Unprocessable Entity → Missing oneTimeCompletion (periodicity type: ALWAYS)","","Fri May 30 19:36:26 GMT 2025","passed","Fri May 30 19:36:26 GMT 2025","","422 Unprocessable Entity →","Missing oneTimeCompletion (periodicity type: ALWAYS)",""
"","221","Workspaces endpoints tests → Workspaces created → Get workspace applet respondent by id → 403 Forbidden","","Fri May 30 19:56:44 GMT 2025","passed","Fri May 30 19:56:44 GMT 2025","","Get workspace applet respondent by id →","403 Forbidden",""
"","346","Invitations endpoints tests → Create shell account → 200 OK: shell account with min required attributes","","Fri May 30 19:45:48 GMT 2025","passed","Fri May 30 19:45:48 GMT 2025","","Create shell account →","200 OK: shell account with min required attributes",""
"","289","Applets ""setFolder"" endpoint tests → 404 (incorrect appletId)","","Fri May 30 19:37:58 GMT 2025","passed","Fri May 30 19:37:58 GMT 2025","","Applets ""setFolder"" endpoint tests →","404 (incorrect appletId)",""
"","277","Applet public access tests → Get public applet base info by key → 200 OK","","Fri May 30 19:37:34 GMT 2025","passed","Fri May 30 19:37:34 GMT 2025","","Get public applet base info by key →","200 OK",""
"","73","Logs upload/download tests → Download Logs → 401 Unauthorized","","Fri May 30 19:42:55 GMT 2025","passed","Fri May 30 19:42:55 GMT 2025","","Download Logs →","401 Unauthorized",""
"","233","Workspaces endpoints tests → Workspaces created → Get workspace Applets → Respondent gets own applets","","Fri May 30 19:56:27 GMT 2025","passed","Fri May 30 19:56:27 GMT 2025","","Get workspace Applets →","Respondent gets own applets",""
"","523","Administration tests → Organizers tests → View all organizers tests → 200 OK (Manager can view organizers)","","Fri May 30 19:48:13 GMT 2025","passed","Fri May 30 19:48:13 GMT 2025","","View all organizers tests →","200 OK (Manager can view organizers)",""
"","478","Activity Assignments tests → Positive tests → Create empty assignment","","Fri May 30 19:29:35 GMT 2025","passed","Fri May 30 19:29:35 GMT 2025","","Positive tests →","Create empty assignment",""
"","15","Applets CRUD endpoints tests → Get applets list → 401 Unauthorized","","Fri May 30 19:34:32 GMT 2025","passed","Fri May 30 19:34:32 GMT 2025","","Get applets list →","401 Unauthorized",""
"","370","Applet Events CRUD tests → Create cross-day events tests → 201 Created (Cross-day Event with DAILY periodicity type and availability range: 23:59:00-23:58:00)","","Fri May 30 19:36:59 GMT 2025","passed","Fri May 30 19:36:59 GMT 2025","","Create cross-day events tests →","201 Created (Cross-day Event with DAILY periodicity type and availability range: 23:59:00-23:58:00)",""
"","445","Workspace folder for different users tests → Manager is invited to the applet → Get folders (manager)","","Fri May 30 19:55:30 GMT 2025","passed","Fri May 30 19:55:30 GMT 2025","","Manager is invited to the applet →","Get folders (manager)",""
"","495","Administration tests → Applets tests → Export & view data in workspace of Applet owner tests → Export data tests → 200 OK (Reviewer with assigned respondents can export data)","","Fri May 30 19:50:39 GMT 2025","passed","Fri May 30 19:50:39 GMT 2025","","Export data tests →","200 OK (Reviewer with assigned respondents can export data)",""
"","198","Workspaces endpoints tests → Workspaces created → Get managers priority role → 404 Not Found (Invalid ownerId)","","Fri May 30 19:56:39 GMT 2025","passed","Fri May 30 19:56:39 GMT 2025","","Get managers priority role →","404 Not Found (Invalid ownerId)",""
"","404","Applet ""Transfer Ownership"" scenario tests → Transfer Accept → First receiver should become the owner → Verify transferred applet details","","Fri May 30 19:38:35 GMT 2025","passed","Fri May 30 19:38:35 GMT 2025","","First receiver should become the owner →","Verify transferred applet details",""
"","2401","User Password tests → Password recovery approve tests → User can login with initial password after failed password recovery approve","","Fri May 30 19:54:09 GMT 2025","passed","Fri May 30 19:54:11 GMT 2025","","Password recovery approve tests →","User can login with initial password after failed password recovery approve",""
"","153","Applet Events CRUD tests → Update Applet Event tests → 422 Unprocessable Entity → Update Event with missing endTime (periodicity type: WEEKLY) param","","Fri May 30 19:36:48 GMT 2025","passed","Fri May 30 19:36:48 GMT 2025","","422 Unprocessable Entity →","Update Event with missing endTime (periodicity type: WEEKLY) param",""
"","333","Administration tests → Perform activities tests → 200 OK (Editor can submit answers)","","Fri May 30 19:53:52 GMT 2025","failed","Fri May 30 19:53:52 GMT 2025","","Perform activities tests →","200 OK (Editor can submit answers)",""
"","714","Administration tests → Applets tests → Duplicate Applet in workspace of Applet owner tests → 403 Forbidden (Respondent can NOT duplicate Applet)","","Fri May 30 19:50:10 GMT 2025","passed","Fri May 30 19:50:10 GMT 2025","","Duplicate Applet in workspace of Applet owner tests →","403 Forbidden (Respondent can NOT duplicate Applet)",""
"","253","Answers CRUD tests → Answers handling after invitation acceptance by respondent → Get activity answers list & Answers of respondent tests → Get Activity answers list & Answers of deleted Applet → 404 Not Found (Get Activity answers list of deleted Applet)","","Fri May 30 19:32:15 GMT 2025","passed","Fri May 30 19:32:15 GMT 2025","","Get Activity answers list & Answers of deleted Applet →","404 Not Found (Get Activity answers list of deleted Applet)",""
"","334","Answers CRUD tests → Answers handling after invitation acceptance by respondent → Create Answer tests → 201 Create Answer","","Fri May 30 19:32:06 GMT 2025","passed","Fri May 30 19:32:06 GMT 2025","","Create Answer tests →","201 Create Answer",""
"","104","Invitations endpoints tests → Send invitation → Invitation Respondent Send → 422 Missing attributes Missing lastName","","Fri May 30 19:45:31 GMT 2025","passed","Fri May 30 19:45:31 GMT 2025","","422 Missing attributes","Missing lastName",""
"","129","Applet Events CRUD tests → Create Events tests → 422 Unprocessable Entity → Create Event with missing startTime (periodicity type: WEEKDAYS) param","","Fri May 30 19:36:26 GMT 2025","passed","Fri May 30 19:36:26 GMT 2025","","422 Unprocessable Entity →","Create Event with missing startTime (periodicity type: WEEKDAYS) param",""
"","2455","Applet versions endpoints tests → Update Applet → Add Activity → Remove Activity → Add Activity Flow → Remove Activity Flow → Add Activity Item → Remove Activity Item → Update Activity → Update Activity Item → Update Activity Flow → Update Applet description → Get applet versions","","Fri May 30 19:41:30 GMT 2025","passed","Fri May 30 19:41:32 GMT 2025","","Update Applet description →","Get applet versions",""
