"DESCRIPTION","DURATION IN MS","NAME","PARENT SUITE","START TIME","STATUS","STOP TIME","SUB SUITE","SUITE","TEST CLASS","TEST METHOD"
"","702","Workspaces endpoints tests → Workspaces created → Get managers priority role → 200 OK (Reviewer gets role in first user's workspace)","","Wed Jun 18 14:55:04 GMT 2025","passed","Wed Jun 18 14:55:04 GMT 2025","","Get managers priority role →","200 OK (Reviewer gets role in first user's workspace)",""
"","694","Administration tests → Respondents tests → Invite new respondent tests → 200 OK (Manager can invite new respondent)","","Wed Jun 18 14:48:58 GMT 2025","passed","Wed Jun 18 14:48:58 GMT 2025","","Invite new respondent tests →","200 OK (Manager can invite new respondent)",""
"","173","Invitations endpoints tests → Decline invitation → 401 Unauthorized (invalid token)","","Wed Jun 18 14:46:31 GMT 2025","passed","Wed Jun 18 14:46:31 GMT 2025","","Decline invitation →","401 Unauthorized (invalid token)",""
"","1276","Answers scenario tests → Activity, completed within the activity flow: get activity answers list & Answers of respondent tests → Get Answer of respondent, created within the activity flow","","Wed Jun 18 14:28:48 GMT 2025","passed","Wed Jun 18 14:28:49 GMT 2025","","Activity, completed within the activity flow: get activity answers list & Answers of respondent tests →","Get Answer of respondent, created within the activity flow",""
"","175","Get applet completed activities tests → 401 Unauthorized","","Wed Jun 18 14:26:12 GMT 2025","passed","Wed Jun 18 14:26:12 GMT 2025","","Get applet completed activities tests →","401 Unauthorized",""
"","618","Files upload/download directly to S3 bucket tests → Upload media files directly to storage (S3 bucket) Verify GET /fileLink returns 403 error before file is uploaded","","Wed Jun 18 14:45:20 GMT 2025","passed","Wed Jun 18 14:45:20 GMT 2025","","Upload media files directly to storage (S3 bucket)","Verify GET /fileLink returns 403 error before file is uploaded",""
"","234","Applet Events CRUD tests → Create Events tests → 401 Unauthorized (Create general scheduled activity Event with not existing appletOwnerToken)","","Wed Jun 18 14:37:24 GMT 2025","passed","Wed Jun 18 14:37:24 GMT 2025","","Create Events tests →","401 Unauthorized (Create general scheduled activity Event with not existing appletOwnerToken)",""
"","438","""Subjects"" endpoints CRUD tests → Update subjects 404: Not Found","","Wed Jun 18 14:51:08 GMT 2025","passed","Wed Jun 18 14:51:08 GMT 2025","","Update subjects","404: Not Found",""
"","1138","Applet Library tests → Applet is added to the library → Update Library item → 200 OK","","Wed Jun 18 14:34:10 GMT 2025","passed","Wed Jun 18 14:34:11 GMT 2025","","Update Library item →","200 OK",""
"","1045","Applet builder tests → Create applet → Positive tests → Applet with maximum items settings","","Wed Jun 18 14:35:40 GMT 2025","passed","Wed Jun 18 14:35:41 GMT 2025","","Positive tests →","Applet with maximum items settings",""
"","509","Workspaces managers access tests → Set workspace managers applet access list → 400 Bad Request (empty respondents list for reviewer)","","Wed Jun 18 14:53:25 GMT 2025","passed","Wed Jun 18 14:53:25 GMT 2025","","Set workspace managers applet access list →","400 Bad Request (empty respondents list for reviewer)",""
"","281","Administration tests → Respondents tests → Invite new reviewer for a specific respondent tests → 403 Forbidden (Editor can NOT invite new reviewer for a specific respondent)","","Wed Jun 18 14:49:04 GMT 2025","passed","Wed Jun 18 14:49:04 GMT 2025","","Invite new reviewer for a specific respondent tests →","403 Forbidden (Editor can NOT invite new reviewer for a specific respondent)",""
"","301","Applet Events CRUD tests → Remove individual scheduled Applet Events negative tests → 404 Not Found (Remove scheduled Events of not existing user)","","Wed Jun 18 14:38:22 GMT 2025","passed","Wed Jun 18 14:38:22 GMT 2025","","Remove individual scheduled Applet Events negative tests →","404 Not Found (Remove scheduled Events of not existing user)",""
"","321","Applet Events CRUD tests → Create Events tests → 422 Unprocessable Entity → Create Event with missing accessBeforeSchedule (periodicity type: WEEKDAYS) param","","Wed Jun 18 14:37:27 GMT 2025","passed","Wed Jun 18 14:37:27 GMT 2025","","422 Unprocessable Entity →","Create Event with missing accessBeforeSchedule (periodicity type: WEEKDAYS) param",""
"","282","Applet builder tests → Create applet → Negative tests → Duplicate Item name","","Wed Jun 18 14:35:57 GMT 2025","passed","Wed Jun 18 14:35:57 GMT 2025","","Negative tests →","Duplicate Item name",""
"","1075","Answer Notes tests → Delete Note tests → 404 Not Found (Delete not existing Note)","","Wed Jun 18 14:26:00 GMT 2025","passed","Wed Jun 18 14:26:01 GMT 2025","","Delete Note tests →","404 Not Found (Delete not existing Note)",""
"","627","Workspaces endpoints tests → Workspaces created → Get workspace Folder Applets → 200 OK (no result)","","Wed Jun 18 14:54:22 GMT 2025","passed","Wed Jun 18 14:54:22 GMT 2025","","Get workspace Folder Applets →","200 OK (no result)",""
"","460","Multiinformant assessment validate tests → 200 OK: sourceSubjectId = targetSubjectId = ownerSubjectId","","Wed Jun 18 14:33:06 GMT 2025","passed","Wed Jun 18 14:33:06 GMT 2025","","Multiinformant assessment validate tests →","200 OK: sourceSubjectId = targetSubjectId = ownerSubjectId",""
"","370","Get applet completed activities tests → 403 Forbidden (for another user)","","Wed Jun 18 14:26:12 GMT 2025","passed","Wed Jun 18 14:26:12 GMT 2025","","Get applet completed activities tests →","403 Forbidden (for another user)",""
"","65","""Workspace Folders"" endpoints tests → Workspace is created → Pin/Unpin Folder → Unpin Folder → 401 Unauthorized (invalid token)","","Wed Jun 18 14:52:50 GMT 2025","passed","Wed Jun 18 14:52:50 GMT 2025","","Unpin Folder →","401 Unauthorized (invalid token)",""
"","295","Answers CRUD tests → Answers handling after invitation acceptance by respondent → Get flow submissions list & Flow answers of respondent tests → 404 Not Found (Get flow submissions list of not existing Applet)","","Wed Jun 18 14:29:49 GMT 2025","passed","Wed Jun 18 14:29:49 GMT 2025","","Get flow submissions list & Flow answers of respondent tests →","404 Not Found (Get flow submissions list of not existing Applet)",""
"","218","Invitations endpoints tests → Create shell account → 422: Missing attribute","","Wed Jun 18 14:46:53 GMT 2025","passed","Wed Jun 18 14:46:53 GMT 2025","","Create shell account →","422: Missing attribute",""
"","456","Applet versions endpoints tests → Update Applet → Add Activity → Remove Activity → Add Activity Flow → Remove Activity Flow → Add Activity Item → Remove Activity Item → Update Activity → Update Activity Item → Get applet version changes","","Wed Jun 18 14:44:17 GMT 2025","passed","Wed Jun 18 14:44:17 GMT 2025","","Update Activity Item →","Get applet version changes",""
"","307","Access link tests → Create Access link tests → 401 Unauthorized (Create Access link with invalid token)","","Wed Jun 18 14:34:20 GMT 2025","passed","Wed Jun 18 14:34:20 GMT 2025","","Create Access link tests →","401 Unauthorized (Create Access link with invalid token)",""
"","212","Applets CRUD endpoints tests → Create applet → 422 Unprocessable Entity (missing attribute) Missing ""activities""","","Wed Jun 18 14:34:40 GMT 2025","passed","Wed Jun 18 14:34:40 GMT 2025","","422 Unprocessable Entity (missing attribute)","Missing ""activities""",""
"","503","Applet builder tests → Create applet → Negative tests → Incorrect conditional logic config (drawing item config)","","Wed Jun 18 14:35:57 GMT 2025","passed","Wed Jun 18 14:35:57 GMT 2025","","Negative tests →","Incorrect conditional logic config (drawing item config)",""
"","288","Logs upload/download tests → Check logs existence → 200 OK (uploaded = false)","","Wed Jun 18 14:45:14 GMT 2025","passed","Wed Jun 18 14:45:14 GMT 2025","","Check logs existence →","200 OK (uploaded = false)",""
"","1116","Applets ""setFolder"" endpoint tests → 200 OK (set folder)","","Wed Jun 18 14:41:11 GMT 2025","passed","Wed Jun 18 14:41:12 GMT 2025","","Applets ""setFolder"" endpoint tests →","200 OK (set folder)",""
"","493","""Authentication"" endpoints tests → Tokens invalidation tests → Verify refreshToken is invalidated but access token is still alive","","Wed Jun 18 14:44:38 GMT 2025","passed","Wed Jun 18 14:44:38 GMT 2025","","Tokens invalidation tests →","Verify refreshToken is invalidated but access token is still alive",""
"","4575","Applet Events scenario tests → End-To-End scenario (General scheduled flow Event)","","Wed Jun 18 14:39:13 GMT 2025","passed","Wed Jun 18 14:39:17 GMT 2025","","Applet Events scenario tests →","End-To-End scenario (General scheduled flow Event)",""
"","490","Activity Assessment & Review CRUD tests → Delete Assessment tests → 404 Not Found (Delete submitted assessment for not existing answer)","","Wed Jun 18 14:30:56 GMT 2025","passed","Wed Jun 18 14:30:56 GMT 2025","","Delete Assessment tests →","404 Not Found (Delete submitted assessment for not existing answer)",""
"","1395","Administration tests → Organizers tests → Invite new organizer tests → 403 Forbidden (Respondent can NOT invite manager, coordinator, editor, reviewer)","","Wed Jun 18 14:48:44 GMT 2025","passed","Wed Jun 18 14:48:45 GMT 2025","","Invite new organizer tests →","403 Forbidden (Respondent can NOT invite manager, coordinator, editor, reviewer)",""
"","1120","Get submit dates & exported Answers data tests → Get exported data & dates after answer submit → 200 OK: empty list (Get exported data by reviewer with no assigned respondents)","","Wed Jun 18 14:26:54 GMT 2025","passed","Wed Jun 18 14:26:55 GMT 2025","","Get exported data & dates after answer submit →","200 OK: empty list (Get exported data by reviewer with no assigned respondents)",""
"","169","Logs upload/download tests → Download Logs → 401 Unauthorized","","Wed Jun 18 14:45:10 GMT 2025","passed","Wed Jun 18 14:45:10 GMT 2025","","Download Logs →","401 Unauthorized",""
"","1102","Answer Notes tests → Edit Note tests → 404 Not Found (Update Note in not existing Applet)","","Wed Jun 18 14:25:47 GMT 2025","passed","Wed Jun 18 14:25:48 GMT 2025","","Edit Note tests →","404 Not Found (Update Note in not existing Applet)",""
"","543","Files upload/download directly to S3 bucket tests → Upload answer files directly to storage (S3 bucket) Upload answer file directly to generated link","","Wed Jun 18 14:45:26 GMT 2025","passed","Wed Jun 18 14:45:26 GMT 2025","","Upload answer files directly to storage (S3 bucket)","Upload answer file directly to generated link",""
"","196","Applets ""retentions"" endpoint tests → 400 / 422 Bad Request → Invalid retention value","","Wed Jun 18 14:36:51 GMT 2025","passed","Wed Jun 18 14:36:51 GMT 2025","","400 / 422 Bad Request →","Invalid retention value",""
"","1919","Shell account invitation scenario tests → Accept invitation by unregistered user → New user registers in the app","","Wed Jun 18 14:47:36 GMT 2025","passed","Wed Jun 18 14:47:37 GMT 2025","","Accept invitation by unregistered user →","New user registers in the app",""
"","309","Applets ""unique_name"" endpoint tests → 422 invalid attribute (excludingAppletId)","","Wed Jun 18 14:43:17 GMT 2025","passed","Wed Jun 18 14:43:17 GMT 2025","","Applets ""unique_name"" endpoint tests →","422 invalid attribute (excludingAppletId)",""
"","1069","""Workspace Folders"" endpoints tests → Workspace is created → Pin/Unpin Folder → Unpin Folder → 400 (applet not in folder)","","Wed Jun 18 14:52:50 GMT 2025","passed","Wed Jun 18 14:52:51 GMT 2025","","Unpin Folder →","400 (applet not in folder)",""
"","1156","Administration tests → Applets tests → Duplicate Applet in workspace of Applet owner tests → 201 Created (Manager can duplicate Applet)","","Wed Jun 18 14:49:22 GMT 2025","passed","Wed Jun 18 14:49:23 GMT 2025","","Duplicate Applet in workspace of Applet owner tests →","201 Created (Manager can duplicate Applet)",""
"","675","Applet builder tests → Create applet → Positive tests → Multiple activity with multiple items in each","","Wed Jun 18 14:35:40 GMT 2025","passed","Wed Jun 18 14:35:40 GMT 2025","","Positive tests →","Multiple activity with multiple items in each",""
"","434","Flow Versions & Identifiers tests → Get flow Versions tests → 404 Not Found (Get flow versions of not existing Applet)","","Wed Jun 18 14:31:07 GMT 2025","passed","Wed Jun 18 14:31:07 GMT 2025","","Get flow Versions tests →","404 Not Found (Get flow versions of not existing Applet)",""
"","175","""Themes"" endpoints tests → Delete Theme → 404 Not Found (non-existent theme)","","Wed Jun 18 14:51:23 GMT 2025","passed","Wed Jun 18 14:51:23 GMT 2025","","Delete Theme →","404 Not Found (non-existent theme)",""
"","366","Invitations endpoints tests → Send invitation → Invitation Reviewer Send → 422 Missing attributes Missing firstName","","Wed Jun 18 14:46:44 GMT 2025","passed","Wed Jun 18 14:46:44 GMT 2025","","422 Missing attributes","Missing firstName",""
"","380","Invitations endpoints tests → Send invitation → Invitation Reviewer Send → 422 Missing attributes Missing lastName","","Wed Jun 18 14:46:44 GMT 2025","passed","Wed Jun 18 14:46:44 GMT 2025","","422 Missing attributes","Missing lastName",""
"","380","Get applet completed activities tests → Respondent completes the 1st activity within default always available event → 200 OK (empty list): incorrect applet version","","Wed Jun 18 14:26:24 GMT 2025","passed","Wed Jun 18 14:26:24 GMT 2025","","Respondent completes the 1st activity within default always available event →","200 OK (empty list): incorrect applet version",""
"","325","Answers CRUD tests → Answers handling after invitation acceptance by respondent → Check answer existence tests → 200 OK (exists = false, non-existent activity id)","","Wed Jun 18 14:29:38 GMT 2025","passed","Wed Jun 18 14:29:38 GMT 2025","","Check answer existence tests →","200 OK (exists = false, non-existent activity id)",""
"","349","Applet Events CRUD tests → Create Events tests → 422 Unprocessable Entity → Create Event with missing accessBeforeSchedule (periodicity type: ONCE) param","","Wed Jun 18 14:37:27 GMT 2025","passed","Wed Jun 18 14:37:27 GMT 2025","","422 Unprocessable Entity →","Create Event with missing accessBeforeSchedule (periodicity type: ONCE) param",""
"","1932","Workspaces endpoints tests → Workspaces created → Get workspace applet respondents → First workspace applet respondents","","Wed Jun 18 14:54:44 GMT 2025","failed","Wed Jun 18 14:54:45 GMT 2025","","Get workspace applet respondents →","First workspace applet respondents",""
"","184","Applet Events CRUD tests → Create Events tests → 422 Unprocessable Entity → Create Event with missing endTime (periodicity type: DAILY) param","","Wed Jun 18 14:37:27 GMT 2025","passed","Wed Jun 18 14:37:27 GMT 2025","","422 Unprocessable Entity →","Create Event with missing endTime (periodicity type: DAILY) param",""
"","450","Applet Events CRUD tests → Create Events tests → 400 Bad Request (Create general Always Available activity Event)","","Wed Jun 18 14:37:24 GMT 2025","passed","Wed Jun 18 14:37:24 GMT 2025","","Create Events tests →","400 Bad Request (Create general Always Available activity Event)",""
"","241","Applets ""unique_name"" endpoint tests → 200 OK: not unique name (case insensitive)","","Wed Jun 18 14:43:17 GMT 2025","passed","Wed Jun 18 14:43:17 GMT 2025","","Applets ""unique_name"" endpoint tests →","200 OK: not unique name (case insensitive)",""
"","957","Flow Versions & Identifiers tests → Get flow Identifiers tests → 200: Empty list (not existing activityFlowId)","","Wed Jun 18 14:31:21 GMT 2025","passed","Wed Jun 18 14:31:21 GMT 2025","","Get flow Identifiers tests →","200: Empty list (not existing activityFlowId)",""
"","224","Files upload/download tests → Upload File → 401 Unauthorized","","Wed Jun 18 14:44:44 GMT 2025","passed","Wed Jun 18 14:44:44 GMT 2025","","Upload File →","401 Unauthorized",""
"","1","Answers scenario tests → Activity, completed within the activity flow: get activity answers list & Answers of respondent tests → Get activity answers list with answer, created within the activity flow","","Wed Jun 18 14:28:48 GMT 2025","failed","Wed Jun 18 14:28:48 GMT 2025","","Activity, completed within the activity flow: get activity answers list & Answers of respondent tests →","Get activity answers list with answer, created within the activity flow",""
"","426","Workspaces endpoints tests → Workspaces created → Get workspace Applets → Second applet owner gets own applets","","Wed Jun 18 14:54:15 GMT 2025","passed","Wed Jun 18 14:54:15 GMT 2025","","Get workspace Applets →","Second applet owner gets own applets",""
"","6379","Applet builder tests → Update applet → Add activity","","Wed Jun 18 14:36:00 GMT 2025","passed","Wed Jun 18 14:36:06 GMT 2025","","Update applet →","Add activity",""
"","2177","Applet public access tests → Create anonymous answer 404 Not Found (invalid appletId)","","Wed Jun 18 14:40:11 GMT 2025","passed","Wed Jun 18 14:40:13 GMT 2025","","Create anonymous answer","404 Not Found (invalid appletId)",""
"","307","Answers CRUD tests → Answers handling after invitation acceptance by respondent → Create Answer tests → 422 Unprocessable Entity → Create Answer with missing submitId param","","Wed Jun 18 14:29:35 GMT 2025","passed","Wed Jun 18 14:29:35 GMT 2025","","422 Unprocessable Entity →","Create Answer with missing submitId param",""
"","294","Invitations endpoints tests → Decline invitation → 422 - invalid invitation key","","Wed Jun 18 14:46:31 GMT 2025","passed","Wed Jun 18 14:46:31 GMT 2025","","Decline invitation →","422 - invalid invitation key",""
"","575","Applet Events CRUD tests → Create cross-day events tests → 422 (Cross-day Event with DAILY periodicity type and availability range: 23:59:00-23:59:00)","","Wed Jun 18 14:38:32 GMT 2025","passed","Wed Jun 18 14:38:32 GMT 2025","","Create cross-day events tests →","422 (Cross-day Event with DAILY periodicity type and availability range: 23:59:00-23:59:00)",""
"","1148","Applet versions endpoints tests → Update Applet → Add Activity → Remove Activity → Get applet versions","","Wed Jun 18 14:43:33 GMT 2025","passed","Wed Jun 18 14:43:34 GMT 2025","","Remove Activity →","Get applet versions",""
"","3132","Create Answers for different item types tests → Gyroscope performance task","","Wed Jun 18 14:27:21 GMT 2025","passed","Wed Jun 18 14:27:24 GMT 2025","","Create Answers for different item types tests →","Gyroscope performance task",""
"","65","""Workspace Folders"" endpoints tests → Workspace is created → Delete Folder → 401 Unauthorized (invalid token)","","Wed Jun 18 14:52:46 GMT 2025","passed","Wed Jun 18 14:52:46 GMT 2025","","Delete Folder →","401 Unauthorized (invalid token)",""
"","161","Invitations endpoints tests → Get invitations → No Invitations created → Get invitation by key → 422 Unprocessable entity (invalid key)","","Wed Jun 18 14:46:25 GMT 2025","passed","Wed Jun 18 14:46:25 GMT 2025","","Get invitation by key →","422 Unprocessable entity (invalid key)",""
"","258","Invitations endpoints tests → Send invitation → Invitation Managers Send → 422 - Incorrect ""language"" value","","Wed Jun 18 14:46:46 GMT 2025","failed","Wed Jun 18 14:46:46 GMT 2025","","Invitation Managers Send →","422 - Incorrect ""language"" value",""
"","726","Applet Events CRUD tests → Create cross-day events tests → 422 (Cross-day Event with ONCE periodicity type and availability range: 23:59:00-23:59:00)","","Wed Jun 18 14:38:32 GMT 2025","passed","Wed Jun 18 14:38:32 GMT 2025","","Create cross-day events tests →","422 (Cross-day Event with ONCE periodicity type and availability range: 23:59:00-23:59:00)",""
"","359","Invitations scenario tests → Accept invitation positive flow → Invited user can retrieve invitation","","Wed Jun 18 14:45:49 GMT 2025","passed","Wed Jun 18 14:45:49 GMT 2025","","Accept invitation positive flow →","Invited user can retrieve invitation",""
"","261","Update User tests → 422 Unprocessable Entity Update user with missing lastName param","","Wed Jun 18 14:52:14 GMT 2025","passed","Wed Jun 18 14:52:14 GMT 2025","","422 Unprocessable Entity","Update user with missing lastName param",""
"","603","Applet versions endpoints tests → Get applet versions → 200 Ok (single default version)","","Wed Jun 18 14:43:26 GMT 2025","passed","Wed Jun 18 14:43:26 GMT 2025","","Get applet versions →","200 Ok (single default version)",""
"","826","Applet builder tests → Create applet → Positive tests → Applet with all hidden items","","Wed Jun 18 14:35:40 GMT 2025","passed","Wed Jun 18 14:35:40 GMT 2025","","Positive tests →","Applet with all hidden items",""
"","943","Applet versions endpoints tests → Update Applet → Add Activity → Remove Activity → Add Activity Flow → Remove Activity Flow → Add Activity Item → Get applet versions","","Wed Jun 18 14:43:58 GMT 2025","passed","Wed Jun 18 14:43:58 GMT 2025","","Add Activity Item →","Get applet versions",""
"","402","""Themes"" endpoints tests → Create Theme → 422 Unprocessable Entity (missing attribute) Missing backgroundImage","","Wed Jun 18 14:51:19 GMT 2025","passed","Wed Jun 18 14:51:19 GMT 2025","","422 Unprocessable Entity (missing attribute)","Missing backgroundImage",""
"","302","Administration tests → Respondents tests → Set schedule for respondents tests → 403 Forbidden (Reviewer can NOT schedule Event)","","Wed Jun 18 14:49:07 GMT 2025","passed","Wed Jun 18 14:49:07 GMT 2025","","Set schedule for respondents tests →","403 Forbidden (Reviewer can NOT schedule Event)",""
"","1764","Applet Events CRUD tests → Update Applet Event tests → 422 Unprocessable Entity → Update Event with missing selectedDate param (periodicity type: ONCE)","","Wed Jun 18 14:38:02 GMT 2025","passed","Wed Jun 18 14:38:03 GMT 2025","","422 Unprocessable Entity →","Update Event with missing selectedDate param (periodicity type: ONCE)",""
"","2170","Administration tests → Applets tests → Export & view data in workspace of Applet owner tests → View respondent's data tests → 403 Forbidden (Respondent can NOT view data)","","Wed Jun 18 14:49:35 GMT 2025","passed","Wed Jun 18 14:49:37 GMT 2025","","View respondent's data tests →","403 Forbidden (Respondent can NOT view data)",""
"","274","Workspaces managers access tests → Set workspace managers applet access list → 404 Not Found (incorrect appletId)","","Wed Jun 18 14:53:25 GMT 2025","passed","Wed Jun 18 14:53:25 GMT 2025","","Set workspace managers applet access list →","404 Not Found (incorrect appletId)",""
"","65","Invitations endpoints tests → Accept invitation → 401 Unauthorized (invalid token)","","Wed Jun 18 14:46:27 GMT 2025","passed","Wed Jun 18 14:46:27 GMT 2025","","Accept invitation →","401 Unauthorized (invalid token)",""
"","493","Answers CRUD tests → Answers handling after invitation acceptance by respondent → Check answer existence tests → 200 OK (exists = true, check by respondent)","","Wed Jun 18 14:29:38 GMT 2025","passed","Wed Jun 18 14:29:38 GMT 2025","","Check answer existence tests →","200 OK (exists = true, check by respondent)",""
"","6562","Create Answers for different item types tests → All rows items","","Wed Jun 18 14:27:21 GMT 2025","passed","Wed Jun 18 14:27:27 GMT 2025","","Create Answers for different item types tests →","All rows items",""
"","414","Administration tests → Organizers tests → View all organizers tests → 200 OK (Applet owner can view organizers)","","Wed Jun 18 14:48:53 GMT 2025","passed","Wed Jun 18 14:48:53 GMT 2025","","View all organizers tests →","200 OK (Applet owner can view organizers)",""
"","1","Answers CRUD tests → Answers handling after invitation acceptance by respondent → Get flow submissions list & Flow answers of respondent tests → 200 OK (Get flow submissions list)","","Wed Jun 18 14:29:49 GMT 2025","passed","Wed Jun 18 14:29:49 GMT 2025","","Get flow submissions list & Flow answers of respondent tests →","200 OK (Get flow submissions list)",""
"","539","Summary & Review activities tests → Get Summary and Review Activities (empty list) tests → Get Summary Activities (empty list) →","","Wed Jun 18 14:33:39 GMT 2025","passed","Wed Jun 18 14:33:39 GMT 2025","","Get Summary and Review Activities (empty list) tests →","Get Summary Activities (empty list) →",""
"","223","""Authentication"" endpoints tests → Refresh Token → 422 Unprocessable Entity (missing attribute)","","Wed Jun 18 14:44:31 GMT 2025","passed","Wed Jun 18 14:44:31 GMT 2025","","Refresh Token →","422 Unprocessable Entity (missing attribute)",""
"","553","Applet Events CRUD tests → Create cross-day events tests → 422 (Cross-day Event with ONCE periodicity type and availability range: 00:00:00-00:00:00)","","Wed Jun 18 14:38:32 GMT 2025","passed","Wed Jun 18 14:38:32 GMT 2025","","Create cross-day events tests →","422 (Cross-day Event with ONCE periodicity type and availability range: 00:00:00-00:00:00)",""
"","198","Activity Assignments tests → Negative tests → Create Assignments → 422 Unprocessable entity: missing attribute","","Wed Jun 18 14:25:26 GMT 2025","passed","Wed Jun 18 14:25:26 GMT 2025","","Create Assignments →","422 Unprocessable entity: missing attribute",""
