"DESCRIPTION","DURATION IN MS","NAME","PARENT SUITE","START TIME","STATUS","STOP TIME","SUB SUITE","SUITE","TEST CLASS","TEST METHOD"
"","653","Applet Events CRUD tests → Update Applet Event tests → 422 Unprocessable Entity → Update Event with missing startTime (periodicity type: MONTHLY) param","","Wed Jun 18 14:38:02 GMT 2025","passed","Wed Jun 18 14:38:02 GMT 2025","","422 Unprocessable Entity →","Update Event with missing startTime (periodicity type: MONTHLY) param",""
"","3326","Create Answers for different item types tests → Flanker performance task","","Wed Jun 18 14:27:21 GMT 2025","passed","Wed Jun 18 14:27:24 GMT 2025","","Create Answers for different item types tests →","Flanker performance task",""
"","664","""Authentication"" endpoints tests → Get Token → 200 OK","","Wed Jun 18 14:44:29 GMT 2025","passed","Wed Jun 18 14:44:29 GMT 2025","","Get Token →","200 OK",""
"","424","Applet public access tests → Get public applet by key → 404: invalid key","","Wed Jun 18 14:39:55 GMT 2025","passed","Wed Jun 18 14:39:55 GMT 2025","","Get public applet by key →","404: invalid key",""
"","661","Administration tests → Applets tests → Export & view data in workspace of Applet owner tests → Export data tests → 200 OK (Coordinator can export his own data)","","Wed Jun 18 14:49:31 GMT 2025","passed","Wed Jun 18 14:49:31 GMT 2025","","Export data tests →","200 OK (Coordinator can export his own data)",""
"","533","Invitations endpoints tests → Accept invitation → 200 OK","","Wed Jun 18 14:46:27 GMT 2025","passed","Wed Jun 18 14:46:27 GMT 2025","","Accept invitation →","200 OK",""
"","2141","Applet public links tests → Accept Public invitation tests → 200 OK (any other user can also accept public link invitation)","","Wed Jun 18 14:47:06 GMT 2025","passed","Wed Jun 18 14:47:08 GMT 2025","","Accept Public invitation tests →","200 OK (any other user can also accept public link invitation)",""
"","226","Activity Versions & Identifiers tests → Get Versions tests → 401 Unauthorized (Get activity versions with not existing token)","","Wed Jun 18 14:31:52 GMT 2025","passed","Wed Jun 18 14:31:52 GMT 2025","","Get Versions tests →","401 Unauthorized (Get activity versions with not existing token)",""
"","325","Applet Events CRUD tests → Get Applet Event by Id tests → 200 OK (Get individual scheduled activity Event by id)","","Wed Jun 18 14:37:46 GMT 2025","passed","Wed Jun 18 14:37:46 GMT 2025","","Get Applet Event by Id tests →","200 OK (Get individual scheduled activity Event by id)",""
"","3685","Administration tests → Perform activities tests → 200 OK (Manager can submit answers)","","Wed Jun 18 14:50:04 GMT 2025","passed","Wed Jun 18 14:50:07 GMT 2025","","Perform activities tests →","200 OK (Manager can submit answers)",""
"","236","""Subjects"" endpoints CRUD tests → Delete subjects 401: Unauthorized","","Wed Jun 18 14:51:13 GMT 2025","passed","Wed Jun 18 14:51:13 GMT 2025","","Delete subjects","401: Unauthorized",""
"","716","Invitations endpoints tests → Send invitation → Invitation Managers Send → 200 OK (send to unregistered user) Role = editor","","Wed Jun 18 14:46:48 GMT 2025","passed","Wed Jun 18 14:46:48 GMT 2025","","200 OK (send to unregistered user)","Role = editor",""
"","399","Applet Events CRUD tests → Delete scheduled Applet Event by Id tests → 404 Not Found (Delete individual scheduled activity Event of not existing Applet)","","Wed Jun 18 14:37:51 GMT 2025","passed","Wed Jun 18 14:37:51 GMT 2025","","Delete scheduled Applet Event by Id tests →","404 Not Found (Delete individual scheduled activity Event of not existing Applet)",""
"","226","Activity Assessment & Review CRUD tests → Get Assessment & Review tests → Get Assessment tests → 401 Unauthorized (Get Assessment with not existing token)","","Wed Jun 18 14:30:44 GMT 2025","passed","Wed Jun 18 14:30:44 GMT 2025","","Get Assessment tests →","401 Unauthorized (Get Assessment with not existing token)",""
"","170","""Workspace Folders"" endpoints tests → Workspace is created → Get Folders → 401 Unauthorized (invalid token)","","Wed Jun 18 14:52:43 GMT 2025","passed","Wed Jun 18 14:52:43 GMT 2025","","Get Folders →","401 Unauthorized (invalid token)",""
"","1478","Applets ""setFolder"" endpoint tests → 200 OK (unset folder)","","Wed Jun 18 14:41:11 GMT 2025","passed","Wed Jun 18 14:41:12 GMT 2025","","Applets ""setFolder"" endpoint tests →","200 OK (unset folder)",""
"","3253","Administration tests → Organizers tests → Invite new organizer tests → 200 OK (Manager can invite manager, coordinator, editor, reviewer)","","Wed Jun 18 14:48:44 GMT 2025","passed","Wed Jun 18 14:48:47 GMT 2025","","Invite new organizer tests →","200 OK (Manager can invite manager, coordinator, editor, reviewer)",""
"","453","Invitations scenario tests → Re-send invitation flow → Same user can't be invited again","","Wed Jun 18 14:46:04 GMT 2025","passed","Wed Jun 18 14:46:04 GMT 2025","","Re-send invitation flow →","Same user can't be invited again",""
"","428","Workspaces endpoints tests → Workspaces created → Update workspace applet respondent → 404 Not Found (invalid applet id)","","Wed Jun 18 14:55:21 GMT 2025","passed","Wed Jun 18 14:55:21 GMT 2025","","Update workspace applet respondent →","404 Not Found (invalid applet id)",""
"","569","Summary & Review activities tests → Get Summary and Review Activities (non-empty list) tests → Get Review Activities list tests → 404 Not Found (Get Review Activities list of not existing Applet)","","Wed Jun 18 14:33:44 GMT 2025","passed","Wed Jun 18 14:33:44 GMT 2025","","Get Review Activities list tests →","404 Not Found (Get Review Activities list of not existing Applet)",""
"","428","Invitations endpoints tests → Decline invitation → 404 - non-existent invitation key","","Wed Jun 18 14:46:31 GMT 2025","passed","Wed Jun 18 14:46:31 GMT 2025","","Decline invitation →","404 - non-existent invitation key",""
"","65","Applet ""Transfer Ownership"" endpoints tests → Transfer Initiate → 401 Unauthorized","","Wed Jun 18 14:42:56 GMT 2025","passed","Wed Jun 18 14:42:56 GMT 2025","","Transfer Initiate →","401 Unauthorized",""
"","300","Answers CRUD tests → Answers handling after invitation acceptance by respondent → Check answer existence tests → 200 OK (exists = false, check by applet owner w/o submitId)","","Wed Jun 18 14:29:38 GMT 2025","passed","Wed Jun 18 14:29:38 GMT 2025","","Check answer existence tests →","200 OK (exists = false, check by applet owner w/o submitId)",""
"","969","Access link tests → Delete Access link tests → 404 (Delete already deleted Access link)","","Wed Jun 18 14:34:25 GMT 2025","passed","Wed Jun 18 14:34:25 GMT 2025","","Delete Access link tests →","404 (Delete already deleted Access link)",""
"","445","Access link tests → Create Access link tests → 201 Created (Access link can successfully be created)","","Wed Jun 18 14:34:20 GMT 2025","passed","Wed Jun 18 14:34:20 GMT 2025","","Create Access link tests →","201 Created (Access link can successfully be created)",""
"","1115","Get Assessment & Review of updated activity tests → Switch to a new assessment version New assessment activity for subsequent activity completions Get new assessment activity","","Wed Jun 18 14:30:27 GMT 2025","passed","Wed Jun 18 14:30:28 GMT 2025","","New assessment activity for subsequent activity completions","Get new assessment activity",""
"","269","Invitations endpoints tests → Create shell account → 200 OK: shell account with min required attributes","","Wed Jun 18 14:46:53 GMT 2025","passed","Wed Jun 18 14:46:53 GMT 2025","","Create shell account →","200 OK: shell account with min required attributes",""
"","616","Delete User tests → 404 Not found (Delete already deleted user)","","Wed Jun 18 14:51:31 GMT 2025","passed","Wed Jun 18 14:51:31 GMT 2025","","Delete User tests →","404 Not found (Delete already deleted user)",""
"","68","Invitations endpoints tests → Send invitation → Invitation Reviewer Send → 401 Unauthorized (invalid token)","","Wed Jun 18 14:46:40 GMT 2025","passed","Wed Jun 18 14:46:40 GMT 2025","","Invitation Reviewer Send →","401 Unauthorized (invalid token)",""
"","236","Files upload/download tests → Upload File → 422 Empty form data","","Wed Jun 18 14:44:44 GMT 2025","passed","Wed Jun 18 14:44:44 GMT 2025","","Upload File →","422 Empty form data",""
"","65","Applet versions endpoints tests → Get applet version changes → 401 Unauthorized","","Wed Jun 18 14:43:28 GMT 2025","passed","Wed Jun 18 14:43:28 GMT 2025","","Get applet version changes →","401 Unauthorized",""
"","499","Applet ""Transfer Ownership"" endpoints tests → Transfer Accept → 200 OK","","Wed Jun 18 14:42:58 GMT 2025","passed","Wed Jun 18 14:42:58 GMT 2025","","Transfer Accept →","200 OK",""
"","223","Files upload/download directly to S3 bucket tests → Generate presigned links EPs negative tests Presign link 401 Unauthorized","","Wed Jun 18 14:45:46 GMT 2025","passed","Wed Jun 18 14:45:46 GMT 2025","","Presign link","401 Unauthorized",""
"","1330","Flow Versions & Identifiers tests → Get flow Versions tests → Flow has been updated → 200 OK (Get flow versions after adding new activity in flow)","","Wed Jun 18 14:31:09 GMT 2025","passed","Wed Jun 18 14:31:10 GMT 2025","","Flow has been updated →","200 OK (Get flow versions after adding new activity in flow)",""
"","2685","Applet Events CRUD tests → Create cross-day events tests → 201 Created (Cross-day Event with MONTHLY periodicity type and availability range: 00:01:00-00:00:00)","","Wed Jun 18 14:38:32 GMT 2025","passed","Wed Jun 18 14:38:34 GMT 2025","","Create cross-day events tests →","201 Created (Cross-day Event with MONTHLY periodicity type and availability range: 00:01:00-00:00:00)",""
"","1287","Applet ""Transfer Ownership"" scenario tests → Transfer Accept → First receiver should become the owner → Verify transferred answers list","","Wed Jun 18 14:42:10 GMT 2025","passed","Wed Jun 18 14:42:11 GMT 2025","","First receiver should become the owner →","Verify transferred answers list",""
"","482","Multiinformant assessment validate tests → 422: Unprocessable Entity","","Wed Jun 18 14:33:06 GMT 2025","passed","Wed Jun 18 14:33:06 GMT 2025","","Multiinformant assessment validate tests →","422: Unprocessable Entity",""
"","1731","Activity Assessment & Review CRUD tests → Delete Assessment tests → 404 Not Found (Delete submitted assessment in not existing Applet)","","Wed Jun 18 14:30:56 GMT 2025","passed","Wed Jun 18 14:30:57 GMT 2025","","Delete Assessment tests →","404 Not Found (Delete submitted assessment in not existing Applet)",""
"","349","""Workspace Folders"" endpoints tests → Workspace is created → Pin/Unpin Folder → Unpin Folder → 400 (non-existent folder)","","Wed Jun 18 14:52:50 GMT 2025","passed","Wed Jun 18 14:52:50 GMT 2025","","Unpin Folder →","400 (non-existent folder)",""
"","1026","Workspaces endpoints tests → Workspaces created → Get managers priority role → 404 Not Found (Invalid ownerId)","","Wed Jun 18 14:55:04 GMT 2025","passed","Wed Jun 18 14:55:05 GMT 2025","","Get managers priority role →","404 Not Found (Invalid ownerId)",""
"","2489","Get submit dates & exported Answers data tests → Get exported data & dates after answer submit → 200 OK (Get exported data by respondent - should see only his own data)","","Wed Jun 18 14:26:54 GMT 2025","failed","Wed Jun 18 14:26:56 GMT 2025","","Get exported data & dates after answer submit →","200 OK (Get exported data by respondent - should see only his own data)",""
"","4721","Applet Events scenario tests → End-To-End scenario (General scheduled activity Event)","","Wed Jun 18 14:39:13 GMT 2025","passed","Wed Jun 18 14:39:17 GMT 2025","","Applet Events scenario tests →","End-To-End scenario (General scheduled activity Event)",""
"","3757","Applet ""Transfer Ownership"" scenario tests → Transfer Accept → Applet owner should remain the same before transfer request accepted by another user","","Wed Jun 18 14:41:31 GMT 2025","passed","Wed Jun 18 14:41:34 GMT 2025","","Transfer Accept →","Applet owner should remain the same before transfer request accepted by another user",""
"","609","Administration tests → Applets tests → Export & view data in workspace of Applet owner tests → Export data tests → 200 OK (Reviewer with assigned respondents can export data)","","Wed Jun 18 14:49:31 GMT 2025","passed","Wed Jun 18 14:49:31 GMT 2025","","Export data tests →","200 OK (Reviewer with assigned respondents can export data)",""
"","590","Administration tests → Applets tests → View General calendar in workspace of Applet owner tests → 403 Forbidden (Reviewer can NOT view General calendar)","","Wed Jun 18 14:49:27 GMT 2025","passed","Wed Jun 18 14:49:27 GMT 2025","","View General calendar in workspace of Applet owner tests →","403 Forbidden (Reviewer can NOT view General calendar)",""
"","322","Summary & Review activities tests → Get Summary and Review Activities (non-empty list) tests → Get Review Activities list tests → 422 Unprocessable Entity (Get Review Activities list without createdDate query param)","","Wed Jun 18 14:33:44 GMT 2025","passed","Wed Jun 18 14:33:44 GMT 2025","","Get Review Activities list tests →","422 Unprocessable Entity (Get Review Activities list without createdDate query param)",""
"","370","Invitations scenario tests → Re-send invitation flow → Invited user can't accept old invitation","","Wed Jun 18 14:46:04 GMT 2025","passed","Wed Jun 18 14:46:04 GMT 2025","","Re-send invitation flow →","Invited user can't accept old invitation",""
"","451","Activity Assessment & Review CRUD tests → Delete Assessment tests → 404 Not Found (Delete not existing assessment)","","Wed Jun 18 14:30:56 GMT 2025","passed","Wed Jun 18 14:30:56 GMT 2025","","Delete Assessment tests →","404 Not Found (Delete not existing assessment)",""
"","233","Create User tests → 422 Unprocessable Entity Create user with empty password param","","Wed Jun 18 14:51:27 GMT 2025","passed","Wed Jun 18 14:51:27 GMT 2025","","422 Unprocessable Entity","Create user with empty password param",""
"","2228","Applet ""Transfer Ownership"" scenario tests → Transfer Decline → Second receiver should become the owner","","Wed Jun 18 14:42:23 GMT 2025","passed","Wed Jun 18 14:42:25 GMT 2025","","Transfer Decline →","Second receiver should become the owner",""
"","376","Applet Library tests → Applet is added to the library → Get Library items list 200 OK (search by activity name)","","Wed Jun 18 14:34:06 GMT 2025","passed","Wed Jun 18 14:34:06 GMT 2025","","Get Library items list","200 OK (search by activity name)",""
"","581","Workspaces endpoints tests → Workspaces created → Update workspace applet respondent → 404 Not Found (invalid respondent id)","","Wed Jun 18 14:55:21 GMT 2025","passed","Wed Jun 18 14:55:21 GMT 2025","","Update workspace applet respondent →","404 Not Found (invalid respondent id)",""
"","3973","Create Answers for different item types tests → SingleSelect item","","Wed Jun 18 14:27:21 GMT 2025","passed","Wed Jun 18 14:27:24 GMT 2025","","Create Answers for different item types tests →","SingleSelect item",""
"","355","Invitations endpoints tests → Get invitations → No Invitations created → Get invitation by key → 404 Not found (non-existent key)","","Wed Jun 18 14:46:25 GMT 2025","passed","Wed Jun 18 14:46:25 GMT 2025","","Get invitation by key →","404 Not found (non-existent key)",""
"","169","""Authentication"" endpoints tests → OpenAPI auth → 422 Unprocessable Entity (missing attribute)","","Wed Jun 18 14:44:36 GMT 2025","passed","Wed Jun 18 14:44:36 GMT 2025","","OpenAPI auth →","422 Unprocessable Entity (missing attribute)",""
"","223","Workspaces managers access tests → Get workspace roles list → 401 Unauthorized","","Wed Jun 18 14:53:36 GMT 2025","passed","Wed Jun 18 14:53:36 GMT 2025","","Get workspace roles list →","401 Unauthorized",""
"","1328","Activity Assessment & Review CRUD tests → Submit Assessment tests → 201 Submit Assessment","","Wed Jun 18 14:30:51 GMT 2025","failed","Wed Jun 18 14:30:52 GMT 2025","","Submit Assessment tests →","201 Submit Assessment",""
"","328","Files upload/download directly to S3 bucket tests → Upload media files directly to storage (S3 bucket) Generate presigned media url","","Wed Jun 18 14:45:20 GMT 2025","passed","Wed Jun 18 14:45:20 GMT 2025","","Upload media files directly to storage (S3 bucket)","Generate presigned media url",""
"","294","Summary & Review activity flow tests → Get Review activity flow tests → 422 Unprocessable Entity (Get Review activity flow list without targetSubjectId query param)","","Wed Jun 18 14:33:56 GMT 2025","passed","Wed Jun 18 14:33:56 GMT 2025","","Get Review activity flow tests →","422 Unprocessable Entity (Get Review activity flow list without targetSubjectId query param)",""
"","462","Workspaces endpoints tests → Workspaces created → Get workspace applet respondent by id → 200 OK (manager)","","Wed Jun 18 14:55:18 GMT 2025","passed","Wed Jun 18 14:55:18 GMT 2025","","Get workspace applet respondent by id →","200 OK (manager)",""
"","438","Activity Assignments tests → Positive tests → Get empty assignments list","","Wed Jun 18 14:25:21 GMT 2025","passed","Wed Jun 18 14:25:21 GMT 2025","","Positive tests →","Get empty assignments list",""
"","513","Workspace folder for different users tests → Manager is invited to the applet → Manager creates own folder in the same workspace Applet Owner and Manager add the same applet in their folders Get folders (manager)","","Wed Jun 18 14:53:02 GMT 2025","passed","Wed Jun 18 14:53:02 GMT 2025","","Applet Owner and Manager add the same applet in their folders","Get folders (manager)",""
"","319","Applet Events CRUD tests → Create Events tests → 422 Unprocessable Entity → Create Event with missing startTime (periodicity type: WEEKLY) param","","Wed Jun 18 14:37:27 GMT 2025","passed","Wed Jun 18 14:37:27 GMT 2025","","422 Unprocessable Entity →","Create Event with missing startTime (periodicity type: WEEKLY) param",""
"","367","Applet public access tests → Create anonymous answer 404 Not Found (invalid activityId)","","Wed Jun 18 14:40:11 GMT 2025","passed","Wed Jun 18 14:40:11 GMT 2025","","Create anonymous answer","404 Not Found (invalid activityId)",""
"","1117","Activity Versions & Identifiers tests → Get Identifiers tests → 404 Not Found (not existing activityId)","","Wed Jun 18 14:32:43 GMT 2025","passed","Wed Jun 18 14:32:44 GMT 2025","","Get Identifiers tests →","404 Not Found (not existing activityId)",""
"","181","Invitations endpoints tests → Send invitation → Invitation Reviewer Send → 422 Missing attributes Missing language","","Wed Jun 18 14:46:44 GMT 2025","passed","Wed Jun 18 14:46:44 GMT 2025","","422 Missing attributes","Missing language",""
"","693","Activity Assessment & Review CRUD tests → Submit Assessment tests → 422 Unprocessable Entity → Create Assessment with missing assessmentVersionId param","","Wed Jun 18 14:30:54 GMT 2025","passed","Wed Jun 18 14:30:54 GMT 2025","","422 Unprocessable Entity →","Create Assessment with missing assessmentVersionId param",""
"","2512","Applet public access tests → Get public applet base info by key → 200 OK","","Wed Jun 18 14:40:07 GMT 2025","passed","Wed Jun 18 14:40:09 GMT 2025","","Get public applet base info by key →","200 OK",""
"","171","Invitations endpoints tests → Get invitations → No Invitations created → Get invitations for invitor → 401 Unauthorized (invalid token)","","Wed Jun 18 14:46:25 GMT 2025","passed","Wed Jun 18 14:46:25 GMT 2025","","Get invitations for invitor →","401 Unauthorized (invalid token)",""
"","407","Answers CRUD tests → Answers handling after invitation acceptance by respondent → Create Answer tests → 422 Unprocessable Entity → Create Answer with missing activityId param","","Wed Jun 18 14:29:35 GMT 2025","passed","Wed Jun 18 14:29:35 GMT 2025","","422 Unprocessable Entity →","Create Answer with missing activityId param",""
"","2898","Create Answers for different item types tests → Text item","","Wed Jun 18 14:27:21 GMT 2025","passed","Wed Jun 18 14:27:23 GMT 2025","","Create Answers for different item types tests →","Text item",""
"","301","Shell account invitation scenario tests → Accept invitation by unregistered user → New user can view invitation after registration","","Wed Jun 18 14:47:36 GMT 2025","failed","Wed Jun 18 14:47:36 GMT 2025","","Accept invitation by unregistered user →","New user can view invitation after registration",""
"","219","Applet Events CRUD tests → Create Events tests → 422 Unprocessable Entity → Create Event with missing startTime (periodicity type: MONTHLY) param","","Wed Jun 18 14:37:27 GMT 2025","passed","Wed Jun 18 14:37:27 GMT 2025","","422 Unprocessable Entity →","Create Event with missing startTime (periodicity type: MONTHLY) param",""
"","335","""Subjects"" endpoints CRUD tests → Update subjects 200 OK: respondent","","Wed Jun 18 14:51:08 GMT 2025","passed","Wed Jun 18 14:51:08 GMT 2025","","Update subjects","200 OK: respondent",""
"","445","Get submit dates & exported Answers data tests → Get dates before Answer submit → 404 Not Found (Get submit dates of not existing Applet)","","Wed Jun 18 14:26:52 GMT 2025","passed","Wed Jun 18 14:26:52 GMT 2025","","Get dates before Answer submit →","404 Not Found (Get submit dates of not existing Applet)",""
"","1428","Administration tests → Organizers tests → Invite new organizer tests → 403 Forbidden (Editor can NOT invite manager, coordinator, editor, reviewer)","","Wed Jun 18 14:48:44 GMT 2025","passed","Wed Jun 18 14:48:45 GMT 2025","","Invite new organizer tests →","403 Forbidden (Editor can NOT invite manager, coordinator, editor, reviewer)",""
"","765","Applet versions endpoints tests → Update Applet → Add Activity → Remove Activity → Add Activity Flow → Remove Activity Flow → Get applet versions","","Wed Jun 18 14:43:50 GMT 2025","passed","Wed Jun 18 14:43:50 GMT 2025","","Remove Activity Flow →","Get applet versions",""
"","160","Logs upload/download tests → Upload Logs → 422 Empty form data","","Wed Jun 18 14:45:09 GMT 2025","passed","Wed Jun 18 14:45:09 GMT 2025","","Upload Logs →","422 Empty form data",""
"","901","Applet public access tests → Get public activities by key → 404: invalid key","","Wed Jun 18 14:39:56 GMT 2025","passed","Wed Jun 18 14:39:56 GMT 2025","","Get public activities by key →","404: invalid key",""
"","550","Applet Events CRUD tests → Delete all general scheduled Applet Events tests → 404 Not Found (Delete all general scheduled Events of not existing Applet)","","Wed Jun 18 14:37:40 GMT 2025","passed","Wed Jun 18 14:37:40 GMT 2025","","Delete all general scheduled Applet Events tests →","404 Not Found (Delete all general scheduled Events of not existing Applet)",""
"","306","Access link tests → Get Access link tests → 401 Unauthorized (Get Access link with invalid token)","","Wed Jun 18 14:34:22 GMT 2025","passed","Wed Jun 18 14:34:22 GMT 2025","","Get Access link tests →","401 Unauthorized (Get Access link with invalid token)",""
"","707","Delete User tests → 404 (Deleted user can not login)","","Wed Jun 18 14:51:31 GMT 2025","passed","Wed Jun 18 14:51:31 GMT 2025","","Delete User tests →","404 (Deleted user can not login)",""
"","3360","Get Assessment & Review of updated activity tests → Switch to a new assessment version Get Assessment info after switching to a new assessment version","","Wed Jun 18 14:30:17 GMT 2025","failed","Wed Jun 18 14:30:20 GMT 2025","","Switch to a new assessment version","Get Assessment info after switching to a new assessment version",""
"","3063","Create Answers for different item types tests → A/B Trails Tablet performance task","","Wed Jun 18 14:27:21 GMT 2025","passed","Wed Jun 18 14:27:24 GMT 2025","","Create Answers for different item types tests →","A/B Trails Tablet performance task",""
"","1222","Applet Events CRUD tests → Create Events tests → 201 Create general scheduled activity Event & general Always Available activity Event","","Wed Jun 18 14:37:24 GMT 2025","passed","Wed Jun 18 14:37:25 GMT 2025","","Create Events tests →","201 Create general scheduled activity Event & general Always Available activity Event",""
"","169","Update Password tests → 401 Unauthorized (Update password with not existing token)","","Wed Jun 18 14:51:58 GMT 2025","passed","Wed Jun 18 14:51:58 GMT 2025","","Update Password tests →","401 Unauthorized (Update password with not existing token)",""
"","235","Applet Events CRUD tests → Count scheduled Applet Events tests → 401 Unauthorized (Count general scheduled Events with not existing appletOwnerToken)","","Wed Jun 18 14:38:14 GMT 2025","passed","Wed Jun 18 14:38:14 GMT 2025","","Count scheduled Applet Events tests →","401 Unauthorized (Count general scheduled Events with not existing appletOwnerToken)",""
"","242","Workspaces endpoints tests → Empty workspaces → Get workspace applets → 404 Not found (non-existent ownerId)","","Wed Jun 18 14:53:55 GMT 2025","passed","Wed Jun 18 14:53:55 GMT 2025","","Get workspace applets →","404 Not found (non-existent ownerId)",""
"","407","Workspaces managers access tests → Remove manager access → 403 Forbidden (try to remove access for respondent)","","Wed Jun 18 14:53:31 GMT 2025","passed","Wed Jun 18 14:53:31 GMT 2025","","Remove manager access →","403 Forbidden (try to remove access for respondent)",""
