"DESCRIPTION","DURATION IN MS","NAME","PARENT SUITE","START TIME","STATUS","STOP TIME","SUB SUITE","SUITE","TEST CLASS","TEST METHOD"
"","10","User Password tests → Recover password tests → 422 Unprocessable Entity (Recover password without required param - email)","","Tue Oct 29 23:56:20 GMT 2024","passed","Tue Oct 29 23:56:20 GMT 2024","","Recover password tests →","422 Unprocessable Entity (Recover password without required param - email)",""
"","14","Applet Events CRUD tests → Delete all general scheduled Applet Events tests → 401 Unauthorized (Delete all general scheduled Events with not existing appletOwnerToken)","","Tue Oct 29 23:48:55 GMT 2024","passed","Tue Oct 29 23:48:55 GMT 2024","","Delete all general scheduled Applet Events tests →","401 Unauthorized (Delete all general scheduled Events with not existing appletOwnerToken)",""
"","164","Applet public access tests → Get public events by key → 200 OK","","Tue Oct 29 23:50:01 GMT 2024","passed","Tue Oct 29 23:50:01 GMT 2024","","Get public events by key →","200 OK",""
"","292","Applet public links tests → Accept Public invitation tests → Status of Public Invitation has not changed after its acceptance","","Tue Oct 29 23:53:34 GMT 2024","passed","Tue Oct 29 23:53:34 GMT 2024","","Accept Public invitation tests →","Status of Public Invitation has not changed after its acceptance",""
"","177","Applet Library tests → Applet is added to the library → Get Library Applet by id → 404 Not found  (invalid applet item id)","","Tue Oct 29 23:47:03 GMT 2024","passed","Tue Oct 29 23:47:03 GMT 2024","","Get Library Applet by id →","404 Not found  (invalid applet item id)",""
"","311","Get Assessment & Review of updated activity tests → Get Assessment info before switching to a new assessment version","","Tue Oct 29 23:45:51 GMT 2024","passed","Tue Oct 29 23:45:51 GMT 2024","","Get Assessment & Review of updated activity tests →","Get Assessment info before switching to a new assessment version",""
"","232","Administration tests → Applets tests → Update Applet in workspace of Applet owner tests → 403 Forbidden (Reviewer can NOT update Applet)","","Tue Oct 29 23:55:15 GMT 2024","passed","Tue Oct 29 23:55:15 GMT 2024","","Update Applet in workspace of Applet owner tests →","403 Forbidden (Reviewer can NOT update Applet)",""
"","185","Applet Library tests → Applet is added to the library → Check Library item name → 200 OK: new unique name","","Tue Oct 29 23:47:05 GMT 2024","passed","Tue Oct 29 23:47:05 GMT 2024","","Check Library item name →","200 OK: new unique name",""
"","181","Logs upload/download tests → Upload Logs → 422 Empty form data","","Tue Oct 29 23:52:07 GMT 2024","passed","Tue Oct 29 23:52:07 GMT 2024","","Upload Logs →","422 Empty form data",""
"","196","Applet Library tests → Applet is added to the library → Update Library item → 404 Not Found (library item)","","Tue Oct 29 23:47:05 GMT 2024","passed","Tue Oct 29 23:47:05 GMT 2024","","Update Library item →","404 Not Found (library item)",""
"","11","Activity Assignments tests → Negative tests → Create Assignments → 401 Unauthorised","","Tue Oct 29 23:43:31 GMT 2024","passed","Tue Oct 29 23:43:31 GMT 2024","","Create Assignments →","401 Unauthorised",""
"","273","Applet ""Transfer Ownership"" endpoints tests → Transfer Accept → 404 (Accept same request again)","","Tue Oct 29 23:50:59 GMT 2024","passed","Tue Oct 29 23:50:59 GMT 2024","","Transfer Accept →","404 (Accept same request again)",""
"","232","Summary & Review activities tests → Get Summary and Review Activities (non-empty list) tests → Get Review Activities list tests → 404 Not Found (Get Review Activities list of not existing Applet)","","Tue Oct 29 23:46:48 GMT 2024","passed","Tue Oct 29 23:46:48 GMT 2024","","Get Review Activities list tests →","404 Not Found (Get Review Activities list of not existing Applet)",""
"","291","Workspaces endpoints tests → Workspaces created → Get workspace applet respondent by id → 200 OK (manager)","","Tue Oct 29 23:58:36 GMT 2024","passed","Tue Oct 29 23:58:36 GMT 2024","","Get workspace applet respondent by id →","200 OK (manager)",""
"","250","Applet ""Transfer Ownership"" scenario tests → Transfer Accept → First receiver should become the owner → Verify transferred managers list","","Tue Oct 29 23:50:32 GMT 2024","passed","Tue Oct 29 23:50:32 GMT 2024","","First receiver should become the owner →","Verify transferred managers list",""
"","203","Applet Events CRUD tests → Update Applet Event tests → 422 Unprocessable Entity → Update Event with missing startTime (periodicity type: WEEKLY) param","","Tue Oct 29 23:49:10 GMT 2024","passed","Tue Oct 29 23:49:10 GMT 2024","","422 Unprocessable Entity →","Update Event with missing startTime (periodicity type: WEEKLY) param",""
"","527","Workspaces endpoints tests → Workspaces created → Update workspace applet respondent → 400 Bad Request (not unique secretUserId)","","Tue Oct 29 23:58:38 GMT 2024","passed","Tue Oct 29 23:58:38 GMT 2024","","Update workspace applet respondent →","400 Bad Request (not unique secretUserId)",""
"","1473","Invitations scenario tests → Invite unregistered user flow → New user registers in the app","","Tue Oct 29 23:52:54 GMT 2024","passed","Tue Oct 29 23:52:55 GMT 2024","","Invite unregistered user flow →","New user registers in the app",""
"","209","""Workspace Folders"" endpoints tests → Workspace is created → Pin/Unpin Folder → Pin Folder → 200 OK","","Tue Oct 29 23:57:12 GMT 2024","passed","Tue Oct 29 23:57:12 GMT 2024","","Pin Folder →","200 OK",""
"","276","Applet Events CRUD tests → Import Applet Events tests → 201 Import Events (general scheduled activity Event & individual Always Available activity Event)","","Tue Oct 29 23:49:18 GMT 2024","passed","Tue Oct 29 23:49:18 GMT 2024","","Import Applet Events tests →","201 Import Events (general scheduled activity Event & individual Always Available activity Event)",""
"","215","Answers CRUD tests → Answers handling after invitation acceptance by respondent → Create Answer tests → 422 Unprocessable Entity → Create Answer with missing submitId param","","Tue Oct 29 23:45:38 GMT 2024","passed","Tue Oct 29 23:45:38 GMT 2024","","422 Unprocessable Entity →","Create Answer with missing submitId param",""
"","196","""Subjects"" endpoints CRUD tests → Update subjects 404: Not Found","","Tue Oct 29 23:55:57 GMT 2024","passed","Tue Oct 29 23:55:57 GMT 2024","","Update subjects","404: Not Found",""
"","291","Multiinformant assessment validate tests → 200 OK: sourceSubjectId = respondent, targetSubjectId = manager","","Tue Oct 29 23:46:31 GMT 2024","passed","Tue Oct 29 23:46:31 GMT 2024","","Multiinformant assessment validate tests →","200 OK: sourceSubjectId = respondent, targetSubjectId = manager",""
"","125","Workspaces endpoints tests → Workspaces created → Update workspace applet respondent → 422 Missing Attribute (secretUserId)","","Tue Oct 29 23:58:38 GMT 2024","passed","Tue Oct 29 23:58:38 GMT 2024","","Update workspace applet respondent →","422 Missing Attribute (secretUserId)",""
"","218","Invitations endpoints tests → Decline invitation → 404 - non-existent invitation key","","Tue Oct 29 23:53:11 GMT 2024","passed","Tue Oct 29 23:53:11 GMT 2024","","Decline invitation →","404 - non-existent invitation key",""
"","117","Applet Events CRUD tests → Create Events tests → 422 Unprocessable Entity → Create Event with missing endTime (periodicity type: WEEKLY) param","","Tue Oct 29 23:48:48 GMT 2024","passed","Tue Oct 29 23:48:48 GMT 2024","","422 Unprocessable Entity →","Create Event with missing endTime (periodicity type: WEEKLY) param",""
"","991","Applet builder tests → Create applet → Positive tests → Applet with all hidden items","","Tue Oct 29 23:47:35 GMT 2024","passed","Tue Oct 29 23:47:35 GMT 2024","","Positive tests →","Applet with all hidden items",""
"","208","Workspaces endpoints tests → Workspaces created → Get workspace applet details → 404 Not Found (non-existent ownerId)","","Tue Oct 29 23:58:25 GMT 2024","passed","Tue Oct 29 23:58:25 GMT 2024","","Get workspace applet details →","404 Not Found (non-existent ownerId)",""
"","12","Access link tests → Create Access link tests → 401 Unauthorized (Create Access link with invalid token)","","Tue Oct 29 23:47:10 GMT 2024","passed","Tue Oct 29 23:47:10 GMT 2024","","Create Access link tests →","401 Unauthorized (Create Access link with invalid token)",""
"","364","Shell account invitation scenario tests → Accept invitation by unregistered user → Verify there's no shell account anymore in the list of respondents","","Tue Oct 29 23:53:58 GMT 2024","passed","Tue Oct 29 23:53:58 GMT 2024","","Accept invitation by unregistered user →","Verify there's no shell account anymore in the list of respondents",""
"","171","Applet ""Transfer Ownership"" endpoints tests → Transfer Decline → 404 (invalid applet id)","","Tue Oct 29 23:51:07 GMT 2024","passed","Tue Oct 29 23:51:07 GMT 2024","","Transfer Decline →","404 (invalid applet id)",""
"","137","Applet Library tests → Applet is added to the library → Check Library item name → 422 missing attribute (name)","","Tue Oct 29 23:47:05 GMT 2024","passed","Tue Oct 29 23:47:05 GMT 2024","","Check Library item name →","422 missing attribute (name)",""
"","213","Administration tests → Respondents tests → Set schedule for respondents tests → 403 Forbidden (Respondent can NOT schedule Event)","","Tue Oct 29 23:55:12 GMT 2024","passed","Tue Oct 29 23:55:12 GMT 2024","","Set schedule for respondents tests →","403 Forbidden (Respondent can NOT schedule Event)",""
"","533","Administration tests → Applets tests → Create Applet in workspace of Applet owner tests → 201 Created (Editor can create Applet in workspace of Applet owner)","","Tue Oct 29 23:55:13 GMT 2024","passed","Tue Oct 29 23:55:13 GMT 2024","","Create Applet in workspace of Applet owner tests →","201 Created (Editor can create Applet in workspace of Applet owner)",""
"","169","Files upload/download directly to S3 bucket tests → Upload media files directly to storage (S3 bucket) Generate presigned media url","","Tue Oct 29 23:52:16 GMT 2024","passed","Tue Oct 29 23:52:16 GMT 2024","","Upload media files directly to storage (S3 bucket)","Generate presigned media url",""
"","321","Get Assessment & Review of updated activity tests → Switch to a new assessment version New assessment activity for subsequent activity completions Get new assessment activity","","Tue Oct 29 23:45:59 GMT 2024","passed","Tue Oct 29 23:45:59 GMT 2024","","New assessment activity for subsequent activity completions","Get new assessment activity",""
"","266","Answers CRUD tests → Applet owner should not get any flows submissions before invitation acceptance by respondent","","Tue Oct 29 23:45:29 GMT 2024","passed","Tue Oct 29 23:45:29 GMT 2024","","Answers CRUD tests →","Applet owner should not get any flows submissions before invitation acceptance by respondent",""
"","279","Applet Events CRUD tests → Delete individual scheduled Applet Events negative tests → 404 Not Found (Delete scheduled Events of a particular user with not existing Applet)","","Tue Oct 29 23:49:16 GMT 2024","passed","Tue Oct 29 23:49:16 GMT 2024","","Delete individual scheduled Applet Events negative tests →","404 Not Found (Delete scheduled Events of a particular user with not existing Applet)",""
"","244","Answers CRUD tests → Answers handling after invitation acceptance by respondent → Get activity answers list & Answers of respondent tests → 404 Not Found (Get Answer with not existing activityId)","","Tue Oct 29 23:45:42 GMT 2024","passed","Tue Oct 29 23:45:42 GMT 2024","","Get activity answers list & Answers of respondent tests →","404 Not Found (Get Answer with not existing activityId)",""
"","360","Invitations scenario tests → Invite unregistered user flow → New user can view invitation after registration","","Tue Oct 29 23:52:54 GMT 2024","passed","Tue Oct 29 23:52:54 GMT 2024","","Invite unregistered user flow →","New user can view invitation after registration",""
"","227","Workspaces endpoints tests → Workspaces created → Get workspace respondent applet access list → 404 Not found (non-existent ownerId)","","Tue Oct 29 23:58:35 GMT 2024","passed","Tue Oct 29 23:58:35 GMT 2024","","Get workspace respondent applet access list →","404 Not found (non-existent ownerId)",""
"","1272","Applet builder tests → Create applet → Positive tests → Applet multiple flows with maximum parameters","","Tue Oct 29 23:47:35 GMT 2024","passed","Tue Oct 29 23:47:36 GMT 2024","","Positive tests →","Applet multiple flows with maximum parameters",""
"","199","""Workspace Folders"" endpoints tests → Workspace is created → Delete Folder → 204 OK","","Tue Oct 29 23:57:11 GMT 2024","passed","Tue Oct 29 23:57:11 GMT 2024","","Delete Folder →","204 OK",""
"","327","""Workspace Folders"" endpoints tests → Workspace is created → Get Folders → 200 OK (empty list)","","Tue Oct 29 23:57:09 GMT 2024","passed","Tue Oct 29 23:57:09 GMT 2024","","Get Folders →","200 OK (empty list)",""
"","184","Administration tests → Transfer ownership of Applet tests → 403 Forbidden (Coordinator can not transfer ownership)","","Tue Oct 29 23:54:55 GMT 2024","passed","Tue Oct 29 23:54:55 GMT 2024","","Transfer ownership of Applet tests →","403 Forbidden (Coordinator can not transfer ownership)",""
"","423","Invitations scenario tests → Invite unregistered user flow → New user can accept invitation after registration","","Tue Oct 29 23:52:54 GMT 2024","passed","Tue Oct 29 23:52:54 GMT 2024","","Invite unregistered user flow →","New user can accept invitation after registration",""
"","25","Applet Events CRUD tests → Get general and individual Applet Events → 401 Unauthorized (Get Applet Events with invalid appletOwnerToken)","","Tue Oct 29 23:48:50 GMT 2024","passed","Tue Oct 29 23:48:50 GMT 2024","","Get general and individual Applet Events →","401 Unauthorized (Get Applet Events with invalid appletOwnerToken)",""
"","443","Workspaces endpoints tests → Workspaces created → Get workspace Folder Applets → 200 OK (no result)","","Tue Oct 29 23:58:24 GMT 2024","passed","Tue Oct 29 23:58:24 GMT 2024","","Get workspace Folder Applets →","200 OK (no result)",""
"","229","Logs upload/download tests → Check logs existence → Logs uploaded → 200 OK (2 files uploaded)","","Tue Oct 29 23:52:12 GMT 2024","passed","Tue Oct 29 23:52:12 GMT 2024","","Logs uploaded →","200 OK (2 files uploaded)",""
"","149","Invitations endpoints tests → Send invitation → Invitation Respondent Send → 422 - Incorrect ""language"" value","","Tue Oct 29 23:53:13 GMT 2024","passed","Tue Oct 29 23:53:13 GMT 2024","","Invitation Respondent Send →","422 - Incorrect ""language"" value",""
"","248","Invitations endpoints tests → Get invitations → Invitation created → Get invitations for invitor → 200 OK (non-empty list)","","Tue Oct 29 23:53:07 GMT 2024","passed","Tue Oct 29 23:53:07 GMT 2024","","Get invitations for invitor →","200 OK (non-empty list)",""
"","10","Workspaces endpoints tests → Workspaces created → Get workspace applet managers → Negative tests → 401 Unauthorized","","Tue Oct 29 23:58:31 GMT 2024","passed","Tue Oct 29 23:58:31 GMT 2024","","Negative tests →","401 Unauthorized",""
"","275","Answers scenario tests → Review count in activity answers after submitting assessment by Applet owner and Reviewer Get review count by Reviewer","","Tue Oct 29 23:45:24 GMT 2024","passed","Tue Oct 29 23:45:24 GMT 2024","","Review count in activity answers after submitting assessment by Applet owner and Reviewer","Get review count by Reviewer",""
"","2068","Files upload/download tests → Upload/Download answers (applet files) → Download Answer → 200 OK","","Tue Oct 29 23:51:55 GMT 2024","passed","Tue Oct 29 23:51:57 GMT 2024","","Download Answer →","200 OK",""
"","300","Answers CRUD tests → Answers handling after invitation acceptance by respondent → Create Answer tests → 201 (Answer can be created by Applet Owner)","","Tue Oct 29 23:45:36 GMT 2024","passed","Tue Oct 29 23:45:36 GMT 2024","","Create Answer tests →","201 (Answer can be created by Applet Owner)",""
"","218","Workspaces endpoints tests → Workspaces created → Get workspace applet respondent by id → 404 not found (invalid respondent id)","","Tue Oct 29 23:58:36 GMT 2024","passed","Tue Oct 29 23:58:36 GMT 2024","","Get workspace applet respondent by id →","404 not found (invalid respondent id)",""
"","12","Logs upload/download tests → Check logs existence → 401 Unauthorized","","Tue Oct 29 23:52:11 GMT 2024","passed","Tue Oct 29 23:52:11 GMT 2024","","Check logs existence →","401 Unauthorized",""
"","242","""Themes"" endpoints tests → Update Theme → 200 OK","","Tue Oct 29 23:56:05 GMT 2024","passed","Tue Oct 29 23:56:05 GMT 2024","","Update Theme →","200 OK",""
"","214","Workspaces endpoints tests → Workspaces created → Get workspace applet respondents → Negative tests → 403 Forbidden (invalid applet id)","","Tue Oct 29 23:58:28 GMT 2024","passed","Tue Oct 29 23:58:28 GMT 2024","","Negative tests →","403 Forbidden (invalid applet id)",""
"","269","Workspaces endpoints tests → Workspaces created → Get workspace applet details → 404 Not Found (non-existent appletId)","","Tue Oct 29 23:58:25 GMT 2024","passed","Tue Oct 29 23:58:25 GMT 2024","","Get workspace applet details →","404 Not Found (non-existent appletId)",""
"","258","Applet ""Transfer Ownership"" scenario tests → Transfer Accept → First receiver should become the owner → Verify transferred applets list","","Tue Oct 29 23:50:32 GMT 2024","passed","Tue Oct 29 23:50:32 GMT 2024","","First receiver should become the owner →","Verify transferred applets list",""
"","13","Files upload/download tests → Download File → 401 Unauthorized","","Tue Oct 29 23:51:51 GMT 2024","passed","Tue Oct 29 23:51:51 GMT 2024","","Download File →","401 Unauthorized",""
"","214","Activity Versions & Identifiers tests → Get Identifiers tests → 404 Not Found (not existing activityId)","","Tue Oct 29 23:46:27 GMT 2024","passed","Tue Oct 29 23:46:27 GMT 2024","","Get Identifiers tests →","404 Not Found (not existing activityId)",""
"","141","Applet Events CRUD tests → Create cross-day events tests → 422 (Cross-day Event with ONCE periodicity type and availability range: 00:00:00-00:00:00)","","Tue Oct 29 23:49:21 GMT 2024","passed","Tue Oct 29 23:49:21 GMT 2024","","Create cross-day events tests →","422 (Cross-day Event with ONCE periodicity type and availability range: 00:00:00-00:00:00)",""
"","220","Activity Assessment & Review CRUD tests → Get Assessment & Review tests → Get Reviews tests → 404 Not Found (Get Review of not existing Applet)","","Tue Oct 29 23:46:07 GMT 2024","passed","Tue Oct 29 23:46:07 GMT 2024","","Get Reviews tests →","404 Not Found (Get Review of not existing Applet)",""
"","250","Activity Assessment & Review CRUD tests → Get Assessment & Review tests → Assessment has been submitted → 200 OK (Get Review)","","Tue Oct 29 23:46:08 GMT 2024","passed","Tue Oct 29 23:46:08 GMT 2024","","Assessment has been submitted →","200 OK (Get Review)",""
"","130","Applet Events CRUD tests → Create Events tests → 422 Unprocessable Entity → Create Event with missing startTime (periodicity type: MONTHLY) param","","Tue Oct 29 23:48:48 GMT 2024","passed","Tue Oct 29 23:48:48 GMT 2024","","422 Unprocessable Entity →","Create Event with missing startTime (periodicity type: MONTHLY) param",""
"","246","""Subjects"" endpoints CRUD tests → Get subjects 403: Forbidden","","Tue Oct 29 23:55:55 GMT 2024","passed","Tue Oct 29 23:55:55 GMT 2024","","Get subjects","403: Forbidden",""
"","210","Applets CRUD endpoints tests → Update applet → 404 Applet not found","","Tue Oct 29 23:47:25 GMT 2024","passed","Tue Oct 29 23:47:25 GMT 2024","","Update applet →","404 Applet not found",""
"","1371","User Events scenario tests → User should be able to see events related to a specific Applet","","Tue Oct 29 23:56:49 GMT 2024","passed","Tue Oct 29 23:56:50 GMT 2024","","User Events scenario tests →","User should be able to see events related to a specific Applet",""
"","211","Files upload/download directly to S3 bucket tests → Upload media files directly to storage (S3 bucket) Upload media file directly to generated link","","Tue Oct 29 23:52:16 GMT 2024","passed","Tue Oct 29 23:52:16 GMT 2024","","Upload media files directly to storage (S3 bucket)","Upload media file directly to generated link",""
"","207","Workspaces managers access tests → Set workspace managers applet access list → 403 Access denied (role = super_admin)","","Tue Oct 29 23:57:42 GMT 2024","passed","Tue Oct 29 23:57:42 GMT 2024","","Set workspace managers applet access list →","403 Access denied (role = super_admin)",""
"","133","""Authentication"" endpoints tests → Refresh Token → 200 OK","","Tue Oct 29 23:51:40 GMT 2024","passed","Tue Oct 29 23:51:40 GMT 2024","","Refresh Token →","200 OK",""
"","244","Applet Events CRUD tests → Remove individual scheduled Applet Events negative tests → 404 Not Found (Remove scheduled Events of not existing user)","","Tue Oct 29 23:49:17 GMT 2024","passed","Tue Oct 29 23:49:17 GMT 2024","","Remove individual scheduled Applet Events negative tests →","404 Not Found (Remove scheduled Events of not existing user)",""
"","218","Workspaces endpoints tests → Workspaces created → Get workspace applet managers → Negative tests → 403 Forbidden (invalid applet id)","","Tue Oct 29 23:58:31 GMT 2024","passed","Tue Oct 29 23:58:31 GMT 2024","","Negative tests →","403 Forbidden (invalid applet id)",""
"","1764","Applet builder tests → Update applet → Add activity","","Tue Oct 29 23:48:02 GMT 2024","passed","Tue Oct 29 23:48:03 GMT 2024","","Update applet →","Add activity",""
"","12","Retrieve latest report negative tests → 401 Unauthorized (Get summary latest report with not existing token)","","Tue Oct 29 23:44:56 GMT 2024","passed","Tue Oct 29 23:44:56 GMT 2024","","Retrieve latest report negative tests →","401 Unauthorized (Get summary latest report with not existing token)",""
"","215","Invitations endpoints tests → Decline invitation → 200 OK","","Tue Oct 29 23:53:11 GMT 2024","passed","Tue Oct 29 23:53:11 GMT 2024","","Decline invitation →","200 OK",""
"","261","Activity Assessment & Review CRUD tests → Get Assessment & Review tests → Get Assessment tests → 200 OK (no Assessment data)","","Tue Oct 29 23:46:06 GMT 2024","passed","Tue Oct 29 23:46:06 GMT 2024","","Get Assessment tests →","200 OK (no Assessment data)",""
"","296","""Subjects"" endpoints CRUD tests → Delete subjects 404: Not Found","","Tue Oct 29 23:55:59 GMT 2024","passed","Tue Oct 29 23:55:59 GMT 2024","","Delete subjects","404: Not Found",""
"","224","Flow Versions & Identifiers tests → Get flow Identifiers tests → Get flow identifiers after answer submitting → 200 OK (Get flow identifiers)","","Tue Oct 29 23:46:20 GMT 2024","passed","Tue Oct 29 23:46:20 GMT 2024","","Get flow identifiers after answer submitting →","200 OK (Get flow identifiers)",""
"","227","Get applet completed activities tests → Respondent completes the 1st activity within default always available event → 200 OK (empty list): incorrect applet version","","Tue Oct 29 23:43:54 GMT 2024","passed","Tue Oct 29 23:43:54 GMT 2024","","Respondent completes the 1st activity within default always available event →","200 OK (empty list): incorrect applet version",""
"","1515","Workspaces endpoints tests → Workspaces created → Update workspace applet respondent → 200 OK","","Tue Oct 29 23:58:38 GMT 2024","passed","Tue Oct 29 23:58:39 GMT 2024","","Update workspace applet respondent →","200 OK",""
"","264","Applets ""retentions"" endpoint tests → 200 OK → 100 month","","Tue Oct 29 23:48:21 GMT 2024","passed","Tue Oct 29 23:48:21 GMT 2024","","200 OK →","100 month",""
"","4261","Applet Events scenario tests → End-To-End scenario (General scheduled activity Event)","","Tue Oct 29 23:49:27 GMT 2024","passed","Tue Oct 29 23:49:31 GMT 2024","","Applet Events scenario tests →","End-To-End scenario (General scheduled activity Event)",""
"","259","Applet versions endpoints tests → Update Applet → Add Activity → Remove Activity → Add Activity Flow → Remove Activity Flow → Get applet version by id","","Tue Oct 29 23:51:28 GMT 2024","passed","Tue Oct 29 23:51:28 GMT 2024","","Remove Activity Flow →","Get applet version by id",""
"","12","Applets GET ""base info"" endpoint tests → 401 Unauthorized","","Tue Oct 29 23:47:29 GMT 2024","passed","Tue Oct 29 23:47:29 GMT 2024","","Applets GET ""base info"" endpoint tests →","401 Unauthorized",""
"","11","Get applet completed activities tests → 401 Unauthorized","","Tue Oct 29 23:43:47 GMT 2024","passed","Tue Oct 29 23:43:47 GMT 2024","","Get applet completed activities tests →","401 Unauthorized",""
"","344","Administration tests → Organizers tests → View all organizers tests → 200 OK (Manager can view organizers)","","Tue Oct 29 23:55:03 GMT 2024","passed","Tue Oct 29 23:55:03 GMT 2024","","View all organizers tests →","200 OK (Manager can view organizers)",""
"","245","Administration tests → Applets tests → Create Applet in workspace of Applet owner tests → 403 Forbidden (Coordinator can NOT create Applet in workspace of Applet owner)","","Tue Oct 29 23:55:13 GMT 2024","passed","Tue Oct 29 23:55:13 GMT 2024","","Create Applet in workspace of Applet owner tests →","403 Forbidden (Coordinator can NOT create Applet in workspace of Applet owner)",""
