"DESCRIPTION","DURATION IN MS","NAME","PARENT SUITE","START TIME","STATUS","STOP TIME","SUB SUITE","SUITE","TEST CLASS","TEST METHOD"
"","502","Workspaces endpoints tests → Workspaces created → Get managers priority role → 200 OK (First applet owner gets role in second user's workspace with appletIds filter)","","Tue Oct 29 23:58:32 GMT 2024","passed","Tue Oct 29 23:58:32 GMT 2024","","Get managers priority role →","200 OK (First applet owner gets role in second user's workspace with appletIds filter)",""
"","3701","Applet Events scenario tests → End-To-End scenario (Individual scheduled flow Event)","","Tue Oct 29 23:49:27 GMT 2024","passed","Tue Oct 29 23:49:30 GMT 2024","","Applet Events scenario tests →","End-To-End scenario (Individual scheduled flow Event)",""
"","217","Applets CRUD endpoints tests → Get applets list → Test for filters (query params) → Limit","","Tue Oct 29 23:47:20 GMT 2024","passed","Tue Oct 29 23:47:20 GMT 2024","","Test for filters (query params) →","Limit",""
"","123","Access link tests → Create Access link tests → 422 Unprocessable Entity (Create Access link without required param)","","Tue Oct 29 23:47:10 GMT 2024","passed","Tue Oct 29 23:47:10 GMT 2024","","Create Access link tests →","422 Unprocessable Entity (Create Access link without required param)",""
"","55","Summary & Review activities tests → Get Summary and Review Activities (non-empty list) tests → Get Review Activities list tests → 401 Unauthorized (Get Review Activities list with not existing token)","","Tue Oct 29 23:46:48 GMT 2024","passed","Tue Oct 29 23:46:48 GMT 2024","","Get Review Activities list tests →","401 Unauthorized (Get Review Activities list with not existing token)",""
"","11","Workspaces endpoints tests → Workspaces created → Update workspace applet respondent → 401 Unauthorized","","Tue Oct 29 23:58:38 GMT 2024","passed","Tue Oct 29 23:58:38 GMT 2024","","Update workspace applet respondent →","401 Unauthorized",""
"","14","Invitations endpoints tests → Create shell account → 401: Unauthorized","","Tue Oct 29 23:53:27 GMT 2024","passed","Tue Oct 29 23:53:27 GMT 2024","","Create shell account →","401: Unauthorized",""
"","611","Files upload/download tests → Upload/Download answers (applet files) → Upload Answer → 200 OK","","Tue Oct 29 23:51:55 GMT 2024","passed","Tue Oct 29 23:51:55 GMT 2024","","Upload Answer →","200 OK",""
"","114","Activity Assignments tests → Negative tests → Create Assignments → 422 Unprocessable entity: missing attribute","","Tue Oct 29 23:43:31 GMT 2024","passed","Tue Oct 29 23:43:31 GMT 2024","","Create Assignments →","422 Unprocessable entity: missing attribute",""
"","219","Invitations endpoints tests → Create shell account → 200 OK: shell account with min required attributes","","Tue Oct 29 23:53:27 GMT 2024","passed","Tue Oct 29 23:53:27 GMT 2024","","Create shell account →","200 OK: shell account with min required attributes",""
"","12","Answer Notes tests → Get Notes list tests → Get Notes list (not empty) 401 Unauthorized (Get Note list with not existing token)","","Tue Oct 29 23:43:38 GMT 2024","passed","Tue Oct 29 23:43:38 GMT 2024","","Get Notes list (not empty)","401 Unauthorized (Get Note list with not existing token)",""
"","297","Activity Assignments tests → Negative tests → Create Assignments → 400 bad request: assign activity to limited account","","Tue Oct 29 23:43:31 GMT 2024","passed","Tue Oct 29 23:43:31 GMT 2024","","Create Assignments →","400 bad request: assign activity to limited account",""
"","537","Applets ""report configuration"" endpoint tests → 200 OK","","Tue Oct 29 23:50:04 GMT 2024","passed","Tue Oct 29 23:50:04 GMT 2024","","Applets ""report configuration"" endpoint tests →","200 OK",""
"","293","Applet public links tests → Accept Public invitation tests → 200 OK (Accept Public Invitation for created Applet)","","Tue Oct 29 23:53:34 GMT 2024","passed","Tue Oct 29 23:53:34 GMT 2024","","Accept Public invitation tests →","200 OK (Accept Public Invitation for created Applet)",""
"","10","Create User tests → 422 Unprocessable Entity Create user with empty password param","","Tue Oct 29 23:56:08 GMT 2024","passed","Tue Oct 29 23:56:08 GMT 2024","","422 Unprocessable Entity","Create user with empty password param",""
"","258","Answer Notes tests → Get Notes list tests → Get Notes list (not empty) 404 Not Found (Get Note list of not existing Applet)","","Tue Oct 29 23:43:38 GMT 2024","passed","Tue Oct 29 23:43:38 GMT 2024","","Get Notes list (not empty)","404 Not Found (Get Note list of not existing Applet)",""
"","142","Applet Library tests → Applet is added to the library → Get Library items list 200 OK (search by description)","","Tue Oct 29 23:47:04 GMT 2024","passed","Tue Oct 29 23:47:04 GMT 2024","","Get Library items list","200 OK (search by description)",""
"","212","Applet Events CRUD tests → Update Applet Event tests → 422 Unprocessable Entity → Update Event with missing accessBeforeSchedule (periodicity type: ONCE) param","","Tue Oct 29 23:49:10 GMT 2024","passed","Tue Oct 29 23:49:10 GMT 2024","","422 Unprocessable Entity →","Update Event with missing accessBeforeSchedule (periodicity type: ONCE) param",""
"","194","Activity Assessment & Review CRUD tests → Delete Assessment tests → 404 Not Found (Delete not existing assessment)","","Tue Oct 29 23:46:10 GMT 2024","passed","Tue Oct 29 23:46:10 GMT 2024","","Delete Assessment tests →","404 Not Found (Delete not existing assessment)",""
"","402","Applet Events CRUD tests → Delete scheduled Applet Event by Id tests → 404 Not Found (Delete already deleted individual scheduled activity Event)","","Tue Oct 29 23:49:04 GMT 2024","passed","Tue Oct 29 23:49:04 GMT 2024","","Delete scheduled Applet Event by Id tests →","404 Not Found (Delete already deleted individual scheduled activity Event)",""
"","194","Applet versions endpoints tests → Get applet version by id → 404 (incorrect appletId)","","Tue Oct 29 23:51:21 GMT 2024","passed","Tue Oct 29 23:51:21 GMT 2024","","Get applet version by id →","404 (incorrect appletId)",""
"","1745","Applet builder tests → Create applet → Positive tests → Applet with subscale settings and scorable items","","Tue Oct 29 23:47:35 GMT 2024","passed","Tue Oct 29 23:47:36 GMT 2024","","Positive tests →","Applet with subscale settings and scorable items",""
"","237","Workspaces managers access tests → Remove manager access → 403 Forbidden (try to remove access for respondent)","","Tue Oct 29 23:57:46 GMT 2024","passed","Tue Oct 29 23:57:46 GMT 2024","","Remove manager access →","403 Forbidden (try to remove access for respondent)",""
"","1116","Applet builder tests → Create applet → Positive tests → Single activity with mobile-only items (Audio, Video, Drawing, Geolocation, Photo, Time)","","Tue Oct 29 23:47:35 GMT 2024","passed","Tue Oct 29 23:47:36 GMT 2024","","Positive tests →","Single activity with mobile-only items (Audio, Video, Drawing, Geolocation, Photo, Time)",""
"","197","Get applet completed activities tests → 422 Unprocessable entity: invalid query params","","Tue Oct 29 23:43:47 GMT 2024","passed","Tue Oct 29 23:43:47 GMT 2024","","Get applet completed activities tests →","422 Unprocessable entity: invalid query params",""
"","1498","Applet builder tests → Update applet → Add activity item(s)","","Tue Oct 29 23:48:02 GMT 2024","passed","Tue Oct 29 23:48:03 GMT 2024","","Update applet →","Add activity item(s)",""
"","100","Applets ""setFolder"" endpoint tests → 422 missing attribute (appletId)","","Tue Oct 29 23:50:08 GMT 2024","passed","Tue Oct 29 23:50:08 GMT 2024","","Applets ""setFolder"" endpoint tests →","422 missing attribute (appletId)",""
"","198","Administration tests → Respondents tests → View all respondents tests → 403 Forbidden (Respondent can NOT view all respondents)","","Tue Oct 29 23:55:08 GMT 2024","passed","Tue Oct 29 23:55:08 GMT 2024","","View all respondents tests →","403 Forbidden (Respondent can NOT view all respondents)",""
"","285","Workspaces endpoints tests → Workspaces created → Get workspace respondents → Test for filters (query params) → Limit","","Tue Oct 29 23:58:26 GMT 2024","passed","Tue Oct 29 23:58:26 GMT 2024","","Test for filters (query params) →","Limit",""
"","2955","Create Answers for different item types tests → A/B Trails Tablet performance task","","Tue Oct 29 23:44:22 GMT 2024","passed","Tue Oct 29 23:44:24 GMT 2024","","Create Answers for different item types tests →","A/B Trails Tablet performance task",""
"","420","Shell account invitation scenario tests → Accept invitation by already registered user → Send invitation to the shell account","","Tue Oct 29 23:54:14 GMT 2024","passed","Tue Oct 29 23:54:14 GMT 2024","","Accept invitation by already registered user →","Send invitation to the shell account",""
"","263","Get User Device Information → 200 Get User Device","","Tue Oct 29 23:56:46 GMT 2024","passed","Tue Oct 29 23:56:46 GMT 2024","","Get User Device Information →","200 Get User Device",""
"","266","Administration tests → Applets tests → Export & view data in workspace of Applet owner tests → View respondent's data tests → 403 Forbidden (Reviewer with no assigned respondents can NOT view data)","","Tue Oct 29 23:55:23 GMT 2024","passed","Tue Oct 29 23:55:23 GMT 2024","","View respondent's data tests →","403 Forbidden (Reviewer with no assigned respondents can NOT view data)",""
"","28","Files upload/download directly to S3 bucket tests → Generate presigned links EPs negative tests Media URL 401 Unauthorized","","Tue Oct 29 23:52:37 GMT 2024","passed","Tue Oct 29 23:52:37 GMT 2024","","Media URL","401 Unauthorized",""
"","2163","Create Answers for different item types tests → All web-app items","","Tue Oct 29 23:44:22 GMT 2024","passed","Tue Oct 29 23:44:24 GMT 2024","","Create Answers for different item types tests →","All web-app items",""
"","211","Applet Library tests → Share applet to the library 403 invalid applet id","","Tue Oct 29 23:47:02 GMT 2024","passed","Tue Oct 29 23:47:02 GMT 2024","","Share applet to the library","403 invalid applet id",""
"","158","Applet public access tests → Create anonymous answer 404 Not Found (invalid appletId)","","Tue Oct 29 23:50:02 GMT 2024","passed","Tue Oct 29 23:50:02 GMT 2024","","Create anonymous answer","404 Not Found (invalid appletId)",""
"","225","Workspaces endpoints tests → Workspaces created → Get workspace Applets → Test for filters (query params) → Limit","","Tue Oct 29 23:58:22 GMT 2024","passed","Tue Oct 29 23:58:22 GMT 2024","","Test for filters (query params) →","Limit",""
"","11","Workspaces endpoints tests → Workspaces created → Pin user (manager) on workspace → 401 Unauthorized","","Tue Oct 29 23:58:34 GMT 2024","passed","Tue Oct 29 23:58:34 GMT 2024","","Pin user (manager) on workspace →","401 Unauthorized",""
"","758","Applets CRUD endpoints tests → Update applet → 400 Bad Request (duplicate name)","","Tue Oct 29 23:47:25 GMT 2024","passed","Tue Oct 29 23:47:25 GMT 2024","","Update applet →","400 Bad Request (duplicate name)",""
"","145","Applet Events CRUD tests → Create cross-day events tests → 422 (Cross-day Event with WEEKDAYS periodicity type and availability range: 23:59:00-23:59:00)","","Tue Oct 29 23:49:21 GMT 2024","passed","Tue Oct 29 23:49:21 GMT 2024","","Create cross-day events tests →","422 (Cross-day Event with WEEKDAYS periodicity type and availability range: 23:59:00-23:59:00)",""
"","6923","Answers scenario tests → New Applet owner should be able to see Answers of respondent after transferring ownership to another user","","Tue Oct 29 23:45:03 GMT 2024","passed","Tue Oct 29 23:45:09 GMT 2024","","Answers scenario tests →","New Applet owner should be able to see Answers of respondent after transferring ownership to another user",""
"","12","""Authentication"" endpoints tests → OpenAPI auth → 422 Unprocessable Entity (missing attribute)","","Tue Oct 29 23:51:44 GMT 2024","passed","Tue Oct 29 23:51:44 GMT 2024","","OpenAPI auth →","422 Unprocessable Entity (missing attribute)",""
"","370","""Authentication"" endpoints tests → Tokens invalidation tests → Verify refreshToken is invalidated but access token is still alive","","Tue Oct 29 23:51:46 GMT 2024","passed","Tue Oct 29 23:51:46 GMT 2024","","Tokens invalidation tests →","Verify refreshToken is invalidated but access token is still alive",""
"","222","Answer Notes tests → Delete Note tests → 404 Not Found (Delete Note in not existing Applet)","","Tue Oct 29 23:43:44 GMT 2024","passed","Tue Oct 29 23:43:44 GMT 2024","","Delete Note tests →","404 Not Found (Delete Note in not existing Applet)",""
"","159","Applet public access tests → Create anonymous answer 404 Not Found (invalid activityId)","","Tue Oct 29 23:50:02 GMT 2024","passed","Tue Oct 29 23:50:02 GMT 2024","","Create anonymous answer","404 Not Found (invalid activityId)",""
"","325","Get submit dates & exported Answers data tests → Get exported data & dates after answer submit → 200 OK (Get exported data by reviewer with assigned respondent)","","Tue Oct 29 23:44:18 GMT 2024","passed","Tue Oct 29 23:44:18 GMT 2024","","Get exported data & dates after answer submit →","200 OK (Get exported data by reviewer with assigned respondent)",""
"","385","Workspace folder for different users tests → Get folders (manager)","","Tue Oct 29 23:57:15 GMT 2024","passed","Tue Oct 29 23:57:15 GMT 2024","","Workspace folder for different users tests →","Get folders (manager)",""
"","264","Applet ""Transfer Ownership"" scenario tests → Transfer Accept → First receiver should become the owner → Verify transferred respondents list","","Tue Oct 29 23:50:32 GMT 2024","passed","Tue Oct 29 23:50:32 GMT 2024","","First receiver should become the owner →","Verify transferred respondents list",""
"","262","Shell account invitation scenario tests → Decline invitation by unregistered user → Verify shell account remains the same in the list of respondents","","Tue Oct 29 23:54:10 GMT 2024","passed","Tue Oct 29 23:54:10 GMT 2024","","Decline invitation by unregistered user →","Verify shell account remains the same in the list of respondents",""
"","113","Invitations endpoints tests → Send invitation → Invitation Respondent Send → 422 Missing attributes Missing language","","Tue Oct 29 23:53:16 GMT 2024","passed","Tue Oct 29 23:53:16 GMT 2024","","422 Missing attributes","Missing language",""
"","236","Applets ""retentions"" endpoint tests → 404 applet Not found","","Tue Oct 29 23:48:19 GMT 2024","passed","Tue Oct 29 23:48:19 GMT 2024","","Applets ""retentions"" endpoint tests →","404 applet Not found",""
"","268","Shell account invitation scenario tests → Accept invitation by already registered user → Verify shell account is in pending status in the list of respondents","","Tue Oct 29 23:54:14 GMT 2024","passed","Tue Oct 29 23:54:14 GMT 2024","","Accept invitation by already registered user →","Verify shell account is in pending status in the list of respondents",""
"","135","Invitations endpoints tests → Send invitation → Invitation Reviewer Send → 422 Missing attributes Missing email","","Tue Oct 29 23:53:20 GMT 2024","passed","Tue Oct 29 23:53:20 GMT 2024","","422 Missing attributes","Missing email",""
"","336","Get submit dates & exported Answers data tests → Get exported data & dates after answer submit → 200 OK (Get exported data by applet owner)","","Tue Oct 29 23:44:18 GMT 2024","passed","Tue Oct 29 23:44:18 GMT 2024","","Get exported data & dates after answer submit →","200 OK (Get exported data by applet owner)",""
"","133","Applet Events CRUD tests → Update Applet Event tests → 422 Unprocessable Entity (Update Event type by params - activityId, flowId, respondentId)","","Tue Oct 29 23:49:08 GMT 2024","passed","Tue Oct 29 23:49:08 GMT 2024","","Update Applet Event tests →","422 Unprocessable Entity (Update Event type by params - activityId, flowId, respondentId)",""
"","265","Applet versions endpoints tests → Update Applet → Add Activity → Remove Activity → Add Activity Flow → Get applet version changes","","Tue Oct 29 23:51:27 GMT 2024","passed","Tue Oct 29 23:51:27 GMT 2024","","Add Activity Flow →","Get applet version changes",""
"","107","Invitations endpoints tests → Send invitation → Invitation Respondent Send → 422 Missing attributes Missing secretUserId","","Tue Oct 29 23:53:16 GMT 2024","passed","Tue Oct 29 23:53:16 GMT 2024","","422 Missing attributes","Missing secretUserId",""
"","225","""Workspace Folders"" endpoints tests → Workspace is created → Pin/Unpin Folder → Unpin Folder → 400 (non-existent folder)","","Tue Oct 29 23:57:13 GMT 2024","passed","Tue Oct 29 23:57:13 GMT 2024","","Unpin Folder →","400 (non-existent folder)",""
"","329","Logs upload/download tests → Upload Logs → 200 OK","","Tue Oct 29 23:52:07 GMT 2024","passed","Tue Oct 29 23:52:07 GMT 2024","","Upload Logs →","200 OK",""
"","389","Logs upload/download tests → Download Logs → 200 OK","","Tue Oct 29 23:52:07 GMT 2024","passed","Tue Oct 29 23:52:07 GMT 2024","","Download Logs →","200 OK",""
"","243","Activity Versions & Identifiers tests → Get Versions tests → 404 Not Found (Get versions of not existing Applet)","","Tue Oct 29 23:46:24 GMT 2024","passed","Tue Oct 29 23:46:24 GMT 2024","","Get Versions tests →","404 Not Found (Get versions of not existing Applet)",""
"","12","""Authentication"" endpoints tests → Get Token → 422 Unprocessable Entity (missing attribute)","","Tue Oct 29 23:51:38 GMT 2024","passed","Tue Oct 29 23:51:38 GMT 2024","","Get Token →","422 Unprocessable Entity (missing attribute)",""
"","117","Invitations endpoints tests → Send invitation → Invitation Reviewer Send → 422 - Incorrect ""language"" value","","Tue Oct 29 23:53:17 GMT 2024","passed","Tue Oct 29 23:53:17 GMT 2024","","Invitation Reviewer Send →","422 - Incorrect ""language"" value",""
"","397","""Themes"" endpoints tests → Create Theme → 400 Bad Request (duplicate name)","","Tue Oct 29 23:56:03 GMT 2024","passed","Tue Oct 29 23:56:03 GMT 2024","","Create Theme →","400 Bad Request (duplicate name)",""
"","14","Create User tests → 422 Unprocessable Entity Create user with empty lastName param","","Tue Oct 29 23:56:08 GMT 2024","passed","Tue Oct 29 23:56:08 GMT 2024","","422 Unprocessable Entity","Create user with empty lastName param",""
"","99","""Authentication"" endpoints tests → Get Token → 401 incorrect email","","Tue Oct 29 23:51:38 GMT 2024","passed","Tue Oct 29 23:51:38 GMT 2024","","Get Token →","401 incorrect email",""
"","401","Administration tests → Respondents tests → Set schedule for respondents tests → 201 (Coordinator can schedule Event)","","Tue Oct 29 23:55:12 GMT 2024","passed","Tue Oct 29 23:55:12 GMT 2024","","Set schedule for respondents tests →","201 (Coordinator can schedule Event)",""
"","216","Administration tests → Organizers tests → View all organizers tests → 403 Forbidden (Coordinator can NOT view organizers)","","Tue Oct 29 23:55:03 GMT 2024","passed","Tue Oct 29 23:55:03 GMT 2024","","View all organizers tests →","403 Forbidden (Coordinator can NOT view organizers)",""
"","327","Files upload/download tests → Upload/Download answers (applet files) → Download Answer → 404 file not found","","Tue Oct 29 23:51:55 GMT 2024","passed","Tue Oct 29 23:51:55 GMT 2024","","Download Answer →","404 file not found",""
"","125","Applets ""retentions"" endpoint tests → 400 / 422 Bad Request → Missing period","","Tue Oct 29 23:48:22 GMT 2024","passed","Tue Oct 29 23:48:22 GMT 2024","","400 / 422 Bad Request →","Missing period",""
"","191","Flow Versions & Identifiers tests → Get flow Versions tests → 200: Empty list (Get flow versions of not existing activityFlowId)","","Tue Oct 29 23:46:15 GMT 2024","passed","Tue Oct 29 23:46:15 GMT 2024","","Get flow Versions tests →","200: Empty list (Get flow versions of not existing activityFlowId)",""
"","280","Invitations endpoints tests → Create shell account → 403: Forbidden","","Tue Oct 29 23:53:27 GMT 2024","passed","Tue Oct 29 23:53:27 GMT 2024","","Create shell account →","403: Forbidden",""
"","2343","Create Answers for different item types tests → Flanker performance task","","Tue Oct 29 23:44:22 GMT 2024","passed","Tue Oct 29 23:44:24 GMT 2024","","Create Answers for different item types tests →","Flanker performance task",""
"","242","Invitations endpoints tests → Get invitations → No Invitations created → Get invitations for invitor → 200 OK (empty list)","","Tue Oct 29 23:53:06 GMT 2024","passed","Tue Oct 29 23:53:06 GMT 2024","","Get invitations for invitor →","200 OK (empty list)",""
"","1069","Applet builder tests → Create applet → Positive tests → Scores and reports configurations","","Tue Oct 29 23:47:35 GMT 2024","failed","Tue Oct 29 23:47:36 GMT 2024","","Positive tests →","Scores and reports configurations",""
"","743","Answers scenario tests → Applet owner should NOT be able to see Answers of respondent in the Applet duplicate","","Tue Oct 29 23:45:03 GMT 2024","passed","Tue Oct 29 23:45:03 GMT 2024","","Answers scenario tests →","Applet owner should NOT be able to see Answers of respondent in the Applet duplicate",""
"","10","Applet ""Transfer Ownership"" endpoints tests → Transfer Initiate → 401 Unauthorized","","Tue Oct 29 23:50:58 GMT 2024","passed","Tue Oct 29 23:50:58 GMT 2024","","Transfer Initiate →","401 Unauthorized",""
"","332","Administration tests → Applets tests → Export & view data in workspace of Applet owner tests → Export data tests → 200 OK (Reviewer with assigned respondents can export data)","","Tue Oct 29 23:55:22 GMT 2024","passed","Tue Oct 29 23:55:22 GMT 2024","","Export data tests →","200 OK (Reviewer with assigned respondents can export data)",""
"","183","Invitations scenario tests → Decline invitation positive flow → Invited user can't see invitation anymore","","Tue Oct 29 23:52:44 GMT 2024","passed","Tue Oct 29 23:52:44 GMT 2024","","Decline invitation positive flow →","Invited user can't see invitation anymore",""
"","423","Invitations endpoints tests → Send invitation → Invitation Respondent Send → 200 OK (send to existing user)","","Tue Oct 29 23:53:13 GMT 2024","passed","Tue Oct 29 23:53:13 GMT 2024","","Invitation Respondent Send →","200 OK (send to existing user)",""
"","237","Get applet completed activities tests → Respondent completes the 1st activity within default always available event → Respondent completes the 2nd activity within oneTimeCompletion Event → 200 OK : second activity completion should be present","","Tue Oct 29 23:43:56 GMT 2024","passed","Tue Oct 29 23:43:56 GMT 2024","","Respondent completes the 2nd activity within oneTimeCompletion Event →","200 OK : second activity completion should be present",""
"","316","Shell account invitation scenario tests → Accept invitation by already registered user → New user can access invitation by key","","Tue Oct 29 23:54:14 GMT 2024","passed","Tue Oct 29 23:54:14 GMT 2024","","Accept invitation by already registered user →","New user can access invitation by key",""
"","224","Applet builder tests → Create applet → Negative tests → Single select item with incorrect responseType","","Tue Oct 29 23:48:01 GMT 2024","passed","Tue Oct 29 23:48:01 GMT 2024","","Negative tests →","Single select item with incorrect responseType",""
"","2070","Create Answers for different item types tests → Slider item","","Tue Oct 29 23:44:22 GMT 2024","passed","Tue Oct 29 23:44:24 GMT 2024","","Create Answers for different item types tests →","Slider item",""
"","111","Applet public access tests → Invite link with { requireLogin: true } created → Get public applet events: 404 Not found","","Tue Oct 29 23:50:03 GMT 2024","passed","Tue Oct 29 23:50:03 GMT 2024","","Invite link with { requireLogin: true } created →","Get public applet events: 404 Not found",""
"","11","Applet Events CRUD tests → Remove individual scheduled Applet Events negative tests → 401 Unauthorized (Remove scheduled Events of a particular user with not existing appletOwnerToken)","","Tue Oct 29 23:49:17 GMT 2024","passed","Tue Oct 29 23:49:17 GMT 2024","","Remove individual scheduled Applet Events negative tests →","401 Unauthorized (Remove scheduled Events of a particular user with not existing appletOwnerToken)",""
"","358","Get submit dates & exported Answers data tests → Get exported data & dates after answer submit → 200 OK (Get exported data by editor - should see only his own data)","","Tue Oct 29 23:44:18 GMT 2024","passed","Tue Oct 29 23:44:18 GMT 2024","","Get exported data & dates after answer submit →","200 OK (Get exported data by editor - should see only his own data)",""
"","221","Applets ""retentions"" endpoint tests → 200 OK → 1 indefinitely","","Tue Oct 29 23:48:21 GMT 2024","passed","Tue Oct 29 23:48:21 GMT 2024","","200 OK →","1 indefinitely",""
"","258","Invitations endpoints tests → Send invitation → Invitation Reviewer Send → 400 - Incorrect respondents list","","Tue Oct 29 23:53:17 GMT 2024","passed","Tue Oct 29 23:53:17 GMT 2024","","Invitation Reviewer Send →","400 - Incorrect respondents list",""
"","307","Get submit dates & exported Answers data tests → Get exported data before Answer submit → 200 OK (Get empty exported data)","","Tue Oct 29 23:44:16 GMT 2024","passed","Tue Oct 29 23:44:16 GMT 2024","","Get exported data before Answer submit →","200 OK (Get empty exported data)",""
