"DESCRIPTION","DURATION IN MS","NAME","PARENT SUITE","START TIME","STATUS","STOP TIME","SUB SUITE","SUITE","TEST CLASS","TEST METHOD"
"","274","Workspaces endpoints tests → Workspaces created → Get workspace managers → Test for filters (query params) → Search → Search by firstName","","Tue Oct 29 23:58:30 GMT 2024","passed","Tue Oct 29 23:58:30 GMT 2024","","Search →","Search by firstName",""
"","10","Access link tests → Get Access link tests → 401 Unauthorized (Get Access link with invalid token)","","Tue Oct 29 23:47:10 GMT 2024","passed","Tue Oct 29 23:47:10 GMT 2024","","Get Access link tests →","401 Unauthorized (Get Access link with invalid token)",""
"","13","Applets ""unique_name"" endpoint tests → 401 Unauthorized","","Tue Oct 29 23:51:15 GMT 2024","passed","Tue Oct 29 23:51:15 GMT 2024","","Applets ""unique_name"" endpoint tests →","401 Unauthorized",""
"","477","Administration tests → Applets tests → Duplicate Applet in workspace of Applet owner tests → 201 Created (Editor can duplicate Applet)","","Tue Oct 29 23:55:17 GMT 2024","passed","Tue Oct 29 23:55:17 GMT 2024","","Duplicate Applet in workspace of Applet owner tests →","201 Created (Editor can duplicate Applet)",""
"","255","Delete User tests → 401 Unauthorized (Delete User with not existing token)","","Tue Oct 29 23:56:11 GMT 2024","passed","Tue Oct 29 23:56:11 GMT 2024","","Delete User tests →","401 Unauthorized (Delete User with not existing token)",""
"","225","Applet Events CRUD tests → Update Applet Event tests → 404 Not Found (Update general scheduled activity Event with not existing id)","","Tue Oct 29 23:49:08 GMT 2024","passed","Tue Oct 29 23:49:08 GMT 2024","","Update Applet Event tests →","404 Not Found (Update general scheduled activity Event with not existing id)",""
"","248","Administration tests → Applets tests → Export & view data in workspace of Applet owner tests → Export data tests → 200 OK (Manager can export data)","","Tue Oct 29 23:55:22 GMT 2024","passed","Tue Oct 29 23:55:22 GMT 2024","","Export data tests →","200 OK (Manager can export data)",""
"","411","Administration tests → Perform activities tests → 200 OK (Editor can submit answers)","","Tue Oct 29 23:55:25 GMT 2024","passed","Tue Oct 29 23:55:25 GMT 2024","","Perform activities tests →","200 OK (Editor can submit answers)",""
"","457","Workspace folder for different users tests → Manager is invited to the applet → Manager creates own folder in the same workspace Applet Owner and Manager add the same applet in their folders Get folders (manager)","","Tue Oct 29 23:57:21 GMT 2024","passed","Tue Oct 29 23:57:21 GMT 2024","","Applet Owner and Manager add the same applet in their folders","Get folders (manager)",""
"","11","Applet public links tests → Accept Public invitation tests → 401 Unauthorized (Accept invitation with not existing token)","","Tue Oct 29 23:53:34 GMT 2024","passed","Tue Oct 29 23:53:34 GMT 2024","","Accept Public invitation tests →","401 Unauthorized (Accept invitation with not existing token)",""
"","211","""Themes"" endpoints tests → Delete Theme → 204 OK","","Tue Oct 29 23:56:05 GMT 2024","passed","Tue Oct 29 23:56:05 GMT 2024","","Delete Theme →","204 OK",""
"","304","Activity Versions & Identifiers tests → Get Versions tests → 404 Not Found (Get versions of not existing activityId)","","Tue Oct 29 23:46:24 GMT 2024","passed","Tue Oct 29 23:46:24 GMT 2024","","Get Versions tests →","404 Not Found (Get versions of not existing activityId)",""
"","837","Applet Events scenario tests → General Always Available activity & General Always Available flow Events should appear automatically after Applet creation","","Tue Oct 29 23:49:27 GMT 2024","passed","Tue Oct 29 23:49:27 GMT 2024","","Applet Events scenario tests →","General Always Available activity & General Always Available flow Events should appear automatically after Applet creation",""
"","122","""Themes"" endpoints tests → Delete Theme → 404 Not Found (non-existent theme)","","Tue Oct 29 23:56:05 GMT 2024","passed","Tue Oct 29 23:56:05 GMT 2024","","Delete Theme →","404 Not Found (non-existent theme)",""
"","2507","Create Answers for different item types tests → All rows items","","Tue Oct 29 23:44:22 GMT 2024","passed","Tue Oct 29 23:44:24 GMT 2024","","Create Answers for different item types tests →","All rows items",""
"","220","Answers CRUD tests → Answers handling after invitation acceptance by respondent → Create Answer tests → 422 Unprocessable Entity → Create Answer with missing activityId param","","Tue Oct 29 23:45:38 GMT 2024","passed","Tue Oct 29 23:45:38 GMT 2024","","422 Unprocessable Entity →","Create Answer with missing activityId param",""
"","392","Duplicate Applet endpoint tests → 400 not unique applet name","","Tue Oct 29 23:48:23 GMT 2024","passed","Tue Oct 29 23:48:23 GMT 2024","","Duplicate Applet endpoint tests →","400 not unique applet name",""
"","613","Administration tests → Applets tests → Duplicate Applet in workspace of Applet owner tests → 201 Created (Manager can duplicate Applet)","","Tue Oct 29 23:55:17 GMT 2024","passed","Tue Oct 29 23:55:17 GMT 2024","","Duplicate Applet in workspace of Applet owner tests →","201 Created (Manager can duplicate Applet)",""
"","298","Delete and remove individual Events scenario tests → Delete individual scheduled user Events scenario tests → Second Respondent should have individual scheduled flow Event & general Always Available activity Event if individual scheduled flow Event has NOT been deleted","","Tue Oct 29 23:48:39 GMT 2024","passed","Tue Oct 29 23:48:39 GMT 2024","","Delete individual scheduled user Events scenario tests →","Second Respondent should have individual scheduled flow Event & general Always Available activity Event if individual scheduled flow Event has NOT been deleted",""
"","256","Applet versions endpoints tests → Update Applet → Add Activity → Remove Activity → Add Activity Flow → Remove Activity Flow → Add Activity Item → Remove Activity Item → Get applet versions","","Tue Oct 29 23:51:31 GMT 2024","passed","Tue Oct 29 23:51:31 GMT 2024","","Remove Activity Item →","Get applet versions",""
"","941","Administration tests → Organizers tests → Invite new organizer tests → 403 Forbidden (Editor can NOT invite manager, coordinator, editor, reviewer)","","Tue Oct 29 23:54:56 GMT 2024","passed","Tue Oct 29 23:54:56 GMT 2024","","Invite new organizer tests →","403 Forbidden (Editor can NOT invite manager, coordinator, editor, reviewer)",""
"","5141","Shell account invitation scenario tests → Accept invitation by unregistered user → New user should receive an e-mail with invitation","","Tue Oct 29 23:53:58 GMT 2024","passed","Tue Oct 29 23:54:03 GMT 2024","","Accept invitation by unregistered user →","New user should receive an e-mail with invitation",""
"","298","""Subjects"" endpoints CRUD tests → Update subjects 200 OK: respondent","","Tue Oct 29 23:55:57 GMT 2024","passed","Tue Oct 29 23:55:57 GMT 2024","","Update subjects","200 OK: respondent",""
"","223","Workspaces endpoints tests → Workspaces created → Get workspace applet respondent by id → 404 not found (invalid workspace id)","","Tue Oct 29 23:58:36 GMT 2024","passed","Tue Oct 29 23:58:36 GMT 2024","","Get workspace applet respondent by id →","404 not found (invalid workspace id)",""
"","332","Invitations scenario tests → Invite unregistered user flow → New user can see the applet","","Tue Oct 29 23:52:54 GMT 2024","passed","Tue Oct 29 23:52:54 GMT 2024","","Invite unregistered user flow →","New user can see the applet",""
"","675","Create User tests → 201 Create User","","Tue Oct 29 23:56:07 GMT 2024","passed","Tue Oct 29 23:56:07 GMT 2024","","Create User tests →","201 Create User",""
"","1821","Applet builder tests → Update applet → Unhide all items","","Tue Oct 29 23:48:02 GMT 2024","passed","Tue Oct 29 23:48:03 GMT 2024","","Update applet →","Unhide all items",""
"","230","Invitations endpoints tests → Get invitations → No Invitations created → Get invitation by key → 404 Not found (non-existent key)","","Tue Oct 29 23:53:06 GMT 2024","passed","Tue Oct 29 23:53:06 GMT 2024","","Get invitation by key →","404 Not found (non-existent key)",""
"","127","Workspaces endpoints tests → Workspaces created → Get managers priority role → 422 Invalid query params","","Tue Oct 29 23:58:32 GMT 2024","passed","Tue Oct 29 23:58:32 GMT 2024","","Get managers priority role →","422 Invalid query params",""
"","240","Administration tests → Applets tests → Export & view data in workspace of Applet owner tests → View respondent's data tests → 403 Forbidden (Respondent can NOT view data)","","Tue Oct 29 23:55:23 GMT 2024","passed","Tue Oct 29 23:55:23 GMT 2024","","View respondent's data tests →","403 Forbidden (Respondent can NOT view data)",""
"","297","Logs upload/download tests → Check logs existence → 200 OK (empty list)","","Tue Oct 29 23:52:11 GMT 2024","passed","Tue Oct 29 23:52:11 GMT 2024","","Check logs existence →","200 OK (empty list)",""
"","572","Invitations scenario tests → Decline invitation positive flow → Invitation can be sent again after it declination by the user","","Tue Oct 29 23:52:44 GMT 2024","passed","Tue Oct 29 23:52:44 GMT 2024","","Decline invitation positive flow →","Invitation can be sent again after it declination by the user",""
"","501","Workspaces managers access tests → Remove manager access → 200 OK (empty appletIds)","","Tue Oct 29 23:57:46 GMT 2024","passed","Tue Oct 29 23:57:46 GMT 2024","","Remove manager access →","200 OK (empty appletIds)",""
"","11","Invitations endpoints tests → Get invitations → No Invitations created → Get invitation by key → 401 Unauthorized (invalid token)","","Tue Oct 29 23:53:06 GMT 2024","passed","Tue Oct 29 23:53:06 GMT 2024","","Get invitation by key →","401 Unauthorized (invalid token)",""
"","193","Workspace folder for different users tests → Manager is invited to the applet → Manager creates own folder in the same workspace Get folders (applet owner)","","Tue Oct 29 23:57:20 GMT 2024","passed","Tue Oct 29 23:57:20 GMT 2024","","Manager creates own folder in the same workspace","Get folders (applet owner)",""
"","144","Applet public access tests → Get public activities by key → 200 OK","","Tue Oct 29 23:50:00 GMT 2024","passed","Tue Oct 29 23:50:00 GMT 2024","","Get public activities by key →","200 OK",""
"","213","Workspaces endpoints tests → Workspaces created → Get workspace by ownerId → 200 OK","","Tue Oct 29 23:58:19 GMT 2024","passed","Tue Oct 29 23:58:19 GMT 2024","","Get workspace by ownerId →","200 OK",""
"","222","Summary & Review activity flow tests → Get Review activity flow tests → 422 Unprocessable Entity (Get Review activity flow list without createdDate query param)","","Tue Oct 29 23:46:56 GMT 2024","passed","Tue Oct 29 23:46:56 GMT 2024","","Get Review activity flow tests →","422 Unprocessable Entity (Get Review activity flow list without createdDate query param)",""
"","10","Applet versions endpoints tests → Get applet versions → 401 Unauthorized","","Tue Oct 29 23:51:21 GMT 2024","passed","Tue Oct 29 23:51:21 GMT 2024","","Get applet versions →","401 Unauthorized",""
"","12","User Password tests → Password recovery approve tests → 422 Unprocessable Entity Approve user password recovery with missing email param","","Tue Oct 29 23:56:32 GMT 2024","passed","Tue Oct 29 23:56:32 GMT 2024","","422 Unprocessable Entity","Approve user password recovery with missing email param",""
"","223","Answers CRUD tests → Answers handling after invitation acceptance by respondent → Create Answer tests → 422 Unprocessable Entity → Create Answer with missing version param","","Tue Oct 29 23:45:38 GMT 2024","passed","Tue Oct 29 23:45:38 GMT 2024","","422 Unprocessable Entity →","Create Answer with missing version param",""
"","197","Applet Library tests → Applet is added to the library → Get Library items list 200 OK (get the whole list)","","Tue Oct 29 23:47:04 GMT 2024","passed","Tue Oct 29 23:47:04 GMT 2024","","Get Library items list","200 OK (get the whole list)",""
"","183","Applet builder tests → Create applet → Negative tests → Incorrect conditional logic config (drawing item config)","","Tue Oct 29 23:48:01 GMT 2024","passed","Tue Oct 29 23:48:01 GMT 2024","","Negative tests →","Incorrect conditional logic config (drawing item config)",""
"","752","Shell account invitation scenario tests → Send shell account invitation to an existing respondent → Verify 2 or more shell accounts invitations can be sent to the same email","","Tue Oct 29 23:54:25 GMT 2024","passed","Tue Oct 29 23:54:25 GMT 2024","","Send shell account invitation to an existing respondent →","Verify 2 or more shell accounts invitations can be sent to the same email",""
"","1378","Applet Events CRUD tests → Count scheduled Applet Events tests → Count general scheduled Events after their creation and deletion","","Tue Oct 29 23:49:13 GMT 2024","passed","Tue Oct 29 23:49:14 GMT 2024","","Count scheduled Applet Events tests →","Count general scheduled Events after their creation and deletion",""
"","184","Workspaces endpoints tests → Workspaces created → Pin user (manager) on workspace → 404 Not Found (ownerId)","","Tue Oct 29 23:58:34 GMT 2024","passed","Tue Oct 29 23:58:34 GMT 2024","","Pin user (manager) on workspace →","404 Not Found (ownerId)",""
"","254","Administration tests → Applets tests → Export & view data in workspace of Applet owner tests → View respondent's data tests → 200 OK (Applet owner can view data)","","Tue Oct 29 23:55:23 GMT 2024","passed","Tue Oct 29 23:55:23 GMT 2024","","View respondent's data tests →","200 OK (Applet owner can view data)",""
"","11","""Workspace Folders"" endpoints tests → Workspace is created → Update Folder → 401 Unauthorized (invalid token)","","Tue Oct 29 23:57:10 GMT 2024","passed","Tue Oct 29 23:57:10 GMT 2024","","Update Folder →","401 Unauthorized (invalid token)",""
"","208","Summary & Review activity flow tests → Get Review activity flow tests → 422 Unprocessable Entity (Get Review activity flow list without targetSubjectId query param)","","Tue Oct 29 23:46:56 GMT 2024","passed","Tue Oct 29 23:46:56 GMT 2024","","Get Review activity flow tests →","422 Unprocessable Entity (Get Review activity flow list without targetSubjectId query param)",""
"","234","Applet versions endpoints tests → Update Applet → Add Activity → Remove Activity → Add Activity Flow → Remove Activity Flow → Add Activity Item → Remove Activity Item → Update Activity → Update Activity Item → Get applet version by id","","Tue Oct 29 23:51:33 GMT 2024","passed","Tue Oct 29 23:51:33 GMT 2024","","Update Activity Item →","Get applet version by id",""
"","141","""Themes"" endpoints tests → Create Theme → 422 Unprocessable Entity (missing attribute) Missing name","","Tue Oct 29 23:56:04 GMT 2024","passed","Tue Oct 29 23:56:04 GMT 2024","","422 Unprocessable Entity (missing attribute)","Missing name",""
"","502","Shell account invitation scenario tests → Accept invitation by unregistered user → Verify invitation in list of invitations","","Tue Oct 29 23:53:58 GMT 2024","passed","Tue Oct 29 23:53:58 GMT 2024","","Accept invitation by unregistered user →","Verify invitation in list of invitations",""
"","11","Activity Versions & Identifiers tests → Get Identifiers tests → 401 Unauthorized (Get identifiers with not existing token)","","Tue Oct 29 23:46:27 GMT 2024","passed","Tue Oct 29 23:46:27 GMT 2024","","Get Identifiers tests →","401 Unauthorized (Get identifiers with not existing token)",""
"","176","Invitations scenario tests → Re-send invitation flow → Invited user can't accept old invitation","","Tue Oct 29 23:52:49 GMT 2024","passed","Tue Oct 29 23:52:49 GMT 2024","","Re-send invitation flow →","Invited user can't accept old invitation",""
"","554","Invitations endpoints tests → Send invitation → Invitation Managers Send → 200 OK (send to unregistered user) With title","","Tue Oct 29 23:53:23 GMT 2024","passed","Tue Oct 29 23:53:23 GMT 2024","","200 OK (send to unregistered user)","With title",""
"","231","Administration tests → Applets tests → Export & view data in workspace of Applet owner tests → Export data tests → 200 OK (Respondent can export his own data)","","Tue Oct 29 23:55:22 GMT 2024","passed","Tue Oct 29 23:55:22 GMT 2024","","Export data tests →","200 OK (Respondent can export his own data)",""
"","203","Applet Library tests → Share applet to the library 422 missing attribute (name)","","Tue Oct 29 23:47:02 GMT 2024","passed","Tue Oct 29 23:47:02 GMT 2024","","Share applet to the library","422 missing attribute (name)",""
"","351","Shell account invitation scenario tests → Accept invitation by unregistered user → Verify shell account is in pending status in the list of respondents","","Tue Oct 29 23:53:58 GMT 2024","passed","Tue Oct 29 23:53:58 GMT 2024","","Accept invitation by unregistered user →","Verify shell account is in pending status in the list of respondents",""
"","254","Answer Notes tests → Edit Note tests → 404 Not Found (Update not existing Note)","","Tue Oct 29 23:43:42 GMT 2024","passed","Tue Oct 29 23:43:42 GMT 2024","","Edit Note tests →","404 Not Found (Update not existing Note)",""
"","134","Files upload/download directly to S3 bucket tests → Generate presigned links EPs negative tests Presign link 422 Unprocessable entity (empty body)","","Tue Oct 29 23:52:38 GMT 2024","passed","Tue Oct 29 23:52:38 GMT 2024","","Presign link","422 Unprocessable entity (empty body)",""
"","123","Applet Events CRUD tests → Update Applet Event tests → 422 Unprocessable Entity → Update Event with missing selectedDate param (periodicity type: ONCE)","","Tue Oct 29 23:49:10 GMT 2024","passed","Tue Oct 29 23:49:10 GMT 2024","","422 Unprocessable Entity →","Update Event with missing selectedDate param (periodicity type: ONCE)",""
"","221","Answer Notes tests → Edit Note tests → 404 Not Found (Update Note for not existing activity)","","Tue Oct 29 23:43:42 GMT 2024","passed","Tue Oct 29 23:43:42 GMT 2024","","Edit Note tests →","404 Not Found (Update Note for not existing activity)",""
"","220","Answer Notes tests → Get Notes list tests → Get Notes list (not empty) 404 Not Found (Get Note list for not existing activity)","","Tue Oct 29 23:43:38 GMT 2024","passed","Tue Oct 29 23:43:38 GMT 2024","","Get Notes list (not empty)","404 Not Found (Get Note list for not existing activity)",""
"","295","Applets CRUD endpoints tests → Get applets list → 200 OK (empty list)","","Tue Oct 29 23:47:19 GMT 2024","passed","Tue Oct 29 23:47:19 GMT 2024","","Get applets list →","200 OK (empty list)",""
"","251","Workspaces managers access tests → Get workspace roles list → 200 OK","","Tue Oct 29 23:57:50 GMT 2024","passed","Tue Oct 29 23:57:50 GMT 2024","","Get workspace roles list →","200 OK",""
"","1239","Delete Subjects (remove applet access) tests → 200 OK: remove access to both applets for the 2nd respondent","","Tue Oct 29 23:55:32 GMT 2024","passed","Tue Oct 29 23:55:33 GMT 2024","","Delete Subjects (remove applet access) tests →","200 OK: remove access to both applets for the 2nd respondent",""
"","208","Access link tests → Create Access link tests → 201 Created (Access link can successfully be created)","","Tue Oct 29 23:47:10 GMT 2024","passed","Tue Oct 29 23:47:10 GMT 2024","","Create Access link tests →","201 Created (Access link can successfully be created)",""
"","263","Get applet completed activities tests → Respondent completes the 1st activity within default always available event → Respondent completes the 2nd activity within oneTimeCompletion Event → Respondent completes activities within the activity flow → 200 OK : activity flow completion should be present","","Tue Oct 29 23:43:57 GMT 2024","passed","Tue Oct 29 23:43:57 GMT 2024","","Respondent completes activities within the activity flow →","200 OK : activity flow completion should be present",""
"","227","Answers CRUD tests → Answers handling after invitation acceptance by respondent → Get activity answers list & Answers of respondent tests → Get Activity answers list & Answers of deleted Applet → 404 Not Found (Get Activity answers list of deleted Applet)","","Tue Oct 29 23:45:46 GMT 2024","passed","Tue Oct 29 23:45:46 GMT 2024","","Get Activity answers list & Answers of deleted Applet →","404 Not Found (Get Activity answers list of deleted Applet)",""
"","138","""Themes"" endpoints tests → Create Theme → 422 Unprocessable Entity (missing attribute) Missing backgroundImage","","Tue Oct 29 23:56:04 GMT 2024","passed","Tue Oct 29 23:56:04 GMT 2024","","422 Unprocessable Entity (missing attribute)","Missing backgroundImage",""
"","338","Workspaces endpoints tests → Workspaces created → Get workspace applet managers → Second workspace first applet managers","","Tue Oct 29 23:58:30 GMT 2024","passed","Tue Oct 29 23:58:30 GMT 2024","","Get workspace applet managers →","Second workspace first applet managers",""
"","24","Files upload/download tests → Upload/Download answers (applet files) → Check answer (file) uploaded → 401 Unauthorized","","Tue Oct 29 23:51:58 GMT 2024","passed","Tue Oct 29 23:51:58 GMT 2024","","Check answer (file) uploaded →","401 Unauthorized",""
"","691","""Authentication"" endpoints tests → Get Token → 401 incorrect password","","Tue Oct 29 23:51:38 GMT 2024","passed","Tue Oct 29 23:51:38 GMT 2024","","Get Token →","401 incorrect password",""
"","24","""Workspace Folders"" endpoints tests → Workspace is created → Pin/Unpin Folder → Unpin Folder → 401 Unauthorized (invalid token)","","Tue Oct 29 23:57:13 GMT 2024","passed","Tue Oct 29 23:57:13 GMT 2024","","Unpin Folder →","401 Unauthorized (invalid token)",""
"","2236","Create Answers for different item types tests → Gyroscope performance task","","Tue Oct 29 23:44:22 GMT 2024","passed","Tue Oct 29 23:44:24 GMT 2024","","Create Answers for different item types tests →","Gyroscope performance task",""
"","11","Duplicate Applet endpoint tests → 401 Unauthorized","","Tue Oct 29 23:48:23 GMT 2024","passed","Tue Oct 29 23:48:23 GMT 2024","","Duplicate Applet endpoint tests →","401 Unauthorized",""
"","227","Invitations endpoints tests → Send invitation → Invitation Managers Send → 404 - Applet does not exist","","Tue Oct 29 23:53:21 GMT 2024","passed","Tue Oct 29 23:53:21 GMT 2024","","Invitation Managers Send →","404 - Applet does not exist",""
"","11","Applet Library tests → Share applet to the library 401 Unauthorized","","Tue Oct 29 23:47:02 GMT 2024","passed","Tue Oct 29 23:47:02 GMT 2024","","Share applet to the library","401 Unauthorized",""
"","706","Shell account invitation scenario tests → Accept invitation by unregistered user → Send invitation to the shell account","","Tue Oct 29 23:53:58 GMT 2024","passed","Tue Oct 29 23:53:58 GMT 2024","","Accept invitation by unregistered user →","Send invitation to the shell account",""
"","1020","Administration tests → Organizers tests → Invite new organizer tests → 403 Forbidden (Coordinator can NOT invite manager, coordinator, editor)","","Tue Oct 29 23:54:56 GMT 2024","passed","Tue Oct 29 23:54:57 GMT 2024","","Invite new organizer tests →","403 Forbidden (Coordinator can NOT invite manager, coordinator, editor)",""
"","721","Applet Events CRUD tests → Get Applet Event by Id tests → 404 Not Found (Get individual deleted scheduled activity Event)","","Tue Oct 29 23:48:58 GMT 2024","passed","Tue Oct 29 23:48:58 GMT 2024","","Get Applet Event by Id tests →","404 Not Found (Get individual deleted scheduled activity Event)",""
"","194","Activity Assignments tests → Negative tests → Create Assignments → 404 Not Found: applet","","Tue Oct 29 23:43:31 GMT 2024","passed","Tue Oct 29 23:43:31 GMT 2024","","Create Assignments →","404 Not Found: applet",""
"","232","Activity Assessment & Review CRUD tests → Get Assessment & Review tests → Get Reviews tests → 404 Not Found (Get Review of not existing Answer)","","Tue Oct 29 23:46:07 GMT 2024","passed","Tue Oct 29 23:46:07 GMT 2024","","Get Reviews tests →","404 Not Found (Get Review of not existing Answer)",""
"","248","Answer Notes tests → Get Notes list tests → 200 OK (Get empty Notes list)","","Tue Oct 29 23:43:38 GMT 2024","passed","Tue Oct 29 23:43:38 GMT 2024","","Get Notes list tests →","200 OK (Get empty Notes list)",""
"","310","Invitations endpoints tests → Send invitation → Invitation Respondent Send → 404 - Applet does not exist","","Tue Oct 29 23:53:13 GMT 2024","passed","Tue Oct 29 23:53:13 GMT 2024","","Invitation Respondent Send →","404 - Applet does not exist",""
"","398","Applet Events CRUD tests → Update Applet Event tests → 200 OK (Update general scheduled activity Event - set new start time and change periodicity type)","","Tue Oct 29 23:49:08 GMT 2024","passed","Tue Oct 29 23:49:08 GMT 2024","","Update Applet Event tests →","200 OK (Update general scheduled activity Event - set new start time and change periodicity type)",""
"","140","""Subjects"" endpoints CRUD tests → Update subjects 422: Missing secretId","","Tue Oct 29 23:55:57 GMT 2024","passed","Tue Oct 29 23:55:57 GMT 2024","","Update subjects","422: Missing secretId",""
"","244","Applets ""setFolder"" endpoint tests → 200 OK (set folder)","","Tue Oct 29 23:50:08 GMT 2024","passed","Tue Oct 29 23:50:08 GMT 2024","","Applets ""setFolder"" endpoint tests →","200 OK (set folder)",""
