"Status","Start Time","Stop Time","Duration in ms","Parent Suite","Suite","Sub Suite","Test Class","Test Method","Name","Description"
"passed","Thu Sep 05 16:14:01 GMT 2024","Thu Sep 05 16:14:01 GMT 2024","139","","Delete individual scheduled Applet Events negative tests →","","401 Unauthorized (Delete scheduled Events of a particular user with not existing appletOwnerToken)","","Applet Events CRUD tests → Delete individual scheduled Applet Events negative tests → 401 Unauthorized (Delete scheduled Events of a particular user with not existing appletOwnerToken)",""
"passed","Thu Sep 05 16:19:14 GMT 2024","Thu Sep 05 16:19:14 GMT 2024","681","","200 OK (send to unregistered user)","","With workspace prefix, language: fr","","Invitations endpoints tests → Send invitation → Invitation Reviewer Send → 200 OK (send to unregistered user) With workspace prefix, language: fr",""
"passed","Thu Sep 05 16:22:59 GMT 2024","Thu Sep 05 16:22:59 GMT 2024","788","","Delete User tests →","","404 Not found (Delete already deleted user)","","Delete User tests → 404 Not found (Delete already deleted user)",""
"passed","Thu Sep 05 16:06:30 GMT 2024","Thu Sep 05 16:06:30 GMT 2024","352","","Create Notes tests →","","422 Unprocessable Entity (Create Note without required param - note)","","Answer Notes tests → Create Notes tests → 422 Unprocessable Entity (Create Note without required param - note)",""
"passed","Thu Sep 05 16:10:53 GMT 2024","Thu Sep 05 16:10:53 GMT 2024","290","","Get Library items list","","200 OK (get the whole list)","","Applet Library tests → Applet is added to the library → Get Library items list 200 OK (get the whole list)",""
"passed","Thu Sep 05 16:26:07 GMT 2024","Thu Sep 05 16:26:07 GMT 2024","348","","Get managers priority role →","","200 OK (Reviewer gets role in first user's workspace)","","Workspaces endpoints tests → Workspaces created → Get managers priority role → 200 OK (Reviewer gets role in first user's workspace)",""
"passed","Thu Sep 05 16:06:13 GMT 2024","Thu Sep 05 16:06:13 GMT 2024","782","","Positive tests →","","Create empty assignment","","Activity Assignments tests → Positive tests → Create empty assignment",""
"passed","Thu Sep 05 16:25:27 GMT 2024","Thu Sep 05 16:25:27 GMT 2024","156","","Get workspace managers →","","401 Unauthorized","","Workspaces endpoints tests → Empty workspaces → Get workspace managers → 401 Unauthorized",""
"passed","Thu Sep 05 16:26:17 GMT 2024","Thu Sep 05 16:26:17 GMT 2024","356","","Update workspace applet respondent →","","404 Not Found (invalid applet id)","","Workspaces endpoints tests → Workspaces created → Update workspace applet respondent → 404 Not Found (invalid applet id)",""
"passed","Thu Sep 05 16:13:37 GMT 2024","Thu Sep 05 16:13:37 GMT 2024","346","","Get Applet Event by Id tests →","","200 OK (Get individual scheduled activity Event by id)","","Applet Events CRUD tests → Get Applet Event by Id tests → 200 OK (Get individual scheduled activity Event by id)",""
"passed","Thu Sep 05 16:26:01 GMT 2024","Thu Sep 05 16:26:01 GMT 2024","146","","Negative tests →","","401 Unauthorized","","Workspaces endpoints tests → Workspaces created → Get workspace applet respondents → Negative tests → 401 Unauthorized",""
"passed","Thu Sep 05 16:16:51 GMT 2024","Thu Sep 05 16:16:51 GMT 2024","412","","Remove Activity Flow →","","Get applet version changes","","Applet versions endpoints tests → Update Applet → Add Activity → Remove Activity → Add Activity Flow → Remove Activity Flow → Get applet version changes",""
"passed","Thu Sep 05 16:08:47 GMT 2024","Thu Sep 05 16:08:47 GMT 2024","442","","Answers CRUD tests →","","Applet owner should not get any Answers in activity answers list before invitation acceptance by respondent","","Answers CRUD tests → Applet owner should not get any Answers in activity answers list before invitation acceptance by respondent",""
"passed","Thu Sep 05 16:19:03 GMT 2024","Thu Sep 05 16:19:03 GMT 2024","364","","Decline invitation →","","404 - non-existent invitation key","","Invitations endpoints tests → Decline invitation → 404 - non-existent invitation key",""
"passed","Thu Sep 05 16:23:43 GMT 2024","Thu Sep 05 16:23:43 GMT 2024","236","","422 Unprocessable Entity","","Update user with missing firstName param","","Update User tests → 422 Unprocessable Entity Update user with missing firstName param",""
"passed","Thu Sep 05 16:24:30 GMT 2024","Thu Sep 05 16:24:30 GMT 2024","338","","Applet Owner and Manager add the same applet in their folders","","Get folders (applet owner)","","Workspace folder for different users tests → Manager is invited to the applet → Manager creates own folder in the same workspace Applet Owner and Manager add the same applet in their folders Get folders (applet owner)",""
"passed","Thu Sep 05 16:26:02 GMT 2024","Thu Sep 05 16:26:02 GMT 2024","443","","Get workspace managers →","","First workspace managers","","Workspaces endpoints tests → Workspaces created → Get workspace managers → First workspace managers",""
"passed","Thu Sep 05 16:21:27 GMT 2024","Thu Sep 05 16:21:27 GMT 2024","356","","Change organizer roles/permissions tests →","","403 Forbidden (Coordinator can NOT grant editor's permissions to respondent)","","Administration tests → Organizers tests → Change organizer roles/permissions tests → 403 Forbidden (Coordinator can NOT grant editor's permissions to respondent)",""
"passed","Thu Sep 05 16:13:20 GMT 2024","Thu Sep 05 16:13:20 GMT 2024","238","","422 Unprocessable Entity →","","Create Event with missing accessBeforeSchedule (periodicity type: MONTHLY) param","","Applet Events CRUD tests → Create Events tests → 422 Unprocessable Entity → Create Event with missing accessBeforeSchedule (periodicity type: MONTHLY) param",""
"passed","Thu Sep 05 16:22:47 GMT 2024","Thu Sep 05 16:22:47 GMT 2024","237","","422 Unprocessable Entity (missing attribute)","","Missing backgroundImage","","""Themes"" endpoints tests → Create Theme → 422 Unprocessable Entity (missing attribute) Missing backgroundImage",""
"passed","Thu Sep 05 16:22:55 GMT 2024","Thu Sep 05 16:22:56 GMT 2024","1513","","Create user with already registered email & with email of already deleted user →","","400 Bad Request (Create user with already registered email)","","Create User tests → Create user with already registered email & with email of already deleted user → 400 Bad Request (Create user with already registered email)",""
"passed","Thu Sep 05 16:17:11 GMT 2024","Thu Sep 05 16:17:11 GMT 2024","299","","Delete refresh Token →","","200 OK","","""Authentication"" endpoints tests → Delete refresh Token → 200 OK",""
"passed","Thu Sep 05 16:16:17 GMT 2024","Thu Sep 05 16:16:17 GMT 2024","378","","Transfer Accept →","","200 OK","","Applet ""Transfer Ownership"" endpoints tests → Transfer Accept → 200 OK",""
"passed","Thu Sep 05 16:06:32 GMT 2024","Thu Sep 05 16:06:32 GMT 2024","418","","Edit Note tests →","","404 Not Found (Update not existing Note)","","Answer Notes tests → Edit Note tests → 404 Not Found (Update not existing Note)",""
"passed","Thu Sep 05 16:26:10 GMT 2024","Thu Sep 05 16:26:10 GMT 2024","151","","Pin user (respondent) on workspace →","","401 Unauthorized","","Workspaces endpoints tests → Workspaces created → Pin user (respondent) on workspace → 401 Unauthorized",""
"passed","Thu Sep 05 16:26:03 GMT 2024","Thu Sep 05 16:26:03 GMT 2024","439","","Test for filters (query params) →","","Role","","Workspaces endpoints tests → Workspaces created → Get workspace managers → Test for filters (query params) → Role",""
"passed","Thu Sep 05 16:15:12 GMT 2024","Thu Sep 05 16:15:12 GMT 2024","352","","Applets ""setFolder"" endpoint tests →","","200 OK (set folder)","","Applets ""setFolder"" endpoint tests → 200 OK (set folder)",""
"passed","Thu Sep 05 16:08:57 GMT 2024","Thu Sep 05 16:08:57 GMT 2024","555","","422 Unprocessable Entity →","","Create Answer with missing endTime param","","Answers CRUD tests → Answers handling after invitation acceptance by respondent → Create Answer tests → 422 Unprocessable Entity → Create Answer with missing endTime param",""
"passed","Thu Sep 05 16:13:51 GMT 2024","Thu Sep 05 16:13:51 GMT 2024","262","","422 Unprocessable Entity →","","Update Event with missing endTime (periodicity type: MONTHLY) param","","Applet Events CRUD tests → Update Applet Event tests → 422 Unprocessable Entity → Update Event with missing endTime (periodicity type: MONTHLY) param",""
"passed","Thu Sep 05 16:16:25 GMT 2024","Thu Sep 05 16:16:25 GMT 2024","333","","Transfer Decline →","","404 (Decline same request again)","","Applet ""Transfer Ownership"" endpoints tests → Transfer Decline → 404 (Decline same request again)",""
"passed","Thu Sep 05 16:15:44 GMT 2024","Thu Sep 05 16:15:44 GMT 2024","696","","First receiver should become the owner →","","Verify Pending Invitations & Public link","","Applet ""Transfer Ownership"" scenario tests → Transfer Accept → First receiver should become the owner → Verify Pending Invitations & Public link",""
"passed","Thu Sep 05 16:20:08 GMT 2024","Thu Sep 05 16:20:08 GMT 2024","380","","Accept invitation by unregistered user →","","Verify invitation in list of invitations","","Shell account invitation scenario tests → Accept invitation by unregistered user → Verify invitation in list of invitations",""
"passed","Thu Sep 05 16:10:53 GMT 2024","Thu Sep 05 16:10:53 GMT 2024","401","","Get Library items list","","200 OK (search by description)","","Applet Library tests → Applet is added to the library → Get Library items list 200 OK (search by description)",""
"passed","Thu Sep 05 16:16:49 GMT 2024","Thu Sep 05 16:16:49 GMT 2024","418","","Add Activity Flow →","","Get applet version changes","","Applet versions endpoints tests → Update Applet → Add Activity → Remove Activity → Add Activity Flow → Get applet version changes",""
"passed","Thu Sep 05 16:14:09 GMT 2024","Thu Sep 05 16:14:09 GMT 2024","487","","Create cross-day events tests →","","201 Created (Cross-day Event with WEEKDAYS periodicity type and availability range: 00:01:00-00:00:00)","","Applet Events CRUD tests → Create cross-day events tests → 201 Created (Cross-day Event with WEEKDAYS periodicity type and availability range: 00:01:00-00:00:00)",""
"passed","Thu Sep 05 16:15:48 GMT 2024","Thu Sep 05 16:15:49 GMT 2024","1089","","Transfer Decline →","","Applet owner should remain the same after first user has declined transfer request","","Applet ""Transfer Ownership"" scenario tests → Transfer Decline → Applet owner should remain the same after first user has declined transfer request",""
"passed","Thu Sep 05 16:22:53 GMT 2024","Thu Sep 05 16:22:53 GMT 2024","779","","Create User tests →","","201 Create User","","Create User tests → 201 Create User",""
"passed","Thu Sep 05 16:09:36 GMT 2024","Thu Sep 05 16:09:36 GMT 2024","437","","Get Reviews tests →","","404 Not Found (Get Review of not existing Applet)","","Activity Assessment & Review CRUD tests → Get Assessment & Review tests → Get Reviews tests → 404 Not Found (Get Review of not existing Applet)",""
"passed","Thu Sep 05 16:10:08 GMT 2024","Thu Sep 05 16:10:08 GMT 2024","423","","Get identifiers after answer submitting →","","200 OK (Get identifiers)","","Activity Versions & Identifiers tests → Get Identifiers tests → Get identifiers after answer submitting → 200 OK (Get identifiers)",""
"passed","Thu Sep 05 16:24:12 GMT 2024","Thu Sep 05 16:24:12 GMT 2024","258","","Create Folder →","","422 Unprocessable Entity (missing attribute)","","""Workspace Folders"" endpoints tests → Workspace is created → Create Folder → 422 Unprocessable Entity (missing attribute)",""
"passed","Thu Sep 05 16:19:27 GMT 2024","Thu Sep 05 16:19:27 GMT 2024","397","","Create shell account →","","403: Forbidden","","Invitations endpoints tests → Create shell account → 403: Forbidden",""
"passed","Thu Sep 05 16:11:05 GMT 2024","Thu Sep 05 16:11:05 GMT 2024","332","","Create Access link tests →","","404 Not Found (Create Access link with not existing applet)","","Access link tests → Create Access link tests → 404 Not Found (Create Access link with not existing applet)",""
"passed","Thu Sep 05 16:25:06 GMT 2024","Thu Sep 05 16:25:06 GMT 2024","397","","Get workspace roles list →","","200 OK","","Workspaces managers access tests → Get workspace roles list → 200 OK",""
"passed","Thu Sep 05 16:21:27 GMT 2024","Thu Sep 05 16:21:28 GMT 2024","1676","","Change organizer roles/permissions tests →","","200 OK (Manager can grant reviewer's permissions to coordinator)","","Administration tests → Organizers tests → Change organizer roles/permissions tests → 200 OK (Manager can grant reviewer's permissions to coordinator)",""
"passed","Thu Sep 05 16:21:55 GMT 2024","Thu Sep 05 16:21:55 GMT 2024","356","","View respondent's data tests →","","403 Forbidden (Editor can NOT view data)","","Administration tests → Applets tests → Export & view data in workspace of Applet owner tests → View respondent's data tests → 403 Forbidden (Editor can NOT view data)",""
"passed","Thu Sep 05 16:23:44 GMT 2024","Thu Sep 05 16:23:44 GMT 2024","270","","Get User Device Information →","","422 Unprocessable Entity","","Get User Device Information → 422 Unprocessable Entity",""
"passed","Thu Sep 05 16:11:06 GMT 2024","Thu Sep 05 16:11:06 GMT 2024","370","","Get Access link tests →","","200 OK (Get created Access link)","","Access link tests → Get Access link tests → 200 OK (Get created Access link)",""
"passed","Thu Sep 05 16:26:17 GMT 2024","Thu Sep 05 16:26:17 GMT 2024","248","","Update workspace applet respondent →","","422 Missing Attribute (secretUserId)","","Workspaces endpoints tests → Workspaces created → Update workspace applet respondent → 422 Missing Attribute (secretUserId)",""
"passed","Thu Sep 05 16:14:09 GMT 2024","Thu Sep 05 16:14:09 GMT 2024","476","","Create cross-day events tests →","","201 Created (Cross-day Event with WEEKDAYS periodicity type and availability range: 23:59:00-23:58:00)","","Applet Events CRUD tests → Create cross-day events tests → 201 Created (Cross-day Event with WEEKDAYS periodicity type and availability range: 23:59:00-23:58:00)",""
"passed","Thu Sep 05 16:25:56 GMT 2024","Thu Sep 05 16:25:56 GMT 2024","425","","Get workspace applet details →","","200 OK","","Workspaces endpoints tests → Workspaces created → Get workspace applet details → 200 OK",""
"passed","Thu Sep 05 16:18:56 GMT 2024","Thu Sep 05 16:18:56 GMT 2024","391","","Get invitations for invitor →","","200 OK (empty list)","","Invitations endpoints tests → Get invitations → No Invitations created → Get invitations for invitor → 200 OK (empty list)",""
"passed","Thu Sep 05 16:21:52 GMT 2024","Thu Sep 05 16:21:52 GMT 2024","392","","Export data tests →","","200 OK (Reviewer with no assigned respondents can export his own data)","","Administration tests → Applets tests → Export & view data in workspace of Applet owner tests → Export data tests → 200 OK (Reviewer with no assigned respondents can export his own data)",""
"passed","Thu Sep 05 16:22:37 GMT 2024","Thu Sep 05 16:22:37 GMT 2024","402","","Update subjects","","200 OK: manager","","""Subjects"" endpoints CRUD tests → Update subjects 200 OK: manager",""
"passed","Thu Sep 05 16:22:49 GMT 2024","Thu Sep 05 16:22:49 GMT 2024","264","","Update Theme →","","404 Not Found (non-existent theme)","","""Themes"" endpoints tests → Update Theme → 404 Not Found (non-existent theme)",""
"passed","Thu Sep 05 16:24:29 GMT 2024","Thu Sep 05 16:24:29 GMT 2024","789","","Manager creates own folder in the same workspace","","Get folders (manager)","","Workspace folder for different users tests → Manager is invited to the applet → Manager creates own folder in the same workspace Get folders (manager)",""
"passed","Thu Sep 05 16:17:23 GMT 2024","Thu Sep 05 16:17:25 GMT 2024","2379","","Download File →","","200 OK","","Files upload/download tests → Download File → 200 OK",""
"passed","Thu Sep 05 16:18:35 GMT 2024","Thu Sep 05 16:18:35 GMT 2024","766","","Re-send invitation flow →","","User should not be able to accept/decline same invitation again","","Invitations scenario tests → Re-send invitation flow → User should not be able to accept/decline same invitation again",""
"passed","Thu Sep 05 16:19:27 GMT 2024","Thu Sep 05 16:19:27 GMT 2024","148","","Create shell account →","","401: Unauthorized","","Invitations endpoints tests → Create shell account → 401: Unauthorized",""
"passed","Thu Sep 05 16:21:33 GMT 2024","Thu Sep 05 16:21:33 GMT 2024","469","","View all respondents tests →","","200 OK (Reviewer can NOT view respondents not assigned to him)","","Administration tests → Respondents tests → View all respondents tests → 200 OK (Reviewer can NOT view respondents not assigned to him)",""
"passed","Thu Sep 05 16:06:36 GMT 2024","Thu Sep 05 16:06:36 GMT 2024","342","","Delete Note tests →","","403 Forbidden (Delete Note by respondent)","","Answer Notes tests → Delete Note tests → 403 Forbidden (Delete Note by respondent)",""
"passed","Thu Sep 05 16:11:29 GMT 2024","Thu Sep 05 16:11:29 GMT 2024","262","","422 Unprocessable Entity (missing attribute)","","Missing ""activity flows""","","Applets CRUD endpoints tests → Update applet → 422 Unprocessable Entity (missing attribute) Missing ""activity flows""",""
"passed","Thu Sep 05 16:23:43 GMT 2024","Thu Sep 05 16:23:43 GMT 2024","251","","422 Unprocessable Entity","","Update user with missing lastName param","","Update User tests → 422 Unprocessable Entity Update user with missing lastName param",""
"passed","Thu Sep 05 16:19:09 GMT 2024","Thu Sep 05 16:19:09 GMT 2024","469","","200 OK (send to unregistered user)","","W/o nickname, language: fr","","Invitations endpoints tests → Send invitation → Invitation Respondent Send → 200 OK (send to unregistered user) W/o nickname, language: fr",""
"passed","Thu Sep 05 16:23:35 GMT 2024","Thu Sep 05 16:23:35 GMT 2024","297","","422 Unprocessable Entity","","Update password with missing password param","","Update Password tests → 422 Unprocessable Entity Update password with missing password param",""
"passed","Thu Sep 05 16:25:46 GMT 2024","Thu Sep 05 16:25:46 GMT 2024","817","","Get workspace Applets →","","Reviewer gets collaborated applets","","Workspaces endpoints tests → Workspaces created → Get workspace Applets → Reviewer gets collaborated applets",""
"passed","Thu Sep 05 16:22:46 GMT 2024","Thu Sep 05 16:22:46 GMT 2024","742","","Create Theme →","","400 Bad Request (duplicate name)","","""Themes"" endpoints tests → Create Theme → 400 Bad Request (duplicate name)",""
"passed","Thu Sep 05 16:11:29 GMT 2024","Thu Sep 05 16:11:29 GMT 2024","265","","422 Unprocessable Entity (missing attribute)","","Missing ""activities""","","Applets CRUD endpoints tests → Update applet → 422 Unprocessable Entity (missing attribute) Missing ""activities""",""
"passed","Thu Sep 05 16:19:17 GMT 2024","Thu Sep 05 16:19:17 GMT 2024","259","","422 Missing attributes","","Missing firstName","","Invitations endpoints tests → Send invitation → Invitation Reviewer Send → 422 Missing attributes Missing firstName",""
"passed","Thu Sep 05 16:09:51 GMT 2024","Thu Sep 05 16:09:51 GMT 2024","459","","Get flow Identifiers tests →","","200: Empty list (not existing activityFlowId)","","Flow Versions & Identifiers tests → Get flow Identifiers tests → 200: Empty list (not existing activityFlowId)",""
"passed","Thu Sep 05 16:16:00 GMT 2024","Thu Sep 05 16:16:00 GMT 2024","747","","Transfer Ownership to unregistered user →","","Send transfer request to unregistered user","","Applet ""Transfer Ownership"" scenario tests → Transfer Ownership to unregistered user → Send transfer request to unregistered user",""
"passed","Thu Sep 05 16:06:40 GMT 2024","Thu Sep 05 16:06:40 GMT 2024","392","","Get applet completed activities tests →","","200 OK (empty): no answers submitted yet","","Get applet completed activities tests → 200 OK (empty): no answers submitted yet",""
"passed","Thu Sep 05 16:22:37 GMT 2024","Thu Sep 05 16:22:37 GMT 2024","348","","Update subjects","","200 OK: respondent","","""Subjects"" endpoints CRUD tests → Update subjects 200 OK: respondent",""
"passed","Thu Sep 05 16:21:14 GMT 2024","Thu Sep 05 16:21:14 GMT 2024","343","","Transfer ownership of Applet tests →","","403 Forbidden (Editor can not transfer ownership)","","Administration tests → Transfer ownership of Applet tests → 403 Forbidden (Editor can not transfer ownership)",""
"passed","Thu Sep 05 16:25:58 GMT 2024","Thu Sep 05 16:25:58 GMT 2024","424","","Test for filters (query params) →","","Search by nickname is not allowed","","Workspaces endpoints tests → Workspaces created → Get workspace respondents → Test for filters (query params) → Search by nickname is not allowed",""
"passed","Thu Sep 05 16:17:43 GMT 2024","Thu Sep 05 16:17:43 GMT 2024","353","","Download Logs →","","404 Not Found","","Logs upload/download tests → Download Logs → 404 Not Found",""
"passed","Thu Sep 05 16:23:07 GMT 2024","Thu Sep 05 16:23:07 GMT 2024","678","","Get User tests →","","404 Not found (Get deleted user)","","Get User tests → 404 Not found (Get deleted user)",""
"passed","Thu Sep 05 16:13:25 GMT 2024","Thu Sep 05 16:13:25 GMT 2024","140","","Get general and individual Applet Events →","","401 Unauthorized (Get Applet Events with invalid appletOwnerToken)","","Applet Events CRUD tests → Get general and individual Applet Events → 401 Unauthorized (Get Applet Events with invalid appletOwnerToken)",""
"passed","Thu Sep 05 16:11:23 GMT 2024","Thu Sep 05 16:11:23 GMT 2024","307","","422 Unprocessable Entity (missing attribute)","","Missing ""activity flows""","","Applets CRUD endpoints tests → Create applet → 422 Unprocessable Entity (missing attribute) Missing ""activity flows""",""
"passed","Thu Sep 05 16:11:29 GMT 2024","Thu Sep 05 16:11:29 GMT 2024","279","","422 Unprocessable Entity (missing attribute)","","Missing ""display name""","","Applets CRUD endpoints tests → Update applet → 422 Unprocessable Entity (missing attribute) Missing ""display name""",""
"passed","Thu Sep 05 16:16:35 GMT 2024","Thu Sep 05 16:16:35 GMT 2024","145","","Applets ""unique_name"" endpoint tests →","","401 Unauthorized","","Applets ""unique_name"" endpoint tests → 401 Unauthorized",""
"passed","Thu Sep 05 16:15:44 GMT 2024","Thu Sep 05 16:15:44 GMT 2024","396","","First receiver should become the owner →","","Verify transferred answers list","","Applet ""Transfer Ownership"" scenario tests → Transfer Accept → First receiver should become the owner → Verify transferred answers list",""
"passed","Thu Sep 05 16:08:57 GMT 2024","Thu Sep 05 16:08:57 GMT 2024","344","","422 Unprocessable Entity →","","Create Answer with missing activityId param","","Answers CRUD tests → Answers handling after invitation acceptance by respondent → Create Answer tests → 422 Unprocessable Entity → Create Answer with missing activityId param",""
"passed","Thu Sep 05 16:21:58 GMT 2024","Thu Sep 05 16:21:58 GMT 2024","414","","Perform activities tests →","","200 OK (Applet owner can submit answers)","","Administration tests → Perform activities tests → 200 OK (Applet owner can submit answers)",""
"passed","Thu Sep 05 16:15:08 GMT 2024","Thu Sep 05 16:15:08 GMT 2024","740","","Applets ""report configuration"" endpoint tests →","","200 OK","","Applets ""report configuration"" endpoint tests → 200 OK",""
"passed","Thu Sep 05 16:22:54 GMT 2024","Thu Sep 05 16:22:54 GMT 2024","141","","422 Unprocessable Entity","","Create user with missing email param","","Create User tests → 422 Unprocessable Entity Create user with missing email param",""
"passed","Thu Sep 05 16:15:12 GMT 2024","Thu Sep 05 16:15:12 GMT 2024","362","","Applets ""setFolder"" endpoint tests →","","200 OK (unset folder)","","Applets ""setFolder"" endpoint tests → 200 OK (unset folder)",""
"passed","Thu Sep 05 16:21:27 GMT 2024","Thu Sep 05 16:21:27 GMT 2024","381","","Change organizer roles/permissions tests →","","403 Forbidden (Reviewer can NOT grant editor's permissions to respondent)","","Administration tests → Organizers tests → Change organizer roles/permissions tests → 403 Forbidden (Reviewer can NOT grant editor's permissions to respondent)",""
"passed","Thu Sep 05 16:17:00 GMT 2024","Thu Sep 05 16:17:00 GMT 2024","405","","Update Activity Flow →","","Get applet versions","","Applet versions endpoints tests → Update Applet → Add Activity → Remove Activity → Add Activity Flow → Remove Activity Flow → Add Activity Item → Remove Activity Item → Update Activity → Update Activity Item → Update Activity Flow → Get applet versions",""
"passed","Thu Sep 05 16:13:20 GMT 2024","Thu Sep 05 16:13:20 GMT 2024","237","","422 Unprocessable Entity →","","Create Event with missing endTime (periodicity type: ONCE) param","","Applet Events CRUD tests → Create Events tests → 422 Unprocessable Entity → Create Event with missing endTime (periodicity type: ONCE) param",""
"passed","Thu Sep 05 16:11:41 GMT 2024","Thu Sep 05 16:11:43 GMT 2024","2042","","Positive tests →","","Performance task activities: A/B Trails Tablet and A/B Trails Mobile","","Applet builder tests → Create applet → Positive tests → Performance task activities: A/B Trails Tablet and A/B Trails Mobile",""
"passed","Thu Sep 05 16:10:59 GMT 2024","Thu Sep 05 16:10:59 GMT 2024","291","","Cart test →","","401 Unauthorized","","Applet Library tests → Applet is added to the library → Cart test → 401 Unauthorized",""
