"DESCRIPTION","DURATION IN MS","NAME","PARENT SUITE","START TIME","STATUS","STOP TIME","SUB SUITE","SUITE","TEST CLASS","TEST METHOD"
"","235","Administration tests → Applets tests → Create Applet in workspace of Applet owner tests → 403 Forbidden (Coordinator can NOT create Applet in workspace of Applet owner)","","Mon Feb 17 21:42:51 GMT 2025","passed","Mon Feb 17 21:42:51 GMT 2025","","Create Applet in workspace of Applet owner tests →","403 Forbidden (Coordinator can NOT create Applet in workspace of Applet owner)",""
"","5","Logs upload/download tests → Upload Logs → 401 Unauthorized","","Mon Feb 17 21:39:50 GMT 2025","passed","Mon Feb 17 21:39:50 GMT 2025","","Upload Logs →","401 Unauthorized",""
"","8","""Authentication"" endpoints tests → Refresh Token → 400 Bad Request (non-existent token)","","Mon Feb 17 21:39:24 GMT 2025","passed","Mon Feb 17 21:39:24 GMT 2025","","Refresh Token →","400 Bad Request (non-existent token)",""
"","264","Answers CRUD tests → Applet owner should not get any flows submissions before invitation acceptance by respondent","","Mon Feb 17 21:33:14 GMT 2025","passed","Mon Feb 17 21:33:14 GMT 2025","","Answers CRUD tests →","Applet owner should not get any flows submissions before invitation acceptance by respondent",""
"","189","Workspaces endpoints tests → Workspaces created → Get user workspaces → First applet owner","","Mon Feb 17 21:45:46 GMT 2025","passed","Mon Feb 17 21:45:46 GMT 2025","","Get user workspaces →","First applet owner",""
"","257","Workspaces endpoints tests → Workspaces created → Get workspace applet respondent by id → 403 Forbidden","","Mon Feb 17 21:46:05 GMT 2025","passed","Mon Feb 17 21:46:05 GMT 2025","","Get workspace applet respondent by id →","403 Forbidden",""
"","203","Flow Versions & Identifiers tests → Get flow Versions tests → 200 OK (default version after Applet creation)","","Mon Feb 17 21:34:38 GMT 2025","passed","Mon Feb 17 21:34:38 GMT 2025","","Get flow Versions tests →","200 OK (default version after Applet creation)",""
"","505","Workspaces endpoints tests → Workspaces created → Get managers priority role → 200 OK (First applet owner gets role in second user's workspace with appletIds filter)","","Mon Feb 17 21:46:00 GMT 2025","passed","Mon Feb 17 21:46:00 GMT 2025","","Get managers priority role →","200 OK (First applet owner gets role in second user's workspace with appletIds filter)",""
"","8","Get applet completed activities tests → 401 Unauthorized","","Mon Feb 17 21:31:38 GMT 2025","passed","Mon Feb 17 21:31:38 GMT 2025","","Get applet completed activities tests →","401 Unauthorized",""
"","207","Answers CRUD tests → Answers handling after invitation acceptance by respondent → Check answer existence tests → 200 OK (exists = true, check by applet owner with submitId)","","Mon Feb 17 21:33:24 GMT 2025","passed","Mon Feb 17 21:33:24 GMT 2025","","Check answer existence tests →","200 OK (exists = true, check by applet owner with submitId)",""
"","218","Administration tests → Applets tests → Duplicate Applet in workspace of Applet owner tests → 403 Forbidden (Respondent can NOT duplicate Applet)","","Mon Feb 17 21:42:54 GMT 2025","passed","Mon Feb 17 21:42:54 GMT 2025","","Duplicate Applet in workspace of Applet owner tests →","403 Forbidden (Respondent can NOT duplicate Applet)",""
"","199","Invitations scenario tests → Invite unregistered user flow → New user can view invitation after registration","","Mon Feb 17 21:40:36 GMT 2025","passed","Mon Feb 17 21:40:36 GMT 2025","","Invite unregistered user flow →","New user can view invitation after registration",""
"","395","Applet Library tests → Applet is added to the library → Update Library item → 400 Bad Request (not unique name)","","Mon Feb 17 21:35:26 GMT 2025","passed","Mon Feb 17 21:35:26 GMT 2025","","Update Library item →","400 Bad Request (not unique name)",""
"","375","""Workspace Folders"" endpoints tests → Workspace is created → Create Folder → 201 Created","","Mon Feb 17 21:44:41 GMT 2025","passed","Mon Feb 17 21:44:41 GMT 2025","","Create Folder →","201 Created",""
"","2103","Create Answers for different item types tests → Gyroscope performance task","","Mon Feb 17 21:32:12 GMT 2025","passed","Mon Feb 17 21:32:14 GMT 2025","","Create Answers for different item types tests →","Gyroscope performance task",""
"","9","Create User tests → 422 Unprocessable Entity Create user with empty firstName param","","Mon Feb 17 21:43:42 GMT 2025","passed","Mon Feb 17 21:43:42 GMT 2025","","422 Unprocessable Entity","Create user with empty firstName param",""
"","314","Administration tests → Respondents tests → View all respondents tests → 200 OK (Applet owner can view all respondents)","","Mon Feb 17 21:42:46 GMT 2025","passed","Mon Feb 17 21:42:46 GMT 2025","","View all respondents tests →","200 OK (Applet owner can view all respondents)",""
"","2145","Create Answers for different item types tests → Text item","","Mon Feb 17 21:32:12 GMT 2025","passed","Mon Feb 17 21:32:14 GMT 2025","","Create Answers for different item types tests →","Text item",""
"","306","Activity Assessment & Review CRUD tests → Get Assessment & Review tests → Get Assessment tests → 200 OK (no Assessment data)","","Mon Feb 17 21:34:01 GMT 2025","passed","Mon Feb 17 21:34:01 GMT 2025","","Get Assessment tests →","200 OK (no Assessment data)",""
"","233","Applet Events CRUD tests → Create Events tests → 400 Bad Request (Create general Always Available activity Event)","","Mon Feb 17 21:36:57 GMT 2025","passed","Mon Feb 17 21:36:57 GMT 2025","","Create Events tests →","400 Bad Request (Create general Always Available activity Event)",""
"","101","""Themes"" endpoints tests → Create Theme → 422 Unprocessable Entity (missing attribute) Missing logo","","Mon Feb 17 21:43:38 GMT 2025","passed","Mon Feb 17 21:43:38 GMT 2025","","422 Unprocessable Entity (missing attribute)","Missing logo",""
"","456","Files upload/download tests → Upload/Download answers (applet files) → Check answer (file) uploaded → 200 OK (uploaded = false)","","Mon Feb 17 21:39:44 GMT 2025","passed","Mon Feb 17 21:39:44 GMT 2025","","Check answer (file) uploaded →","200 OK (uploaded = false)",""
"","128","Applet Events CRUD tests → Create Events tests → 422 Unprocessable Entity → Create Event with missing startTime (periodicity type: WEEKDAYS) param","","Mon Feb 17 21:36:59 GMT 2025","passed","Mon Feb 17 21:36:59 GMT 2025","","422 Unprocessable Entity →","Create Event with missing startTime (periodicity type: WEEKDAYS) param",""
"","126","Logs upload/download tests → Check logs existence → 422 Unprocessable entity","","Mon Feb 17 21:39:54 GMT 2025","passed","Mon Feb 17 21:39:54 GMT 2025","","Check logs existence →","422 Unprocessable entity",""
"","251","Workspaces endpoints tests → Workspaces created → Get managers priority role → 200 Null (non-existent appletId)","","Mon Feb 17 21:46:00 GMT 2025","passed","Mon Feb 17 21:46:00 GMT 2025","","Get managers priority role →","200 Null (non-existent appletId)",""
"","196","Answers CRUD tests → Answers handling after invitation acceptance by respondent → Check answer existence tests → 404 Not Found (applet id)","","Mon Feb 17 21:33:24 GMT 2025","passed","Mon Feb 17 21:33:24 GMT 2025","","Check answer existence tests →","404 Not Found (applet id)",""
"","996","Applet builder tests → Create applet → Positive tests → Single activity with rows item types (SliderRows, SingleSelectionRows, MultiSelectionRows)","","Mon Feb 17 21:35:57 GMT 2025","passed","Mon Feb 17 21:35:57 GMT 2025","","Positive tests →","Single activity with rows item types (SliderRows, SingleSelectionRows, MultiSelectionRows)",""
"","260","Applet versions endpoints tests → Update Applet → Add Activity → Get applet version changes","","Mon Feb 17 21:39:09 GMT 2025","passed","Mon Feb 17 21:39:09 GMT 2025","","Add Activity →","Get applet version changes",""
"","110","Applet Events CRUD tests → Create Events tests → 422 Unprocessable Entity → Create Event with missing selectedDate param (periodicity type: MONTHLY)","","Mon Feb 17 21:36:59 GMT 2025","passed","Mon Feb 17 21:36:59 GMT 2025","","422 Unprocessable Entity →","Create Event with missing selectedDate param (periodicity type: MONTHLY)",""
"","265","Activity Versions & Identifiers tests → Get Identifiers tests → 404 Not Found (Get identifiers of not existing Applet)","","Mon Feb 17 21:34:50 GMT 2025","passed","Mon Feb 17 21:34:50 GMT 2025","","Get Identifiers tests →","404 Not Found (Get identifiers of not existing Applet)",""
"","192","Shell account invitation scenario tests → Decline invitation by unregistered user → Verify Invitation key expires after declining the invite","","Mon Feb 17 21:41:49 GMT 2025","passed","Mon Feb 17 21:41:49 GMT 2025","","Decline invitation by unregistered user →","Verify Invitation key expires after declining the invite",""
"","8","Get submit dates & exported Answers data tests → Get dates before Answer submit → 401 Unauthorized (Get submit dates with not existing token)","","Mon Feb 17 21:32:07 GMT 2025","passed","Mon Feb 17 21:32:07 GMT 2025","","Get dates before Answer submit →","401 Unauthorized (Get submit dates with not existing token)",""
"","352","""Authentication"" endpoints tests → Tokens invalidation tests → Verify refreshToken is invalidated but access token is still alive","","Mon Feb 17 21:39:29 GMT 2025","passed","Mon Feb 17 21:39:29 GMT 2025","","Tokens invalidation tests →","Verify refreshToken is invalidated but access token is still alive",""
"","271","Applet Events CRUD tests → Import Applet Events tests → 200 OK (Get all created and imported Applet Events) 200 OK (Get all general Applet Events)","","Mon Feb 17 21:37:29 GMT 2025","failed","Mon Feb 17 21:37:29 GMT 2025","","200 OK (Get all created and imported Applet Events)","200 OK (Get all general Applet Events)",""
"","699","Administration tests → Respondents tests → Invite new reviewer for a specific respondent tests → 200 OK (Manager can invite new reviewer for a specific respondent)","","Mon Feb 17 21:42:47 GMT 2025","passed","Mon Feb 17 21:42:47 GMT 2025","","Invite new reviewer for a specific respondent tests →","200 OK (Manager can invite new reviewer for a specific respondent)",""
"","117","Applet Events CRUD tests → Update Applet Event tests → 422 Unprocessable Entity → Update Event with missing endTime (periodicity type: MONTHLY) param","","Mon Feb 17 21:37:18 GMT 2025","passed","Mon Feb 17 21:37:18 GMT 2025","","422 Unprocessable Entity →","Update Event with missing endTime (periodicity type: MONTHLY) param",""
"","470","Applet Events CRUD tests → Get Applet Event by Id tests → 404 Not Found (Get individual scheduled activity Event of deleted Applet)","","Mon Feb 17 21:37:09 GMT 2025","passed","Mon Feb 17 21:37:09 GMT 2025","","Get Applet Event by Id tests →","404 Not Found (Get individual scheduled activity Event of deleted Applet)",""
"","220","Activity Assessment & Review CRUD tests → Delete Assessment tests → 404 Not Found (Delete submitted assessment for not existing answer)","","Mon Feb 17 21:34:20 GMT 2025","passed","Mon Feb 17 21:34:20 GMT 2025","","Delete Assessment tests →","404 Not Found (Delete submitted assessment for not existing answer)",""
"","114","Applet Events CRUD tests → Update Applet Event tests → 422 Unprocessable Entity → Update Event with missing timer param (timer type: TIMER)","","Mon Feb 17 21:37:18 GMT 2025","passed","Mon Feb 17 21:37:18 GMT 2025","","422 Unprocessable Entity →","Update Event with missing timer param (timer type: TIMER)",""
"","253","Workspaces endpoints tests → Workspaces created → Update workspace applet respondent → 404 Not Found (invalid applet id)","","Mon Feb 17 21:46:06 GMT 2025","passed","Mon Feb 17 21:46:06 GMT 2025","","Update workspace applet respondent →","404 Not Found (invalid applet id)",""
"","651","Administration tests → Applets tests → Update Applet in workspace of Applet owner tests → 200 OK (Editor can update Applet)","","Mon Feb 17 21:42:53 GMT 2025","passed","Mon Feb 17 21:42:53 GMT 2025","","Update Applet in workspace of Applet owner tests →","200 OK (Editor can update Applet)",""
"","6","User Password tests → Password recovery approve tests → 422 Unprocessable Entity Approve user password recovery with missing email param","","Mon Feb 17 21:44:06 GMT 2025","passed","Mon Feb 17 21:44:06 GMT 2025","","422 Unprocessable Entity","Approve user password recovery with missing email param",""
"","394","Administration tests → Applets tests → Export & view data in workspace of Applet owner tests → Export data tests → 200 OK (Reviewer with assigned respondents can export data)","","Mon Feb 17 21:42:58 GMT 2025","passed","Mon Feb 17 21:42:58 GMT 2025","","Export data tests →","200 OK (Reviewer with assigned respondents can export data)",""
"","6","Workspaces endpoints tests → Workspaces created → Get workspace respondent applet access list → 401 Unauthorized","","Mon Feb 17 21:46:04 GMT 2025","passed","Mon Feb 17 21:46:04 GMT 2025","","Get workspace respondent applet access list →","401 Unauthorized",""
"","115","Applet Events CRUD tests → Create cross-day events tests → 422 (Cross-day Event with DAILY periodicity type and availability range: 00:00:00-00:00:00)","","Mon Feb 17 21:37:31 GMT 2025","passed","Mon Feb 17 21:37:31 GMT 2025","","Create cross-day events tests →","422 (Cross-day Event with DAILY periodicity type and availability range: 00:00:00-00:00:00)",""
"","108","Applets ""unique_name"" endpoint tests → 422 missing attribute (name)","","Mon Feb 17 21:39:02 GMT 2025","passed","Mon Feb 17 21:39:02 GMT 2025","","Applets ""unique_name"" endpoint tests →","422 missing attribute (name)",""
"","6","""Themes"" endpoints tests → Delete Theme → 401 Unauthorized (invalid token)","","Mon Feb 17 21:43:39 GMT 2025","passed","Mon Feb 17 21:43:39 GMT 2025","","Delete Theme →","401 Unauthorized (invalid token)",""
"","258","Applet Events CRUD tests → Delete individual scheduled Applet Events negative tests → 404 Not Found (Delete scheduled Events of not existing user)","","Mon Feb 17 21:37:24 GMT 2025","passed","Mon Feb 17 21:37:24 GMT 2025","","Delete individual scheduled Applet Events negative tests →","404 Not Found (Delete scheduled Events of not existing user)",""
"","100","Applet Events CRUD tests → Create cross-day events tests → 422 (Cross-day Event with ONCE periodicity type and availability range: 15:30:00-15:30:00)","","Mon Feb 17 21:37:31 GMT 2025","passed","Mon Feb 17 21:37:31 GMT 2025","","Create cross-day events tests →","422 (Cross-day Event with ONCE periodicity type and availability range: 15:30:00-15:30:00)",""
"","316","Invitations scenario tests → Invite unregistered user flow → Send invitation to unregistered user","","Mon Feb 17 21:40:36 GMT 2025","passed","Mon Feb 17 21:40:36 GMT 2025","","Invite unregistered user flow →","Send invitation to unregistered user",""
"","196","Applets ""retentions"" endpoint tests → 404 applet Not found","","Mon Feb 17 21:36:31 GMT 2025","passed","Mon Feb 17 21:36:31 GMT 2025","","Applets ""retentions"" endpoint tests →","404 applet Not found",""
"","201","Applet versions endpoints tests → Update Applet → Add Activity → Remove Activity → Add Activity Flow → Remove Activity Flow → Add Activity Item → Remove Activity Item → Update Activity → Get applet versions","","Mon Feb 17 21:39:17 GMT 2025","passed","Mon Feb 17 21:39:17 GMT 2025","","Update Activity →","Get applet versions",""
"","120","Applet Events CRUD tests → Update Applet Event tests → 422 Unprocessable Entity → Update Event with missing endTime (periodicity type: WEEKLY) param","","Mon Feb 17 21:37:18 GMT 2025","passed","Mon Feb 17 21:37:18 GMT 2025","","422 Unprocessable Entity →","Update Event with missing endTime (periodicity type: WEEKLY) param",""
"","106","Logs upload/download tests → Upload Logs → 422 Empty form data","","Mon Feb 17 21:39:50 GMT 2025","passed","Mon Feb 17 21:39:50 GMT 2025","","Upload Logs →","422 Empty form data",""
"","126","Update Password tests → 422 Unprocessable Entity Update password with missing password param","","Mon Feb 17 21:44:15 GMT 2025","passed","Mon Feb 17 21:44:15 GMT 2025","","422 Unprocessable Entity","Update password with missing password param",""
"","211","Applets ""retentions"" endpoint tests → 200 OK → Ten days","","Mon Feb 17 21:36:34 GMT 2025","passed","Mon Feb 17 21:36:34 GMT 2025","","200 OK →","Ten days",""
"","243","Workspaces endpoints tests → Workspaces created → Search workspace Applets → 200 OK (search by partial name)","","Mon Feb 17 21:45:51 GMT 2025","passed","Mon Feb 17 21:45:51 GMT 2025","","Search workspace Applets →","200 OK (search by partial name)",""
"","253","Administration tests → Applets tests → Export & view data in workspace of Applet owner tests → View respondent's data tests → 403 Forbidden (Coordinator can NOT view data)","","Mon Feb 17 21:43:00 GMT 2025","passed","Mon Feb 17 21:43:00 GMT 2025","","View respondent's data tests →","403 Forbidden (Coordinator can NOT view data)",""
"","359","User Password tests → Recover password tests → 404 Bad request (Recover password of deleted user)","","Mon Feb 17 21:43:54 GMT 2025","passed","Mon Feb 17 21:43:54 GMT 2025","","Recover password tests →","404 Bad request (Recover password of deleted user)",""
"","222","Answer Notes tests → Get Notes list tests → Get Notes list (not empty) 404 Not Found (Get Note list for not existing Answer)","","Mon Feb 17 21:31:31 GMT 2025","passed","Mon Feb 17 21:31:31 GMT 2025","","Get Notes list (not empty)","404 Not Found (Get Note list for not existing Answer)",""
"","19","Duplicate Applet endpoint tests → 401 Unauthorized","","Mon Feb 17 21:36:35 GMT 2025","passed","Mon Feb 17 21:36:35 GMT 2025","","Duplicate Applet endpoint tests →","401 Unauthorized",""
"","214","Administration tests → Organizers tests → Change organizer roles/permissions tests → 403 Forbidden (Editor can NOT grant reviewer's permissions to coordinator)","","Mon Feb 17 21:42:42 GMT 2025","passed","Mon Feb 17 21:42:42 GMT 2025","","Change organizer roles/permissions tests →","403 Forbidden (Editor can NOT grant reviewer's permissions to coordinator)",""
"","164","Applet Events CRUD tests → Create cross-day events tests → 422 (Cross-day Event with WEEKLY periodicity type and availability range: 15:30:00-15:30:00)","","Mon Feb 17 21:37:31 GMT 2025","passed","Mon Feb 17 21:37:31 GMT 2025","","Create cross-day events tests →","422 (Cross-day Event with WEEKLY periodicity type and availability range: 15:30:00-15:30:00)",""
"","8","Create User tests → 422 Unprocessable Entity (Create user with invalid email format)","","Mon Feb 17 21:43:41 GMT 2025","passed","Mon Feb 17 21:43:41 GMT 2025","","Create User tests →","422 Unprocessable Entity (Create user with invalid email format)",""
"","246","Delete and remove individual Events scenario tests → Delete individual scheduled user Events scenario tests → First Respondent should have individual Always Available activity Event & general Always Available flow Event after deletion of individual scheduled activity Event","","Mon Feb 17 21:36:51 GMT 2025","failed","Mon Feb 17 21:36:51 GMT 2025","","Delete individual scheduled user Events scenario tests →","First Respondent should have individual Always Available activity Event & general Always Available flow Event after deletion of individual scheduled activity Event",""
"","287","Shell account invitation scenario tests → Accept invitation by unregistered user → New user can see the applet","","Mon Feb 17 21:41:39 GMT 2025","passed","Mon Feb 17 21:41:39 GMT 2025","","Accept invitation by unregistered user →","New user can see the applet",""
"","600","Invitations endpoints tests → Send invitation → Invitation Reviewer Send → 200 OK (send to existing user)","","Mon Feb 17 21:40:57 GMT 2025","passed","Mon Feb 17 21:40:57 GMT 2025","","Invitation Reviewer Send →","200 OK (send to existing user)",""
"","207","Answers CRUD tests → Answers handling after invitation acceptance by respondent → Check answer existence tests → 200 OK (exists = false, non-existent activity id)","","Mon Feb 17 21:33:24 GMT 2025","passed","Mon Feb 17 21:33:24 GMT 2025","","Check answer existence tests →","200 OK (exists = false, non-existent activity id)",""
"","220","Applet ""Transfer Ownership"" endpoints tests → Transfer Accept → 404 (Accept same request again)","","Mon Feb 17 21:38:46 GMT 2025","passed","Mon Feb 17 21:38:46 GMT 2025","","Transfer Accept →","404 (Accept same request again)",""
"","730","Create User tests → 201 Create User","","Mon Feb 17 21:43:41 GMT 2025","passed","Mon Feb 17 21:43:41 GMT 2025","","Create User tests →","201 Create User",""
"","194","Applet versions endpoints tests → Update Applet → Add Activity → Remove Activity → Add Activity Flow → Get applet versions","","Mon Feb 17 21:39:12 GMT 2025","passed","Mon Feb 17 21:39:12 GMT 2025","","Add Activity Flow →","Get applet versions",""
"","589","Invitations endpoints tests → Send invitation → Invitation Managers Send → 200 OK (send to unregistered user) Role = coordinator","","Mon Feb 17 21:41:04 GMT 2025","passed","Mon Feb 17 21:41:04 GMT 2025","","200 OK (send to unregistered user)","Role = coordinator",""
"","238","Applet versions endpoints tests → Update Applet → Add Activity → Get applet version by id","","Mon Feb 17 21:39:09 GMT 2025","passed","Mon Feb 17 21:39:09 GMT 2025","","Add Activity →","Get applet version by id",""
"","907","Applet builder tests → Create applet → Positive tests → Applet with all hidden activities","","Mon Feb 17 21:35:57 GMT 2025","failed","Mon Feb 17 21:35:57 GMT 2025","","Positive tests →","Applet with all hidden activities",""
"","266","Answers CRUD tests → Answers handling after invitation acceptance by respondent → Get activity answers list & Answers of respondent tests → 404 Not Found (Get Answer with not existing answerId)","","Mon Feb 17 21:33:27 GMT 2025","passed","Mon Feb 17 21:33:27 GMT 2025","","Get activity answers list & Answers of respondent tests →","404 Not Found (Get Answer with not existing answerId)",""
"","8","Create User tests → 422 Unprocessable Entity Create user with missing email param","","Mon Feb 17 21:43:42 GMT 2025","passed","Mon Feb 17 21:43:42 GMT 2025","","422 Unprocessable Entity","Create user with missing email param",""
"","218","Invitations endpoints tests → Accept invitation → 404 - non-existent invitation key","","Mon Feb 17 21:40:49 GMT 2025","passed","Mon Feb 17 21:40:49 GMT 2025","","Accept invitation →","404 - non-existent invitation key",""
"","877","Applet builder tests → Create applet → Positive tests → Applet with maximum activity and items settings","","Mon Feb 17 21:35:57 GMT 2025","failed","Mon Feb 17 21:35:57 GMT 2025","","Positive tests →","Applet with maximum activity and items settings",""
"","210","Workspaces managers access tests → Get workspace roles list → 200 OK","","Mon Feb 17 21:45:19 GMT 2025","passed","Mon Feb 17 21:45:19 GMT 2025","","Get workspace roles list →","200 OK",""
"","192","Applet Library tests → Applet is added to the library → Get Library Applet by id → 200 OK","","Mon Feb 17 21:35:24 GMT 2025","failed","Mon Feb 17 21:35:24 GMT 2025","","Get Library Applet by id →","200 OK",""
"","124","Applet public links tests → Get public link tests → 200 Get public link by Id of created Applet","","Mon Feb 17 21:41:13 GMT 2025","passed","Mon Feb 17 21:41:13 GMT 2025","","Get public link tests →","200 Get public link by Id of created Applet",""
"","183","Get applet completed activities tests → Respondent completes the 1st activity within default always available event → 200 OK (empty list): incorrect applet version","","Mon Feb 17 21:31:45 GMT 2025","passed","Mon Feb 17 21:31:45 GMT 2025","","Respondent completes the 1st activity within default always available event →","200 OK (empty list): incorrect applet version",""
"","234","Applet Events CRUD tests → Delete individual scheduled Applet Events negative tests → 404 Not Found (Delete scheduled Events of a particular user with not existing Applet)","","Mon Feb 17 21:37:24 GMT 2025","passed","Mon Feb 17 21:37:24 GMT 2025","","Delete individual scheduled Applet Events negative tests →","404 Not Found (Delete scheduled Events of a particular user with not existing Applet)",""
"","205","Applet ""Transfer Ownership"" scenario tests → Transfer Accept → First receiver should become the owner → Verify transferred respondents list","","Mon Feb 17 21:38:21 GMT 2025","failed","Mon Feb 17 21:38:21 GMT 2025","","First receiver should become the owner →","Verify transferred respondents list",""
"","525","Applet Library tests → Applet is added to the library → Cart test → Clear cart","","Mon Feb 17 21:35:27 GMT 2025","passed","Mon Feb 17 21:35:27 GMT 2025","","Cart test →","Clear cart",""
"","146","Applet Events CRUD tests → Create Events tests → 422 Unprocessable Entity → Create Event with missing startTime (periodicity type: WEEKLY) param","","Mon Feb 17 21:36:59 GMT 2025","passed","Mon Feb 17 21:36:59 GMT 2025","","422 Unprocessable Entity →","Create Event with missing startTime (periodicity type: WEEKLY) param",""
"","6289","Applet ""Transfer Ownership"" scenario tests → Transfer Decline → Send transfer request to two different users","","Mon Feb 17 21:38:24 GMT 2025","passed","Mon Feb 17 21:38:30 GMT 2025","","Transfer Decline →","Send transfer request to two different users",""
