"DESCRIPTION","DURATION IN MS","NAME","PARENT SUITE","START TIME","STATUS","STOP TIME","SUB SUITE","SUITE","TEST CLASS","TEST METHOD"
"","13987","Activity Assessment & Review CRUD tests → Submit Assessment tests → 201 Submit Assessment","","Mon Feb 17 21:34:04 GMT 2025","failed","Mon Feb 17 21:34:17 GMT 2025","","Submit Assessment tests →","201 Submit Assessment",""
"","223","Applet Events CRUD tests → Get general and individual Applet Events → 200 OK (with respondentId in the query)","","Mon Feb 17 21:37:02 GMT 2025","failed","Mon Feb 17 21:37:02 GMT 2025","","Get general and individual Applet Events →","200 OK (with respondentId in the query)",""
"","169","Applet ""Transfer Ownership"" endpoints tests → Transfer Accept → 404 (invalid applet id)","","Mon Feb 17 21:38:46 GMT 2025","passed","Mon Feb 17 21:38:46 GMT 2025","","Transfer Accept →","404 (invalid applet id)",""
"","206","Workspace folder for different users tests → Manager is invited to the applet → Manager creates own folder in the same workspace Applet Owner and Manager add the same applet in their folders Applet Owner creates another folder Get folders (manager)","","Mon Feb 17 21:44:54 GMT 2025","passed","Mon Feb 17 21:44:54 GMT 2025","","Applet Owner creates another folder","Get folders (manager)",""
"","260","Applets ""unique_name"" endpoint tests → 200 OK: not unique name","","Mon Feb 17 21:39:02 GMT 2025","passed","Mon Feb 17 21:39:02 GMT 2025","","Applets ""unique_name"" endpoint tests →","200 OK: not unique name",""
"","6691","Answers scenario tests → New Applet owner should be able to see Answers of respondent after transferring ownership to another user","","Mon Feb 17 21:32:50 GMT 2025","passed","Mon Feb 17 21:32:56 GMT 2025","","Answers scenario tests →","New Applet owner should be able to see Answers of respondent after transferring ownership to another user",""
"","1196","Applet builder tests → Create applet → Positive tests → Single activity with mobile-only items (Audio, Video, Drawing, Geolocation, Photo, Time)","","Mon Feb 17 21:35:57 GMT 2025","passed","Mon Feb 17 21:35:58 GMT 2025","","Positive tests →","Single activity with mobile-only items (Audio, Video, Drawing, Geolocation, Photo, Time)",""
"","108","Invitations endpoints tests → Send invitation → Invitation Managers Send → 422 Missing attributes Missing role","","Mon Feb 17 21:41:07 GMT 2025","passed","Mon Feb 17 21:41:07 GMT 2025","","422 Missing attributes","Missing role",""
"","206","Get applet completed activities tests → Respondent completes the 1st activity within default always available event → 200 OK : first activity completion should be present","","Mon Feb 17 21:31:45 GMT 2025","passed","Mon Feb 17 21:31:45 GMT 2025","","Respondent completes the 1st activity within default always available event →","200 OK : first activity completion should be present",""
"","108","Applet Events CRUD tests → Create Events tests → 422 Unprocessable Entity → Create Event with missing endTime (periodicity type: WEEKDAYS) param","","Mon Feb 17 21:36:59 GMT 2025","passed","Mon Feb 17 21:36:59 GMT 2025","","422 Unprocessable Entity →","Create Event with missing endTime (periodicity type: WEEKDAYS) param",""
"","631","Applets CRUD endpoints tests → Create applet → 201 Created","","Mon Feb 17 21:35:42 GMT 2025","passed","Mon Feb 17 21:35:42 GMT 2025","","Create applet →","201 Created",""
"","126","Applet public access tests → Create anonymous answer 404 Not Found (invalid appletId)","","Mon Feb 17 21:37:51 GMT 2025","passed","Mon Feb 17 21:37:51 GMT 2025","","Create anonymous answer","404 Not Found (invalid appletId)",""
"","387","Workspace folder for different users tests → Manager is invited to the applet → Manager creates own folder in the same workspace Applet Owner and Manager add the same applet in their folders Get folders (manager)","","Mon Feb 17 21:44:53 GMT 2025","passed","Mon Feb 17 21:44:53 GMT 2025","","Applet Owner and Manager add the same applet in their folders","Get folders (manager)",""
"","233","Workspaces endpoints tests → Workspaces created → Get workspace applet respondent by id → 404 not found (invalid applet id)","","Mon Feb 17 21:46:05 GMT 2025","passed","Mon Feb 17 21:46:05 GMT 2025","","Get workspace applet respondent by id →","404 not found (invalid applet id)",""
"","252","""Authentication"" endpoints tests → Delete Token → 200 OK","","Mon Feb 17 21:39:24 GMT 2025","passed","Mon Feb 17 21:39:24 GMT 2025","","Delete Token →","200 OK",""
"","202","Applets ""retentions"" endpoint tests → 200 OK → 100 month","","Mon Feb 17 21:36:34 GMT 2025","passed","Mon Feb 17 21:36:34 GMT 2025","","200 OK →","100 month",""
"","259","Applet Library tests → Share applet to the library 200 OK","","Mon Feb 17 21:35:24 GMT 2025","passed","Mon Feb 17 21:35:24 GMT 2025","","Share applet to the library","200 OK",""
"","412","User Password tests → Recover password tests → 201 Recover password","","Mon Feb 17 21:43:54 GMT 2025","passed","Mon Feb 17 21:43:54 GMT 2025","","Recover password tests →","201 Recover password",""
"","247","Workspaces endpoints tests → Workspaces created → Get workspace Applets → Respondent gets own applets","","Mon Feb 17 21:45:47 GMT 2025","passed","Mon Feb 17 21:45:47 GMT 2025","","Get workspace Applets →","Respondent gets own applets",""
"","411","Applet Events CRUD tests → Update Applet Event tests → 200 OK (Update general scheduled activity Event - set new start time and change periodicity type)","","Mon Feb 17 21:37:16 GMT 2025","passed","Mon Feb 17 21:37:16 GMT 2025","","Update Applet Event tests →","200 OK (Update general scheduled activity Event - set new start time and change periodicity type)",""
"","212","Administration tests → Organizers tests → Change organizer roles/permissions tests → 403 Forbidden (Coordinator can NOT grant editor's permissions to respondent)","","Mon Feb 17 21:42:42 GMT 2025","passed","Mon Feb 17 21:42:42 GMT 2025","","Change organizer roles/permissions tests →","403 Forbidden (Coordinator can NOT grant editor's permissions to respondent)",""
"","599","Administration tests → Applets tests → Duplicate Applet in workspace of Applet owner tests → 201 Created (Manager can duplicate Applet)","","Mon Feb 17 21:42:54 GMT 2025","passed","Mon Feb 17 21:42:54 GMT 2025","","Duplicate Applet in workspace of Applet owner tests →","201 Created (Manager can duplicate Applet)",""
"","794","Invitations endpoints tests → Send invitation → Invitation Managers Send → 200 OK (send to unregistered user) With workspace prefix, language: fr","","Mon Feb 17 21:41:04 GMT 2025","passed","Mon Feb 17 21:41:04 GMT 2025","","200 OK (send to unregistered user)","With workspace prefix, language: fr",""
"","221","Answer Notes tests → Get Notes list tests → Get Notes list (not empty) 404 Not Found (Get Note list for not existing activity)","","Mon Feb 17 21:31:31 GMT 2025","passed","Mon Feb 17 21:31:31 GMT 2025","","Get Notes list (not empty)","404 Not Found (Get Note list for not existing activity)",""
"","1091","Answers scenario tests → Applet owner should NOT be able to see Answers of respondent in the Applet duplicate","","Mon Feb 17 21:32:50 GMT 2025","passed","Mon Feb 17 21:32:51 GMT 2025","","Answers scenario tests →","Applet owner should NOT be able to see Answers of respondent in the Applet duplicate",""
"","186","Answers CRUD tests → Answers handling after invitation acceptance by respondent → Create Answer tests → 422 Unprocessable Entity → Create Answer with missing itemIds param","","Mon Feb 17 21:33:23 GMT 2025","passed","Mon Feb 17 21:33:23 GMT 2025","","422 Unprocessable Entity →","Create Answer with missing itemIds param",""
"","207","Workspaces endpoints tests → Workspaces created → Get workspace applet details → 404 Not Found (non-existent ownerId)","","Mon Feb 17 21:45:53 GMT 2025","passed","Mon Feb 17 21:45:53 GMT 2025","","Get workspace applet details →","404 Not Found (non-existent ownerId)",""
"","7","Applets ""report configuration"" endpoint tests → 401 Unauthorized","","Mon Feb 17 21:37:53 GMT 2025","passed","Mon Feb 17 21:37:53 GMT 2025","","Applets ""report configuration"" endpoint tests →","401 Unauthorized",""
"","1273","Get applet completed activities tests → Respondent completes the 1st activity within default always available event → Respondent completes the 2nd activity within oneTimeCompletion Event → Respondent completes activities within the activity flow → ""before all"" hook for ""200 OK : activity flow completion should be present""","","Mon Feb 17 21:31:48 GMT 2025","failed","Mon Feb 17 21:31:49 GMT 2025","","Respondent completes activities within the activity flow →","""before all"" hook for ""200 OK : activity flow completion should be present""",""
"","203","Answers CRUD tests → Answers handling after invitation acceptance by respondent → Check answer existence tests → 200 OK (exists = true, check by respondent)","","Mon Feb 17 21:33:24 GMT 2025","passed","Mon Feb 17 21:33:24 GMT 2025","","Check answer existence tests →","200 OK (exists = true, check by respondent)",""
"","237","Applet versions endpoints tests → Update Applet → Add Activity → Remove Activity → Add Activity Flow → Remove Activity Flow → Add Activity Item → Remove Activity Item → Update Activity → Update Activity Item → Update Activity Flow → Update Applet description → Get applet version changes","","Mon Feb 17 21:39:20 GMT 2025","passed","Mon Feb 17 21:39:20 GMT 2025","","Update Applet description →","Get applet version changes",""
"","175","Multiinformant assessment validate tests → 422: Unprocessable Entity","","Mon Feb 17 21:34:54 GMT 2025","passed","Mon Feb 17 21:34:54 GMT 2025","","Multiinformant assessment validate tests →","422: Unprocessable Entity",""
"","7","Applet versions endpoints tests → Get applet version changes → 401 Unauthorized","","Mon Feb 17 21:39:08 GMT 2025","passed","Mon Feb 17 21:39:08 GMT 2025","","Get applet version changes →","401 Unauthorized",""
"","383","Workspaces endpoints tests → Workspaces created → Get workspace respondents → Second workspace respondents","","Mon Feb 17 21:45:54 GMT 2025","passed","Mon Feb 17 21:45:54 GMT 2025","","Get workspace respondents →","Second workspace respondents",""
"","7","Applet Events CRUD tests → Count scheduled Applet Events tests → 401 Unauthorized (Count general scheduled Events with not existing appletOwnerToken)","","Mon Feb 17 21:37:21 GMT 2025","passed","Mon Feb 17 21:37:21 GMT 2025","","Count scheduled Applet Events tests →","401 Unauthorized (Count general scheduled Events with not existing appletOwnerToken)",""
"","338","Files upload/download tests → Upload/Download answers (applet files) → Check answer (file) uploaded → 200 OK (multiple files, uploaded = false)","","Mon Feb 17 21:39:44 GMT 2025","passed","Mon Feb 17 21:39:44 GMT 2025","","Check answer (file) uploaded →","200 OK (multiple files, uploaded = false)",""
"","719","Files upload/download tests → Upload File → 200 OK","","Mon Feb 17 21:39:34 GMT 2025","passed","Mon Feb 17 21:39:34 GMT 2025","","Upload File →","200 OK",""
"","112","Workspaces managers access tests → Set workspace managers applet access list → 422 Unprocessable entity (empty body)","","Mon Feb 17 21:45:13 GMT 2025","passed","Mon Feb 17 21:45:13 GMT 2025","","Set workspace managers applet access list →","422 Unprocessable entity (empty body)",""
"","119","Duplicate Applet endpoint tests → 422 missing attribute (encryption)","","Mon Feb 17 21:36:35 GMT 2025","passed","Mon Feb 17 21:36:35 GMT 2025","","Duplicate Applet endpoint tests →","422 missing attribute (encryption)",""
"","276","Activity Versions & Identifiers tests → Get Identifiers tests → 404 Not Found (not existing activityId)","","Mon Feb 17 21:34:50 GMT 2025","passed","Mon Feb 17 21:34:50 GMT 2025","","Get Identifiers tests →","404 Not Found (not existing activityId)",""
"","207","Administration tests → Organizers tests → View all organizers tests → 403 Forbidden (Coordinator can NOT view organizers)","","Mon Feb 17 21:42:41 GMT 2025","passed","Mon Feb 17 21:42:41 GMT 2025","","View all organizers tests →","403 Forbidden (Coordinator can NOT view organizers)",""
"","193","Applet versions endpoints tests → Get applet versions → 404 (incorrect appletId)","","Mon Feb 17 21:39:07 GMT 2025","passed","Mon Feb 17 21:39:07 GMT 2025","","Get applet versions →","404 (incorrect appletId)",""
"","232","Applets GET ""base info"" endpoint tests → 200 OK","","Mon Feb 17 21:35:51 GMT 2025","passed","Mon Feb 17 21:35:51 GMT 2025","","Applets GET ""base info"" endpoint tests →","200 OK",""
"","5082","Shell account invitation scenario tests → Accept invitation by unregistered user → New user should receive an e-mail with invitation","","Mon Feb 17 21:41:39 GMT 2025","passed","Mon Feb 17 21:41:44 GMT 2025","","Accept invitation by unregistered user →","New user should receive an e-mail with invitation",""
"","1985","Create Answers for different item types tests → Slider item","","Mon Feb 17 21:32:12 GMT 2025","passed","Mon Feb 17 21:32:13 GMT 2025","","Create Answers for different item types tests →","Slider item",""
"","241","Administration tests → Respondents tests → Invite new reviewer for a specific respondent tests → 403 Forbidden (Editor can NOT invite new reviewer for a specific respondent)","","Mon Feb 17 21:42:47 GMT 2025","passed","Mon Feb 17 21:42:47 GMT 2025","","Invite new reviewer for a specific respondent tests →","403 Forbidden (Editor can NOT invite new reviewer for a specific respondent)",""
"","685","""Authentication"" endpoints tests → OpenAPI auth → 401 Unauthorized (incorrect password)","","Mon Feb 17 21:39:28 GMT 2025","passed","Mon Feb 17 21:39:28 GMT 2025","","OpenAPI auth →","401 Unauthorized (incorrect password)",""
"","219","Logs upload/download tests → Check logs existence → 200 OK (empty list)","","Mon Feb 17 21:39:54 GMT 2025","passed","Mon Feb 17 21:39:54 GMT 2025","","Check logs existence →","200 OK (empty list)",""
"","293","""Workspace Folders"" endpoints tests → Workspace is created → Pin/Unpin Folder → Pin Folder → 200 OK","","Mon Feb 17 21:44:43 GMT 2025","passed","Mon Feb 17 21:44:43 GMT 2025","","Pin Folder →","200 OK",""
"","217","Answer Notes tests → Edit Note tests → 422 Unprocessable Entity (Update Note without required param - note)","","Mon Feb 17 21:31:34 GMT 2025","passed","Mon Feb 17 21:31:34 GMT 2025","","Edit Note tests →","422 Unprocessable Entity (Update Note without required param - note)",""
"","272","Activity Assessment & Review CRUD tests → Get Assessment & Review tests → Assessment has been submitted → 200 OK (Get Review)","","Mon Feb 17 21:34:03 GMT 2025","passed","Mon Feb 17 21:34:03 GMT 2025","","Assessment has been submitted →","200 OK (Get Review)",""
"","202","Workspaces endpoints tests → Workspaces created → Get workspace by ownerId → 200 OK","","Mon Feb 17 21:45:47 GMT 2025","passed","Mon Feb 17 21:45:47 GMT 2025","","Get workspace by ownerId →","200 OK",""
"","191","Activity Assignments tests → Negative tests → Create Assignments → 403 Forbidden","","Mon Feb 17 21:31:24 GMT 2025","passed","Mon Feb 17 21:31:24 GMT 2025","","Create Assignments →","403 Forbidden",""
"","98","Applet public access tests → Get public events by key → 404: invalid key","","Mon Feb 17 21:37:50 GMT 2025","passed","Mon Feb 17 21:37:50 GMT 2025","","Get public events by key →","404: invalid key",""
"","5","Get User Device Information → 401 Unathorized error","","Mon Feb 17 21:44:21 GMT 2025","passed","Mon Feb 17 21:44:21 GMT 2025","","Get User Device Information →","401 Unathorized error",""
"","7","Summary & Review activities tests → Get Summary and Review Activities (non-empty list) tests → Get Review Activities list tests → 401 Unauthorized (Get Review Activities list with not existing token)","","Mon Feb 17 21:35:11 GMT 2025","passed","Mon Feb 17 21:35:11 GMT 2025","","Get Review Activities list tests →","401 Unauthorized (Get Review Activities list with not existing token)",""
"","756","Applet builder tests → Create applet → Positive tests → Applet with alerts configured (Slider, SingleSelection, MultiSelection, SliderRows, Single/MultiRows)","","Mon Feb 17 21:35:57 GMT 2025","failed","Mon Feb 17 21:35:57 GMT 2025","","Positive tests →","Applet with alerts configured (Slider, SingleSelection, MultiSelection, SliderRows, Single/MultiRows)",""
"","386","Files upload/download directly to S3 bucket tests → Upload log files directly to storage (S3 bucket) Generate presigned logs url","","Mon Feb 17 21:39:59 GMT 2025","passed","Mon Feb 17 21:39:59 GMT 2025","","Upload log files directly to storage (S3 bucket)","Generate presigned logs url",""
"","231","Activity Assessment & Review CRUD tests → Submit Assessment tests → 422 Unprocessable Entity → Create Assessment with missing assessmentVersionId param","","Mon Feb 17 21:34:19 GMT 2025","passed","Mon Feb 17 21:34:19 GMT 2025","","422 Unprocessable Entity →","Create Assessment with missing assessmentVersionId param",""
"","231","Applet versions endpoints tests → Update Applet → Add Activity → Remove Activity → Get applet versions","","Mon Feb 17 21:39:10 GMT 2025","passed","Mon Feb 17 21:39:10 GMT 2025","","Remove Activity →","Get applet versions",""
"","201","Access link tests → Create Access link tests → 404 Not Found (Create Access link with not existing applet)","","Mon Feb 17 21:35:31 GMT 2025","passed","Mon Feb 17 21:35:31 GMT 2025","","Create Access link tests →","404 Not Found (Create Access link with not existing applet)",""
"","6263","Applet ""Transfer Ownership"" scenario tests → Transfer Accept → Send transfer request to two different users","","Mon Feb 17 21:38:07 GMT 2025","passed","Mon Feb 17 21:38:13 GMT 2025","","Transfer Accept →","Send transfer request to two different users",""
"","2047","Create Answers for different item types tests → A/B Mobile performance task","","Mon Feb 17 21:32:12 GMT 2025","passed","Mon Feb 17 21:32:14 GMT 2025","","Create Answers for different item types tests →","A/B Mobile performance task",""
"","141","Applet public access tests → Get public applet base info by key → 404: invalid key","","Mon Feb 17 21:37:50 GMT 2025","passed","Mon Feb 17 21:37:50 GMT 2025","","Get public applet base info by key →","404: invalid key",""
"","1659","Applet builder tests → Create applet → Positive tests → Performance task activities: Gyroscope and touch","","Mon Feb 17 21:35:57 GMT 2025","passed","Mon Feb 17 21:35:58 GMT 2025","","Positive tests →","Performance task activities: Gyroscope and touch",""
"","108","Applet Events CRUD tests → Update Applet Event tests → 422 Unprocessable Entity → Update Event with missing selectedDate param (periodicity type: ONCE)","","Mon Feb 17 21:37:18 GMT 2025","passed","Mon Feb 17 21:37:18 GMT 2025","","422 Unprocessable Entity →","Update Event with missing selectedDate param (periodicity type: ONCE)",""
"","109","Invitations endpoints tests → Invite Shell account → 422: Missing attribute","","Mon Feb 17 21:41:11 GMT 2025","passed","Mon Feb 17 21:41:11 GMT 2025","","Invite Shell account →","422: Missing attribute",""
"","242","Administration tests → Applets tests → Create Applet in workspace of Applet owner tests → 403 Forbidden (Reviewer can NOT create Applet in workspace of Applet owner)","","Mon Feb 17 21:42:51 GMT 2025","passed","Mon Feb 17 21:42:51 GMT 2025","","Create Applet in workspace of Applet owner tests →","403 Forbidden (Reviewer can NOT create Applet in workspace of Applet owner)",""
"","686","""Authentication"" endpoints tests → Get Token → 200 OK","","Mon Feb 17 21:39:22 GMT 2025","passed","Mon Feb 17 21:39:22 GMT 2025","","Get Token →","200 OK",""
"","6","""Themes"" endpoints tests → Create Theme → 401 Unauthorized (invalid token)","","Mon Feb 17 21:43:37 GMT 2025","passed","Mon Feb 17 21:43:37 GMT 2025","","Create Theme →","401 Unauthorized (invalid token)",""
"","282","Applet versions endpoints tests → Update Applet → Add Activity → Remove Activity → Add Activity Flow → Remove Activity Flow → Add Activity Item → Remove Activity Item → Update Activity → Get applet version changes","","Mon Feb 17 21:39:17 GMT 2025","passed","Mon Feb 17 21:39:17 GMT 2025","","Update Activity →","Get applet version changes",""
"","6","Applet Events CRUD tests → Get Applet Event by Id tests → 401 Unauthorized (Get individual scheduled activity Event with invalid appletOwnerToken)","","Mon Feb 17 21:37:09 GMT 2025","passed","Mon Feb 17 21:37:09 GMT 2025","","Get Applet Event by Id tests →","401 Unauthorized (Get individual scheduled activity Event with invalid appletOwnerToken)",""
"","308","Applets CRUD endpoints tests → Create applet → 422 Unprocessable Entity (missing attribute) Missing ""activities""","","Mon Feb 17 21:35:44 GMT 2025","passed","Mon Feb 17 21:35:44 GMT 2025","","422 Unprocessable Entity (missing attribute)","Missing ""activities""",""
"","7","Applets ""setFolder"" endpoint tests → 401 Unauthorized","","Mon Feb 17 21:37:57 GMT 2025","passed","Mon Feb 17 21:37:57 GMT 2025","","Applets ""setFolder"" endpoint tests →","401 Unauthorized",""
"","233","Get submit dates & exported Answers data tests → Get exported data & dates after answer submit → 200 OK: empty list (Get exported data by coordinator)","","Mon Feb 17 21:32:08 GMT 2025","passed","Mon Feb 17 21:32:08 GMT 2025","","Get exported data & dates after answer submit →","200 OK: empty list (Get exported data by coordinator)",""
"","405","Delete Subjects (remove applet access) tests → Verify workspace users applet access list before respondents access removed","","Mon Feb 17 21:43:08 GMT 2025","passed","Mon Feb 17 21:43:08 GMT 2025","","Delete Subjects (remove applet access) tests →","Verify workspace users applet access list before respondents access removed",""
"","242","Answer Notes tests → Delete Note tests → 404 Not Found (Delete Note of not existing Answer)","","Mon Feb 17 21:31:36 GMT 2025","passed","Mon Feb 17 21:31:36 GMT 2025","","Delete Note tests →","404 Not Found (Delete Note of not existing Answer)",""
"","221","Administration tests → Applets tests → Export & view data in workspace of Applet owner tests → View respondent's data tests → 403 Forbidden (Respondent can NOT view data)","","Mon Feb 17 21:43:00 GMT 2025","passed","Mon Feb 17 21:43:00 GMT 2025","","View respondent's data tests →","403 Forbidden (Respondent can NOT view data)",""
"","469","Applet Events CRUD tests → Create cross-day events tests → 201 Created (Cross-day Event with DAILY periodicity type and availability range: 23:59:00-23:58:00)","","Mon Feb 17 21:37:31 GMT 2025","failed","Mon Feb 17 21:37:31 GMT 2025","","Create cross-day events tests →","201 Created (Cross-day Event with DAILY periodicity type and availability range: 23:59:00-23:58:00)",""
"","225","Applet ""Transfer Ownership"" endpoints tests → Transfer Decline → 404 (invalid key)","","Mon Feb 17 21:38:54 GMT 2025","passed","Mon Feb 17 21:38:54 GMT 2025","","Transfer Decline →","404 (invalid key)",""
"","54","Files upload/download directly to S3 bucket tests → Upload media files directly to storage (S3 bucket) Verify file is accessible by the link (can be downloaded)","","Mon Feb 17 21:39:59 GMT 2025","passed","Mon Feb 17 21:39:59 GMT 2025","","Upload media files directly to storage (S3 bucket)","Verify file is accessible by the link (can be downloaded)",""
"","218","Applet Events CRUD tests → Remove individual scheduled Applet Events negative tests → 404 Not Found (Remove scheduled Events of a particular user with not existing Applet)","","Mon Feb 17 21:37:26 GMT 2025","passed","Mon Feb 17 21:37:26 GMT 2025","","Remove individual scheduled Applet Events negative tests →","404 Not Found (Remove scheduled Events of a particular user with not existing Applet)",""
"","7","Access link tests → Get Access link tests → 401 Unauthorized (Get Access link with invalid token)","","Mon Feb 17 21:35:31 GMT 2025","passed","Mon Feb 17 21:35:31 GMT 2025","","Get Access link tests →","401 Unauthorized (Get Access link with invalid token)",""
"","8","Applet Events CRUD tests → Delete individual scheduled Applet Events negative tests → 401 Unauthorized (Delete scheduled Events of a particular user with not existing appletOwnerToken)","","Mon Feb 17 21:37:24 GMT 2025","passed","Mon Feb 17 21:37:24 GMT 2025","","Delete individual scheduled Applet Events negative tests →","401 Unauthorized (Delete scheduled Events of a particular user with not existing appletOwnerToken)",""
"","99","Applet Events CRUD tests → Create Events tests → 422 Unprocessable Entity → Create Event with missing startTime (periodicity type: ONCE) param","","Mon Feb 17 21:36:59 GMT 2025","passed","Mon Feb 17 21:36:59 GMT 2025","","422 Unprocessable Entity →","Create Event with missing startTime (periodicity type: ONCE) param",""
"","130","Applet Events CRUD tests → Create Events tests → 422 Unprocessable Entity → Create Event with missing timer param (timer type: TIMER)","","Mon Feb 17 21:36:59 GMT 2025","passed","Mon Feb 17 21:36:59 GMT 2025","","422 Unprocessable Entity →","Create Event with missing timer param (timer type: TIMER)",""
"","1729","Applet builder tests → Update applet → Remove activity flow","","Mon Feb 17 21:36:16 GMT 2025","failed","Mon Feb 17 21:36:17 GMT 2025","","Update applet →","Remove activity flow",""
