"DESCRIPTION","DURATION IN MS","NAME","PARENT SUITE","START TIME","STATUS","STOP TIME","SUB SUITE","SUITE","TEST CLASS","TEST METHOD"
"","126","""Themes"" endpoints tests → Update Theme → 404 Not Found (non-existent theme)","","Tue Oct 29 17:02:20 GMT 2024","passed","Tue Oct 29 17:02:20 GMT 2024","","Update Theme →","404 Not Found (non-existent theme)",""
"","281","Invitations scenario tests → Accept invitation positive flow → Invitation can't be sent again after it acceptance by the user","","Tue Oct 29 16:58:34 GMT 2024","passed","Tue Oct 29 16:58:34 GMT 2024","","Accept invitation positive flow →","Invitation can't be sent again after it acceptance by the user",""
"","273","Workspaces endpoints tests → Workspaces created → Get workspace Applets → Second applet owner gets collaborated applets","","Tue Oct 29 17:04:47 GMT 2024","passed","Tue Oct 29 17:04:47 GMT 2024","","Get workspace Applets →","Second applet owner gets collaborated applets",""
"","57","Workspaces endpoints tests → Workspaces created → Pin user (respondent) on workspace → 401 Unauthorized","","Tue Oct 29 17:05:07 GMT 2024","passed","Tue Oct 29 17:05:07 GMT 2024","","Pin user (respondent) on workspace →","401 Unauthorized",""
"","1","Answers CRUD tests → Answers handling after invitation acceptance by respondent → Get flow submissions list & Flow answers of respondent tests → 200 OK (Get flow submissions list)","","Tue Oct 29 16:51:13 GMT 2024","passed","Tue Oct 29 16:51:13 GMT 2024","","Get flow submissions list & Flow answers of respondent tests →","200 OK (Get flow submissions list)",""
"","300","Workspaces endpoints tests → Workspaces created → Get workspace Applets → Respondent gets own applets","","Tue Oct 29 17:04:47 GMT 2024","passed","Tue Oct 29 17:04:47 GMT 2024","","Get workspace Applets →","Respondent gets own applets",""
"","197","Applet Events CRUD tests → Update Applet Event tests → 422 Unprocessable Entity → Update Event with missing startTime (periodicity type: MONTHLY) param","","Tue Oct 29 16:54:56 GMT 2024","passed","Tue Oct 29 16:54:56 GMT 2024","","422 Unprocessable Entity →","Update Event with missing startTime (periodicity type: MONTHLY) param",""
"","316","Activity Versions & Identifiers tests → Get Identifiers tests → 404 Not Found (not existing activityId)","","Tue Oct 29 16:51:56 GMT 2024","passed","Tue Oct 29 16:51:56 GMT 2024","","Get Identifiers tests →","404 Not Found (not existing activityId)",""
"","357","Applet versions endpoints tests → Update Applet → Add Activity → Remove Activity → Add Activity Flow → Remove Activity Flow → Add Activity Item → Remove Activity Item → Update Activity → Update Activity Item → Update Activity Flow → Update Applet description → Get applet version changes","","Tue Oct 29 16:57:29 GMT 2024","passed","Tue Oct 29 16:57:29 GMT 2024","","Update Applet description →","Get applet version changes",""
"","160","Applets CRUD endpoints tests → Update applet → 422 Unprocessable Entity (missing attribute) Missing ""activities""","","Tue Oct 29 16:53:04 GMT 2024","passed","Tue Oct 29 16:53:04 GMT 2024","","422 Unprocessable Entity (missing attribute)","Missing ""activities""",""
"","238","Multiinformant assessment validate tests → 422: Unprocessable Entity","","Tue Oct 29 16:52:00 GMT 2024","passed","Tue Oct 29 16:52:00 GMT 2024","","Multiinformant assessment validate tests →","422: Unprocessable Entity",""
"","45","Create User tests → 422 Unprocessable Entity Create user with missing password param","","Tue Oct 29 17:02:23 GMT 2024","passed","Tue Oct 29 17:02:23 GMT 2024","","422 Unprocessable Entity","Create user with missing password param",""
"","258","Activity Assessment & Review CRUD tests → Submit Assessment tests → 401 Not Found (Submit Assessment to not existing Answer)","","Tue Oct 29 16:51:36 GMT 2024","passed","Tue Oct 29 16:51:36 GMT 2024","","Submit Assessment tests →","401 Not Found (Submit Assessment to not existing Answer)",""
"","297","Administration tests → Applets tests → Export & view data in workspace of Applet owner tests → View respondent's data tests → 403 Forbidden (Reviewer with no assigned respondents can NOT view data)","","Tue Oct 29 17:01:37 GMT 2024","passed","Tue Oct 29 17:01:37 GMT 2024","","View respondent's data tests →","403 Forbidden (Reviewer with no assigned respondents can NOT view data)",""
"","263","Answer Notes tests → Edit Note tests → 422 Unprocessable Entity (Update Note without required param - note)","","Tue Oct 29 16:48:59 GMT 2024","passed","Tue Oct 29 16:48:59 GMT 2024","","Edit Note tests →","422 Unprocessable Entity (Update Note without required param - note)",""
"","282","Activity Versions & Identifiers tests → Get Versions tests → Applet has been updated → 200 OK (Get versions after updating item type, applet name and adding new item)","","Tue Oct 29 16:51:53 GMT 2024","passed","Tue Oct 29 16:51:53 GMT 2024","","Applet has been updated →","200 OK (Get versions after updating item type, applet name and adding new item)",""
"","298","Answers scenario tests → Review count in activity answers after submitting assessment by Applet owner and Reviewer Get review count by Reviewer","","Tue Oct 29 16:50:48 GMT 2024","passed","Tue Oct 29 16:50:48 GMT 2024","","Review count in activity answers after submitting assessment by Applet owner and Reviewer","Get review count by Reviewer",""
"","629","Administration tests → Respondents tests → Invite new reviewer for a specific respondent tests → 200 OK (Manager can invite new reviewer for a specific respondent)","","Tue Oct 29 17:01:21 GMT 2024","passed","Tue Oct 29 17:01:21 GMT 2024","","Invite new reviewer for a specific respondent tests →","200 OK (Manager can invite new reviewer for a specific respondent)",""
"","51","Logs upload/download tests → Download Logs → 401 Unauthorized","","Tue Oct 29 16:58:01 GMT 2024","passed","Tue Oct 29 16:58:01 GMT 2024","","Download Logs →","401 Unauthorized",""
"","855","Logs upload/download tests → Download Logs → 200 OK (empty list)","","Tue Oct 29 16:58:01 GMT 2024","passed","Tue Oct 29 16:58:01 GMT 2024","","Download Logs →","200 OK (empty list)",""
"","262","Workspaces endpoints tests → Workspaces created → Pin user (manager) on workspace → 403 Forbidden (invalid manager_id)","","Tue Oct 29 17:05:08 GMT 2024","passed","Tue Oct 29 17:05:08 GMT 2024","","Pin user (manager) on workspace →","403 Forbidden (invalid manager_id)",""
"","206","Applet Library tests → Applet is added to the library → Get Library items list 200 OK (search by activity name)","","Tue Oct 29 16:52:35 GMT 2024","passed","Tue Oct 29 16:52:35 GMT 2024","","Get Library items list","200 OK (search by activity name)",""
"","254","Activity Assessment & Review CRUD tests → Submit Assessment tests → 201 Submit Assessment","","Tue Oct 29 16:51:36 GMT 2024","passed","Tue Oct 29 16:51:36 GMT 2024","","Submit Assessment tests →","201 Submit Assessment",""
"","53","Workspaces endpoints tests → Workspaces created → Get workspace applet respondents → Negative tests → 401 Unauthorized","","Tue Oct 29 17:04:59 GMT 2024","passed","Tue Oct 29 17:04:59 GMT 2024","","Negative tests →","401 Unauthorized",""
"","334","Shell account invitation scenario tests → Accept invitation by already registered user → New user can access invitation by key","","Tue Oct 29 17:00:22 GMT 2024","passed","Tue Oct 29 17:00:22 GMT 2024","","Accept invitation by already registered user →","New user can access invitation by key",""
"","284","Activity Assessment & Review CRUD tests → Get Assessment & Review tests → Get Assessment tests → 200 OK (no Assessment data)","","Tue Oct 29 16:51:33 GMT 2024","passed","Tue Oct 29 16:51:33 GMT 2024","","Get Assessment tests →","200 OK (no Assessment data)",""
"","372","Administration tests → Respondents tests → Set schedule for respondents tests → 201 (Coordinator can schedule Event)","","Tue Oct 29 17:01:23 GMT 2024","passed","Tue Oct 29 17:01:23 GMT 2024","","Set schedule for respondents tests →","201 (Coordinator can schedule Event)",""
"","156","Applet Events CRUD tests → Create Events tests → 422 Unprocessable Entity → Create Event with missing accessBeforeSchedule (periodicity type: MONTHLY) param","","Tue Oct 29 16:54:32 GMT 2024","passed","Tue Oct 29 16:54:32 GMT 2024","","422 Unprocessable Entity →","Create Event with missing accessBeforeSchedule (periodicity type: MONTHLY) param",""
"","52","Create User tests → 422 Unprocessable Entity Create user with missing email param","","Tue Oct 29 17:02:23 GMT 2024","passed","Tue Oct 29 17:02:23 GMT 2024","","422 Unprocessable Entity","Create user with missing email param",""
"","595","Workspaces endpoints tests → Workspaces created → Get managers priority role → 200 OK (First applet owner gets role in second user's workspace with appletIds filter)","","Tue Oct 29 17:05:04 GMT 2024","passed","Tue Oct 29 17:05:04 GMT 2024","","Get managers priority role →","200 OK (First applet owner gets role in second user's workspace with appletIds filter)",""
"","215","Answers CRUD tests → Answers handling after invitation acceptance by respondent → Check answer existence tests → 200 OK (exists = false, incorrect createdAt)","","Tue Oct 29 16:51:06 GMT 2024","passed","Tue Oct 29 16:51:06 GMT 2024","","Check answer existence tests →","200 OK (exists = false, incorrect createdAt)",""
"","142","Invitations endpoints tests → Send invitation → Invitation Managers Send → 422 - Incorrect ""language"" value","","Tue Oct 29 16:59:21 GMT 2024","passed","Tue Oct 29 16:59:21 GMT 2024","","Invitation Managers Send →","422 - Incorrect ""language"" value",""
"","310","Workspaces managers access tests → Set workspace managers applet access list → 403 Access denied (role = owner)","","Tue Oct 29 17:04:06 GMT 2024","passed","Tue Oct 29 17:04:06 GMT 2024","","Set workspace managers applet access list →","403 Access denied (role = owner)",""
"","245","Applet Library tests → Share applet to the library 403 invalid applet id","","Tue Oct 29 16:52:33 GMT 2024","passed","Tue Oct 29 16:52:33 GMT 2024","","Share applet to the library","403 invalid applet id",""
"","306","Logs upload/download tests → Check logs existence → 200 OK (multiple files, uploaded = false)","","Tue Oct 29 16:58:05 GMT 2024","passed","Tue Oct 29 16:58:05 GMT 2024","","Check logs existence →","200 OK (multiple files, uploaded = false)",""
"","239","Answer Notes tests → Get Notes list tests → Get Notes list (not empty) 200 Get Note list with created Note","","Tue Oct 29 16:48:55 GMT 2024","passed","Tue Oct 29 16:48:55 GMT 2024","","Get Notes list (not empty)","200 Get Note list with created Note",""
"","254","Applets ""retentions"" endpoint tests → 200 OK → 100 month","","Tue Oct 29 16:54:04 GMT 2024","passed","Tue Oct 29 16:54:04 GMT 2024","","200 OK →","100 month",""
"","627","Workspaces managers access tests → Set workspace managers applet access list → 200 OK (grant coordinator's permissions for manager)","","Tue Oct 29 17:04:06 GMT 2024","passed","Tue Oct 29 17:04:06 GMT 2024","","Set workspace managers applet access list →","200 OK (grant coordinator's permissions for manager)",""
"","225","Applet ""Transfer Ownership"" scenario tests → Transfer Accept → Second receiver should not be able to accept transfer request anymore","","Tue Oct 29 16:56:08 GMT 2024","passed","Tue Oct 29 16:56:08 GMT 2024","","Transfer Accept →","Second receiver should not be able to accept transfer request anymore",""
"","319","Workspaces endpoints tests → Workspaces created → Get workspace Folder Applets → 200 OK (non-empty list)","","Tue Oct 29 17:04:53 GMT 2024","passed","Tue Oct 29 17:04:53 GMT 2024","","Get workspace Folder Applets →","200 OK (non-empty list)",""
"","51","Workspaces managers access tests → Get workspace roles list → 401 Unauthorized","","Tue Oct 29 17:04:14 GMT 2024","passed","Tue Oct 29 17:04:14 GMT 2024","","Get workspace roles list →","401 Unauthorized",""
"","390","Administration tests → Respondents tests → View all respondents tests → 200 OK (Coordinator can view all respondents)","","Tue Oct 29 17:01:19 GMT 2024","passed","Tue Oct 29 17:01:19 GMT 2024","","View all respondents tests →","200 OK (Coordinator can view all respondents)",""
"","378","Delete User tests → 404 (Deleted user can not login)","","Tue Oct 29 17:02:27 GMT 2024","passed","Tue Oct 29 17:02:27 GMT 2024","","Delete User tests →","404 (Deleted user can not login)",""
"","591","Applets ""report configuration"" endpoint tests → 200 OK (w/o server configuration)","","Tue Oct 29 16:55:53 GMT 2024","passed","Tue Oct 29 16:55:53 GMT 2024","","Applets ""report configuration"" endpoint tests →","200 OK (w/o server configuration)",""
"","50","Create User tests → 422 Unprocessable Entity Create user with empty firstName param","","Tue Oct 29 17:02:23 GMT 2024","passed","Tue Oct 29 17:02:23 GMT 2024","","422 Unprocessable Entity","Create user with empty firstName param",""
"","42","Get User Device Information → 401 Unathorized error","","Tue Oct 29 17:03:05 GMT 2024","passed","Tue Oct 29 17:03:05 GMT 2024","","Get User Device Information →","401 Unathorized error",""
"","334","Answers CRUD tests → Answers handling after invitation acceptance by respondent → Get activity answers list & Answers of respondent tests → 404 Not Found (Get Answer with not existing activityId)","","Tue Oct 29 16:51:09 GMT 2024","passed","Tue Oct 29 16:51:09 GMT 2024","","Get activity answers list & Answers of respondent tests →","404 Not Found (Get Answer with not existing activityId)",""
"","205","Access link tests → Get Access link tests → 200 OK (Get created Access link)","","Tue Oct 29 16:52:44 GMT 2024","passed","Tue Oct 29 16:52:44 GMT 2024","","Get Access link tests →","200 OK (Get created Access link)",""
"","232","Workspaces endpoints tests → Workspaces created → Get user workspaces → Respondent user","","Tue Oct 29 17:04:45 GMT 2024","passed","Tue Oct 29 17:04:45 GMT 2024","","Get user workspaces →","Respondent user",""
"","191","Invitations endpoints tests → Send invitation → Invitation Respondent Send → 422 Missing attributes Missing lastName","","Tue Oct 29 16:59:15 GMT 2024","passed","Tue Oct 29 16:59:15 GMT 2024","","422 Missing attributes","Missing lastName",""
"","300","Answers scenario tests → Activity, completed within the activity flow: get activity answers list & Answers of respondent tests → Get Answer of respondent, created within the activity flow","","Tue Oct 29 16:50:46 GMT 2024","passed","Tue Oct 29 16:50:46 GMT 2024","","Activity, completed within the activity flow: get activity answers list & Answers of respondent tests →","Get Answer of respondent, created within the activity flow",""
"","255","Applet ""Transfer Ownership"" endpoints tests → Transfer Decline → 404 (Decline same request again)","","Tue Oct 29 16:57:00 GMT 2024","passed","Tue Oct 29 16:57:00 GMT 2024","","Transfer Decline →","404 (Decline same request again)",""
"","353","Get submit dates & exported Answers data tests → Get exported data & dates after answer submit → 200 OK (Get exported data by reviewer with assigned respondent)","","Tue Oct 29 16:49:38 GMT 2024","passed","Tue Oct 29 16:49:38 GMT 2024","","Get exported data & dates after answer submit →","200 OK (Get exported data by reviewer with assigned respondent)",""
"","266","Applet Library tests → Applet is added to the library → Check Library item name → 200 OK: new unique name","","Tue Oct 29 16:52:37 GMT 2024","passed","Tue Oct 29 16:52:37 GMT 2024","","Check Library item name →","200 OK: new unique name",""
"","376","Answers CRUD tests → Respondent should not be able to submit Answer before invitation acceptance","","Tue Oct 29 16:50:54 GMT 2024","passed","Tue Oct 29 16:50:54 GMT 2024","","Answers CRUD tests →","Respondent should not be able to submit Answer before invitation acceptance",""
"","393","Shell account invitation scenario tests → Accept invitation by already registered user → Verify shell account is in pending status in the list of respondents","","Tue Oct 29 17:00:22 GMT 2024","passed","Tue Oct 29 17:00:22 GMT 2024","","Accept invitation by already registered user →","Verify shell account is in pending status in the list of respondents",""
"","242","Invitations endpoints tests → Accept invitation → 404 - non-existent invitation key","","Tue Oct 29 16:59:06 GMT 2024","passed","Tue Oct 29 16:59:06 GMT 2024","","Accept invitation →","404 - non-existent invitation key",""
"","339","Get applet completed activities tests → Respondent completes the 1st activity within default always available event → 200 OK (empty list): fromDate > today","","Tue Oct 29 16:49:13 GMT 2024","passed","Tue Oct 29 16:49:13 GMT 2024","","Respondent completes the 1st activity within default always available event →","200 OK (empty list): fromDate > today",""
"","138","Invitations endpoints tests → Send invitation → Invitation Managers Send → 422 - Incorrect ""role"" value","","Tue Oct 29 16:59:21 GMT 2024","passed","Tue Oct 29 16:59:21 GMT 2024","","Invitation Managers Send →","422 - Incorrect ""role"" value",""
"","283","""Subjects"" endpoints CRUD tests → Get subjects 200 OK: respondent","","Tue Oct 29 17:02:10 GMT 2024","passed","Tue Oct 29 17:02:10 GMT 2024","","Get subjects","200 OK: respondent",""
"","324","Shell account invitation scenario tests → Decline invitation by unregistered user → Verify shell account remains the same in the list of respondents","","Tue Oct 29 17:00:18 GMT 2024","passed","Tue Oct 29 17:00:18 GMT 2024","","Decline invitation by unregistered user →","Verify shell account remains the same in the list of respondents",""
"","165","""Authentication"" endpoints tests → Get Token → 401 incorrect email","","Tue Oct 29 16:57:31 GMT 2024","passed","Tue Oct 29 16:57:31 GMT 2024","","Get Token →","401 incorrect email",""
"","47","Applet Library tests → Applet is added to the library → Update Library item → 401 Unauthorized","","Tue Oct 29 16:52:37 GMT 2024","passed","Tue Oct 29 16:52:37 GMT 2024","","Update Library item →","401 Unauthorized",""
"","48","Applet Library tests → Share applet to the library 401 Unauthorized","","Tue Oct 29 16:52:33 GMT 2024","passed","Tue Oct 29 16:52:33 GMT 2024","","Share applet to the library","401 Unauthorized",""
"","44","Summary & Review activity flow tests → Get Review activity flow tests → 401 Unauthorized (Get Review activity flow list with not existing token)","","Tue Oct 29 16:52:28 GMT 2024","passed","Tue Oct 29 16:52:28 GMT 2024","","Get Review activity flow tests →","401 Unauthorized (Get Review activity flow list with not existing token)",""
"","127","Applet public access tests → Get public applet base info by key → 404: invalid key","","Tue Oct 29 16:55:50 GMT 2024","passed","Tue Oct 29 16:55:50 GMT 2024","","Get public applet base info by key →","404: invalid key",""
"","588","Applet ""Transfer Ownership"" scenario tests → Transfer Ownership to unregistered user → New user should become the applet owner","","Tue Oct 29 16:56:38 GMT 2024","passed","Tue Oct 29 16:56:38 GMT 2024","","Transfer Ownership to unregistered user →","New user should become the applet owner",""
"","52","""Subjects"" endpoints CRUD tests → Delete subjects 401: Unauthorized","","Tue Oct 29 17:02:14 GMT 2024","passed","Tue Oct 29 17:02:14 GMT 2024","","Delete subjects","401: Unauthorized",""
"","219","""Workspace Folders"" endpoints tests → Workspace is created → Create Folder → 422 Unprocessable Entity (missing attribute)","","Tue Oct 29 17:03:30 GMT 2024","passed","Tue Oct 29 17:03:30 GMT 2024","","Create Folder →","422 Unprocessable Entity (missing attribute)",""
"","268","Workspaces managers access tests → Get workspace roles list → 200 OK","","Tue Oct 29 17:04:14 GMT 2024","passed","Tue Oct 29 17:04:14 GMT 2024","","Get workspace roles list →","200 OK",""
"","441","Logs upload/download tests → Download Logs → 200 OK","","Tue Oct 29 16:58:01 GMT 2024","passed","Tue Oct 29 16:58:01 GMT 2024","","Download Logs →","200 OK",""
"","274","Answers CRUD tests → Answers handling after invitation acceptance by respondent → Get flow submissions list & Flow answers of respondent tests → 404 Not Found (Get flow submission of not existing Applet)","","Tue Oct 29 16:51:13 GMT 2024","passed","Tue Oct 29 16:51:13 GMT 2024","","Get flow submissions list & Flow answers of respondent tests →","404 Not Found (Get flow submission of not existing Applet)",""
"","1847","Workspaces endpoints tests → Workspaces created → Update workspace applet respondent → 200 OK","","Tue Oct 29 17:05:12 GMT 2024","passed","Tue Oct 29 17:05:13 GMT 2024","","Update workspace applet respondent →","200 OK",""
"","267","Workspaces managers access tests → Set workspace managers applet access list → 404 Not Found (incorrect ownerId)","","Tue Oct 29 17:04:06 GMT 2024","passed","Tue Oct 29 17:04:06 GMT 2024","","Set workspace managers applet access list →","404 Not Found (incorrect ownerId)",""
"","288","Applet ""Transfer Ownership"" endpoints tests → Transfer Decline → 403 Forbidden (for applet owner)","","Tue Oct 29 16:57:00 GMT 2024","passed","Tue Oct 29 16:57:00 GMT 2024","","Transfer Decline →","403 Forbidden (for applet owner)",""
"","238","Applets ""unique_name"" endpoint tests → 200 OK: not unique name","","Tue Oct 29 16:57:09 GMT 2024","passed","Tue Oct 29 16:57:09 GMT 2024","","Applets ""unique_name"" endpoint tests →","200 OK: not unique name",""
"","309","""Themes"" endpoints tests → Create Theme → 201 Created","","Tue Oct 29 17:02:18 GMT 2024","passed","Tue Oct 29 17:02:18 GMT 2024","","Create Theme →","201 Created",""
"","382","Invitations endpoints tests → Send invitation → Invitation Respondent Send → 200 OK (send to unregistered user) All properties, language: en","","Tue Oct 29 16:59:14 GMT 2024","passed","Tue Oct 29 16:59:14 GMT 2024","","200 OK (send to unregistered user)","All properties, language: en",""
"","269","Applet Library tests → Applet is added to the library → Check Library item name → 400 Bad request: not unique name","","Tue Oct 29 16:52:37 GMT 2024","passed","Tue Oct 29 16:52:37 GMT 2024","","Check Library item name →","400 Bad request: not unique name",""
"","302","Workspaces managers access tests → Set workspace managers applet access list → 404 Not Found (incorrect managerId)","","Tue Oct 29 17:04:06 GMT 2024","passed","Tue Oct 29 17:04:06 GMT 2024","","Set workspace managers applet access list →","404 Not Found (incorrect managerId)",""
"","254","Applet Events CRUD tests → Get Applet Event by Id tests → 200 OK (Get individual scheduled activity Event by id)","","Tue Oct 29 16:54:46 GMT 2024","passed","Tue Oct 29 16:54:46 GMT 2024","","Get Applet Event by Id tests →","200 OK (Get individual scheduled activity Event by id)",""
"","130","Applet Events CRUD tests → Create cross-day events tests → 422 (Cross-day Event with DAILY periodicity type and availability range: 00:00:00-00:00:00)","","Tue Oct 29 16:55:10 GMT 2024","passed","Tue Oct 29 16:55:10 GMT 2024","","Create cross-day events tests →","422 (Cross-day Event with DAILY periodicity type and availability range: 00:00:00-00:00:00)",""
"","293","Logs upload/download tests → Check logs existence → 200 OK (uploaded = false)","","Tue Oct 29 16:58:05 GMT 2024","passed","Tue Oct 29 16:58:05 GMT 2024","","Check logs existence →","200 OK (uploaded = false)",""
"","147","Applet Events CRUD tests → Create Events tests → 422 Unprocessable Entity → Create Event with missing accessBeforeSchedule (periodicity type: WEEKLY) param","","Tue Oct 29 16:54:32 GMT 2024","passed","Tue Oct 29 16:54:32 GMT 2024","","422 Unprocessable Entity →","Create Event with missing accessBeforeSchedule (periodicity type: WEEKLY) param",""
"","313","Workspaces endpoints tests → Empty workspaces → Get workspace applets → 404 Not found (non-existent ownerId)","","Tue Oct 29 17:04:30 GMT 2024","passed","Tue Oct 29 17:04:30 GMT 2024","","Get workspace applets →","404 Not found (non-existent ownerId)",""
"","811","Shell account invitation scenario tests → Accept invitation by unregistered user → Send invitation to the shell account","","Tue Oct 29 17:00:05 GMT 2024","passed","Tue Oct 29 17:00:05 GMT 2024","","Accept invitation by unregistered user →","Send invitation to the shell account",""
"","45","Summary & Review activity flow tests → Get Summary activity flow tests → 401 Unauthorized (Get Summary activity flow with not existing token)","","Tue Oct 29 16:52:27 GMT 2024","passed","Tue Oct 29 16:52:27 GMT 2024","","Get Summary activity flow tests →","401 Unauthorized (Get Summary activity flow with not existing token)",""
"","199","Invitations endpoints tests → Send invitation → Invitation Reviewer Send → 422 - Incorrect ""language"" value","","Tue Oct 29 16:59:16 GMT 2024","passed","Tue Oct 29 16:59:16 GMT 2024","","Invitation Reviewer Send →","422 - Incorrect ""language"" value",""
"","257","Administration tests → Applets tests → Export & view data in workspace of Applet owner tests → View respondent's data tests → 200 OK (Manager can view data)","","Tue Oct 29 17:01:37 GMT 2024","passed","Tue Oct 29 17:01:37 GMT 2024","","View respondent's data tests →","200 OK (Manager can view data)",""
