"DESCRIPTION","DURATION IN MS","NAME","PARENT SUITE","START TIME","STATUS","STOP TIME","SUB SUITE","SUITE","TEST CLASS","TEST METHOD"
"","294","Workspaces endpoints tests → Workspaces created → Get workspace applet respondent by id → 404 not found (invalid workspace id)","","Tue Oct 29 17:05:10 GMT 2024","passed","Tue Oct 29 17:05:10 GMT 2024","","Get workspace applet respondent by id →","404 not found (invalid workspace id)",""
"","158","Applets ""retentions"" endpoint tests → 400 / 422 Bad Request → 0 period","","Tue Oct 29 16:54:05 GMT 2024","passed","Tue Oct 29 16:54:05 GMT 2024","","400 / 422 Bad Request →","0 period",""
"","233","Applets ""unique_name"" endpoint tests → 200 OK: unique name","","Tue Oct 29 16:57:09 GMT 2024","passed","Tue Oct 29 16:57:09 GMT 2024","","Applets ""unique_name"" endpoint tests →","200 OK: unique name",""
"","69","""Workspace Folders"" endpoints tests → Workspace is created → Delete Folder → 401 Unauthorized (invalid token)","","Tue Oct 29 17:03:32 GMT 2024","passed","Tue Oct 29 17:03:32 GMT 2024","","Delete Folder →","401 Unauthorized (invalid token)",""
"","306","Workspaces endpoints tests → Workspaces created → Get managers priority role → 200 OK (First applet owner gets role in second user's workspace)","","Tue Oct 29 17:05:04 GMT 2024","passed","Tue Oct 29 17:05:04 GMT 2024","","Get managers priority role →","200 OK (First applet owner gets role in second user's workspace)",""
"","318","Administration tests → Perform activities tests → 200 OK (Reviewer can submit answers)","","Tue Oct 29 17:01:39 GMT 2024","passed","Tue Oct 29 17:01:39 GMT 2024","","Perform activities tests →","200 OK (Reviewer can submit answers)",""
"","348","Answer Notes tests → Edit Note tests → 403 Forbidden (Update Note by respondent)","","Tue Oct 29 16:48:59 GMT 2024","passed","Tue Oct 29 16:48:59 GMT 2024","","Edit Note tests →","403 Forbidden (Update Note by respondent)",""
"","1028","Applet ""Transfer Ownership"" scenario tests → Transfer Accept → First receiver should become the owner → Verify transferred events","","Tue Oct 29 16:56:24 GMT 2024","passed","Tue Oct 29 16:56:25 GMT 2024","","First receiver should become the owner →","Verify transferred events",""
"","243","Applet versions endpoints tests → Update Applet → Add Activity → Remove Activity → Add Activity Flow → Get applet versions","","Tue Oct 29 16:57:19 GMT 2024","passed","Tue Oct 29 16:57:19 GMT 2024","","Add Activity Flow →","Get applet versions",""
"","254","Administration tests → Respondents tests → Invite new reviewer for a specific respondent tests → 403 Forbidden (Reviewer can NOT invite new reviewer for a specific respondent)","","Tue Oct 29 17:01:21 GMT 2024","passed","Tue Oct 29 17:01:21 GMT 2024","","Invite new reviewer for a specific respondent tests →","403 Forbidden (Reviewer can NOT invite new reviewer for a specific respondent)",""
"","55","Workspaces endpoints tests → Empty workspaces → Get user workspaces → 401 Unauthorized","","Tue Oct 29 17:04:29 GMT 2024","passed","Tue Oct 29 17:04:29 GMT 2024","","Get user workspaces →","401 Unauthorized",""
"","288","Answers CRUD tests → Answers handling after invitation acceptance by respondent → Check answer existence tests → 404 Not Found (applet id)","","Tue Oct 29 16:51:06 GMT 2024","passed","Tue Oct 29 16:51:06 GMT 2024","","Check answer existence tests →","404 Not Found (applet id)",""
"","253","Workspaces endpoints tests → Workspaces created → Get workspace by ownerId → 200 OK","","Tue Oct 29 17:04:46 GMT 2024","passed","Tue Oct 29 17:04:46 GMT 2024","","Get workspace by ownerId →","200 OK",""
"","133","Invitations endpoints tests → Send invitation → Invitation Reviewer Send → 422 Missing attributes Missing firstName","","Tue Oct 29 16:59:20 GMT 2024","passed","Tue Oct 29 16:59:20 GMT 2024","","422 Missing attributes","Missing firstName",""
"","2617","Create Answers for different item types tests → All simple mobile items","","Tue Oct 29 16:49:43 GMT 2024","passed","Tue Oct 29 16:49:45 GMT 2024","","Create Answers for different item types tests →","All simple mobile items",""
"","1085","Activity Assignments tests → Positive tests → Assign single activity to full participant","","Tue Oct 29 16:48:44 GMT 2024","passed","Tue Oct 29 16:48:45 GMT 2024","","Positive tests →","Assign single activity to full participant",""
"","237","Applet versions endpoints tests → Update Applet → Add Activity → Remove Activity → Add Activity Flow → Remove Activity Flow → Add Activity Item → Remove Activity Item → Update Activity → Update Activity Item → Get applet versions","","Tue Oct 29 16:57:26 GMT 2024","passed","Tue Oct 29 16:57:26 GMT 2024","","Update Activity Item →","Get applet versions",""
"","240","Answers CRUD tests → Answers handling after invitation acceptance by respondent → Create Answer tests → 422 Unprocessable Entity → Create Answer with missing endTime param","","Tue Oct 29 16:51:04 GMT 2024","passed","Tue Oct 29 16:51:04 GMT 2024","","422 Unprocessable Entity →","Create Answer with missing endTime param",""
"","225","Administration tests → Applets tests → Duplicate Applet in workspace of Applet owner tests → 403 Forbidden (Reviewer can NOT duplicate Applet)","","Tue Oct 29 17:01:30 GMT 2024","passed","Tue Oct 29 17:01:30 GMT 2024","","Duplicate Applet in workspace of Applet owner tests →","403 Forbidden (Reviewer can NOT duplicate Applet)",""
"","236","Applet ""Transfer Ownership"" scenario tests → Transfer Decline → First receiver declines transfer request","","Tue Oct 29 16:56:28 GMT 2024","passed","Tue Oct 29 16:56:28 GMT 2024","","Transfer Decline →","First receiver declines transfer request",""
"","51","Applets GET ""base info"" endpoint tests → 401 Unauthorized","","Tue Oct 29 16:53:07 GMT 2024","passed","Tue Oct 29 16:53:07 GMT 2024","","Applets GET ""base info"" endpoint tests →","401 Unauthorized",""
"","294","Applet ""Transfer Ownership"" scenario tests → Transfer Ownership to unregistered user → New user can accept transfer request after registration","","Tue Oct 29 16:56:38 GMT 2024","passed","Tue Oct 29 16:56:38 GMT 2024","","Transfer Ownership to unregistered user →","New user can accept transfer request after registration",""
"","236","Flow Versions & Identifiers tests → Get flow Versions tests → 200 OK (default version after Applet creation)","","Tue Oct 29 16:51:43 GMT 2024","passed","Tue Oct 29 16:51:43 GMT 2024","","Get flow Versions tests →","200 OK (default version after Applet creation)",""
"","51","""Workspace Folders"" endpoints tests → Workspace is created → Get Folders → 401 Unauthorized (invalid token)","","Tue Oct 29 17:03:29 GMT 2024","passed","Tue Oct 29 17:03:29 GMT 2024","","Get Folders →","401 Unauthorized (invalid token)",""
"","1","Answers CRUD tests → Answers handling after invitation acceptance by respondent → Get activity answers list & Answers of respondent tests → 200 OK (Applet owner should be able to get activity answers list)","","Tue Oct 29 16:51:09 GMT 2024","passed","Tue Oct 29 16:51:09 GMT 2024","","Get activity answers list & Answers of respondent tests →","200 OK (Applet owner should be able to get activity answers list)",""
"","47","Applets ""report configuration"" endpoint tests → 401 Unauthorized","","Tue Oct 29 16:55:53 GMT 2024","passed","Tue Oct 29 16:55:53 GMT 2024","","Applets ""report configuration"" endpoint tests →","401 Unauthorized",""
"","2062","User Password tests → Password recovery approve tests → User can login with initial password after failed password recovery approve","","Tue Oct 29 17:02:39 GMT 2024","passed","Tue Oct 29 17:02:41 GMT 2024","","Password recovery approve tests →","User can login with initial password after failed password recovery approve",""
"","232","Summary & Review activity flow tests → Get Review activity flow tests → 422 Unprocessable Entity (Get Review activity flow list without createdDate query param)","","Tue Oct 29 16:52:28 GMT 2024","passed","Tue Oct 29 16:52:28 GMT 2024","","Get Review activity flow tests →","422 Unprocessable Entity (Get Review activity flow list without createdDate query param)",""
"","343","Shell account invitation scenario tests → Accept invitation by unregistered user → New user can accept invitation after registration","","Tue Oct 29 17:00:05 GMT 2024","passed","Tue Oct 29 17:00:05 GMT 2024","","Accept invitation by unregistered user →","New user can accept invitation after registration",""
"","355","Workspaces endpoints tests → Workspaces created → Get workspace applet respondents → Second workspace first applet respondents","","Tue Oct 29 17:04:58 GMT 2024","passed","Tue Oct 29 17:04:58 GMT 2024","","Get workspace applet respondents →","Second workspace first applet respondents",""
"","255","Update User tests → 200 Update User","","Tue Oct 29 17:03:03 GMT 2024","passed","Tue Oct 29 17:03:03 GMT 2024","","Update User tests →","200 Update User",""
"","128","Applet Events CRUD tests → Update Applet Event tests → 422 Unprocessable Entity → Update Event with missing timer param (timer type: TIMER)","","Tue Oct 29 16:54:56 GMT 2024","passed","Tue Oct 29 16:54:56 GMT 2024","","422 Unprocessable Entity →","Update Event with missing timer param (timer type: TIMER)",""
"","5299","Applet ""Transfer Ownership"" scenario tests → Transfer Ownership to unregistered user → Unregistered user should receive invitation e-mail","","Tue Oct 29 16:56:38 GMT 2024","passed","Tue Oct 29 16:56:43 GMT 2024","","Transfer Ownership to unregistered user →","Unregistered user should receive invitation e-mail",""
"","218","Activity Assignments tests → Negative tests → Create Assignments → 400 bad request: assign activity to limited account","","Tue Oct 29 16:48:48 GMT 2024","passed","Tue Oct 29 16:48:48 GMT 2024","","Create Assignments →","400 bad request: assign activity to limited account",""
"","46","Activity Assessment & Review CRUD tests → Delete Assessment tests → 401 Unauthorized (Delete submitted assessment with not existing token)","","Tue Oct 29 16:51:38 GMT 2024","passed","Tue Oct 29 16:51:38 GMT 2024","","Delete Assessment tests →","401 Unauthorized (Delete submitted assessment with not existing token)",""
"","428","Applet Events CRUD tests → Update Applet Event tests → 200 OK (Update general scheduled activity Event - set new start time and change periodicity type)","","Tue Oct 29 16:54:54 GMT 2024","passed","Tue Oct 29 16:54:54 GMT 2024","","Update Applet Event tests →","200 OK (Update general scheduled activity Event - set new start time and change periodicity type)",""
"","212","Applet versions endpoints tests → Get applet version changes → 404 (incorrect appletId)","","Tue Oct 29 16:57:16 GMT 2024","passed","Tue Oct 29 16:57:16 GMT 2024","","Get applet version changes →","404 (incorrect appletId)",""
"","303","Administration tests → Applets tests → Export & view data in workspace of Applet owner tests → View respondent's data tests → 200 OK (Applet owner can view data)","","Tue Oct 29 17:01:37 GMT 2024","passed","Tue Oct 29 17:01:37 GMT 2024","","View respondent's data tests →","200 OK (Applet owner can view data)",""
"","326","Answers CRUD tests → Applet owner should not get any flows submissions before invitation acceptance by respondent","","Tue Oct 29 16:50:54 GMT 2024","passed","Tue Oct 29 16:50:54 GMT 2024","","Answers CRUD tests →","Applet owner should not get any flows submissions before invitation acceptance by respondent",""
"","242","Applet Events CRUD tests → Count scheduled Applet Events tests → 404 Not Found (Count general scheduled Events of not existing Applet)","","Tue Oct 29 16:55:00 GMT 2024","passed","Tue Oct 29 16:55:00 GMT 2024","","Count scheduled Applet Events tests →","404 Not Found (Count general scheduled Events of not existing Applet)",""
"","48","Applets CRUD endpoints tests → Update applet → 401 Unauthorized","","Tue Oct 29 16:53:01 GMT 2024","passed","Tue Oct 29 16:53:01 GMT 2024","","Update applet →","401 Unauthorized",""
"","1301","Applet builder tests → Create applet → Positive tests → Applet with conditional logic items (SingleSelect, MultiSelect, Slider, Text, Time)","","Tue Oct 29 16:53:14 GMT 2024","passed","Tue Oct 29 16:53:15 GMT 2024","","Positive tests →","Applet with conditional logic items (SingleSelect, MultiSelect, Slider, Text, Time)",""
"","278","Applet versions endpoints tests → Update Applet → Add Activity → Remove Activity → Add Activity Flow → Remove Activity Flow → Get applet version changes","","Tue Oct 29 16:57:21 GMT 2024","passed","Tue Oct 29 16:57:21 GMT 2024","","Remove Activity Flow →","Get applet version changes",""
"","256","Administration tests → Transfer ownership of Applet tests → 403 Forbidden (Respondent can not transfer ownership)","","Tue Oct 29 17:01:06 GMT 2024","passed","Tue Oct 29 17:01:06 GMT 2024","","Transfer ownership of Applet tests →","403 Forbidden (Respondent can not transfer ownership)",""
"","333","Applet Events CRUD tests → Create Events tests → 400 Bad Request (Create general Always Available activity Event)","","Tue Oct 29 16:54:29 GMT 2024","passed","Tue Oct 29 16:54:29 GMT 2024","","Create Events tests →","400 Bad Request (Create general Always Available activity Event)",""
"","224","Activity Assessment & Review CRUD tests → Submit Assessment tests → 401 Not Found (Submit Assessment in not existing Applet)","","Tue Oct 29 16:51:36 GMT 2024","passed","Tue Oct 29 16:51:36 GMT 2024","","Submit Assessment tests →","401 Not Found (Submit Assessment in not existing Applet)",""
"","749","Administration tests → Organizers tests → Invite new organizer tests → 403 Forbidden (Coordinator can NOT invite manager, coordinator, editor)","","Tue Oct 29 17:01:07 GMT 2024","passed","Tue Oct 29 17:01:07 GMT 2024","","Invite new organizer tests →","403 Forbidden (Coordinator can NOT invite manager, coordinator, editor)",""
"","301","Files upload/download directly to S3 bucket tests → Generate presigned links EPs negative tests Answer URL 403 Forbidden (invalid applet id)","","Tue Oct 29 16:58:32 GMT 2024","passed","Tue Oct 29 16:58:32 GMT 2024","","Answer URL","403 Forbidden (invalid applet id)",""
"","442","Administration tests → Applets tests → View General calendar in workspace of Applet owner tests → 200 OK (Manager can view General calendar)","","Tue Oct 29 17:01:32 GMT 2024","passed","Tue Oct 29 17:01:32 GMT 2024","","View General calendar in workspace of Applet owner tests →","200 OK (Manager can view General calendar)",""
"","163","Applet Events CRUD tests → Update Applet Event tests → 422 Unprocessable Entity → Update Event with missing endTime (periodicity type: WEEKLY) param","","Tue Oct 29 16:54:56 GMT 2024","passed","Tue Oct 29 16:54:56 GMT 2024","","422 Unprocessable Entity →","Update Event with missing endTime (periodicity type: WEEKLY) param",""
"","248","Administration tests → Applets tests → Update Applet in workspace of Applet owner tests → 403 Forbidden (Reviewer can NOT update Applet)","","Tue Oct 29 17:01:27 GMT 2024","passed","Tue Oct 29 17:01:27 GMT 2024","","Update Applet in workspace of Applet owner tests →","403 Forbidden (Reviewer can NOT update Applet)",""
"","260","Applets CRUD endpoints tests → Update applet → 422 Unprocessable Entity (missing attribute) Missing ""encryption""","","Tue Oct 29 16:53:04 GMT 2024","passed","Tue Oct 29 16:53:04 GMT 2024","","422 Unprocessable Entity (missing attribute)","Missing ""encryption""",""
"","2229","Applet builder tests → Update applet → Add activity flow","","Tue Oct 29 16:53:42 GMT 2024","passed","Tue Oct 29 16:53:44 GMT 2024","","Update applet →","Add activity flow",""
"","380","Administration tests → Applets tests → View General calendar in workspace of Applet owner tests → 403 Forbidden (Editor can NOT view General calendar)","","Tue Oct 29 17:01:32 GMT 2024","passed","Tue Oct 29 17:01:32 GMT 2024","","View General calendar in workspace of Applet owner tests →","403 Forbidden (Editor can NOT view General calendar)",""
"","273","Summary & Review activity flow tests → Get Review activity flow tests → 422 Unprocessable Entity (Get Review activity flow list without targetSubjectId query param)","","Tue Oct 29 16:52:28 GMT 2024","passed","Tue Oct 29 16:52:28 GMT 2024","","Get Review activity flow tests →","422 Unprocessable Entity (Get Review activity flow list without targetSubjectId query param)",""
"","225","Applet Events CRUD tests → Update Applet Event tests → 422 Unprocessable Entity → Update Event with missing accessBeforeSchedule (periodicity type: DAILY) param","","Tue Oct 29 16:54:56 GMT 2024","passed","Tue Oct 29 16:54:56 GMT 2024","","422 Unprocessable Entity →","Update Event with missing accessBeforeSchedule (periodicity type: DAILY) param",""
"","272","Activity Versions & Identifiers tests → Get Versions tests → 404 Not Found (Get versions of not existing Applet)","","Tue Oct 29 16:51:52 GMT 2024","passed","Tue Oct 29 16:51:52 GMT 2024","","Get Versions tests →","404 Not Found (Get versions of not existing Applet)",""
"","583","Answer Notes tests → Edit Note tests → 404 Not Found (Update Note of not existing Answer)","","Tue Oct 29 16:48:59 GMT 2024","passed","Tue Oct 29 16:48:59 GMT 2024","","Edit Note tests →","404 Not Found (Update Note of not existing Answer)",""
"","268","Applets ""retentions"" endpoint tests → 200 OK → Ten days","","Tue Oct 29 16:54:04 GMT 2024","passed","Tue Oct 29 16:54:04 GMT 2024","","200 OK →","Ten days",""
"","282","Workspaces endpoints tests → Empty workspaces → Get workspace applets → 200 OK","","Tue Oct 29 17:04:30 GMT 2024","passed","Tue Oct 29 17:04:30 GMT 2024","","Get workspace applets →","200 OK",""
"","381","Workspaces endpoints tests → Workspaces created → Get workspace applet respondents → First workspace applet respondents","","Tue Oct 29 17:04:58 GMT 2024","passed","Tue Oct 29 17:04:58 GMT 2024","","Get workspace applet respondents →","First workspace applet respondents",""
"","388","Files upload/download tests → Upload/Download answers (applet files) → Download Answer → 404 file not found","","Tue Oct 29 16:57:51 GMT 2024","passed","Tue Oct 29 16:57:51 GMT 2024","","Download Answer →","404 file not found",""
"","259","Administration tests → Organizers tests → Change organizer roles/permissions tests → 200 OK (Manager can grant reviewer's permissions to coordinator)","","Tue Oct 29 17:01:15 GMT 2024","passed","Tue Oct 29 17:01:15 GMT 2024","","Change organizer roles/permissions tests →","200 OK (Manager can grant reviewer's permissions to coordinator)",""
"","208","Applet builder tests → Create applet → Negative tests → Incorrect conditional logic config (drawing item config)","","Tue Oct 29 16:53:41 GMT 2024","passed","Tue Oct 29 16:53:41 GMT 2024","","Negative tests →","Incorrect conditional logic config (drawing item config)",""
"","149","Applet public access tests → Get public events by key → 404: invalid key","","Tue Oct 29 16:55:50 GMT 2024","passed","Tue Oct 29 16:55:50 GMT 2024","","Get public events by key →","404: invalid key",""
"","295","Get applet completed activities tests → Respondent completes the 1st activity within default always available event → Respondent completes the 2nd activity within oneTimeCompletion Event → 200 OK : second activity completion should be present","","Tue Oct 29 16:49:15 GMT 2024","passed","Tue Oct 29 16:49:15 GMT 2024","","Respondent completes the 2nd activity within oneTimeCompletion Event →","200 OK : second activity completion should be present",""
"","159","Applet Events CRUD tests → Create Events tests → 422 Unprocessable Entity → Create Event with missing endTime (periodicity type: ONCE) param","","Tue Oct 29 16:54:32 GMT 2024","passed","Tue Oct 29 16:54:32 GMT 2024","","422 Unprocessable Entity →","Create Event with missing endTime (periodicity type: ONCE) param",""
"","279","Get submit dates & exported Answers data tests → Get exported data before Answer submit → 200 OK (Get empty exported data)","","Tue Oct 29 16:49:37 GMT 2024","passed","Tue Oct 29 16:49:37 GMT 2024","","Get exported data before Answer submit →","200 OK (Get empty exported data)",""
"","183","Applet public access tests → Get public activities by key → 404: invalid key","","Tue Oct 29 16:55:49 GMT 2024","passed","Tue Oct 29 16:55:49 GMT 2024","","Get public activities by key →","404: invalid key",""
"","258","Applets CRUD endpoints tests → Get applets list → 200 OK (empty list)","","Tue Oct 29 16:52:53 GMT 2024","passed","Tue Oct 29 16:52:53 GMT 2024","","Get applets list →","200 OK (empty list)",""
"","406","Files upload/download tests → Upload/Download answers (applet files) → Check answer (file) uploaded → 200 OK (uploaded = false)","","Tue Oct 29 16:57:54 GMT 2024","passed","Tue Oct 29 16:57:54 GMT 2024","","Check answer (file) uploaded →","200 OK (uploaded = false)",""
"","875","Applet public access tests → Create anonymous answer 201 Created","","Tue Oct 29 16:55:50 GMT 2024","passed","Tue Oct 29 16:55:50 GMT 2024","","Create anonymous answer","201 Created",""
"","236","Answers CRUD tests → Answers handling after invitation acceptance by respondent → Get activity answers list & Answers of respondent tests → 404 Not Found (Get Answer with not existing answerId)","","Tue Oct 29 16:51:09 GMT 2024","passed","Tue Oct 29 16:51:09 GMT 2024","","Get activity answers list & Answers of respondent tests →","404 Not Found (Get Answer with not existing answerId)",""
"","171","Applet Events CRUD tests → Update Applet Event tests → 422 Unprocessable Entity → Update Event with missing startTime (periodicity type: WEEKDAYS) param","","Tue Oct 29 16:54:56 GMT 2024","passed","Tue Oct 29 16:54:56 GMT 2024","","422 Unprocessable Entity →","Update Event with missing startTime (periodicity type: WEEKDAYS) param",""
"","267","Administration tests → Respondents tests → View all respondents tests → 403 Forbidden (Respondent can NOT view all respondents)","","Tue Oct 29 17:01:19 GMT 2024","passed","Tue Oct 29 17:01:19 GMT 2024","","View all respondents tests →","403 Forbidden (Respondent can NOT view all respondents)",""
"","291","Applet versions endpoints tests → Update Applet → Add Activity → Remove Activity → Add Activity Flow → Remove Activity Flow → Add Activity Item → Get applet versions","","Tue Oct 29 16:57:22 GMT 2024","passed","Tue Oct 29 16:57:22 GMT 2024","","Add Activity Item →","Get applet versions",""
"","51","Answer Notes tests → Delete Note tests → 401 Unauthorized (Delete Note with not existing token)","","Tue Oct 29 16:49:03 GMT 2024","passed","Tue Oct 29 16:49:03 GMT 2024","","Delete Note tests →","401 Unauthorized (Delete Note with not existing token)",""
"","136","Files upload/download tests → Upload/Download answers (applet files) → Upload Answer → 422 Empty form data","","Tue Oct 29 16:57:50 GMT 2024","passed","Tue Oct 29 16:57:50 GMT 2024","","Upload Answer →","422 Empty form data",""
"","276","Administration tests → Applets tests → Create Applet in workspace of Applet owner tests → 403 Forbidden (Coordinator can NOT create Applet in workspace of Applet owner)","","Tue Oct 29 17:01:25 GMT 2024","passed","Tue Oct 29 17:01:25 GMT 2024","","Create Applet in workspace of Applet owner tests →","403 Forbidden (Coordinator can NOT create Applet in workspace of Applet owner)",""
"","212","Applet versions endpoints tests → Update Applet → Add Activity → Remove Activity → Add Activity Flow → Remove Activity Flow → Add Activity Item → Remove Activity Item → Update Activity → Update Activity Item → Update Activity Flow → Get applet versions","","Tue Oct 29 16:57:27 GMT 2024","passed","Tue Oct 29 16:57:27 GMT 2024","","Update Activity Flow →","Get applet versions",""
"","752","Applet Library tests → Applet is added to the library → Cart test → Add item to cart","","Tue Oct 29 16:52:39 GMT 2024","passed","Tue Oct 29 16:52:39 GMT 2024","","Cart test →","Add item to cart",""
"","372","Administration tests → Respondents tests → Invite new respondent tests → 403 Forbidden (Respondent can NOT invite new respondent)","","Tue Oct 29 17:01:18 GMT 2024","passed","Tue Oct 29 17:01:18 GMT 2024","","Invite new respondent tests →","403 Forbidden (Respondent can NOT invite new respondent)",""
"","372","Logs upload/download tests → Upload Logs → 200 OK","","Tue Oct 29 16:58:00 GMT 2024","passed","Tue Oct 29 16:58:00 GMT 2024","","Upload Logs →","200 OK",""
"","332","Invitations endpoints tests → Get invitations → Invitation created → Get invitations for invitor → 200 OK (non-empty list)","","Tue Oct 29 16:59:05 GMT 2024","passed","Tue Oct 29 16:59:05 GMT 2024","","Get invitations for invitor →","200 OK (non-empty list)",""
"","350","Workspaces endpoints tests → Workspaces created → Get workspace managers → Second workspace managers","","Tue Oct 29 17:05:00 GMT 2024","passed","Tue Oct 29 17:05:00 GMT 2024","","Get workspace managers →","Second workspace managers",""
"","226","Answers CRUD tests → Answers handling after invitation acceptance by respondent → Get activity answers list & Answers of respondent tests → Get Activity answers list & Answers of deleted Applet → 404 Not Found (Get Activity answers list of deleted Applet)","","Tue Oct 29 16:51:12 GMT 2024","passed","Tue Oct 29 16:51:12 GMT 2024","","Get Activity answers list & Answers of deleted Applet →","404 Not Found (Get Activity answers list of deleted Applet)",""
