"DESCRIPTION","DURATION IN MS","NAME","PARENT SUITE","START TIME","STATUS","STOP TIME","SUB SUITE","SUITE","TEST CLASS","TEST METHOD"
"","464","Activity Assignments tests → Negative tests → Create Assignments → 400 bad request: assign activity to limited account","","Tue Sep 09 14:46:41 UTC 2025","passed","Tue Sep 09 14:46:41 UTC 2025","","Create Assignments →","400 bad request: assign activity to limited account",""
"","374","Applets CRUD endpoints tests → Update applet → 404 Applet not found","","Tue Sep 09 14:51:48 UTC 2025","passed","Tue Sep 09 14:51:48 UTC 2025","","Update applet →","404 Applet not found",""
"","396","Applet versions endpoints tests → Update Applet → Add Activity → Remove Activity → Add Activity Flow → Get applet versions","","Tue Sep 09 14:56:51 UTC 2025","passed","Tue Sep 09 14:56:51 UTC 2025","","Add Activity Flow →","Get applet versions",""
"","383","Applet ""Transfer Ownership"" scenario tests → Transfer Accept → First receiver should become the owner → Verify transferred applet details","","Tue Sep 09 14:55:44 UTC 2025","passed","Tue Sep 09 14:55:44 UTC 2025","","First receiver should become the owner →","Verify transferred applet details",""
"","305","Applets CRUD endpoints tests → Update applet → 422 Unprocessable Entity (missing attribute) Missing ""encryption""","","Tue Sep 09 14:51:53 UTC 2025","passed","Tue Sep 09 14:51:53 UTC 2025","","422 Unprocessable Entity (missing attribute)","Missing ""encryption""",""
"","3530","Applet builder tests → Update applet → Add activity item(s)","","Tue Sep 09 14:52:21 UTC 2025","passed","Tue Sep 09 14:52:24 UTC 2025","","Update applet →","Add activity item(s)",""
"","80","Retrieve latest report negative tests → 401 Unauthorized (Get summary latest report with not existing token)","","Tue Sep 09 14:48:29 UTC 2025","passed","Tue Sep 09 14:48:29 UTC 2025","","Retrieve latest report negative tests →","401 Unauthorized (Get summary latest report with not existing token)",""
"","684","Workspaces endpoints tests → Workspaces created → Update workspace applet respondent → 400 Bad Request (not unique secretUserId)","","Tue Sep 09 15:06:02 UTC 2025","passed","Tue Sep 09 15:06:02 UTC 2025","","Update workspace applet respondent →","400 Bad Request (not unique secretUserId)",""
"","3772","Applet builder tests → Update applet → Remove all non-required settings","","Tue Sep 09 14:52:21 UTC 2025","passed","Tue Sep 09 14:52:24 UTC 2025","","Update applet →","Remove all non-required settings",""
"","592","Invitations endpoints tests → Send invitation → Invitation Reviewer Send → 200 OK (send to unregistered user) All properties, language: en","","Tue Sep 09 14:59:23 UTC 2025","passed","Tue Sep 09 14:59:23 UTC 2025","","200 OK (send to unregistered user)","All properties, language: en",""
"","270","Applets ""setFolder"" endpoint tests → 200 OK (unset folder)","","Tue Sep 09 14:55:11 UTC 2025","passed","Tue Sep 09 14:55:11 UTC 2025","","Applets ""setFolder"" endpoint tests →","200 OK (unset folder)",""
"","3779","Applet Events scenario tests → End-To-End scenario (General scheduled activity Event)","","Tue Sep 09 14:54:26 UTC 2025","passed","Tue Sep 09 14:54:29 UTC 2025","","Applet Events scenario tests →","End-To-End scenario (General scheduled activity Event)",""
"","487","Shell account invitation scenario tests → Decline invitation by unregistered user → Verify shell account remains the same in the list of respondents","","Tue Sep 09 15:00:27 UTC 2025","failed","Tue Sep 09 15:00:27 UTC 2025","","Decline invitation by unregistered user →","Verify shell account remains the same in the list of respondents",""
"","3568","Create Answers for different item types tests → Touch performance task","","Tue Sep 09 14:47:46 UTC 2025","passed","Tue Sep 09 14:47:49 UTC 2025","","Create Answers for different item types tests →","Touch performance task",""
"","1309","Files upload/download tests → Upload File → 200 OK","","Tue Sep 09 14:57:33 UTC 2025","passed","Tue Sep 09 14:57:34 UTC 2025","","Upload File →","200 OK",""
"","366","Workspaces managers access tests → Set workspace managers applet access list → 404 Not Found (incorrect ownerId)","","Tue Sep 09 15:04:47 UTC 2025","passed","Tue Sep 09 15:04:47 UTC 2025","","Set workspace managers applet access list →","404 Not Found (incorrect ownerId)",""
"","431","Administration tests → Respondents tests → View all respondents tests → 200 OK (Coordinator can view all respondents)","","Tue Sep 09 15:01:35 UTC 2025","passed","Tue Sep 09 15:01:35 UTC 2025","","View all respondents tests →","200 OK (Coordinator can view all respondents)",""
"","501","Applet versions endpoints tests → Update Applet → Add Activity → Remove Activity → Add Activity Flow → Remove Activity Flow → Get applet version by id","","Tue Sep 09 14:56:54 UTC 2025","passed","Tue Sep 09 14:56:54 UTC 2025","","Remove Activity Flow →","Get applet version by id",""
"","8880","User Password tests → Password recovery approve tests → After password recovery approve user can login with new password and cannot login with an old one","","Tue Sep 09 15:03:11 UTC 2025","passed","Tue Sep 09 15:03:19 UTC 2025","","Password recovery approve tests →","After password recovery approve user can login with new password and cannot login with an old one",""
"","213","Multiinformant assessment validate tests → 401: Unauthorized","","Tue Sep 09 14:50:39 UTC 2025","passed","Tue Sep 09 14:50:39 UTC 2025","","Multiinformant assessment validate tests →","401: Unauthorized",""
"","380","Answers CRUD tests → Answers handling after invitation acceptance by respondent → Create Answer tests → 201 Create Answer","","Tue Sep 09 14:49:16 UTC 2025","passed","Tue Sep 09 14:49:16 UTC 2025","","Create Answer tests →","201 Create Answer",""
"","77","Applet Events CRUD tests → Get general and individual Applet Events → 401 Unauthorized (Get Applet Events with invalid appletOwnerToken)","","Tue Sep 09 14:53:35 UTC 2025","passed","Tue Sep 09 14:53:35 UTC 2025","","Get general and individual Applet Events →","401 Unauthorized (Get Applet Events with invalid appletOwnerToken)",""
"","290","Workspaces endpoints tests → Workspaces created → Get workspace Applets → Respondent gets own applets","","Tue Sep 09 15:05:35 UTC 2025","passed","Tue Sep 09 15:05:35 UTC 2025","","Get workspace Applets →","Respondent gets own applets",""
"","778","Applets ""report configuration"" endpoint tests → 200 OK","","Tue Sep 09 14:55:07 UTC 2025","passed","Tue Sep 09 14:55:07 UTC 2025","","Applets ""report configuration"" endpoint tests →","200 OK",""
"","160","Applet public access tests → Get public applet base info by key → 404: invalid key","","Tue Sep 09 14:55:02 UTC 2025","passed","Tue Sep 09 14:55:02 UTC 2025","","Get public applet base info by key →","404: invalid key",""
"","368","Administration tests → Respondents tests → Set schedule for respondents tests → 403 Forbidden (Respondent can NOT schedule Event)","","Tue Sep 09 15:01:39 UTC 2025","passed","Tue Sep 09 15:01:39 UTC 2025","","Set schedule for respondents tests →","403 Forbidden (Respondent can NOT schedule Event)",""
"","282","""Themes"" endpoints tests → Create Theme → 422 Unprocessable Entity (missing attribute) Missing tertiaryColor","","Tue Sep 09 15:02:47 UTC 2025","passed","Tue Sep 09 15:02:47 UTC 2025","","422 Unprocessable Entity (missing attribute)","Missing tertiaryColor",""
"","4121","Files upload/download tests → Upload/Download answers (applet files) → Download Answer → 200 OK","","Tue Sep 09 14:57:42 UTC 2025","passed","Tue Sep 09 14:57:46 UTC 2025","","Download Answer →","200 OK",""
"","417","""Subjects"" endpoints CRUD tests → Delete subjects 200 OK: shell account","","Tue Sep 09 15:02:41 UTC 2025","passed","Tue Sep 09 15:02:41 UTC 2025","","Delete subjects","200 OK: shell account",""
"","800","Delete Subjects (remove applet access) tests → Verify workspace users applet access list before respondents access removed","","Tue Sep 09 15:02:08 UTC 2025","passed","Tue Sep 09 15:02:08 UTC 2025","","Delete Subjects (remove applet access) tests →","Verify workspace users applet access list before respondents access removed",""
"","289","Multiinformant assessment validate tests → 200 OK: invalid target subject Id","","Tue Sep 09 14:50:39 UTC 2025","passed","Tue Sep 09 14:50:39 UTC 2025","","Multiinformant assessment validate tests →","200 OK: invalid target subject Id",""
"","212","Applet ""Transfer Ownership"" endpoints tests → Transfer Initiate → 401 Unauthorized","","Tue Sep 09 14:56:14 UTC 2025","passed","Tue Sep 09 14:56:14 UTC 2025","","Transfer Initiate →","401 Unauthorized",""
"","263","Applet versions endpoints tests → Get applet version changes → 404 (incorrect versionId)","","Tue Sep 09 14:56:42 UTC 2025","passed","Tue Sep 09 14:56:42 UTC 2025","","Get applet version changes →","404 (incorrect versionId)",""
"","388","Applets GET ""base info"" endpoint tests → 404 Not Found: invalid applet id","","Tue Sep 09 14:51:56 UTC 2025","passed","Tue Sep 09 14:51:56 UTC 2025","","Applets GET ""base info"" endpoint tests →","404 Not Found: invalid applet id",""
"","210","Summary & Review activities tests → Get Summary and Review Activities (non-empty list) tests → Get Summary Activities list tests → 401 Unauthorized (Get Summary Activities list with not existing token)","","Tue Sep 09 14:51:00 UTC 2025","passed","Tue Sep 09 14:51:00 UTC 2025","","Get Summary Activities list tests →","401 Unauthorized (Get Summary Activities list with not existing token)",""
"","155","Workspaces managers access tests → Set workspace managers applet access list → 422 Unprocessable entity (incorrect role)","","Tue Sep 09 15:04:47 UTC 2025","passed","Tue Sep 09 15:04:47 UTC 2025","","Set workspace managers applet access list →","422 Unprocessable entity (incorrect role)",""
"","379","Get applet completed activities tests → 403 Forbidden (for another user)","","Tue Sep 09 14:47:03 UTC 2025","passed","Tue Sep 09 14:47:03 UTC 2025","","Get applet completed activities tests →","403 Forbidden (for another user)",""
"","237","Shell account invitation scenario tests → Accept invitation by already registered user → Verify Invitation key expires after accepting the invite","","Tue Sep 09 15:00:32 UTC 2025","passed","Tue Sep 09 15:00:32 UTC 2025","","Accept invitation by already registered user →","Verify Invitation key expires after accepting the invite",""
"","1705","Shell account invitation scenario tests → Decline invitation by unregistered user → New user registers in the app","","Tue Sep 09 15:00:27 UTC 2025","passed","Tue Sep 09 15:00:28 UTC 2025","","Decline invitation by unregistered user →","New user registers in the app",""
"","277","Invitations endpoints tests → Send invitation → Invitation Respondent Send → 422 - Incorrect ""language"" value","","Tue Sep 09 14:59:16 UTC 2025","failed","Tue Sep 09 14:59:16 UTC 2025","","Invitation Respondent Send →","422 - Incorrect ""language"" value",""
"","267","Invitations endpoints tests → Send invitation → Invitation Managers Send → 404 - Applet does not exist","","Tue Sep 09 14:59:26 UTC 2025","passed","Tue Sep 09 14:59:26 UTC 2025","","Invitation Managers Send →","404 - Applet does not exist",""
"","215","""Themes"" endpoints tests → Delete Theme → 401 Unauthorized (invalid token)","","Tue Sep 09 15:02:49 UTC 2025","passed","Tue Sep 09 15:02:49 UTC 2025","","Delete Theme →","401 Unauthorized (invalid token)",""
"","143","Invitations endpoints tests → Send invitation → Invitation Reviewer Send → 422 Missing attributes Missing email","","Tue Sep 09 14:59:25 UTC 2025","passed","Tue Sep 09 14:59:25 UTC 2025","","422 Missing attributes","Missing email",""
"","285","Activity Versions & Identifiers tests → Get Identifiers tests → 404 Not Found (not existing activityId)","","Tue Sep 09 14:50:34 UTC 2025","passed","Tue Sep 09 14:50:34 UTC 2025","","Get Identifiers tests →","404 Not Found (not existing activityId)",""
"","302","Applet Events CRUD tests → Update Applet Event tests → 422 Unprocessable Entity → Update Event with missing accessBeforeSchedule (periodicity type: WEEKLY) param","","Tue Sep 09 14:53:59 UTC 2025","passed","Tue Sep 09 14:53:59 UTC 2025","","422 Unprocessable Entity →","Update Event with missing accessBeforeSchedule (periodicity type: WEEKLY) param",""
"","292","Update Password tests → 422 Unprocessable Entity Update password with missing prevPassword param","","Tue Sep 09 15:03:32 UTC 2025","passed","Tue Sep 09 15:03:32 UTC 2025","","422 Unprocessable Entity","Update password with missing prevPassword param",""
"","193","Files upload/download directly to S3 bucket tests → Upload media files directly to storage (S3 bucket) Generate presigned media url","","Tue Sep 09 14:58:07 UTC 2025","passed","Tue Sep 09 14:58:07 UTC 2025","","Upload media files directly to storage (S3 bucket)","Generate presigned media url",""
"","387","Answers CRUD tests → Answers handling after invitation acceptance by respondent → Create Answer tests → 422 Unprocessable Entity → Create Answer with missing itemIds param","","Tue Sep 09 14:49:19 UTC 2025","passed","Tue Sep 09 14:49:19 UTC 2025","","422 Unprocessable Entity →","Create Answer with missing itemIds param",""
"","822","Workspaces managers access tests → Remove manager access → 200 OK (empty appletIds)","","Tue Sep 09 15:04:52 UTC 2025","passed","Tue Sep 09 15:04:52 UTC 2025","","Remove manager access →","200 OK (empty appletIds)",""
"","213","""Workspace Folders"" endpoints tests → Workspace is created → Delete Folder → 401 Unauthorized (invalid token)","","Tue Sep 09 15:04:08 UTC 2025","passed","Tue Sep 09 15:04:08 UTC 2025","","Delete Folder →","401 Unauthorized (invalid token)",""
"","148","Applet Library tests → Applet is added to the library → Update Library item → 422 missing attribute (name)","","Tue Sep 09 14:51:19 UTC 2025","passed","Tue Sep 09 14:51:19 UTC 2025","","Update Library item →","422 missing attribute (name)",""
"","312","Answer Notes tests → Delete Note tests → 404 Not Found (Delete not existing Note)","","Tue Sep 09 14:46:58 UTC 2025","passed","Tue Sep 09 14:46:58 UTC 2025","","Delete Note tests →","404 Not Found (Delete not existing Note)",""
"","586","Administration tests → Respondents tests → Invite new respondent tests → 200 OK (Manager can invite new respondent)","","Tue Sep 09 15:01:32 UTC 2025","passed","Tue Sep 09 15:01:32 UTC 2025","","Invite new respondent tests →","200 OK (Manager can invite new respondent)",""
"","296","Applet Events CRUD tests → Update Applet Event tests → 422 Unprocessable Entity → Update Event with missing startTime (periodicity type: WEEKDAYS) param","","Tue Sep 09 14:53:59 UTC 2025","passed","Tue Sep 09 14:53:59 UTC 2025","","422 Unprocessable Entity →","Update Event with missing startTime (periodicity type: WEEKDAYS) param",""
"","432","""Subjects"" endpoints CRUD tests → Get subjects 200 OK: shell account","","Tue Sep 09 15:02:36 UTC 2025","passed","Tue Sep 09 15:02:36 UTC 2025","","Get subjects","200 OK: shell account",""
"","228","Applet Events CRUD tests → Delete individual scheduled Applet Events negative tests → 404 Not Found (Delete scheduled Events of a particular user with not existing Applet)","","Tue Sep 09 14:54:09 UTC 2025","passed","Tue Sep 09 14:54:09 UTC 2025","","Delete individual scheduled Applet Events negative tests →","404 Not Found (Delete scheduled Events of a particular user with not existing Applet)",""
"","308","Shell account invitation scenario tests → Send shell account invitation to an existing respondent → Verify shell account invitation can't be sent to the already invited respondent's email","","Tue Sep 09 15:00:44 UTC 2025","passed","Tue Sep 09 15:00:44 UTC 2025","","Send shell account invitation to an existing respondent →","Verify shell account invitation can't be sent to the already invited respondent's email",""
"","492","Applet Events CRUD tests → Get general and individual Applet Events → 200 OK (with respondentId in the query)","","Tue Sep 09 14:53:35 UTC 2025","passed","Tue Sep 09 14:53:35 UTC 2025","","Get general and individual Applet Events →","200 OK (with respondentId in the query)",""
"","494","Delete User tests → 404 (Deleted user can not login)","","Tue Sep 09 15:02:57 UTC 2025","passed","Tue Sep 09 15:02:57 UTC 2025","","Delete User tests →","404 (Deleted user can not login)",""
"","277","Invitations endpoints tests → Send invitation → Invitation Reviewer Send → 422 - Incorrect ""language"" value","","Tue Sep 09 14:59:20 UTC 2025","failed","Tue Sep 09 14:59:20 UTC 2025","","Invitation Reviewer Send →","422 - Incorrect ""language"" value",""
"","298","Applet Events CRUD tests → Update Applet Event tests → 422 Unprocessable Entity → Update Event with missing accessBeforeSchedule (periodicity type: MONTHLY) param","","Tue Sep 09 14:53:59 UTC 2025","passed","Tue Sep 09 14:53:59 UTC 2025","","422 Unprocessable Entity →","Update Event with missing accessBeforeSchedule (periodicity type: MONTHLY) param",""
"","4212","Applet builder tests → Update applet → Add activity","","Tue Sep 09 14:52:21 UTC 2025","passed","Tue Sep 09 14:52:25 UTC 2025","","Update applet →","Add activity",""
"","401","Invitations endpoints tests → Accept invitation → 200 OK","","Tue Sep 09 14:59:09 UTC 2025","passed","Tue Sep 09 14:59:09 UTC 2025","","Accept invitation →","200 OK",""
"","286","Logs upload/download tests → Check logs existence → 200 OK (empty list)","","Tue Sep 09 14:58:01 UTC 2025","passed","Tue Sep 09 14:58:01 UTC 2025","","Check logs existence →","200 OK (empty list)",""
"","577","Invitations scenario tests → Re-send invitation flow → User should not be able to accept/decline same invitation again","","Tue Sep 09 14:58:47 UTC 2025","passed","Tue Sep 09 14:58:47 UTC 2025","","Re-send invitation flow →","User should not be able to accept/decline same invitation again",""
"","80","Applet versions endpoints tests → Get applet version changes → 401 Unauthorized","","Tue Sep 09 14:56:42 UTC 2025","passed","Tue Sep 09 14:56:42 UTC 2025","","Get applet version changes →","401 Unauthorized",""
"","6844","Applet ""Transfer Ownership"" scenario tests → Transfer Decline → Send transfer request to two different users","","Tue Sep 09 14:55:48 UTC 2025","passed","Tue Sep 09 14:55:54 UTC 2025","","Transfer Decline →","Send transfer request to two different users",""
"","442","Applet versions endpoints tests → Update Applet → Add Activity → Remove Activity → Add Activity Flow → Remove Activity Flow → Add Activity Item → Remove Activity Item → Update Activity → Update Activity Item → Update Activity Flow → Get applet version changes","","Tue Sep 09 14:57:11 UTC 2025","passed","Tue Sep 09 14:57:11 UTC 2025","","Update Activity Flow →","Get applet version changes",""
"","218","Create User tests → 422 Unprocessable Entity Create user with empty firstName param","","Tue Sep 09 15:02:53 UTC 2025","passed","Tue Sep 09 15:02:53 UTC 2025","","422 Unprocessable Entity","Create user with empty firstName param",""
"","288","Applet public access tests → Get public activities by key → 404: invalid key","","Tue Sep 09 14:55:01 UTC 2025","passed","Tue Sep 09 14:55:01 UTC 2025","","Get public activities by key →","404: invalid key",""
"","210","Applet public links tests → Accept Public invitation tests → 401 Unauthorized (Accept invitation with not existing token)","","Tue Sep 09 14:59:45 UTC 2025","passed","Tue Sep 09 14:59:45 UTC 2025","","Accept Public invitation tests →","401 Unauthorized (Accept invitation with not existing token)",""
"","883","Applet Events CRUD tests → Get Applet Event by Id tests → 404 Not Found (Get individual deleted scheduled activity Event)","","Tue Sep 09 14:53:46 UTC 2025","passed","Tue Sep 09 14:53:46 UTC 2025","","Get Applet Event by Id tests →","404 Not Found (Get individual deleted scheduled activity Event)",""
"","1022","Applet ""Transfer Ownership"" scenario tests → Transfer Accept → First receiver should become the owner → Verify transferred events","","Tue Sep 09 14:55:44 UTC 2025","passed","Tue Sep 09 14:55:45 UTC 2025","","First receiver should become the owner →","Verify transferred events",""
"","636","Administration tests → Respondents tests → Invite new reviewer for a specific respondent tests → 200 OK (Manager can invite new reviewer for a specific respondent)","","Tue Sep 09 15:01:37 UTC 2025","passed","Tue Sep 09 15:01:37 UTC 2025","","Invite new reviewer for a specific respondent tests →","200 OK (Manager can invite new reviewer for a specific respondent)",""
"","213","Workspaces endpoints tests → Workspaces created → Pin user (respondent) on workspace → 401 Unauthorized","","Tue Sep 09 15:05:55 UTC 2025","passed","Tue Sep 09 15:05:55 UTC 2025","","Pin user (respondent) on workspace →","401 Unauthorized",""
"","1126","Workspaces endpoints tests → Workspaces created → Get workspace Applets → Respondent gets collaborated applets","","Tue Sep 09 15:05:35 UTC 2025","passed","Tue Sep 09 15:05:36 UTC 2025","","Get workspace Applets →","Respondent gets collaborated applets",""
"","399","""Workspace Folders"" endpoints tests → Workspace is created → Delete Folder → 204 OK","","Tue Sep 09 15:04:08 UTC 2025","passed","Tue Sep 09 15:04:08 UTC 2025","","Delete Folder →","204 OK",""
"","399","Applets ""setFolder"" endpoint tests → 404 (incorrect appletId)","","Tue Sep 09 14:55:11 UTC 2025","passed","Tue Sep 09 14:55:11 UTC 2025","","Applets ""setFolder"" endpoint tests →","404 (incorrect appletId)",""
"","234","Workspaces endpoints tests → Workspaces created → Get managers priority role → 200 OK (First applet owner gets own role)","","Tue Sep 09 15:05:53 UTC 2025","passed","Tue Sep 09 15:05:53 UTC 2025","","Get managers priority role →","200 OK (First applet owner gets own role)",""
"","399","Get applet completed activities tests → 200 OK (empty): no answers submitted yet","","Tue Sep 09 14:47:03 UTC 2025","passed","Tue Sep 09 14:47:03 UTC 2025","","Get applet completed activities tests →","200 OK (empty): no answers submitted yet",""
"","367","Shell account invitation scenario tests → Decline invitation by unregistered user → Shell account should be present in the list of respondents with ""not invited"" status before invitation is sent","","Tue Sep 09 15:00:27 UTC 2025","failed","Tue Sep 09 15:00:27 UTC 2025","","Decline invitation by unregistered user →","Shell account should be present in the list of respondents with ""not invited"" status before invitation is sent",""
"","291","Applet Events CRUD tests → Create cross-day events tests → 422 (Cross-day Event with ONCE periodicity type and availability range: 15:30:00-15:30:00)","","Tue Sep 09 14:54:17 UTC 2025","passed","Tue Sep 09 14:54:17 UTC 2025","","Create cross-day events tests →","422 (Cross-day Event with ONCE periodicity type and availability range: 15:30:00-15:30:00)",""
"","235","Applet ""Transfer Ownership"" endpoints tests → Transfer Decline → 404 (Decline same request again)","","Tue Sep 09 14:56:24 UTC 2025","passed","Tue Sep 09 14:56:24 UTC 2025","","Transfer Decline →","404 (Decline same request again)",""
"","2001","User Events scenario tests → User should be able to see events related to a specific Applet","","Tue Sep 09 15:03:41 UTC 2025","passed","Tue Sep 09 15:03:43 UTC 2025","","User Events scenario tests →","User should be able to see events related to a specific Applet",""
"","823","Activity Assignments tests → Positive tests → Assign single activity to full participant","","Tue Sep 09 14:46:36 UTC 2025","passed","Tue Sep 09 14:46:36 UTC 2025","","Positive tests →","Assign single activity to full participant",""
"","735","Create User tests → 201 Create User","","Tue Sep 09 15:02:52 UTC 2025","passed","Tue Sep 09 15:02:52 UTC 2025","","Create User tests →","201 Create User",""
"","412","Flow Versions & Identifiers tests → Get flow Identifiers tests → 200 OK (empty list of flow identifiers)","","Tue Sep 09 14:50:17 UTC 2025","passed","Tue Sep 09 14:50:17 UTC 2025","","Get flow Identifiers tests →","200 OK (empty list of flow identifiers)",""
"","1662","Applet Library tests → Applet is added to the library → Get Library items list 200 OK (get the whole list)","","Tue Sep 09 14:51:14 UTC 2025","passed","Tue Sep 09 14:51:15 UTC 2025","","Get Library items list","200 OK (get the whole list)",""
"","282","Applet public access tests → Get public events by key → 404: invalid key","","Tue Sep 09 14:55:02 UTC 2025","passed","Tue Sep 09 14:55:02 UTC 2025","","Get public events by key →","404: invalid key",""
"","213","Workspaces endpoints tests → Empty workspaces → Get workspace applets → 401 Unauthorized","","Tue Sep 09 15:05:14 UTC 2025","passed","Tue Sep 09 15:05:14 UTC 2025","","Get workspace applets →","401 Unauthorized",""
"","667","Invitations endpoints tests → Send invitation → Invitation Reviewer Send → 200 OK (send to existing user)","","Tue Sep 09 14:59:20 UTC 2025","passed","Tue Sep 09 14:59:20 UTC 2025","","Invitation Reviewer Send →","200 OK (send to existing user)",""
"","78","Answer Notes tests → Edit Note tests → 401 Unauthorized (Update Note with not existing token)","","Tue Sep 09 14:46:55 UTC 2025","passed","Tue Sep 09 14:46:55 UTC 2025","","Edit Note tests →","401 Unauthorized (Update Note with not existing token)",""
