"DESCRIPTION","DURATION IN MS","NAME","PARENT SUITE","START TIME","STATUS","STOP TIME","SUB SUITE","SUITE","TEST CLASS","TEST METHOD"
"","226","Administration tests → Applets tests → Export & view data in workspace of Applet owner tests → View respondent's data tests → 200 OK (Applet owner can view data)","","Mon Mar 24 23:35:58 GMT 2025","passed","Mon Mar 24 23:35:58 GMT 2025","","View respondent's data tests →","200 OK (Applet owner can view data)",""
"","100","Applet Events CRUD tests → Create Events tests → 422 Unprocessable Entity → Create Event with missing timer param (timer type: IDLE)","","Mon Mar 24 23:29:18 GMT 2025","passed","Mon Mar 24 23:29:18 GMT 2025","","422 Unprocessable Entity →","Create Event with missing timer param (timer type: IDLE)",""
"","1489","Shell account invitation scenario tests → Accept invitation by unregistered user → New user registers in the app","","Mon Mar 24 23:34:27 GMT 2025","passed","Mon Mar 24 23:34:28 GMT 2025","","Accept invitation by unregistered user →","New user registers in the app",""
"","4094","Applet Events scenario tests → End-To-End scenario (Individual scheduled activity Event)","","Mon Mar 24 23:29:53 GMT 2025","passed","Mon Mar 24 23:29:57 GMT 2025","","Applet Events scenario tests →","End-To-End scenario (Individual scheduled activity Event)",""
"","290","Workspaces endpoints tests → Workspaces created → Get workspace managers → Test for filters (query params) → Search → Search by firstName","","Mon Mar 24 23:39:35 GMT 2025","passed","Mon Mar 24 23:39:35 GMT 2025","","Search →","Search by firstName",""
"","22","Applet Events CRUD tests → Get general and individual Applet Events → 401 Unauthorized (Get Applet Events with invalid appletOwnerToken)","","Mon Mar 24 23:29:20 GMT 2025","passed","Mon Mar 24 23:29:20 GMT 2025","","Get general and individual Applet Events →","401 Unauthorized (Get Applet Events with invalid appletOwnerToken)",""
"","574","Access link tests → Get Access link tests → 404 Not Found (Get deleted Access link)","","Mon Mar 24 23:27:59 GMT 2025","passed","Mon Mar 24 23:27:59 GMT 2025","","Get Access link tests →","404 Not Found (Get deleted Access link)",""
"","467","""Subjects"" endpoints CRUD tests → Get subjects 200 OK: manager","","Mon Mar 24 23:36:35 GMT 2025","passed","Mon Mar 24 23:36:35 GMT 2025","","Get subjects","200 OK: manager",""
"","518","Workspace folder for different users tests → Manager is invited to the applet → Manager creates own folder in the same workspace Get folders (manager)","","Mon Mar 24 23:38:16 GMT 2025","passed","Mon Mar 24 23:38:16 GMT 2025","","Manager creates own folder in the same workspace","Get folders (manager)",""
"","373","Files upload/download tests → Upload/Download answers (applet files) → Download Answer → 404 file not found","","Mon Mar 24 23:32:17 GMT 2025","passed","Mon Mar 24 23:32:17 GMT 2025","","Download Answer →","404 file not found",""
"","546","""Themes"" endpoints tests → Create Theme → 400 Bad Request (duplicate name)","","Mon Mar 24 23:36:43 GMT 2025","passed","Mon Mar 24 23:36:43 GMT 2025","","Create Theme →","400 Bad Request (duplicate name)",""
"","272","Applets GET ""base info"" endpoint tests → 200 OK","","Mon Mar 24 23:28:16 GMT 2025","passed","Mon Mar 24 23:28:16 GMT 2025","","Applets GET ""base info"" endpoint tests →","200 OK",""
"","266","Applet ""Transfer Ownership"" scenario tests → Transfer Accept → First receiver should become the owner → Verify transferred managers list","","Mon Mar 24 23:30:52 GMT 2025","passed","Mon Mar 24 23:30:52 GMT 2025","","First receiver should become the owner →","Verify transferred managers list",""
"","253","Activity Versions & Identifiers tests → Get Identifiers tests → 200 OK (empty list of identifiers)","","Mon Mar 24 23:27:19 GMT 2025","passed","Mon Mar 24 23:27:19 GMT 2025","","Get Identifiers tests →","200 OK (empty list of identifiers)",""
"","15758","Files upload/download directly to S3 bucket tests → Upload files with format conversion "".webm"" media file should be converted to .mp3","","Mon Mar 24 23:32:43 GMT 2025","passed","Mon Mar 24 23:32:58 GMT 2025","","Upload files with format conversion",""".webm"" media file should be converted to .mp3",""
"","205","Applet ""Transfer Ownership"" endpoints tests → Transfer Accept → 403 Forbidden (for applet owner)","","Mon Mar 24 23:31:18 GMT 2025","passed","Mon Mar 24 23:31:18 GMT 2025","","Transfer Accept →","403 Forbidden (for applet owner)",""
"","321","Logs upload/download tests → Check logs existence → 200 OK (empty list)","","Mon Mar 24 23:32:32 GMT 2025","passed","Mon Mar 24 23:32:32 GMT 2025","","Check logs existence →","200 OK (empty list)",""
"","240","Answers CRUD tests → Answers handling after invitation acceptance by respondent → Get flow submissions list & Flow answers of respondent tests → 404 Not Found (Get flow submission with not existing submitId)","","Mon Mar 24 23:26:00 GMT 2025","passed","Mon Mar 24 23:26:00 GMT 2025","","Get flow submissions list & Flow answers of respondent tests →","404 Not Found (Get flow submission with not existing submitId)",""
"","332","Files upload/download directly to S3 bucket tests → Upload media files directly to storage (S3 bucket) Verify GET /fileLink returns 403 error before file is uploaded","","Mon Mar 24 23:32:37 GMT 2025","passed","Mon Mar 24 23:32:37 GMT 2025","","Upload media files directly to storage (S3 bucket)","Verify GET /fileLink returns 403 error before file is uploaded",""
"","532","Invitations scenario tests → Re-send invitation flow → User should not be able to accept/decline same invitation again","","Mon Mar 24 23:33:13 GMT 2025","passed","Mon Mar 24 23:33:13 GMT 2025","","Re-send invitation flow →","User should not be able to accept/decline same invitation again",""
"","321","Multiinformant assessment validate tests → 200 OK: sourceSubjectId = respondent, targetSubjectId = manager","","Mon Mar 24 23:27:23 GMT 2025","passed","Mon Mar 24 23:27:23 GMT 2025","","Multiinformant assessment validate tests →","200 OK: sourceSubjectId = respondent, targetSubjectId = manager",""
"","226","Administration tests → Organizers tests → View all organizers tests → 403 Forbidden (Reviewer can NOT view organizers)","","Mon Mar 24 23:35:35 GMT 2025","passed","Mon Mar 24 23:35:35 GMT 2025","","View all organizers tests →","403 Forbidden (Reviewer can NOT view organizers)",""
"","599","Administration tests → Applets tests → Duplicate Applet in workspace of Applet owner tests → 201 Created (Manager can duplicate Applet)","","Mon Mar 24 23:35:52 GMT 2025","passed","Mon Mar 24 23:35:52 GMT 2025","","Duplicate Applet in workspace of Applet owner tests →","201 Created (Manager can duplicate Applet)",""
"","155","Applet builder tests → Create applet → Negative tests → Duplicate Item name","","Mon Mar 24 23:28:33 GMT 2025","passed","Mon Mar 24 23:28:33 GMT 2025","","Negative tests →","Duplicate Item name",""
"","197","Administration tests → Transfer ownership of Applet tests → 403 Forbidden (Respondent can not transfer ownership)","","Mon Mar 24 23:35:26 GMT 2025","passed","Mon Mar 24 23:35:26 GMT 2025","","Transfer ownership of Applet tests →","403 Forbidden (Respondent can not transfer ownership)",""
"","201","Applets CRUD endpoints tests → Get applets list → Test for filters (query params) → Limit","","Mon Mar 24 23:28:07 GMT 2025","passed","Mon Mar 24 23:28:07 GMT 2025","","Test for filters (query params) →","Limit",""
"","22","Applets CRUD endpoints tests → Get applets list → 401 Unauthorized","","Mon Mar 24 23:28:06 GMT 2025","passed","Mon Mar 24 23:28:06 GMT 2025","","Get applets list →","401 Unauthorized",""
"","263","Workspaces endpoints tests → Workspaces created → Get workspace Applets → First applet owner gets collaborated applets","","Mon Mar 24 23:39:22 GMT 2025","passed","Mon Mar 24 23:39:22 GMT 2025","","Get workspace Applets →","First applet owner gets collaborated applets",""
"","210","""Workspace Folders"" endpoints tests → Workspace is created → Delete Folder → 404 Not Found (non-existent folder)","","Mon Mar 24 23:38:05 GMT 2025","passed","Mon Mar 24 23:38:05 GMT 2025","","Delete Folder →","404 Not Found (non-existent folder)",""
"","96","Applet public access tests → Get public applet base info by key → 404: invalid key","","Mon Mar 24 23:30:22 GMT 2025","passed","Mon Mar 24 23:30:22 GMT 2025","","Get public applet base info by key →","404: invalid key",""
"","100","Applet Events CRUD tests → Create Events tests → 422 Unprocessable Entity → Create Event with missing startTime (periodicity type: DAILY) param","","Mon Mar 24 23:29:18 GMT 2025","passed","Mon Mar 24 23:29:18 GMT 2025","","422 Unprocessable Entity →","Create Event with missing startTime (periodicity type: DAILY) param",""
"","245","Applet versions endpoints tests → Update Applet → Add Activity → Get applet version changes","","Mon Mar 24 23:31:41 GMT 2025","passed","Mon Mar 24 23:31:41 GMT 2025","","Add Activity →","Get applet version changes",""
"","553","Invitations endpoints tests → Send invitation → Invitation Respondent Send → 200 OK (send to unregistered user) W/o nickname, language: fr","","Mon Mar 24 23:33:40 GMT 2025","passed","Mon Mar 24 23:33:40 GMT 2025","","200 OK (send to unregistered user)","W/o nickname, language: fr",""
"","26","Workspaces endpoints tests → Workspaces created → Get workspace by ownerId → 401 Unauthorized","","Mon Mar 24 23:39:22 GMT 2025","passed","Mon Mar 24 23:39:22 GMT 2025","","Get workspace by ownerId →","401 Unauthorized",""
"","196","Summary & Review activities tests → Get Summary and Review Activities (non-empty list) tests → Get Review Activities list tests → 404 Not Found (Get Review Activities list of not existing Applet)","","Mon Mar 24 23:27:38 GMT 2025","passed","Mon Mar 24 23:27:38 GMT 2025","","Get Review Activities list tests →","404 Not Found (Get Review Activities list of not existing Applet)",""
"","262","Administration tests → Organizers tests → Change organizer roles/permissions tests → 403 Forbidden (Coordinator can NOT grant editor's permissions to respondent)","","Mon Mar 24 23:35:37 GMT 2025","passed","Mon Mar 24 23:35:37 GMT 2025","","Change organizer roles/permissions tests →","403 Forbidden (Coordinator can NOT grant editor's permissions to respondent)",""
"","224","Answers CRUD tests → Answers handling after invitation acceptance by respondent → Check answer existence tests → 200 OK (exists = true, check by respondent)","","Mon Mar 24 23:25:53 GMT 2025","passed","Mon Mar 24 23:25:53 GMT 2025","","Check answer existence tests →","200 OK (exists = true, check by respondent)",""
"","515","Get User tests → 404 Not found (Get deleted user)","","Mon Mar 24 23:37:00 GMT 2025","passed","Mon Mar 24 23:37:00 GMT 2025","","Get User tests →","404 Not found (Get deleted user)",""
"","1842","Applet builder tests → Update applet → Add activity flow","","Mon Mar 24 23:28:34 GMT 2025","passed","Mon Mar 24 23:28:35 GMT 2025","","Update applet →","Add activity flow",""
"","282","Applet Events CRUD tests → Get general and individual Applet Events → 200 OK (without respondentId in the query)","","Mon Mar 24 23:29:20 GMT 2025","passed","Mon Mar 24 23:29:20 GMT 2025","","Get general and individual Applet Events →","200 OK (without respondentId in the query)",""
"","278","Workspaces managers access tests → Remove manager access → 403 Forbidden (try to remove access for respondent)","","Mon Mar 24 23:38:45 GMT 2025","passed","Mon Mar 24 23:38:45 GMT 2025","","Remove manager access →","403 Forbidden (try to remove access for respondent)",""
"","5166","Invitations scenario tests → Invite unregistered user flow → New user should receive an e-mail with invitation","","Mon Mar 24 23:33:19 GMT 2025","passed","Mon Mar 24 23:33:24 GMT 2025","","Invite unregistered user flow →","New user should receive an e-mail with invitation",""
"","240","Answers CRUD tests → Answers handling after invitation acceptance by respondent → Create Answer tests → 422 Unprocessable Entity → Create Answer with missing srartTime param","","Mon Mar 24 23:25:52 GMT 2025","passed","Mon Mar 24 23:25:52 GMT 2025","","422 Unprocessable Entity →","Create Answer with missing srartTime param",""
"","261","Applet versions endpoints tests → Get applet versions → 200 Ok (single default version)","","Mon Mar 24 23:31:39 GMT 2025","passed","Mon Mar 24 23:31:39 GMT 2025","","Get applet versions →","200 Ok (single default version)",""
"","384","""Workspace Folders"" endpoints tests → Workspace is created → Pin/Unpin Folder → Unpin Folder → 204 OK","","Mon Mar 24 23:38:08 GMT 2025","passed","Mon Mar 24 23:38:08 GMT 2025","","Unpin Folder →","204 OK",""
"","441","Administration tests → Applets tests → Export & view data in workspace of Applet owner tests → Export data tests → 200 OK (Manager can export data)","","Mon Mar 24 23:35:56 GMT 2025","passed","Mon Mar 24 23:35:56 GMT 2025","","Export data tests →","200 OK (Manager can export data)",""
"","22","Applet Events CRUD tests → Remove individual scheduled Applet Events negative tests → 401 Unauthorized (Remove scheduled Events of a particular user with not existing appletOwnerToken)","","Mon Mar 24 23:29:42 GMT 2025","passed","Mon Mar 24 23:29:42 GMT 2025","","Remove individual scheduled Applet Events negative tests →","401 Unauthorized (Remove scheduled Events of a particular user with not existing appletOwnerToken)",""
"","243","Applet Events CRUD tests → Delete all general scheduled Applet Events tests → 404 Not Found (Delete all general scheduled Events of not existing Applet)","","Mon Mar 24 23:29:24 GMT 2025","passed","Mon Mar 24 23:29:24 GMT 2025","","Delete all general scheduled Applet Events tests →","404 Not Found (Delete all general scheduled Events of not existing Applet)",""
"","208","Workspaces endpoints tests → Workspaces created → Pin user (respondent) on workspace → 404 Not Found (ownerId)","","Mon Mar 24 23:39:39 GMT 2025","passed","Mon Mar 24 23:39:39 GMT 2025","","Pin user (respondent) on workspace →","404 Not Found (ownerId)",""
"","317","Applet Events CRUD tests → Import Applet Events tests → 201 Import Events (general Always Available activity Event & general scheduled activity Event)","","Mon Mar 24 23:29:43 GMT 2025","passed","Mon Mar 24 23:29:43 GMT 2025","","Import Applet Events tests →","201 Import Events (general Always Available activity Event & general scheduled activity Event)",""
"","99","Applet Events CRUD tests → Create Events tests → 422 Unprocessable Entity → Create Event with missing endTime (periodicity type: WEEKDAYS) param","","Mon Mar 24 23:29:18 GMT 2025","passed","Mon Mar 24 23:29:18 GMT 2025","","422 Unprocessable Entity →","Create Event with missing endTime (periodicity type: WEEKDAYS) param",""
"","125","Applet Events CRUD tests → Create cross-day events tests → 422 (Cross-day Event with ONCE periodicity type and availability range: 00:00:00-00:00:00)","","Mon Mar 24 23:29:46 GMT 2025","passed","Mon Mar 24 23:29:46 GMT 2025","","Create cross-day events tests →","422 (Cross-day Event with ONCE periodicity type and availability range: 00:00:00-00:00:00)",""
"","214","""Themes"" endpoints tests → Delete Theme → 204 OK","","Mon Mar 24 23:36:46 GMT 2025","passed","Mon Mar 24 23:36:46 GMT 2025","","Delete Theme →","204 OK",""
"","95","Applets ""retentions"" endpoint tests → 400 / 422 Bad Request → Missing retention","","Mon Mar 24 23:28:54 GMT 2025","passed","Mon Mar 24 23:28:54 GMT 2025","","400 / 422 Bad Request →","Missing retention",""
"","23","Applet ""Transfer Ownership"" endpoints tests → Transfer Initiate → 401 Unauthorized","","Mon Mar 24 23:31:17 GMT 2025","passed","Mon Mar 24 23:31:17 GMT 2025","","Transfer Initiate →","401 Unauthorized",""
"","175","Applet Library tests → Applet is added to the library → Get Library items list 200 OK (search by name)","","Mon Mar 24 23:27:52 GMT 2025","passed","Mon Mar 24 23:27:52 GMT 2025","","Get Library items list","200 OK (search by name)",""
"","174","Activity Assessment & Review CRUD tests → Submit Assessment tests → 422 Unprocessable Entity → Create Assessment with missing assessmentVersionId param","","Mon Mar 24 23:26:48 GMT 2025","passed","Mon Mar 24 23:26:48 GMT 2025","","422 Unprocessable Entity →","Create Assessment with missing assessmentVersionId param",""
"","27","Workspaces endpoints tests → Workspaces created → Search workspace Applets → 401 Unauthorized","","Mon Mar 24 23:39:26 GMT 2025","passed","Mon Mar 24 23:39:26 GMT 2025","","Search workspace Applets →","401 Unauthorized",""
"","200","Activity Assessment & Review CRUD tests → Get Assessment & Review tests → Get Reviews tests → 404 Not Found (Get Review of not existing Answer)","","Mon Mar 24 23:26:32 GMT 2025","passed","Mon Mar 24 23:26:32 GMT 2025","","Get Reviews tests →","404 Not Found (Get Review of not existing Answer)",""
"","117","Applet Events CRUD tests → Create cross-day events tests → 422 (Cross-day Event with DAILY periodicity type and availability range: 00:00:00-00:00:00)","","Mon Mar 24 23:29:46 GMT 2025","passed","Mon Mar 24 23:29:46 GMT 2025","","Create cross-day events tests →","422 (Cross-day Event with DAILY periodicity type and availability range: 00:00:00-00:00:00)",""
"","125","Applet Events CRUD tests → Update Applet Event tests → 422 Unprocessable Entity (Update Event type by params - activityId, flowId, respondentId)","","Mon Mar 24 23:29:33 GMT 2025","passed","Mon Mar 24 23:29:33 GMT 2025","","Update Applet Event tests →","422 Unprocessable Entity (Update Event type by params - activityId, flowId, respondentId)",""
"","190","Get applet completed activities tests → Respondent completes the 1st activity within default always available event → 200 OK (empty list): incorrect applet version","","Mon Mar 24 23:24:18 GMT 2025","passed","Mon Mar 24 23:24:18 GMT 2025","","Respondent completes the 1st activity within default always available event →","200 OK (empty list): incorrect applet version",""
"","118","Logs upload/download tests → Check logs existence → 422 Unprocessable entity","","Mon Mar 24 23:32:32 GMT 2025","passed","Mon Mar 24 23:32:32 GMT 2025","","Check logs existence →","422 Unprocessable entity",""
"","109","Applet Events CRUD tests → Create cross-day events tests → 422 (Cross-day Event with WEEKLY periodicity type and availability range: 00:00:00-00:00:00)","","Mon Mar 24 23:29:46 GMT 2025","passed","Mon Mar 24 23:29:46 GMT 2025","","Create cross-day events tests →","422 (Cross-day Event with WEEKLY periodicity type and availability range: 00:00:00-00:00:00)",""
"","277","Administration tests → Respondents tests → Set schedule for respondents tests → 403 Forbidden (Editor can NOT schedule Event)","","Mon Mar 24 23:35:45 GMT 2025","passed","Mon Mar 24 23:35:45 GMT 2025","","Set schedule for respondents tests →","403 Forbidden (Editor can NOT schedule Event)",""
"","226","Summary & Review activities tests → Get Summary and Review Activities (empty list) tests → Get Summary Activities (empty list) →","","Mon Mar 24 23:27:36 GMT 2025","passed","Mon Mar 24 23:27:36 GMT 2025","","Get Summary and Review Activities (empty list) tests →","Get Summary Activities (empty list) →",""
"","223","Applet ""Transfer Ownership"" endpoints tests → Transfer Decline → 204 OK","","Mon Mar 24 23:31:25 GMT 2025","passed","Mon Mar 24 23:31:25 GMT 2025","","Transfer Decline →","204 OK",""
"","24","""Subjects"" endpoints CRUD tests → Update subjects 401: Unauthorized","","Mon Mar 24 23:36:37 GMT 2025","passed","Mon Mar 24 23:36:37 GMT 2025","","Update subjects","401: Unauthorized",""
"","23","Applet Library tests → Share applet to the library 401 Unauthorized","","Mon Mar 24 23:27:51 GMT 2025","passed","Mon Mar 24 23:27:51 GMT 2025","","Share applet to the library","401 Unauthorized",""
"","221","Answers CRUD tests → Answers handling after invitation acceptance by respondent → Get flow submissions list & Flow answers of respondent tests → 404 Not Found (Get flow submission of not existing Applet)","","Mon Mar 24 23:26:00 GMT 2025","passed","Mon Mar 24 23:26:00 GMT 2025","","Get flow submissions list & Flow answers of respondent tests →","404 Not Found (Get flow submission of not existing Applet)",""
"","100","Applets CRUD endpoints tests → Update applet → 422 Unprocessable Entity (missing attribute) Missing ""activities""","","Mon Mar 24 23:28:15 GMT 2025","passed","Mon Mar 24 23:28:15 GMT 2025","","422 Unprocessable Entity (missing attribute)","Missing ""activities""",""
"","201","Answers CRUD tests → Answers handling after invitation acceptance by respondent → Create Answer tests → 400 Bad Request (not-unique submitId)","","Mon Mar 24 23:25:50 GMT 2025","passed","Mon Mar 24 23:25:50 GMT 2025","","Create Answer tests →","400 Bad Request (not-unique submitId)",""
"","223","""Themes"" endpoints tests → Update Theme → 422 Unprocessable Entity (missing attribute)","","Mon Mar 24 23:36:45 GMT 2025","passed","Mon Mar 24 23:36:45 GMT 2025","","Update Theme →","422 Unprocessable Entity (missing attribute)",""
"","197","Applet Library tests → Applet is added to the library → Update Library item → 404 Not Found (library item)","","Mon Mar 24 23:27:54 GMT 2025","passed","Mon Mar 24 23:27:54 GMT 2025","","Update Library item →","404 Not Found (library item)",""
"","395","Administration tests → Respondents tests → View all respondents tests → 200 OK (Coordinator can view all respondents)","","Mon Mar 24 23:35:40 GMT 2025","passed","Mon Mar 24 23:35:40 GMT 2025","","View all respondents tests →","200 OK (Coordinator can view all respondents)",""
"","24","Workspaces managers access tests → Get workspace roles list → 401 Unauthorized","","Mon Mar 24 23:38:49 GMT 2025","passed","Mon Mar 24 23:38:49 GMT 2025","","Get workspace roles list →","401 Unauthorized",""
"","235","Workspaces endpoints tests → Workspaces created → Get workspace Applets → Test for filters (query params) → Limit","","Mon Mar 24 23:39:25 GMT 2025","passed","Mon Mar 24 23:39:25 GMT 2025","","Test for filters (query params) →","Limit",""
"","205","Invitations scenario tests → Decline invitation positive flow → Invited user can retrieve invitation","","Mon Mar 24 23:33:07 GMT 2025","passed","Mon Mar 24 23:33:07 GMT 2025","","Decline invitation positive flow →","Invited user can retrieve invitation",""
"","842","Files upload/download tests → Upload/Download answers (applet files) → Upload Answer → 200 OK","","Mon Mar 24 23:32:15 GMT 2025","passed","Mon Mar 24 23:32:15 GMT 2025","","Upload Answer →","200 OK",""
"","218","Shell account invitation scenario tests → Accept invitation by already registered user → Verify invitation in list of invitations","","Mon Mar 24 23:34:43 GMT 2025","passed","Mon Mar 24 23:34:43 GMT 2025","","Accept invitation by already registered user →","Verify invitation in list of invitations",""
"","267","Administration tests → Applets tests → Export & view data in workspace of Applet owner tests → Export data tests → 200 OK (Respondent can export his own data)","","Mon Mar 24 23:35:56 GMT 2025","passed","Mon Mar 24 23:35:56 GMT 2025","","Export data tests →","200 OK (Respondent can export his own data)",""
"","213","""Themes"" endpoints tests → Create Theme → 422 Unprocessable Entity (missing attribute) Missing name","","Mon Mar 24 23:36:44 GMT 2025","passed","Mon Mar 24 23:36:44 GMT 2025","","422 Unprocessable Entity (missing attribute)","Missing name",""
"","147","Applets CRUD endpoints tests → Create applet → 422 Unprocessable Entity (missing attribute) Missing ""activity flows""","","Mon Mar 24 23:28:11 GMT 2025","passed","Mon Mar 24 23:28:11 GMT 2025","","422 Unprocessable Entity (missing attribute)","Missing ""activity flows""",""
"","144","Applet Library tests → Applet is added to the library → Get Library items list 200 OK (get the whole list)","","Mon Mar 24 23:27:52 GMT 2025","passed","Mon Mar 24 23:27:52 GMT 2025","","Get Library items list","200 OK (get the whole list)",""
"","218","Applet versions endpoints tests → Update Applet → Add Activity → Remove Activity → Get applet versions","","Mon Mar 24 23:31:43 GMT 2025","passed","Mon Mar 24 23:31:43 GMT 2025","","Remove Activity →","Get applet versions",""
"","99","Applet Events CRUD tests → Create Events tests → 422 Unprocessable Entity → Create Event with missing timer param (timer type: TIMER)","","Mon Mar 24 23:29:18 GMT 2025","passed","Mon Mar 24 23:29:18 GMT 2025","","422 Unprocessable Entity →","Create Event with missing timer param (timer type: TIMER)",""
"","366","Shell account invitation scenario tests → Decline invitation by unregistered user → Send invitation to the shell account","","Mon Mar 24 23:34:38 GMT 2025","passed","Mon Mar 24 23:34:38 GMT 2025","","Decline invitation by unregistered user →","Send invitation to the shell account",""
"","661","Administration tests → Perform activities tests → 200 OK (Applet owner can submit answers)","","Mon Mar 24 23:36:00 GMT 2025","passed","Mon Mar 24 23:36:00 GMT 2025","","Perform activities tests →","200 OK (Applet owner can submit answers)",""
"","121","Update User tests → 422 Unprocessable Entity Update user with missing lastName param","","Mon Mar 24 23:37:34 GMT 2025","passed","Mon Mar 24 23:37:34 GMT 2025","","422 Unprocessable Entity","Update user with missing lastName param",""
