"Status","Start Time","Stop Time","Duration in ms","Parent Suite","Suite","Sub Suite","Test Class","Test Method","Name","Description"
"passed","Thu Oct 24 17:55:18 GMT 2024","Thu Oct 24 17:55:18 GMT 2024","536","","Delete subjects","","200 OK: shell account","","""Subjects"" endpoints CRUD tests → Delete subjects 200 OK: shell account",""
"passed","Thu Oct 24 17:48:53 GMT 2024","Thu Oct 24 17:48:53 GMT 2024","391","","Remove Activity Flow →","","Get applet version by id","","Applet versions endpoints tests → Update Applet → Add Activity → Remove Activity → Add Activity Flow → Remove Activity Flow → Get applet version by id",""
"passed","Thu Oct 24 17:44:59 GMT 2024","Thu Oct 24 17:44:59 GMT 2024","143","","Get general and individual Applet Events →","","401 Unauthorized (Get Applet Events with invalid appletOwnerToken)","","Applet Events CRUD tests → Get general and individual Applet Events → 401 Unauthorized (Get Applet Events with invalid appletOwnerToken)",""
"passed","Thu Oct 24 17:42:21 GMT 2024","Thu Oct 24 17:42:21 GMT 2024","154","","Create Access link tests →","","401 Unauthorized (Create Access link with invalid token)","","Access link tests → Create Access link tests → 401 Unauthorized (Create Access link with invalid token)",""
"passed","Thu Oct 24 17:44:41 GMT 2024","Thu Oct 24 17:44:41 GMT 2024","551","","Delete individual scheduled user Events scenario tests →","","First Respondent should have individual Always Available activity Event & general Always Available flow Event after deletion of individual scheduled activity Event","","Delete and remove individual Events scenario tests → Delete individual scheduled user Events scenario tests → First Respondent should have individual Always Available activity Event & general Always Available flow Event after deletion of individual scheduled activity Event",""
"passed","Thu Oct 24 17:45:31 GMT 2024","Thu Oct 24 17:45:31 GMT 2024","399","","422 Unprocessable Entity →","","Update Event with missing accessBeforeSchedule (periodicity type: WEEKDAYS) param","","Applet Events CRUD tests → Update Applet Event tests → 422 Unprocessable Entity → Update Event with missing accessBeforeSchedule (periodicity type: WEEKDAYS) param",""
"passed","Thu Oct 24 17:49:33 GMT 2024","Thu Oct 24 17:49:33 GMT 2024","575","","Download Answer →","","404 file not found","","Files upload/download tests → Upload/Download answers (applet files) → Download Answer → 404 file not found",""
"passed","Thu Oct 24 17:46:53 GMT 2024","Thu Oct 24 17:46:53 GMT 2024","358","","Get public activities by key →","","200 OK","","Applet public access tests → Get public activities by key → 200 OK",""
"passed","Thu Oct 24 17:59:17 GMT 2024","Thu Oct 24 17:59:17 GMT 2024","448","","Update workspace applet respondent →","","404 Not Found (invalid workspace id)","","Workspaces endpoints tests → Workspaces created → Update workspace applet respondent → 404 Not Found (invalid workspace id)",""
"passed","Thu Oct 24 17:57:10 GMT 2024","Thu Oct 24 17:57:10 GMT 2024","757","","Workspace folder for different users tests →","","Get folders (manager)","","Workspace folder for different users tests → Get folders (manager)",""
"passed","Thu Oct 24 17:45:52 GMT 2024","Thu Oct 24 17:45:52 GMT 2024","283","","Create cross-day events tests →","","422 (Cross-day Event with DAILY periodicity type and availability range: 15:30:00-15:30:00)","","Applet Events CRUD tests → Create cross-day events tests → 422 (Cross-day Event with DAILY periodicity type and availability range: 15:30:00-15:30:00)",""
"passed","Thu Oct 24 17:51:28 GMT 2024","Thu Oct 24 17:51:28 GMT 2024","778","","Invitation Reviewer Send →","","200 OK (send to existing user)","","Invitations endpoints tests → Send invitation → Invitation Reviewer Send → 200 OK (send to existing user)",""
"passed","Thu Oct 24 17:47:00 GMT 2024","Thu Oct 24 17:47:00 GMT 2024","147","","Applets ""report configuration"" endpoint tests →","","401 Unauthorized","","Applets ""report configuration"" endpoint tests → 401 Unauthorized",""
"passed","Thu Oct 24 17:54:38 GMT 2024","Thu Oct 24 17:54:38 GMT 2024","805","","Delete Subjects (remove applet access) tests →","","Verify workspace users applet access list before respondents access removed","","Delete Subjects (remove applet access) tests → Verify workspace users applet access list before respondents access removed",""
"passed","Thu Oct 24 17:49:01 GMT 2024","Thu Oct 24 17:49:01 GMT 2024","425","","Update Activity Item →","","Get applet versions","","Applet versions endpoints tests → Update Applet → Add Activity → Remove Activity → Add Activity Flow → Remove Activity Flow → Add Activity Item → Remove Activity Item → Update Activity → Update Activity Item → Get applet versions",""
"passed","Thu Oct 24 17:51:14 GMT 2024","Thu Oct 24 17:51:14 GMT 2024","523","","Accept invitation →","","200 OK","","Invitations endpoints tests → Accept invitation → 200 OK",""
"passed","Thu Oct 24 17:56:27 GMT 2024","Thu Oct 24 17:56:27 GMT 2024","414","","Get User Device Information →","","200 Get User Device","","Get User Device Information → 200 Get User Device",""
"passed","Thu Oct 24 17:56:18 GMT 2024","Thu Oct 24 17:56:18 GMT 2024","275","","422 Unprocessable Entity","","Update password with missing prevPassword param","","Update Password tests → 422 Unprocessable Entity Update password with missing prevPassword param",""
"passed","Thu Oct 24 17:48:35 GMT 2024","Thu Oct 24 17:48:35 GMT 2024","288","","Applets ""unique_name"" endpoint tests →","","422 invalid attribute (excludingAppletId)","","Applets ""unique_name"" endpoint tests → 422 invalid attribute (excludingAppletId)",""
"passed","Thu Oct 24 17:44:14 GMT 2024","Thu Oct 24 17:44:14 GMT 2024","391","","200 OK →","","1000 years","","Applets ""retentions"" endpoint tests → 200 OK → 1000 years",""
"passed","Thu Oct 24 17:40:10 GMT 2024","Thu Oct 24 17:40:10 GMT 2024","603","","Get flow submissions list & Flow answers of respondent tests →","","200 OK (Get flow submission of respondent)","","Answers CRUD tests → Answers handling after invitation acceptance by respondent → Get flow submissions list & Flow answers of respondent tests → 200 OK (Get flow submission of respondent)",""
"passed","Thu Oct 24 17:50:33 GMT 2024","Thu Oct 24 17:50:33 GMT 2024","527","","Accept invitation positive flow →","","Invited user accepts invitation","","Invitations scenario tests → Accept invitation positive flow → Invited user accepts invitation",""
"passed","Thu Oct 24 17:56:07 GMT 2024","Thu Oct 24 17:56:07 GMT 2024","145","","422 Unprocessable Entity","","Approve user password recovery with missing password param","","User Password tests → Password recovery approve tests → 422 Unprocessable Entity Approve user password recovery with missing password param",""
"passed","Thu Oct 24 17:57:47 GMT 2024","Thu Oct 24 17:57:47 GMT 2024","390","","Set workspace managers applet access list →","","404 Not Found (incorrect ownerId)","","Workspaces managers access tests → Set workspace managers applet access list → 404 Not Found (incorrect ownerId)",""
"passed","Thu Oct 24 17:46:53 GMT 2024","Thu Oct 24 17:46:53 GMT 2024","263","","Get public activities by key →","","404: invalid key","","Applet public access tests → Get public activities by key → 404: invalid key",""
"passed","Thu Oct 24 17:48:45 GMT 2024","Thu Oct 24 17:48:45 GMT 2024","454","","Get applet version changes →","","404 (incorrect appletId)","","Applet versions endpoints tests → Get applet version changes → 404 (incorrect appletId)",""
"passed","Thu Oct 24 17:42:52 GMT 2024","Thu Oct 24 17:42:52 GMT 2024","427","","Applets GET ""base info"" endpoint tests →","","200 OK","","Applets GET ""base info"" endpoint tests → 200 OK",""
"passed","Thu Oct 24 17:38:00 GMT 2024","Thu Oct 24 17:38:00 GMT 2024","614","","Get exported data & dates after answer submit →","","200 OK (Get exported data by editor - should see only his own data)","","Get submit dates & exported Answers data tests → Get exported data & dates after answer submit → 200 OK (Get exported data by editor - should see only his own data)",""
"passed","Thu Oct 24 17:49:48 GMT 2024","Thu Oct 24 17:49:48 GMT 2024","304","","Upload Logs →","","422 Empty form data","","Logs upload/download tests → Upload Logs → 422 Empty form data",""
"passed","Thu Oct 24 17:58:40 GMT 2024","Thu Oct 24 17:58:40 GMT 2024","408","","Get user workspaces →","","Second applet owner","","Workspaces endpoints tests → Workspaces created → Get user workspaces → Second applet owner",""
"passed","Thu Oct 24 17:40:10 GMT 2024","Thu Oct 24 17:40:10 GMT 2024","413","","Get flow submissions list & Flow answers of respondent tests →","","404 Not Found (Get flow submission with not existing activityFlowId)","","Answers CRUD tests → Answers handling after invitation acceptance by respondent → Get flow submissions list & Flow answers of respondent tests → 404 Not Found (Get flow submission with not existing activityFlowId)",""
"passed","Thu Oct 24 17:50:33 GMT 2024","Thu Oct 24 17:50:33 GMT 2024","387","","Accept invitation positive flow →","","Invited user can't see invitation anymore","","Invitations scenario tests → Accept invitation positive flow → Invited user can't see invitation anymore",""
"passed","Thu Oct 24 17:57:04 GMT 2024","Thu Oct 24 17:57:04 GMT 2024","376","","Pin Folder →","","404 Not Found (non-existent applet)","","""Workspace Folders"" endpoints tests → Workspace is created → Pin/Unpin Folder → Pin Folder → 404 Not Found (non-existent applet)",""
"passed","Thu Oct 24 17:40:46 GMT 2024","Thu Oct 24 17:40:46 GMT 2024","388","","Delete Assessment tests →","","204 No Content (Delete submitted assessment)","","Activity Assessment & Review CRUD tests → Delete Assessment tests → 204 No Content (Delete submitted assessment)",""
"passed","Thu Oct 24 17:47:45 GMT 2024","Thu Oct 24 17:47:46 GMT 2024","1798","","Transfer Decline →","","Second receiver should become the owner","","Applet ""Transfer Ownership"" scenario tests → Transfer Decline → Second receiver should become the owner",""
"passed","Thu Oct 24 17:53:59 GMT 2024","Thu Oct 24 17:53:59 GMT 2024","429","","View all respondents tests →","","403 Forbidden (Respondent can NOT view all respondents)","","Administration tests → Respondents tests → View all respondents tests → 403 Forbidden (Respondent can NOT view all respondents)",""
"passed","Thu Oct 24 17:40:27 GMT 2024","Thu Oct 24 17:40:27 GMT 2024","565","","Switch to a new assessment version","","Get Assessment info after switching to a new assessment version","","Get Assessment & Review of updated activity tests → Switch to a new assessment version Get Assessment info after switching to a new assessment version",""
"passed","Thu Oct 24 17:58:48 GMT 2024","Thu Oct 24 17:58:48 GMT 2024","460","","Search workspace Applets →","","200 OK (search by full applet name)","","Workspaces endpoints tests → Workspaces created → Search workspace Applets → 200 OK (search by full applet name)",""
"passed","Thu Oct 24 17:46:58 GMT 2024","Thu Oct 24 17:46:58 GMT 2024","300","","Invite link with { requireLogin: true } created →","","Get public applet events: 404 Not found","","Applet public access tests → Invite link with { requireLogin: true } created → Get public applet events: 404 Not found",""
"passed","Thu Oct 24 17:39:58 GMT 2024","Thu Oct 24 17:39:58 GMT 2024","513","","Check answer existence tests →","","200 OK (exists = true, check by applet owner with submitId)","","Answers CRUD tests → Answers handling after invitation acceptance by respondent → Check answer existence tests → 200 OK (exists = true, check by applet owner with submitId)",""
"passed","Thu Oct 24 17:57:54 GMT 2024","Thu Oct 24 17:57:54 GMT 2024","330","","Remove manager access →","","422 Missing attribute (userId)","","Workspaces managers access tests → Remove manager access → 422 Missing attribute (userId)",""
"passed","Thu Oct 24 17:55:12 GMT 2024","Thu Oct 24 17:55:12 GMT 2024","389","","Get subjects","","200 OK: manager","","""Subjects"" endpoints CRUD tests → Get subjects 200 OK: manager",""
"passed","Thu Oct 24 17:46:04 GMT 2024","Thu Oct 24 17:46:09 GMT 2024","5946","","Applet Events scenario tests →","","End-To-End scenario (Individual scheduled flow Event)","","Applet Events scenario tests → End-To-End scenario (Individual scheduled flow Event)",""
"passed","Thu Oct 24 17:40:57 GMT 2024","Thu Oct 24 17:40:57 GMT 2024","458","","Get flow Identifiers tests →","","200: Empty list (not existing activityFlowId)","","Flow Versions & Identifiers tests → Get flow Identifiers tests → 200: Empty list (not existing activityFlowId)",""
"passed","Thu Oct 24 17:44:49 GMT 2024","Thu Oct 24 17:44:49 GMT 2024","410","","Create Events tests →","","404 Not Found (Create general scheduled activity Event for not existing Applet)","","Applet Events CRUD tests → Create Events tests → 404 Not Found (Create general scheduled activity Event for not existing Applet)",""
"passed","Thu Oct 24 17:48:53 GMT 2024","Thu Oct 24 17:48:53 GMT 2024","418","","Remove Activity Flow →","","Get applet version changes","","Applet versions endpoints tests → Update Applet → Add Activity → Remove Activity → Add Activity Flow → Remove Activity Flow → Get applet version changes",""
"passed","Thu Oct 24 17:41:19 GMT 2024","Thu Oct 24 17:41:19 GMT 2024","426","","Multiinformant assessment validate tests →","","200 OK: invalid source subject Id","","Multiinformant assessment validate tests → 200 OK: invalid source subject Id",""
"passed","Thu Oct 24 17:55:12 GMT 2024","Thu Oct 24 17:55:12 GMT 2024","366","","Get subjects","","200 OK: applet owner","","""Subjects"" endpoints CRUD tests → Get subjects 200 OK: applet owner",""
"passed","Thu Oct 24 17:37:59 GMT 2024","Thu Oct 24 17:37:59 GMT 2024","160","","Get dates before Answer submit →","","401 Unauthorized (Get submit dates with not existing token)","","Get submit dates & exported Answers data tests → Get dates before Answer submit → 401 Unauthorized (Get submit dates with not existing token)",""
"passed","Thu Oct 24 17:50:55 GMT 2024","Thu Oct 24 17:50:56 GMT 2024","1957","","Invite unregistered user flow →","","New user registers in the app","","Invitations scenario tests → Invite unregistered user flow → New user registers in the app",""
"passed","Thu Oct 24 17:38:58 GMT 2024","Thu Oct 24 17:38:58 GMT 2024","459","","Retrieve latest report negative tests →","","400 Bad request (Get summary latest report with not existing Activity)","","Retrieve latest report negative tests → 400 Bad request (Get summary latest report with not existing Activity)",""
"passed","Thu Oct 24 17:37:28 GMT 2024","Thu Oct 24 17:37:28 GMT 2024","396","","Respondent completes the 1st activity within default always available event →","","200 OK (empty list): incorrect applet version","","Get applet completed activities tests → Respondent completes the 1st activity within default always available event → 200 OK (empty list): incorrect applet version",""
"passed","Thu Oct 24 17:49:18 GMT 2024","Thu Oct 24 17:49:19 GMT 2024","1029","","Tokens invalidation tests →","","Verify both access ans refresh tokens are invalidated after logout","","""Authentication"" endpoints tests → Tokens invalidation tests → Verify both access ans refresh tokens are invalidated after logout",""
"passed","Thu Oct 24 17:41:44 GMT 2024","Thu Oct 24 17:41:44 GMT 2024","398","","Get Review Activities list tests →","","422 Unprocessable Entity (Get Review Activities list without createdDate query param)","","Summary & Review activities tests → Get Summary and Review Activities (non-empty list) tests → Get Review Activities list tests → 422 Unprocessable Entity (Get Review Activities list without createdDate query param)",""
"passed","Thu Oct 24 17:45:52 GMT 2024","Thu Oct 24 17:45:52 GMT 2024","302","","Create cross-day events tests →","","422 (Cross-day Event with WEEKLY periodicity type and availability range: 00:00:00-00:00:00)","","Applet Events CRUD tests → Create cross-day events tests → 422 (Cross-day Event with WEEKLY periodicity type and availability range: 00:00:00-00:00:00)",""
"passed","Thu Oct 24 17:57:47 GMT 2024","Thu Oct 24 17:57:47 GMT 2024","921","","Set workspace managers applet access list →","","200 OK (grant manager's permissions for reviewer)","","Workspaces managers access tests → Set workspace managers applet access list → 200 OK (grant manager's permissions for reviewer)",""
"passed","Thu Oct 24 17:51:24 GMT 2024","Thu Oct 24 17:51:24 GMT 2024","572","","200 OK (send to unregistered user)","","With tag","","Invitations endpoints tests → Send invitation → Invitation Respondent Send → 200 OK (send to unregistered user) With tag",""
"passed","Thu Oct 24 17:59:17 GMT 2024","Thu Oct 24 17:59:17 GMT 2024","403","","Update workspace applet respondent →","","404 Not Found (invalid applet id)","","Workspaces endpoints tests → Workspaces created → Update workspace applet respondent → 404 Not Found (invalid applet id)",""
"passed","Thu Oct 24 17:48:44 GMT 2024","Thu Oct 24 17:48:44 GMT 2024","429","","Get applet version by id →","","404 (incorrect versionId)","","Applet versions endpoints tests → Get applet version by id → 404 (incorrect versionId)",""
"passed","Thu Oct 24 17:54:29 GMT 2024","Thu Oct 24 17:54:29 GMT 2024","525","","Perform activities tests →","","200 OK (Manager can submit answers)","","Administration tests → Perform activities tests → 200 OK (Manager can submit answers)",""
"passed","Thu Oct 24 17:58:08 GMT 2024","Thu Oct 24 17:58:09 GMT 2024","1685","","Change user's role (E2E scenario) →","","Change user's role from manager to reviewer","","Workspaces managers access tests → Change user's role (E2E scenario) → Change user's role from manager to reviewer",""
"passed","Thu Oct 24 17:49:03 GMT 2024","Thu Oct 24 17:49:03 GMT 2024","474","","Update Activity Flow →","","Get applet version by id","","Applet versions endpoints tests → Update Applet → Add Activity → Remove Activity → Add Activity Flow → Remove Activity Flow → Add Activity Item → Remove Activity Item → Update Activity → Update Activity Item → Update Activity Flow → Get applet version by id",""
"passed","Thu Oct 24 17:42:11 GMT 2024","Thu Oct 24 17:42:11 GMT 2024","420","","Update Library item →","","404 Not Found (library item)","","Applet Library tests → Applet is added to the library → Update Library item → 404 Not Found (library item)",""
"passed","Thu Oct 24 17:45:31 GMT 2024","Thu Oct 24 17:45:31 GMT 2024","340","","422 Unprocessable Entity →","","Update Event with missing accessBeforeSchedule (periodicity type: WEEKLY) param","","Applet Events CRUD tests → Update Applet Event tests → 422 Unprocessable Entity → Update Event with missing accessBeforeSchedule (periodicity type: WEEKLY) param",""
"passed","Thu Oct 24 17:57:06 GMT 2024","Thu Oct 24 17:57:07 GMT 2024","1171","","Unpin Folder →","","400 (applet not in folder)","","""Workspace Folders"" endpoints tests → Workspace is created → Pin/Unpin Folder → Unpin Folder → 400 (applet not in folder)",""
"passed","Thu Oct 24 17:42:45 GMT 2024","Thu Oct 24 17:42:45 GMT 2024","144","","Update applet →","","401 Unauthorized","","Applets CRUD endpoints tests → Update applet → 401 Unauthorized",""
"passed","Thu Oct 24 17:51:22 GMT 2024","Thu Oct 24 17:51:22 GMT 2024","410","","Invitation Respondent Send →","","404 - Applet does not exist","","Invitations endpoints tests → Send invitation → Invitation Respondent Send → 404 - Applet does not exist",""
"passed","Thu Oct 24 17:43:41 GMT 2024","Thu Oct 24 17:43:41 GMT 2024","350","","Negative tests →","","Duplicate Activity name","","Applet builder tests → Create applet → Negative tests → Duplicate Activity name",""
"passed","Thu Oct 24 17:47:20 GMT 2024","Thu Oct 24 17:47:21 GMT 2024","1435","","Transfer Accept →","","Applet owner should remain the same before transfer request accepted by another user","","Applet ""Transfer Ownership"" scenario tests → Transfer Accept → Applet owner should remain the same before transfer request accepted by another user",""
"passed","Thu Oct 24 17:53:51 GMT 2024","Thu Oct 24 17:53:51 GMT 2024","366","","View all organizers tests →","","403 Forbidden (Respondent can NOT view organizers)","","Administration tests → Organizers tests → View all organizers tests → 403 Forbidden (Respondent can NOT view organizers)",""
"passed","Thu Oct 24 17:50:01 GMT 2024","Thu Oct 24 17:50:01 GMT 2024","693","","Upload media files directly to storage (S3 bucket)","","Verify GET /fileLink returns 403 error before file is uploaded","","Files upload/download directly to S3 bucket tests → Upload media files directly to storage (S3 bucket) Verify GET /fileLink returns 403 error before file is uploaded",""
"passed","Thu Oct 24 17:50:48 GMT 2024","Thu Oct 24 17:50:48 GMT 2024","433","","Re-send invitation flow →","","Invitor can see new invitation","","Invitations scenario tests → Re-send invitation flow → Invitor can see new invitation",""
"passed","Thu Oct 24 17:54:14 GMT 2024","Thu Oct 24 17:54:14 GMT 2024","392","","Duplicate Applet in workspace of Applet owner tests →","","403 Forbidden (Reviewer can NOT duplicate Applet)","","Administration tests → Applets tests → Duplicate Applet in workspace of Applet owner tests → 403 Forbidden (Reviewer can NOT duplicate Applet)",""
"passed","Thu Oct 24 17:47:05 GMT 2024","Thu Oct 24 17:47:05 GMT 2024","293","","Applets ""setFolder"" endpoint tests →","","422 missing attribute (appletId)","","Applets ""setFolder"" endpoint tests → 422 missing attribute (appletId)",""
"passed","Thu Oct 24 17:58:58 GMT 2024","Thu Oct 24 17:58:58 GMT 2024","150","","Negative tests →","","401 Unauthorized","","Workspaces endpoints tests → Workspaces created → Get workspace applet respondents → Negative tests → 401 Unauthorized",""
"passed","Thu Oct 24 17:39:55 GMT 2024","Thu Oct 24 17:39:55 GMT 2024","308","","422 Unprocessable Entity →","","Create Answer with missing appletId param","","Answers CRUD tests → Answers handling after invitation acceptance by respondent → Create Answer tests → 422 Unprocessable Entity → Create Answer with missing appletId param",""
"passed","Thu Oct 24 17:53:57 GMT 2024","Thu Oct 24 17:53:57 GMT 2024","523","","Invite new respondent tests →","","200 OK (Coordinator can invite new respondent)","","Administration tests → Respondents tests → Invite new respondent tests → 200 OK (Coordinator can invite new respondent)",""
"passed","Thu Oct 24 17:38:08 GMT 2024","Thu Oct 24 17:38:11 GMT 2024","3427","","Create Answers for different item types tests →","","Flanker performance task","","Create Answers for different item types tests → Flanker performance task",""
"passed","Thu Oct 24 17:51:26 GMT 2024","Thu Oct 24 17:51:26 GMT 2024","326","","422 Missing attributes","","Missing firstName","","Invitations endpoints tests → Send invitation → Invitation Respondent Send → 422 Missing attributes Missing firstName",""
"passed","Thu Oct 24 17:54:09 GMT 2024","Thu Oct 24 17:54:09 GMT 2024","499","","Create Applet in workspace of Applet owner tests →","","403 Forbidden (Reviewer can NOT create Applet in workspace of Applet owner)","","Administration tests → Applets tests → Create Applet in workspace of Applet owner tests → 403 Forbidden (Reviewer can NOT create Applet in workspace of Applet owner)",""
"passed","Thu Oct 24 17:46:55 GMT 2024","Thu Oct 24 17:46:55 GMT 2024","273","","Create anonymous answer","","404 Not Found (invalid appletId)","","Applet public access tests → Create anonymous answer 404 Not Found (invalid appletId)",""
"passed","Thu Oct 24 17:39:52 GMT 2024","Thu Oct 24 17:39:52 GMT 2024","601","","Create Answer tests →","","201 (Answer can be created by Applet Owner)","","Answers CRUD tests → Answers handling after invitation acceptance by respondent → Create Answer tests → 201 (Answer can be created by Applet Owner)",""
"passed","Thu Oct 24 17:59:14 GMT 2024","Thu Oct 24 17:59:14 GMT 2024","419","","Get workspace applet respondent by id →","","200 OK (invited respondent)","","Workspaces endpoints tests → Workspaces created → Get workspace applet respondent by id → 200 OK (invited respondent)",""
"passed","Thu Oct 24 17:37:03 GMT 2024","Thu Oct 24 17:37:03 GMT 2024","458","","Get Notes list (not empty)","","404 Not Found (Get Note list for not existing Answer)","","Answer Notes tests → Get Notes list tests → Get Notes list (not empty) 404 Not Found (Get Note list for not existing Answer)",""
"passed","Thu Oct 24 17:55:12 GMT 2024","Thu Oct 24 17:55:12 GMT 2024","402","","Get subjects","","404: Not Found","","""Subjects"" endpoints CRUD tests → Get subjects 404: Not Found",""
"passed","Thu Oct 24 17:58:41 GMT 2024","Thu Oct 24 17:58:41 GMT 2024","662","","Get workspace by ownerId →","","200 OK","","Workspaces endpoints tests → Workspaces created → Get workspace by ownerId → 200 OK",""
"passed","Thu Oct 24 17:40:37 GMT 2024","Thu Oct 24 17:40:37 GMT 2024","458","","Get Assessment tests →","","404 Not Found (Get Assessment of not existing Answer)","","Activity Assessment & Review CRUD tests → Get Assessment & Review tests → Get Assessment tests → 404 Not Found (Get Assessment of not existing Answer)",""
"passed","Thu Oct 24 17:48:45 GMT 2024","Thu Oct 24 17:48:45 GMT 2024","373","","Get applet version changes →","","404 (incorrect versionId)","","Applet versions endpoints tests → Get applet version changes → 404 (incorrect versionId)",""
