"Status","Start Time","Stop Time","Duration in ms","Parent Suite","Suite","Sub Suite","Test Class","Test Method","Name","Description"
"passed","Thu Oct 24 17:51:42 GMT 2024","Thu Oct 24 17:51:42 GMT 2024","268","","422 Missing attributes","","Missing firstName","","Invitations endpoints tests → Send invitation → Invitation Managers Send → 422 Missing attributes Missing firstName",""
"passed","Thu Oct 24 17:58:52 GMT 2024","Thu Oct 24 17:58:52 GMT 2024","385","","Get workspace applet details →","","404 Not Found (non-existent ownerId)","","Workspaces endpoints tests → Workspaces created → Get workspace applet details → 404 Not Found (non-existent ownerId)",""
"passed","Thu Oct 24 17:56:58 GMT 2024","Thu Oct 24 17:56:58 GMT 2024","151","","Create Folder →","","401 Unauthorized (invalid token)","","""Workspace Folders"" endpoints tests → Workspace is created → Create Folder → 401 Unauthorized (invalid token)",""
"passed","Thu Oct 24 17:47:05 GMT 2024","Thu Oct 24 17:47:05 GMT 2024","395","","Applets ""setFolder"" endpoint tests →","","200 OK (unset folder)","","Applets ""setFolder"" endpoint tests → 200 OK (unset folder)",""
"passed","Thu Oct 24 17:45:21 GMT 2024","Thu Oct 24 17:45:21 GMT 2024","142","","Delete scheduled Applet Event by Id tests →","","401 Unauthorized (Delete individual scheduled activity Event with not existing appletOwnerToken)","","Applet Events CRUD tests → Delete scheduled Applet Event by Id tests → 401 Unauthorized (Delete individual scheduled activity Event with not existing appletOwnerToken)",""
"passed","Thu Oct 24 17:40:03 GMT 2024","Thu Oct 24 17:40:03 GMT 2024","1","","Get activity answers list & Answers of respondent tests →","","200 OK (Applet owner should be able to get activity answers list)","","Answers CRUD tests → Answers handling after invitation acceptance by respondent → Get activity answers list & Answers of respondent tests → 200 OK (Applet owner should be able to get activity answers list)",""
"passed","Thu Oct 24 17:53:54 GMT 2024","Thu Oct 24 17:53:54 GMT 2024","344","","Change organizer roles/permissions tests →","","403 Forbidden (Editor can NOT grant reviewer's permissions to coordinator)","","Administration tests → Organizers tests → Change organizer roles/permissions tests → 403 Forbidden (Editor can NOT grant reviewer's permissions to coordinator)",""
"passed","Thu Oct 24 17:41:09 GMT 2024","Thu Oct 24 17:41:09 GMT 2024","466","","Applet has been updated →","","200 OK (Get versions after updating item type, applet name and adding new item)","","Activity Versions & Identifiers tests → Get Versions tests → Applet has been updated → 200 OK (Get versions after updating item type, applet name and adding new item)",""
"passed","Thu Oct 24 17:45:37 GMT 2024","Thu Oct 24 17:45:37 GMT 2024","144","","Count scheduled Applet Events tests →","","401 Unauthorized (Count general scheduled Events with not existing appletOwnerToken)","","Applet Events CRUD tests → Count scheduled Applet Events tests → 401 Unauthorized (Count general scheduled Events with not existing appletOwnerToken)",""
"passed","Thu Oct 24 17:53:54 GMT 2024","Thu Oct 24 17:53:54 GMT 2024","386","","Change organizer roles/permissions tests →","","403 Forbidden (Respondent can NOT grant manager's permissions to coordinator)","","Administration tests → Organizers tests → Change organizer roles/permissions tests → 403 Forbidden (Respondent can NOT grant manager's permissions to coordinator)",""
"passed","Thu Oct 24 17:48:55 GMT 2024","Thu Oct 24 17:48:55 GMT 2024","467","","Add Activity Item →","","Get applet version by id","","Applet versions endpoints tests → Update Applet → Add Activity → Remove Activity → Add Activity Flow → Remove Activity Flow → Add Activity Item → Get applet version by id",""
"passed","Thu Oct 24 17:57:21 GMT 2024","Thu Oct 24 17:57:21 GMT 2024","368","","Applet Owner and Manager add the same applet in their folders","","Get folders (applet owner)","","Workspace folder for different users tests → Manager is invited to the applet → Manager creates own folder in the same workspace Applet Owner and Manager add the same applet in their folders Get folders (applet owner)",""
"passed","Thu Oct 24 17:56:07 GMT 2024","Thu Oct 24 17:56:07 GMT 2024","151","","422 Unprocessable Entity","","Approve user password recovery with missing email param","","User Password tests → Password recovery approve tests → 422 Unprocessable Entity Approve user password recovery with missing email param",""
"passed","Thu Oct 24 17:40:39 GMT 2024","Thu Oct 24 17:40:39 GMT 2024","145","","Get Reviews tests →","","401 Unauthorized (Get Review with not existing token)","","Activity Assessment & Review CRUD tests → Get Assessment & Review tests → Get Reviews tests → 401 Unauthorized (Get Review with not existing token)",""
"passed","Thu Oct 24 17:55:48 GMT 2024","Thu Oct 24 17:55:48 GMT 2024","736","","Get User tests →","","404 Not found (Get deleted user)","","Get User tests → 404 Not found (Get deleted user)",""
"passed","Thu Oct 24 17:53:59 GMT 2024","Thu Oct 24 17:53:59 GMT 2024","971","","View all respondents tests →","","200 OK (Applet owner can view all respondents)","","Administration tests → Respondents tests → View all respondents tests → 200 OK (Applet owner can view all respondents)",""
"passed","Thu Oct 24 17:52:29 GMT 2024","Thu Oct 24 17:52:29 GMT 2024","495","","Accept invitation by unregistered user →","","Send invitation to the shell account","","Shell account invitation scenario tests → Accept invitation by unregistered user → Send invitation to the shell account",""
"passed","Thu Oct 24 17:53:57 GMT 2024","Thu Oct 24 17:53:57 GMT 2024","518","","Invite new respondent tests →","","200 OK (Manager can invite new respondent)","","Administration tests → Respondents tests → Invite new respondent tests → 200 OK (Manager can invite new respondent)",""
"passed","Thu Oct 24 17:49:31 GMT 2024","Thu Oct 24 17:49:32 GMT 2024","1116","","Upload Answer →","","200 OK","","Files upload/download tests → Upload/Download answers (applet files) → Upload Answer → 200 OK",""
"passed","Thu Oct 24 17:41:07 GMT 2024","Thu Oct 24 17:41:07 GMT 2024","412","","Get Versions tests →","","404 Not Found (Get versions of not existing activityId)","","Activity Versions & Identifiers tests → Get Versions tests → 404 Not Found (Get versions of not existing activityId)",""
"passed","Thu Oct 24 17:40:41 GMT 2024","Thu Oct 24 17:40:41 GMT 2024","450","","Assessment has been submitted →","","200 OK (Get Review)","","Activity Assessment & Review CRUD tests → Get Assessment & Review tests → Assessment has been submitted → 200 OK (Get Review)",""
"passed","Thu Oct 24 17:55:25 GMT 2024","Thu Oct 24 17:55:25 GMT 2024","285","","422 Unprocessable Entity (missing attribute)","","Missing backgroundImage","","""Themes"" endpoints tests → Create Theme → 422 Unprocessable Entity (missing attribute) Missing backgroundImage",""
"passed","Thu Oct 24 17:40:28 GMT 2024","Thu Oct 24 17:40:28 GMT 2024","566","","New assessment activity for subsequent activity completions","","Get new assessment activity","","Get Assessment & Review of updated activity tests → Switch to a new assessment version New assessment activity for subsequent activity completions Get new assessment activity",""
"passed","Thu Oct 24 17:52:42 GMT 2024","Thu Oct 24 17:52:43 GMT 2024","1701","","Decline invitation by unregistered user →","","New user registers in the app","","Shell account invitation scenario tests → Decline invitation by unregistered user → New user registers in the app",""
"passed","Thu Oct 24 17:53:51 GMT 2024","Thu Oct 24 17:53:51 GMT 2024","509","","View all organizers tests →","","200 OK (Manager can view organizers)","","Administration tests → Organizers tests → View all organizers tests → 200 OK (Manager can view organizers)",""
"passed","Thu Oct 24 17:55:23 GMT 2024","Thu Oct 24 17:55:23 GMT 2024","478","","Get Themes →","","200 OK","","""Themes"" endpoints tests → Get Themes → 200 OK",""
"passed","Thu Oct 24 17:42:39 GMT 2024","Thu Oct 24 17:42:40 GMT 2024","1181","","Create applet →","","400 Bad Request (duplicate name)","","Applets CRUD endpoints tests → Create applet → 400 Bad Request (duplicate name)",""
"passed","Thu Oct 24 17:42:21 GMT 2024","Thu Oct 24 17:42:21 GMT 2024","388","","Create Access link tests →","","404 Not Found (Create Access link with not existing applet)","","Access link tests → Create Access link tests → 404 Not Found (Create Access link with not existing applet)",""
"passed","Thu Oct 24 17:43:01 GMT 2024","Thu Oct 24 17:43:02 GMT 2024","1963","","Positive tests →","","Applet with subscale settings and scorable items","","Applet builder tests → Create applet → Positive tests → Applet with subscale settings and scorable items",""
"passed","Thu Oct 24 17:38:07 GMT 2024","Thu Oct 24 17:38:07 GMT 2024","459","","Get dates after Answer submit →","","200 OK (Get all submit dates)","","Get submit dates & exported Answers data tests → Get exported data & dates after answer submit → Get dates after Answer submit → 200 OK (Get all submit dates)",""
"passed","Thu Oct 24 17:55:14 GMT 2024","Thu Oct 24 17:55:14 GMT 2024","409","","Update subjects","","200 OK: respondent","","""Subjects"" endpoints CRUD tests → Update subjects 200 OK: respondent",""
"passed","Thu Oct 24 17:40:39 GMT 2024","Thu Oct 24 17:40:39 GMT 2024","450","","Get Reviews tests →","","403 Forbidden (Get Review by respondent)","","Activity Assessment & Review CRUD tests → Get Assessment & Review tests → Get Reviews tests → 403 Forbidden (Get Review by respondent)",""
"passed","Thu Oct 24 17:58:50 GMT 2024","Thu Oct 24 17:58:50 GMT 2024","341","","Get workspace Folder Applets →","","404 Not Found (not existing workspace)","","Workspaces endpoints tests → Workspaces created → Get workspace Folder Applets → 404 Not Found (not existing workspace)",""
"passed","Thu Oct 24 17:55:33 GMT 2024","Thu Oct 24 17:55:33 GMT 2024","153","","422 Unprocessable Entity","","Create user with missing firstName param","","Create User tests → 422 Unprocessable Entity Create user with missing firstName param",""
"passed","Thu Oct 24 17:59:14 GMT 2024","Thu Oct 24 17:59:14 GMT 2024","147","","Get workspace applet respondent by id →","","401 Unauthorized","","Workspaces endpoints tests → Workspaces created → Get workspace applet respondent by id → 401 Unauthorized",""
"passed","Thu Oct 24 17:45:08 GMT 2024","Thu Oct 24 17:45:08 GMT 2024","370","","Delete all general scheduled Applet Events tests →","","404 Not Found (Delete all general scheduled Events of not existing Applet)","","Applet Events CRUD tests → Delete all general scheduled Applet Events tests → 404 Not Found (Delete all general scheduled Events of not existing Applet)",""
"passed","Thu Oct 24 17:49:33 GMT 2024","Thu Oct 24 17:49:33 GMT 2024","149","","Download Answer →","","401 Unauthorized","","Files upload/download tests → Upload/Download answers (applet files) → Download Answer → 401 Unauthorized",""
"passed","Thu Oct 24 17:38:00 GMT 2024","Thu Oct 24 17:38:00 GMT 2024","620","","Get exported data & dates after answer submit →","","200 OK (Get exported data by manager)","","Get submit dates & exported Answers data tests → Get exported data & dates after answer submit → 200 OK (Get exported data by manager)",""
"passed","Thu Oct 24 17:56:26 GMT 2024","Thu Oct 24 17:56:26 GMT 2024","344","","422 Unprocessable Entity","","Update user with missing firstName param","","Update User tests → 422 Unprocessable Entity Update user with missing firstName param",""
"passed","Thu Oct 24 17:42:05 GMT 2024","Thu Oct 24 17:42:05 GMT 2024","591","","Share applet to the library","","200 OK","","Applet Library tests → Share applet to the library 200 OK",""
"passed","Thu Oct 24 17:55:12 GMT 2024","Thu Oct 24 17:55:12 GMT 2024","148","","Get subjects","","401: Unauthorized","","""Subjects"" endpoints CRUD tests → Get subjects 401: Unauthorized",""
"passed","Thu Oct 24 17:57:23 GMT 2024","Thu Oct 24 17:57:23 GMT 2024","385","","Applet Owner creates another folder","","Get folders (manager)","","Workspace folder for different users tests → Manager is invited to the applet → Manager creates own folder in the same workspace Applet Owner and Manager add the same applet in their folders Applet Owner creates another folder Get folders (manager)",""
"passed","Thu Oct 24 17:57:01 GMT 2024","Thu Oct 24 17:57:01 GMT 2024","464","","Delete Folder →","","204 OK","","""Workspace Folders"" endpoints tests → Workspace is created → Delete Folder → 204 OK",""
"passed","Thu Oct 24 17:49:48 GMT 2024","Thu Oct 24 17:49:48 GMT 2024","152","","Upload Logs →","","401 Unauthorized","","Logs upload/download tests → Upload Logs → 401 Unauthorized",""
"passed","Thu Oct 24 17:58:48 GMT 2024","Thu Oct 24 17:58:48 GMT 2024","151","","Search workspace Applets →","","401 Unauthorized","","Workspaces endpoints tests → Workspaces created → Search workspace Applets → 401 Unauthorized",""
"passed","Thu Oct 24 17:51:38 GMT 2024","Thu Oct 24 17:51:38 GMT 2024","816","","200 OK (send to unregistered user)","","All properties, language: en","","Invitations endpoints tests → Send invitation → Invitation Managers Send → 200 OK (send to unregistered user) All properties, language: en",""
"passed","Thu Oct 24 17:50:55 GMT 2024","Thu Oct 24 17:51:00 GMT 2024","5510","","Invite unregistered user flow →","","New user should receive an e-mail with invitation","","Invitations scenario tests → Invite unregistered user flow → New user should receive an e-mail with invitation",""
"passed","Thu Oct 24 17:53:01 GMT 2024","Thu Oct 24 17:53:02 GMT 2024","1041","","Send shell account invitation to an existing respondent →","","Verify 2 or more shell accounts invitations can be sent to the same email","","Shell account invitation scenario tests → Send shell account invitation to an existing respondent → Verify 2 or more shell accounts invitations can be sent to the same email",""
"passed","Thu Oct 24 17:56:27 GMT 2024","Thu Oct 24 17:56:27 GMT 2024","289","","Get User Device Information →","","422 Unprocessable Entity","","Get User Device Information → 422 Unprocessable Entity",""
"passed","Thu Oct 24 17:55:18 GMT 2024","Thu Oct 24 17:55:18 GMT 2024","154","","Delete subjects","","401: Unauthorized","","""Subjects"" endpoints CRUD tests → Delete subjects 401: Unauthorized",""
"passed","Thu Oct 24 17:59:04 GMT 2024","Thu Oct 24 17:59:04 GMT 2024","145","","Negative tests →","","401 Unauthorized","","Workspaces endpoints tests → Workspaces created → Get workspace applet managers → Negative tests → 401 Unauthorized",""
"passed","Thu Oct 24 17:55:24 GMT 2024","Thu Oct 24 17:55:24 GMT 2024","152","","Create Theme →","","401 Unauthorized (invalid token)","","""Themes"" endpoints tests → Create Theme → 401 Unauthorized (invalid token)",""
"passed","Thu Oct 24 17:41:15 GMT 2024","Thu Oct 24 17:41:15 GMT 2024","472","","Get identifiers after answer submitting →","","200 OK (Get identifiers)","","Activity Versions & Identifiers tests → Get Identifiers tests → Get identifiers after answer submitting → 200 OK (Get identifiers)",""
"passed","Thu Oct 24 17:43:01 GMT 2024","Thu Oct 24 17:43:03 GMT 2024","2071","","Positive tests →","","Applet multiple flows with maximum parameters","","Applet builder tests → Create applet → Positive tests → Applet multiple flows with maximum parameters",""
"passed","Thu Oct 24 17:45:31 GMT 2024","Thu Oct 24 17:45:31 GMT 2024","294","","422 Unprocessable Entity →","","Update Event with missing endTime (periodicity type: DAILY) param","","Applet Events CRUD tests → Update Applet Event tests → 422 Unprocessable Entity → Update Event with missing endTime (periodicity type: DAILY) param",""
"passed","Thu Oct 24 17:42:10 GMT 2024","Thu Oct 24 17:42:10 GMT 2024","294","","Check Library item name →","","422 missing attribute (name)","","Applet Library tests → Applet is added to the library → Check Library item name → 422 missing attribute (name)",""
"passed","Thu Oct 24 17:53:54 GMT 2024","Thu Oct 24 17:53:54 GMT 2024","501","","Change organizer roles/permissions tests →","","403 Forbidden (Coordinator can NOT grant editor's permissions to respondent)","","Administration tests → Organizers tests → Change organizer roles/permissions tests → 403 Forbidden (Coordinator can NOT grant editor's permissions to respondent)",""
"passed","Thu Oct 24 17:44:53 GMT 2024","Thu Oct 24 17:44:53 GMT 2024","322","","422 Unprocessable Entity →","","Create Event with missing endTime (periodicity type: ONCE) param","","Applet Events CRUD tests → Create Events tests → 422 Unprocessable Entity → Create Event with missing endTime (periodicity type: ONCE) param",""
"passed","Thu Oct 24 17:42:50 GMT 2024","Thu Oct 24 17:42:50 GMT 2024","409","","Delete applet →","","404 Applet not found","","Applets CRUD endpoints tests → Delete applet → 404 Applet not found",""
"passed","Thu Oct 24 17:51:31 GMT 2024","Thu Oct 24 17:51:31 GMT 2024","776","","200 OK (send to unregistered user)","","With title","","Invitations endpoints tests → Send invitation → Invitation Reviewer Send → 200 OK (send to unregistered user) With title",""
"passed","Thu Oct 24 17:39:43 GMT 2024","Thu Oct 24 17:39:43 GMT 2024","431","","Answers CRUD tests →","","Applet owner should not get any Answers in activity answers list before invitation acceptance by respondent","","Answers CRUD tests → Applet owner should not get any Answers in activity answers list before invitation acceptance by respondent",""
"passed","Thu Oct 24 17:48:25 GMT 2024","Thu Oct 24 17:48:25 GMT 2024","357","","Transfer Decline →","","404 (invalid key)","","Applet ""Transfer Ownership"" endpoints tests → Transfer Decline → 404 (invalid key)",""
"passed","Thu Oct 24 17:48:35 GMT 2024","Thu Oct 24 17:48:35 GMT 2024","391","","Applets ""unique_name"" endpoint tests →","","200 OK: not unique name","","Applets ""unique_name"" endpoint tests → 200 OK: not unique name",""
"passed","Thu Oct 24 17:39:55 GMT 2024","Thu Oct 24 17:39:55 GMT 2024","404","","422 Unprocessable Entity →","","Create Answer with missing srartTime param","","Answers CRUD tests → Answers handling after invitation acceptance by respondent → Create Answer tests → 422 Unprocessable Entity → Create Answer with missing srartTime param",""
"passed","Thu Oct 24 17:53:42 GMT 2024","Thu Oct 24 17:53:43 GMT 2024","1278","","Invite new organizer tests →","","403 Forbidden (Coordinator can NOT invite manager, coordinator, editor)","","Administration tests → Organizers tests → Invite new organizer tests → 403 Forbidden (Coordinator can NOT invite manager, coordinator, editor)",""
"passed","Thu Oct 24 17:38:00 GMT 2024","Thu Oct 24 17:38:00 GMT 2024","669","","Get exported data & dates after answer submit →","","200 OK (Get exported data by respondent - should see only his own data)","","Get submit dates & exported Answers data tests → Get exported data & dates after answer submit → 200 OK (Get exported data by respondent - should see only his own data)",""
"passed","Thu Oct 24 17:53:01 GMT 2024","Thu Oct 24 17:53:01 GMT 2024","409","","Send shell account invitation to an existing respondent →","","Verify shell account invitation can't be sent to the already invited respondent's email","","Shell account invitation scenario tests → Send shell account invitation to an existing respondent → Verify shell account invitation can't be sent to the already invited respondent's email",""
"passed","Thu Oct 24 17:45:52 GMT 2024","Thu Oct 24 17:45:52 GMT 2024","278","","Create cross-day events tests →","","422 (Cross-day Event with WEEKDAYS periodicity type and availability range: 00:00:00-00:00:00)","","Applet Events CRUD tests → Create cross-day events tests → 422 (Cross-day Event with WEEKDAYS periodicity type and availability range: 00:00:00-00:00:00)",""
"passed","Thu Oct 24 17:42:10 GMT 2024","Thu Oct 24 17:42:10 GMT 2024","376","","Check Library item name →","","200 OK: new unique name","","Applet Library tests → Applet is added to the library → Check Library item name → 200 OK: new unique name",""
"passed","Thu Oct 24 17:58:20 GMT 2024","Thu Oct 24 17:58:20 GMT 2024","489","","Get workspace applets →","","200 OK","","Workspaces endpoints tests → Empty workspaces → Get workspace applets → 200 OK",""
"passed","Thu Oct 24 17:45:31 GMT 2024","Thu Oct 24 17:45:31 GMT 2024","291","","422 Unprocessable Entity →","","Update Event with missing startTime (periodicity type: DAILY) param","","Applet Events CRUD tests → Update Applet Event tests → 422 Unprocessable Entity → Update Event with missing startTime (periodicity type: DAILY) param",""
"passed","Thu Oct 24 17:50:01 GMT 2024","Thu Oct 24 17:50:01 GMT 2024","375","","Upload media files directly to storage (S3 bucket)","","Generate presigned media url","","Files upload/download directly to S3 bucket tests → Upload media files directly to storage (S3 bucket) Generate presigned media url",""
"passed","Thu Oct 24 17:37:14 GMT 2024","Thu Oct 24 17:37:14 GMT 2024","483","","Delete Note tests →","","404 Not Found (Delete Note for not existing activity)","","Answer Notes tests → Delete Note tests → 404 Not Found (Delete Note for not existing activity)",""
"passed","Thu Oct 24 17:47:00 GMT 2024","Thu Oct 24 17:47:00 GMT 2024","817","","Applets ""report configuration"" endpoint tests →","","200 OK (w/o server configuration)","","Applets ""report configuration"" endpoint tests → 200 OK (w/o server configuration)",""
"passed","Thu Oct 24 17:55:18 GMT 2024","Thu Oct 24 17:55:18 GMT 2024","617","","Delete subjects","","200 OK: manager","","""Subjects"" endpoints CRUD tests → Delete subjects 200 OK: manager",""
"passed","Thu Oct 24 17:51:44 GMT 2024","Thu Oct 24 17:51:44 GMT 2024","340","","Create shell account →","","403: Forbidden","","Invitations endpoints tests → Create shell account → 403: Forbidden",""
"passed","Thu Oct 24 17:38:08 GMT 2024","Thu Oct 24 17:38:11 GMT 2024","3294","","Create Answers for different item types tests →","","Multiselect item","","Create Answers for different item types tests → Multiselect item",""
"passed","Thu Oct 24 17:48:14 GMT 2024","Thu Oct 24 17:48:14 GMT 2024","369","","Transfer Initiate →","","422 invalid email","","Applet ""Transfer Ownership"" endpoints tests → Transfer Initiate → 422 invalid email",""
"passed","Thu Oct 24 17:42:21 GMT 2024","Thu Oct 24 17:42:21 GMT 2024","268","","Create Access link tests →","","422 Unprocessable Entity (Create Access link without required param)","","Access link tests → Create Access link tests → 422 Unprocessable Entity (Create Access link without required param)",""
"passed","Thu Oct 24 17:40:03 GMT 2024","Thu Oct 24 17:40:03 GMT 2024","367","","Get activity answers list & Answers of respondent tests →","","404 Not Found (Get activity answers list of not existing Applet)","","Answers CRUD tests → Answers handling after invitation acceptance by respondent → Get activity answers list & Answers of respondent tests → 404 Not Found (Get activity answers list of not existing Applet)",""
"passed","Thu Oct 24 17:58:43 GMT 2024","Thu Oct 24 17:58:43 GMT 2024","364","","Get workspace Applets →","","First applet owner gets own applets","","Workspaces endpoints tests → Workspaces created → Get workspace Applets → First applet owner gets own applets",""
"passed","Thu Oct 24 17:38:00 GMT 2024","Thu Oct 24 17:38:00 GMT 2024","496","","Get exported data & dates after answer submit →","","200 OK (Get exported data by applet owner)","","Get submit dates & exported Answers data tests → Get exported data & dates after answer submit → 200 OK (Get exported data by applet owner)",""
"passed","Thu Oct 24 17:45:52 GMT 2024","Thu Oct 24 17:45:52 GMT 2024","919","","Create cross-day events tests →","","201 Created (Cross-day Event with WEEKDAYS periodicity type and availability range: 23:59:00-23:58:00)","","Applet Events CRUD tests → Create cross-day events tests → 201 Created (Cross-day Event with WEEKDAYS periodicity type and availability range: 23:59:00-23:58:00)",""
"passed","Thu Oct 24 17:54:09 GMT 2024","Thu Oct 24 17:54:09 GMT 2024","447","","Create Applet in workspace of Applet owner tests →","","403 Forbidden (Respondent can NOT create Applet in workspace of Applet owner)","","Administration tests → Applets tests → Create Applet in workspace of Applet owner tests → 403 Forbidden (Respondent can NOT create Applet in workspace of Applet owner)",""
"passed","Thu Oct 24 17:55:29 GMT 2024","Thu Oct 24 17:55:29 GMT 2024","360","","Delete Theme →","","404 Not Found (non-existent theme)","","""Themes"" endpoints tests → Delete Theme → 404 Not Found (non-existent theme)",""
"passed","Thu Oct 24 17:51:28 GMT 2024","Thu Oct 24 17:51:28 GMT 2024","512","","Invitation Reviewer Send →","","400 - Incorrect respondents list","","Invitations endpoints tests → Send invitation → Invitation Reviewer Send → 400 - Incorrect respondents list",""
"passed","Thu Oct 24 17:47:39 GMT 2024","Thu Oct 24 17:47:40 GMT 2024","1916","","First receiver should become the owner →","","Verify transferred answers list","","Applet ""Transfer Ownership"" scenario tests → Transfer Accept → First receiver should become the owner → Verify transferred answers list",""
"passed","Thu Oct 24 17:55:14 GMT 2024","Thu Oct 24 17:55:14 GMT 2024","434","","Update subjects","","200 OK: manager","","""Subjects"" endpoints CRUD tests → Update subjects 200 OK: manager",""
