"DESCRIPTION","DURATION IN MS","NAME","PARENT SUITE","START TIME","STATUS","STOP TIME","SUB SUITE","SUITE","TEST CLASS","TEST METHOD"
"","494","Administration tests → Applets tests → Export & view data in workspace of Applet owner tests → View respondent's data tests → 200 OK (Applet owner can view data)","","Tue Sep 02 19:33:06 UTC 2025","passed","Tue Sep 02 19:33:06 UTC 2025","","View respondent's data tests →","200 OK (Applet owner can view data)",""
"","660","Workspaces endpoints tests → Workspaces created → Get workspace respondents → First workspace respondents","","Tue Sep 02 19:36:55 UTC 2025","failed","Tue Sep 02 19:36:55 UTC 2025","","Get workspace respondents →","First workspace respondents",""
"","80","Applets CRUD endpoints tests → Update applet → 401 Unauthorized","","Tue Sep 02 19:22:52 UTC 2025","passed","Tue Sep 02 19:22:52 UTC 2025","","Update applet →","401 Unauthorized",""
"","612","Applet versions endpoints tests → Update Applet → Add Activity → Remove Activity → Add Activity Flow → Remove Activity Flow → Add Activity Item → Remove Activity Item → Update Activity → Update Activity Item → Update Activity Flow → Get applet version by id","","Tue Sep 02 19:28:18 UTC 2025","passed","Tue Sep 02 19:28:18 UTC 2025","","Update Activity Flow →","Get applet version by id",""
"","503","Administration tests → Respondents tests → Invite new respondent tests → 200 OK (Coordinator can invite new respondent)","","Tue Sep 02 19:32:40 UTC 2025","passed","Tue Sep 02 19:32:40 UTC 2025","","Invite new respondent tests →","200 OK (Coordinator can invite new respondent)",""
"","1081","Applet ""Transfer Ownership"" scenario tests → Transfer Decline → Applet owner should remain the same after first user has declined transfer request","","Tue Sep 02 19:26:48 UTC 2025","passed","Tue Sep 02 19:26:49 UTC 2025","","Transfer Decline →","Applet owner should remain the same after first user has declined transfer request",""
"","386","Workspaces managers access tests → Set workspace managers applet access list → 403 Access denied (role = super_admin)","","Tue Sep 02 19:35:56 UTC 2025","passed","Tue Sep 02 19:35:56 UTC 2025","","Set workspace managers applet access list →","403 Access denied (role = super_admin)",""
"","158","Applet public links tests → Get public link tests → 200 Get public link by Id of created Applet","","Tue Sep 02 19:30:53 UTC 2025","passed","Tue Sep 02 19:30:53 UTC 2025","","Get public link tests →","200 Get public link by Id of created Applet",""
"","367","Administration tests → Transfer ownership of Applet tests → 403 Forbidden (Editor can not transfer ownership)","","Tue Sep 02 19:32:25 UTC 2025","passed","Tue Sep 02 19:32:25 UTC 2025","","Transfer ownership of Applet tests →","403 Forbidden (Editor can not transfer ownership)",""
"","452","Applet versions endpoints tests → Update Applet → Add Activity → Remove Activity → Add Activity Flow → Remove Activity Flow → Add Activity Item → Remove Activity Item → Update Activity → Update Activity Item → Update Activity Flow → Update Applet description → Get applet versions","","Tue Sep 02 19:28:22 UTC 2025","passed","Tue Sep 02 19:28:22 UTC 2025","","Update Applet description →","Get applet versions",""
"","80","Answers CRUD tests → Answers handling after invitation acceptance by respondent → Get activity answers list & Answers of respondent tests → 401 Unauthorized (Get Answer with not existing token)","","Tue Sep 02 19:20:20 UTC 2025","passed","Tue Sep 02 19:20:20 UTC 2025","","Get activity answers list & Answers of respondent tests →","401 Unauthorized (Get Answer with not existing token)",""
"","266","Activity Assessment & Review CRUD tests → Get Assessment & Review tests → Get Reviews tests → 404 Not Found (Get Review of not existing Answer)","","Tue Sep 02 19:20:55 UTC 2025","passed","Tue Sep 02 19:20:55 UTC 2025","","Get Reviews tests →","404 Not Found (Get Review of not existing Answer)",""
"","79","Applet public links tests → Accept Public invitation tests → 401 Unauthorized (Accept invitation with not existing token)","","Tue Sep 02 19:30:56 UTC 2025","passed","Tue Sep 02 19:30:56 UTC 2025","","Accept Public invitation tests →","401 Unauthorized (Accept invitation with not existing token)",""
"","284","Applet Events CRUD tests → Create Events tests → 422 Unprocessable Entity → Create Event with missing endTime (periodicity type: MONTHLY) param","","Tue Sep 02 19:24:30 UTC 2025","passed","Tue Sep 02 19:24:30 UTC 2025","","422 Unprocessable Entity →","Create Event with missing endTime (periodicity type: MONTHLY) param",""
"","299","Applet Library tests → Applet is added to the library → Cart test → 401 Unauthorized","","Tue Sep 02 19:22:25 UTC 2025","passed","Tue Sep 02 19:22:25 UTC 2025","","Cart test →","401 Unauthorized",""
"","816","Applets CRUD endpoints tests → Update applet → 400 Bad Request (duplicate name)","","Tue Sep 02 19:22:52 UTC 2025","failed","Tue Sep 02 19:22:52 UTC 2025","","Update applet →","400 Bad Request (duplicate name)",""
"","6040","Invitations scenario tests → Invite unregistered user flow → New user should receive an e-mail with invitation","","Tue Sep 02 19:30:03 UTC 2025","passed","Tue Sep 02 19:30:09 UTC 2025","","Invite unregistered user flow →","New user should receive an e-mail with invitation",""
"","536","User Password tests → Recover password tests → 201 Recover password","","Tue Sep 02 19:34:18 UTC 2025","passed","Tue Sep 02 19:34:18 UTC 2025","","Recover password tests →","201 Recover password",""
"","818","Applet builder tests → Create applet → Positive tests → Performance task activities: A/B Trails Tablet and A/B Trails Mobile","","Tue Sep 02 19:23:05 UTC 2025","passed","Tue Sep 02 19:23:05 UTC 2025","","Positive tests →","Performance task activities: A/B Trails Tablet and A/B Trails Mobile",""
"","182","Applet public access tests → Invite link with { requireLogin: true } created → Get public applet details: 404 Not found","","Tue Sep 02 19:26:06 UTC 2025","passed","Tue Sep 02 19:26:06 UTC 2025","","Invite link with { requireLogin: true } created →","Get public applet details: 404 Not found",""
"","213","""Themes"" endpoints tests → Create Theme → 401 Unauthorized (invalid token)","","Tue Sep 02 19:33:55 UTC 2025","passed","Tue Sep 02 19:33:55 UTC 2025","","Create Theme →","401 Unauthorized (invalid token)",""
"","504","Activity Assessment & Review CRUD tests → Delete Assessment tests → 404 Not Found (Delete not existing assessment)","","Tue Sep 02 19:21:00 UTC 2025","passed","Tue Sep 02 19:21:00 UTC 2025","","Delete Assessment tests →","404 Not Found (Delete not existing assessment)",""
"","413","Activity Assignments tests → Negative tests → Create Assignments → 404 Not Found: applet","","Tue Sep 02 19:17:30 UTC 2025","passed","Tue Sep 02 19:17:30 UTC 2025","","Create Assignments →","404 Not Found: applet",""
"","397","Workspaces endpoints tests → Workspaces created → Get workspace managers → Test for filters (query params) → Search → Search by firstName","","Tue Sep 02 19:37:01 UTC 2025","passed","Tue Sep 02 19:37:01 UTC 2025","","Search →","Search by firstName",""
"","386","Retrieve latest report negative tests → 404 Not Found (Get summary latest report of not existing Applet)","","Tue Sep 02 19:19:19 UTC 2025","passed","Tue Sep 02 19:19:19 UTC 2025","","Retrieve latest report negative tests →","404 Not Found (Get summary latest report of not existing Applet)",""
"","413","Workspaces endpoints tests → Workspaces created → Get workspace Applets → Test for filters (query params) → Get flat list","","Tue Sep 02 19:36:49 UTC 2025","passed","Tue Sep 02 19:36:49 UTC 2025","","Test for filters (query params) →","Get flat list",""
"","4216","Create Answers for different item types tests → SingleSelect item","","Tue Sep 02 19:18:35 UTC 2025","passed","Tue Sep 02 19:18:39 UTC 2025","","Create Answers for different item types tests →","SingleSelect item",""
"","623","Files upload/download directly to S3 bucket tests → Upload media files directly to storage (S3 bucket) Verify file is accessible by the link (can be downloaded)","","Tue Sep 02 19:29:14 UTC 2025","passed","Tue Sep 02 19:29:14 UTC 2025","","Upload media files directly to storage (S3 bucket)","Verify file is accessible by the link (can be downloaded)",""
"","383","Activity Versions & Identifiers tests → Get Identifiers tests → 404 Not Found (Get identifiers of not existing Applet)","","Tue Sep 02 19:21:31 UTC 2025","passed","Tue Sep 02 19:21:31 UTC 2025","","Get Identifiers tests →","404 Not Found (Get identifiers of not existing Applet)",""
"","276","Applet Library tests → Applet is added to the library → Check Library item name → 422 missing attribute (name)","","Tue Sep 02 19:22:21 UTC 2025","passed","Tue Sep 02 19:22:21 UTC 2025","","Check Library item name →","422 missing attribute (name)",""
"","2547","Administration tests → Applets tests → Update Applet in workspace of Applet owner tests → 200 OK (Editor can update Applet)","","Tue Sep 02 19:32:52 UTC 2025","passed","Tue Sep 02 19:32:54 UTC 2025","","Update Applet in workspace of Applet owner tests →","200 OK (Editor can update Applet)",""
"","80","Answer Notes tests → Create Notes tests → 401 Unauthorized (Create Note with not existing token)","","Tue Sep 02 19:17:41 UTC 2025","passed","Tue Sep 02 19:17:41 UTC 2025","","Create Notes tests →","401 Unauthorized (Create Note with not existing token)",""
"","648","Applet versions endpoints tests → Update Applet → Add Activity → Remove Activity → Get applet version by id","","Tue Sep 02 19:27:51 UTC 2025","passed","Tue Sep 02 19:27:51 UTC 2025","","Remove Activity →","Get applet version by id",""
"","274","Applets ""setFolder"" endpoint tests → 422 missing attribute (appletId)","","Tue Sep 02 19:26:12 UTC 2025","passed","Tue Sep 02 19:26:12 UTC 2025","","Applets ""setFolder"" endpoint tests →","422 missing attribute (appletId)",""
"","434","Answers CRUD tests → Answers handling after invitation acceptance by respondent → Get activity answers list & Answers of respondent tests → 200 OK (Get Answer of respondent (answer type - singleSelect))","","Tue Sep 02 19:20:20 UTC 2025","passed","Tue Sep 02 19:20:20 UTC 2025","","Get activity answers list & Answers of respondent tests →","200 OK (Get Answer of respondent (answer type - singleSelect))",""
"","387","Get applet completed activities tests → 403 Forbidden (for another user)","","Tue Sep 02 19:17:51 UTC 2025","passed","Tue Sep 02 19:17:51 UTC 2025","","Get applet completed activities tests →","403 Forbidden (for another user)",""
"","271","Administration tests → Applets tests → Duplicate Applet in workspace of Applet owner tests → 403 Forbidden (Respondent can NOT duplicate Applet)","","Tue Sep 02 19:32:59 UTC 2025","passed","Tue Sep 02 19:32:59 UTC 2025","","Duplicate Applet in workspace of Applet owner tests →","403 Forbidden (Respondent can NOT duplicate Applet)",""
"","1244","Applet Library tests → Applet is added to the library → Cart test → Add item to cart","","Tue Sep 02 19:22:25 UTC 2025","passed","Tue Sep 02 19:22:26 UTC 2025","","Cart test →","Add item to cart",""
"","484","Shell account invitation scenario tests → Decline invitation by unregistered user → Verify shell account remains the same in the list of respondents","","Tue Sep 02 19:31:35 UTC 2025","failed","Tue Sep 02 19:31:35 UTC 2025","","Decline invitation by unregistered user →","Verify shell account remains the same in the list of respondents",""
"","206","Applet Events CRUD tests → Update Applet Event tests → 422 Unprocessable Entity → Update Event with missing startTime (periodicity type: ONCE) param","","Tue Sep 02 19:25:00 UTC 2025","passed","Tue Sep 02 19:25:00 UTC 2025","","422 Unprocessable Entity →","Update Event with missing startTime (periodicity type: ONCE) param",""
"","336","Get submit dates & exported Answers data tests → Get exported data & dates after answer submit → 200 OK (Get exported data by reviewer with assigned respondent)","","Tue Sep 02 19:18:29 UTC 2025","failed","Tue Sep 02 19:18:29 UTC 2025","","Get exported data & dates after answer submit →","200 OK (Get exported data by reviewer with assigned respondent)",""
"","236","""Workspace Folders"" endpoints tests → Workspace is created → Pin/Unpin Folder → Unpin Folder → 204 OK","","Tue Sep 02 19:35:22 UTC 2025","passed","Tue Sep 02 19:35:22 UTC 2025","","Unpin Folder →","204 OK",""
"","309","Applet Events CRUD tests → Create cross-day events tests → 422 (Cross-day Event with DAILY periodicity type and availability range: 23:59:00-23:59:00)","","Tue Sep 02 19:25:17 UTC 2025","passed","Tue Sep 02 19:25:17 UTC 2025","","Create cross-day events tests →","422 (Cross-day Event with DAILY periodicity type and availability range: 23:59:00-23:59:00)",""
"","301","Applet Events CRUD tests → Update Applet Event tests → 422 Unprocessable Entity → Update Event with missing timer param (timer type: TIMER)","","Tue Sep 02 19:25:00 UTC 2025","passed","Tue Sep 02 19:25:00 UTC 2025","","422 Unprocessable Entity →","Update Event with missing timer param (timer type: TIMER)",""
"","386","Invitations endpoints tests → Decline invitation → 404 - non-existent invitation key","","Tue Sep 02 19:30:22 UTC 2025","passed","Tue Sep 02 19:30:22 UTC 2025","","Decline invitation →","404 - non-existent invitation key",""
"","1734","Shell account invitation scenario tests → Accept invitation by unregistered user → New user registers in the app","","Tue Sep 02 19:31:24 UTC 2025","passed","Tue Sep 02 19:31:25 UTC 2025","","Accept invitation by unregistered user →","New user registers in the app",""
"","214","Applet Library tests → Share applet to the library 401 Unauthorized","","Tue Sep 02 19:22:16 UTC 2025","passed","Tue Sep 02 19:22:16 UTC 2025","","Share applet to the library","401 Unauthorized",""
"","78","Applets CRUD endpoints tests → Get applets list → 401 Unauthorized","","Tue Sep 02 19:22:43 UTC 2025","passed","Tue Sep 02 19:22:43 UTC 2025","","Get applets list →","401 Unauthorized",""
"","376","Applet versions endpoints tests → Get applet version by id → 404 (incorrect versionId)","","Tue Sep 02 19:27:45 UTC 2025","passed","Tue Sep 02 19:27:45 UTC 2025","","Get applet version by id →","404 (incorrect versionId)",""
"","247","Invitations scenario tests → Accept invitation positive flow → Invited user can't see invitation anymore","","Tue Sep 02 19:29:44 UTC 2025","passed","Tue Sep 02 19:29:44 UTC 2025","","Accept invitation positive flow →","Invited user can't see invitation anymore",""
"","361","Administration tests → Applets tests → Export & view data in workspace of Applet owner tests → View respondent's data tests → 200 OK (Reviewer with assigned respondents can view their data)","","Tue Sep 02 19:33:06 UTC 2025","passed","Tue Sep 02 19:33:06 UTC 2025","","View respondent's data tests →","200 OK (Reviewer with assigned respondents can view their data)",""
"","291","Administration tests → Applets tests → View General calendar in workspace of Applet owner tests → 403 Forbidden (Respondent can NOT view General calendar)","","Tue Sep 02 19:33:01 UTC 2025","passed","Tue Sep 02 19:33:01 UTC 2025","","View General calendar in workspace of Applet owner tests →","403 Forbidden (Respondent can NOT view General calendar)",""
"","280","Access link tests → Create Access link tests → 422 Unprocessable Entity (Create Access link without required param)","","Tue Sep 02 19:22:31 UTC 2025","passed","Tue Sep 02 19:22:31 UTC 2025","","Create Access link tests →","422 Unprocessable Entity (Create Access link without required param)",""
"","411","Workspaces endpoints tests → Workspaces created → Get workspace Applets → Second applet owner gets own applets","","Tue Sep 02 19:36:44 UTC 2025","passed","Tue Sep 02 19:36:44 UTC 2025","","Get workspace Applets →","Second applet owner gets own applets",""
"","225","Applets ""unique_name"" endpoint tests → 200 OK: not unique name","","Tue Sep 02 19:27:37 UTC 2025","passed","Tue Sep 02 19:27:37 UTC 2025","","Applets ""unique_name"" endpoint tests →","200 OK: not unique name",""
"","489","Applet ""Transfer Ownership"" scenario tests → Transfer Accept → First receiver should become the owner → Verify transferred answers list","","Tue Sep 02 19:26:44 UTC 2025","passed","Tue Sep 02 19:26:44 UTC 2025","","First receiver should become the owner →","Verify transferred answers list",""
"","373","Workspaces endpoints tests → Workspaces created → Search workspace Applets → 404 Not Found (not existing workspace)","","Tue Sep 02 19:36:50 UTC 2025","passed","Tue Sep 02 19:36:50 UTC 2025","","Search workspace Applets →","404 Not Found (not existing workspace)",""
"","430","Files upload/download tests → Upload/Download answers (applet files) → Check answer (file) uploaded → 200 OK (empty list)","","Tue Sep 02 19:28:56 UTC 2025","passed","Tue Sep 02 19:28:56 UTC 2025","","Check answer (file) uploaded →","200 OK (empty list)",""
"","313","Activity Assessment & Review CRUD tests → Get Assessment & Review tests → Get Reviews tests → 200 OK (no Review data)","","Tue Sep 02 19:20:55 UTC 2025","passed","Tue Sep 02 19:20:55 UTC 2025","","Get Reviews tests →","200 OK (no Review data)",""
"","373","Administration tests → Transfer ownership of Applet tests → 403 Forbidden (Manager can not transfer ownership)","","Tue Sep 02 19:32:25 UTC 2025","passed","Tue Sep 02 19:32:25 UTC 2025","","Transfer ownership of Applet tests →","403 Forbidden (Manager can not transfer ownership)",""
"","359","Invitations endpoints tests → Send invitation → Invitation Respondent Send → 200 OK (send to existing user)","","Tue Sep 02 19:30:26 UTC 2025","passed","Tue Sep 02 19:30:26 UTC 2025","","Invitation Respondent Send →","200 OK (send to existing user)",""
"","786","Workspaces managers access tests → Remove manager access → 200 OK (empty appletIds)","","Tue Sep 02 19:36:02 UTC 2025","passed","Tue Sep 02 19:36:02 UTC 2025","","Remove manager access →","200 OK (empty appletIds)",""
"","437","Flow Versions & Identifiers tests → Get flow Identifiers tests → 200 OK (empty list of flow identifiers)","","Tue Sep 02 19:21:15 UTC 2025","passed","Tue Sep 02 19:21:15 UTC 2025","","Get flow Identifiers tests →","200 OK (empty list of flow identifiers)",""
"","307","Applet Events CRUD tests → Create Events tests → 422 Unprocessable Entity → Create Event with missing startTime (periodicity type: DAILY) param","","Tue Sep 02 19:24:30 UTC 2025","passed","Tue Sep 02 19:24:30 UTC 2025","","422 Unprocessable Entity →","Create Event with missing startTime (periodicity type: DAILY) param",""
"","730","Invitations endpoints tests → Send invitation → Invitation Managers Send → 200 OK (send to unregistered user) Role = editor","","Tue Sep 02 19:30:40 UTC 2025","passed","Tue Sep 02 19:30:40 UTC 2025","","200 OK (send to unregistered user)","Role = editor",""
"","79","Invitations endpoints tests → Decline invitation → 401 Unauthorized (invalid token)","","Tue Sep 02 19:30:22 UTC 2025","passed","Tue Sep 02 19:30:22 UTC 2025","","Decline invitation →","401 Unauthorized (invalid token)",""
"","273","Activity Assessment & Review CRUD tests → Submit Assessment tests → 422 Unprocessable Entity → Create Assessment with missing assessmentVersionId param","","Tue Sep 02 19:20:59 UTC 2025","passed","Tue Sep 02 19:20:59 UTC 2025","","422 Unprocessable Entity →","Create Assessment with missing assessmentVersionId param",""
"","663","Applet Events CRUD tests → Delete all general scheduled Applet Events tests → 204 No Content (Delete all general scheduled Events)","","Tue Sep 02 19:24:41 UTC 2025","passed","Tue Sep 02 19:24:41 UTC 2025","","Delete all general scheduled Applet Events tests →","204 No Content (Delete all general scheduled Events)",""
"","3062","Create Answers for different item types tests → Number select item","","Tue Sep 02 19:18:35 UTC 2025","passed","Tue Sep 02 19:18:38 UTC 2025","","Create Answers for different item types tests →","Number select item",""
"","83","Applets ""report configuration"" endpoint tests → 401 Unauthorized","","Tue Sep 02 19:26:08 UTC 2025","passed","Tue Sep 02 19:26:08 UTC 2025","","Applets ""report configuration"" endpoint tests →","401 Unauthorized",""
"","416","Invitations scenario tests → Re-send invitation flow → Same user can't be invited again","","Tue Sep 02 19:29:56 UTC 2025","passed","Tue Sep 02 19:29:56 UTC 2025","","Re-send invitation flow →","Same user can't be invited again",""
"","155","Applets CRUD endpoints tests → Update applet → 422 Unprocessable Entity (missing attribute) Missing ""activity flows""","","Tue Sep 02 19:22:54 UTC 2025","failed","Tue Sep 02 19:22:54 UTC 2025","","422 Unprocessable Entity (missing attribute)","Missing ""activity flows""",""
"","730","Create User tests → 201 Create User","","Tue Sep 02 19:34:02 UTC 2025","passed","Tue Sep 02 19:34:02 UTC 2025","","Create User tests →","201 Create User",""
"","402","Workspaces endpoints tests → Workspaces created → Get user workspaces → Reviewer user","","Tue Sep 02 19:36:42 UTC 2025","passed","Tue Sep 02 19:36:42 UTC 2025","","Get user workspaces →","Reviewer user",""
"","276","Invitations endpoints tests → Accept invitation → 422 - invalid invitation key","","Tue Sep 02 19:30:19 UTC 2025","passed","Tue Sep 02 19:30:19 UTC 2025","","Accept invitation →","422 - invalid invitation key",""
"","256","Get applet completed activities tests → 200 OK (empty): no answers submitted yet","","Tue Sep 02 19:17:51 UTC 2025","passed","Tue Sep 02 19:17:51 UTC 2025","","Get applet completed activities tests →","200 OK (empty): no answers submitted yet",""
"","241","Workspaces endpoints tests → Workspaces created → Get workspace applet respondent by id → 404 not found (invalid applet id)","","Tue Sep 02 19:37:11 UTC 2025","passed","Tue Sep 02 19:37:11 UTC 2025","","Get workspace applet respondent by id →","404 not found (invalid applet id)",""
"","664","Applet Events CRUD tests → Update Applet Event tests → 404 Not Found (Update general scheduled activity Event with not existing id)","","Tue Sep 02 19:24:57 UTC 2025","passed","Tue Sep 02 19:24:57 UTC 2025","","Update Applet Event tests →","404 Not Found (Update general scheduled activity Event with not existing id)",""
"","151","Logs upload/download tests → Download Logs → 403 Forbidden (for all other users)","","Tue Sep 02 19:29:04 UTC 2025","passed","Tue Sep 02 19:29:04 UTC 2025","","Download Logs →","403 Forbidden (for all other users)",""
"","956","Activity Assignments tests → Positive tests → Create empty assignment","","Tue Sep 02 19:17:25 UTC 2025","passed","Tue Sep 02 19:17:25 UTC 2025","","Positive tests →","Create empty assignment",""
"","403","Flow Versions & Identifiers tests → Get flow Versions tests → 200 OK (default version after Applet creation)","","Tue Sep 02 19:21:07 UTC 2025","passed","Tue Sep 02 19:21:07 UTC 2025","","Get flow Versions tests →","200 OK (default version after Applet creation)",""
"","483","Applet versions endpoints tests → Update Applet → Add Activity → Remove Activity → Add Activity Flow → Remove Activity Flow → Add Activity Item → Remove Activity Item → Update Activity → Get applet version changes","","Tue Sep 02 19:28:11 UTC 2025","passed","Tue Sep 02 19:28:11 UTC 2025","","Update Activity →","Get applet version changes",""
"","680","Invitations endpoints tests → Send invitation → Invitation Managers Send → 200 OK (send to unregistered user) All properties, language: en","","Tue Sep 02 19:30:40 UTC 2025","passed","Tue Sep 02 19:30:40 UTC 2025","","200 OK (send to unregistered user)","All properties, language: en",""
"","191","Applet Events CRUD tests → Create Events tests → 422 Unprocessable Entity → Missing oneTimeCompletion (periodicity type: ALWAYS)","","Tue Sep 02 19:24:30 UTC 2025","passed","Tue Sep 02 19:24:30 UTC 2025","","422 Unprocessable Entity →","Missing oneTimeCompletion (periodicity type: ALWAYS)",""
"","384","Invitations scenario tests → Accept invitation positive flow → Invited user can retrieve invitation","","Tue Sep 02 19:29:44 UTC 2025","passed","Tue Sep 02 19:29:44 UTC 2025","","Accept invitation positive flow →","Invited user can retrieve invitation",""
"","285","Invitations endpoints tests → Send invitation → Invitation Reviewer Send → 422 - Incorrect ""language"" value","","Tue Sep 02 19:30:31 UTC 2025","failed","Tue Sep 02 19:30:31 UTC 2025","","Invitation Reviewer Send →","422 - Incorrect ""language"" value",""
"","2547","Create Answers for different item types tests → A/B Mobile performance task","","Tue Sep 02 19:18:35 UTC 2025","passed","Tue Sep 02 19:18:37 UTC 2025","","Create Answers for different item types tests →","A/B Mobile performance task",""
"","215","Files upload/download tests → Upload/Download answers (applet files) → Upload Answer → 401 Unauthorized","","Tue Sep 02 19:28:49 UTC 2025","passed","Tue Sep 02 19:28:49 UTC 2025","","Upload Answer →","401 Unauthorized",""
"","373","Applet Library tests → Share applet to the library 403 invalid applet id","","Tue Sep 02 19:22:16 UTC 2025","passed","Tue Sep 02 19:22:16 UTC 2025","","Share applet to the library","403 invalid applet id",""
"","438","Applets ""retentions"" endpoint tests → 200 OK → 1 indefinitely","","Tue Sep 02 19:23:58 UTC 2025","passed","Tue Sep 02 19:23:58 UTC 2025","","200 OK →","1 indefinitely",""
