"DESCRIPTION","DURATION IN MS","NAME","PARENT SUITE","START TIME","STATUS","STOP TIME","SUB SUITE","SUITE","TEST CLASS","TEST METHOD"
"","409","Retrieve latest report negative tests → 400 Bad request (Get summary latest report with not existing Activity)","","Tue Sep 02 19:19:19 UTC 2025","passed","Tue Sep 02 19:19:19 UTC 2025","","Retrieve latest report negative tests →","400 Bad request (Get summary latest report with not existing Activity)",""
"","167","Applet Events CRUD tests → Update Applet Event tests → 422 Unprocessable Entity → Update Event with missing endTime (periodicity type: ONCE) param","","Tue Sep 02 19:25:00 UTC 2025","passed","Tue Sep 02 19:25:00 UTC 2025","","422 Unprocessable Entity →","Update Event with missing endTime (periodicity type: ONCE) param",""
"","402","Invitations endpoints tests → Send invitation → Invitation Respondent Send → 200 OK (send to unregistered user) W/o nickname, language: fr","","Tue Sep 02 19:30:28 UTC 2025","passed","Tue Sep 02 19:30:28 UTC 2025","","200 OK (send to unregistered user)","W/o nickname, language: fr",""
"","3770","Files upload/download tests → Download File → 200 OK","","Tue Sep 02 19:28:43 UTC 2025","passed","Tue Sep 02 19:28:46 UTC 2025","","Download File →","200 OK",""
"","172","""Workspace Folders"" endpoints tests → Workspace is created → Delete Folder → 404 Not Found (non-existent folder)","","Tue Sep 02 19:35:19 UTC 2025","passed","Tue Sep 02 19:35:19 UTC 2025","","Delete Folder →","404 Not Found (non-existent folder)",""
"","378","Applet Events CRUD tests → Create cross-day events tests → 422 (Cross-day Event with WEEKDAYS periodicity type and availability range: 15:30:00-15:30:00)","","Tue Sep 02 19:25:17 UTC 2025","passed","Tue Sep 02 19:25:17 UTC 2025","","Create cross-day events tests →","422 (Cross-day Event with WEEKDAYS periodicity type and availability range: 15:30:00-15:30:00)",""
"","281","Answer Notes tests → Get Notes list tests → Get Notes list (not empty) 404 Not Found (Get Note list of not existing Applet)","","Tue Sep 02 19:17:39 UTC 2025","passed","Tue Sep 02 19:17:39 UTC 2025","","Get Notes list (not empty)","404 Not Found (Get Note list of not existing Applet)",""
"","401","Workspaces managers access tests → Get workspace roles list → 200 OK","","Tue Sep 02 19:36:06 UTC 2025","passed","Tue Sep 02 19:36:06 UTC 2025","","Get workspace roles list →","200 OK",""
"","491","Workspaces endpoints tests → Workspaces created → Get workspace applet respondents → Second workspace second applet respondents","","Tue Sep 02 19:36:57 UTC 2025","failed","Tue Sep 02 19:36:57 UTC 2025","","Get workspace applet respondents →","Second workspace second applet respondents",""
"","375","Invitations endpoints tests → Create shell account → 403: Forbidden","","Tue Sep 02 19:30:45 UTC 2025","passed","Tue Sep 02 19:30:45 UTC 2025","","Create shell account →","403: Forbidden",""
"","86","Answers CRUD tests → Answers handling after invitation acceptance by respondent → Check answer existence tests → 401 Unauthorized (Get Answer with not existing token)","","Tue Sep 02 19:20:16 UTC 2025","passed","Tue Sep 02 19:20:16 UTC 2025","","Check answer existence tests →","401 Unauthorized (Get Answer with not existing token)",""
"","81","Get submit dates & exported Answers data tests → Get dates before Answer submit → 401 Unauthorized (Get submit dates with not existing token)","","Tue Sep 02 19:18:27 UTC 2025","passed","Tue Sep 02 19:18:27 UTC 2025","","Get dates before Answer submit →","401 Unauthorized (Get submit dates with not existing token)",""
"","710","Workspaces endpoints tests → Workspaces created → Pin user (manager) on workspace → 200 OK","","Tue Sep 02 19:37:08 UTC 2025","passed","Tue Sep 02 19:37:08 UTC 2025","","Pin user (manager) on workspace →","200 OK",""
"","284","Duplicate Applet endpoint tests → 422 missing attribute (displayName)","","Tue Sep 02 19:24:01 UTC 2025","passed","Tue Sep 02 19:24:01 UTC 2025","","Duplicate Applet endpoint tests →","422 missing attribute (displayName)",""
"","565","Summary & Review activities tests → Get Summary and Review Activities (non-empty list) tests → Get Summary Activities list tests → 200 OK (non-empty list)","","Tue Sep 02 19:21:57 UTC 2025","passed","Tue Sep 02 19:21:57 UTC 2025","","Get Summary Activities list tests →","200 OK (non-empty list)",""
"","401","Administration tests → Respondents tests → Invite new reviewer for a specific respondent tests → 403 Forbidden (Respondent can NOT invite new reviewer for a specific respondent)","","Tue Sep 02 19:32:45 UTC 2025","passed","Tue Sep 02 19:32:45 UTC 2025","","Invite new reviewer for a specific respondent tests →","403 Forbidden (Respondent can NOT invite new reviewer for a specific respondent)",""
"","457","""Subjects"" endpoints CRUD tests → Delete subjects 200 OK: respondent","","Tue Sep 02 19:33:50 UTC 2025","passed","Tue Sep 02 19:33:50 UTC 2025","","Delete subjects","200 OK: respondent",""
"","271","Workspaces endpoints tests → Workspaces created → Get user workspaces → Second applet owner","","Tue Sep 02 19:36:42 UTC 2025","passed","Tue Sep 02 19:36:42 UTC 2025","","Get user workspaces →","Second applet owner",""
"","388","Workspaces endpoints tests → Workspaces created → Get user workspaces → Respondent user","","Tue Sep 02 19:36:42 UTC 2025","passed","Tue Sep 02 19:36:42 UTC 2025","","Get user workspaces →","Respondent user",""
"","1964","Applet Events CRUD tests → Count scheduled Applet Events tests → Count general scheduled Events after their creation and deletion","","Tue Sep 02 19:25:05 UTC 2025","passed","Tue Sep 02 19:25:06 UTC 2025","","Count scheduled Applet Events tests →","Count general scheduled Events after their creation and deletion",""
"","229","Administration tests → Transfer ownership of Applet tests → 403 Forbidden (Reviewer can not transfer ownership)","","Tue Sep 02 19:32:25 UTC 2025","passed","Tue Sep 02 19:32:25 UTC 2025","","Transfer ownership of Applet tests →","403 Forbidden (Reviewer can not transfer ownership)",""
"","558","Get Assessment & Review of updated activity tests → Switch to a new assessment version Get Review info after switching to a new assessment version","","Tue Sep 02 19:20:43 UTC 2025","failed","Tue Sep 02 19:20:43 UTC 2025","","Switch to a new assessment version","Get Review info after switching to a new assessment version",""
"","383","Shell account invitation scenario tests → Decline invitation by unregistered user → Verify Invitation key expires after declining the invite","","Tue Sep 02 19:31:35 UTC 2025","passed","Tue Sep 02 19:31:35 UTC 2025","","Decline invitation by unregistered user →","Verify Invitation key expires after declining the invite",""
"","285","Invitations endpoints tests → Send invitation → Invitation Managers Send → 422 Missing attributes Missing lastName","","Tue Sep 02 19:30:43 UTC 2025","passed","Tue Sep 02 19:30:43 UTC 2025","","422 Missing attributes","Missing lastName",""
"","244","Workspaces managers access tests → Remove manager access → 403 Forbidden (try to remove access to not-related applet)","","Tue Sep 02 19:36:02 UTC 2025","passed","Tue Sep 02 19:36:02 UTC 2025","","Remove manager access →","403 Forbidden (try to remove access to not-related applet)",""
"","278","Duplicate Applet endpoint tests → 422 missing attribute (encryption)","","Tue Sep 02 19:24:01 UTC 2025","passed","Tue Sep 02 19:24:01 UTC 2025","","Duplicate Applet endpoint tests →","422 missing attribute (encryption)",""
"","415","Invitations endpoints tests → Decline invitation → 200 OK","","Tue Sep 02 19:30:22 UTC 2025","passed","Tue Sep 02 19:30:22 UTC 2025","","Decline invitation →","200 OK",""
"","272","Applets CRUD endpoints tests → Create applet → 403 Forbidden (non-existent workspace)","","Tue Sep 02 19:22:47 UTC 2025","passed","Tue Sep 02 19:22:47 UTC 2025","","Create applet →","403 Forbidden (non-existent workspace)",""
"","388","Activity Versions & Identifiers tests → Get Versions tests → 404 Not Found (Get versions of not existing activityId)","","Tue Sep 02 19:21:23 UTC 2025","passed","Tue Sep 02 19:21:23 UTC 2025","","Get Versions tests →","404 Not Found (Get versions of not existing activityId)",""
"","509","Administration tests → Organizers tests → View all organizers tests → 200 OK (Applet owner can view organizers)","","Tue Sep 02 19:32:35 UTC 2025","passed","Tue Sep 02 19:32:35 UTC 2025","","View all organizers tests →","200 OK (Applet owner can view organizers)",""
"","986","Logs upload/download tests → Download Logs → 200 OK (empty list)","","Tue Sep 02 19:29:04 UTC 2025","passed","Tue Sep 02 19:29:04 UTC 2025","","Download Logs →","200 OK (empty list)",""
"","212","Applet Events CRUD tests → Remove individual scheduled Applet Events negative tests → 401 Unauthorized (Remove scheduled Events of a particular user with not existing appletOwnerToken)","","Tue Sep 02 19:25:11 UTC 2025","passed","Tue Sep 02 19:25:11 UTC 2025","","Remove individual scheduled Applet Events negative tests →","401 Unauthorized (Remove scheduled Events of a particular user with not existing appletOwnerToken)",""
"","252","Access link tests → Get Access link tests → 200 OK (Get created Access link)","","Tue Sep 02 19:22:32 UTC 2025","passed","Tue Sep 02 19:22:32 UTC 2025","","Get Access link tests →","200 OK (Get created Access link)",""
"","1032","Answers scenario tests → Manager should be able to see Answers of respondent","","Tue Sep 02 19:19:28 UTC 2025","passed","Tue Sep 02 19:19:29 UTC 2025","","Answers scenario tests →","Manager should be able to see Answers of respondent",""
"","415","Applet Events CRUD tests → Remove individual scheduled Applet Events negative tests → 404 Not Found (Remove scheduled Events of a particular user with not existing Applet)","","Tue Sep 02 19:25:11 UTC 2025","passed","Tue Sep 02 19:25:11 UTC 2025","","Remove individual scheduled Applet Events negative tests →","404 Not Found (Remove scheduled Events of a particular user with not existing Applet)",""
"","265","Logs upload/download tests → Download Logs → 404 Not Found","","Tue Sep 02 19:29:04 UTC 2025","passed","Tue Sep 02 19:29:04 UTC 2025","","Download Logs →","404 Not Found",""
"","83","Retrieve latest report negative tests → 401 Unauthorized (Get summary latest report with not existing token)","","Tue Sep 02 19:19:19 UTC 2025","passed","Tue Sep 02 19:19:19 UTC 2025","","Retrieve latest report negative tests →","401 Unauthorized (Get summary latest report with not existing token)",""
"","297","Answer Notes tests → Delete Note tests → 404 Not Found (Delete Note for not existing activity)","","Tue Sep 02 19:17:47 UTC 2025","passed","Tue Sep 02 19:17:47 UTC 2025","","Delete Note tests →","404 Not Found (Delete Note for not existing activity)",""
"","282","Multiinformant assessment validate tests → 200 OK: invalid source subject Id","","Tue Sep 02 19:21:37 UTC 2025","passed","Tue Sep 02 19:21:37 UTC 2025","","Multiinformant assessment validate tests →","200 OK: invalid source subject Id",""
"","284","Activity Assignments tests → Negative tests → Get Assignments list → 401 Unauthorised","","Tue Sep 02 19:17:31 UTC 2025","passed","Tue Sep 02 19:17:31 UTC 2025","","Get Assignments list →","401 Unauthorised",""
"","259","Invitations scenario tests → Decline invitation positive flow → Invited user declines invitation","","Tue Sep 02 19:29:50 UTC 2025","passed","Tue Sep 02 19:29:50 UTC 2025","","Decline invitation positive flow →","Invited user declines invitation",""
"","212","Workspaces endpoints tests → Empty workspaces → Get user workspaces → 401 Unauthorized","","Tue Sep 02 19:36:24 UTC 2025","passed","Tue Sep 02 19:36:24 UTC 2025","","Get user workspaces →","401 Unauthorized",""
"","370","Multiinformant assessment validate tests → 422: Unprocessable Entity","","Tue Sep 02 19:21:37 UTC 2025","passed","Tue Sep 02 19:21:37 UTC 2025","","Multiinformant assessment validate tests →","422: Unprocessable Entity",""
"","166","Invitations endpoints tests → Send invitation → Invitation Reviewer Send → 422 Missing attributes Missing subjects","","Tue Sep 02 19:30:36 UTC 2025","passed","Tue Sep 02 19:30:36 UTC 2025","","422 Missing attributes","Missing subjects",""
"","415","""Subjects"" endpoints CRUD tests → Delete subjects 422: Missing deleteAnswers flag","","Tue Sep 02 19:33:50 UTC 2025","passed","Tue Sep 02 19:33:50 UTC 2025","","Delete subjects","422: Missing deleteAnswers flag",""
"","388","Answer Notes tests → Get Notes list tests → Get Notes list (not empty) 404 Not Found (Get Note list for not existing activity)","","Tue Sep 02 19:17:39 UTC 2025","passed","Tue Sep 02 19:17:39 UTC 2025","","Get Notes list (not empty)","404 Not Found (Get Note list for not existing activity)",""
"","301","Answers CRUD tests → Answers handling after invitation acceptance by respondent → Check answer existence tests → 200 OK (exists = true, check by respondent)","","Tue Sep 02 19:20:16 UTC 2025","passed","Tue Sep 02 19:20:16 UTC 2025","","Check answer existence tests →","200 OK (exists = true, check by respondent)",""
"","255","Applet Events CRUD tests → Delete all general scheduled Applet Events tests → 404 Not Found (Delete all general scheduled Events of not existing Applet)","","Tue Sep 02 19:24:41 UTC 2025","passed","Tue Sep 02 19:24:41 UTC 2025","","Delete all general scheduled Applet Events tests →","404 Not Found (Delete all general scheduled Events of not existing Applet)",""
"","656","Administration tests → Applets tests → Duplicate Applet in workspace of Applet owner tests → 201 Created (Editor can duplicate Applet)","","Tue Sep 02 19:32:59 UTC 2025","passed","Tue Sep 02 19:32:59 UTC 2025","","Duplicate Applet in workspace of Applet owner tests →","201 Created (Editor can duplicate Applet)",""
"","248","Get applet completed activities tests → Respondent completes the 1st activity within default always available event → Respondent completes the 2nd activity within oneTimeCompletion Event → Respondent completes activities within the activity flow → 200 OK : activity flow completion should be present","","Tue Sep 02 19:18:05 UTC 2025","passed","Tue Sep 02 19:18:05 UTC 2025","","Respondent completes activities within the activity flow →","200 OK : activity flow completion should be present",""
"","489","Applet versions endpoints tests → Update Applet → Add Activity → Remove Activity → Add Activity Flow → Remove Activity Flow → Get applet version changes","","Tue Sep 02 19:27:59 UTC 2025","passed","Tue Sep 02 19:27:59 UTC 2025","","Remove Activity Flow →","Get applet version changes",""
"","288","Applet Events CRUD tests → Create Events tests → 422 Unprocessable Entity → Create Event with missing timer param (timer type: IDLE)","","Tue Sep 02 19:24:30 UTC 2025","passed","Tue Sep 02 19:24:30 UTC 2025","","422 Unprocessable Entity →","Create Event with missing timer param (timer type: IDLE)",""
"","336","Applet Library tests → Applet is added to the library → Check Library item name → 200 OK: new unique name","","Tue Sep 02 19:22:21 UTC 2025","passed","Tue Sep 02 19:22:21 UTC 2025","","Check Library item name →","200 OK: new unique name",""
"","829","Files upload/download directly to S3 bucket tests → Upload media files directly to storage (S3 bucket) Upload media file directly to generated link","","Tue Sep 02 19:29:14 UTC 2025","passed","Tue Sep 02 19:29:14 UTC 2025","","Upload media files directly to storage (S3 bucket)","Upload media file directly to generated link",""
"","534","Get Assessment & Review of updated activity tests → Get Assessment info before switching to a new assessment version","","Tue Sep 02 19:20:34 UTC 2025","passed","Tue Sep 02 19:20:34 UTC 2025","","Get Assessment & Review of updated activity tests →","Get Assessment info before switching to a new assessment version",""
"","398","Workspaces endpoints tests → Workspaces created → Get workspace applet details → 404 Not Found (non-existent ownerId)","","Tue Sep 02 19:36:53 UTC 2025","passed","Tue Sep 02 19:36:53 UTC 2025","","Get workspace applet details →","404 Not Found (non-existent ownerId)",""
"","1099","Flow Versions & Identifiers tests → Get flow Versions tests → 404 Not Found (Get flow versions of not existing Applet)","","Tue Sep 02 19:21:07 UTC 2025","passed","Tue Sep 02 19:21:08 UTC 2025","","Get flow Versions tests →","404 Not Found (Get flow versions of not existing Applet)",""
"","469","Applet ""Transfer Ownership"" scenario tests → Transfer Accept → First receiver should become the owner → Verify transferred managers list","","Tue Sep 02 19:26:44 UTC 2025","passed","Tue Sep 02 19:26:44 UTC 2025","","First receiver should become the owner →","Verify transferred managers list",""
"","4083","Applet builder tests → Update applet → Add activity","","Tue Sep 02 19:23:22 UTC 2025","passed","Tue Sep 02 19:23:26 UTC 2025","","Update applet →","Add activity",""
"","381","Applet ""Transfer Ownership"" endpoints tests → Transfer Accept → 403 Forbidden (for applet owner)","","Tue Sep 02 19:27:18 UTC 2025","passed","Tue Sep 02 19:27:18 UTC 2025","","Transfer Accept →","403 Forbidden (for applet owner)",""
"","557","Applet Library tests → Share applet to the library 200 OK","","Tue Sep 02 19:22:16 UTC 2025","passed","Tue Sep 02 19:22:16 UTC 2025","","Share applet to the library","200 OK",""
"","289","Invitations endpoints tests → Send invitation → Invitation Respondent Send → 422 Missing attributes Missing email","","Tue Sep 02 19:30:29 UTC 2025","passed","Tue Sep 02 19:30:29 UTC 2025","","422 Missing attributes","Missing email",""
"","179","Applet Library tests → Applet is added to the library → Update Library item → 422 missing attribute (name)","","Tue Sep 02 19:22:22 UTC 2025","passed","Tue Sep 02 19:22:22 UTC 2025","","Update Library item →","422 missing attribute (name)",""
"","766","Applet Library tests → Applet is added to the library → Get Library items list 200 OK (get the whole list)","","Tue Sep 02 19:22:19 UTC 2025","passed","Tue Sep 02 19:22:19 UTC 2025","","Get Library items list","200 OK (get the whole list)",""
"","650","Invitations scenario tests → Decline invitation positive flow → Invitation is not available for invitor anymore","","Tue Sep 02 19:29:50 UTC 2025","passed","Tue Sep 02 19:29:50 UTC 2025","","Decline invitation positive flow →","Invitation is not available for invitor anymore",""
"","3812","Applet Events scenario tests → End-To-End scenario (Individual scheduled flow Event)","","Tue Sep 02 19:25:27 UTC 2025","passed","Tue Sep 02 19:25:30 UTC 2025","","Applet Events scenario tests →","End-To-End scenario (Individual scheduled flow Event)",""
"","286","Applet Events CRUD tests → Update Applet Event tests → 422 Unprocessable Entity → Update Event with missing startTime (periodicity type: WEEKDAYS) param","","Tue Sep 02 19:25:00 UTC 2025","passed","Tue Sep 02 19:25:00 UTC 2025","","422 Unprocessable Entity →","Update Event with missing startTime (periodicity type: WEEKDAYS) param",""
"","404","Activity Assessment & Review CRUD tests → Delete Assessment tests → 404 Not Found (Delete submitted assessment for not existing answer)","","Tue Sep 02 19:21:00 UTC 2025","passed","Tue Sep 02 19:21:00 UTC 2025","","Delete Assessment tests →","404 Not Found (Delete submitted assessment for not existing answer)",""
"","2294","User Password tests → Password recovery approve tests → User can login with initial password after failed password recovery approve","","Tue Sep 02 19:34:21 UTC 2025","passed","Tue Sep 02 19:34:23 UTC 2025","","Password recovery approve tests →","User can login with initial password after failed password recovery approve",""
"","335","Activity Assessment & Review CRUD tests → Get Assessment & Review tests → Assessment has been submitted → 200 OK (Get submitted Assessment)","","Tue Sep 02 19:20:56 UTC 2025","passed","Tue Sep 02 19:20:56 UTC 2025","","Assessment has been submitted →","200 OK (Get submitted Assessment)",""
"","77","""Themes"" endpoints tests → Update Theme → 401 Unauthorized (invalid token)","","Tue Sep 02 19:33:58 UTC 2025","passed","Tue Sep 02 19:33:58 UTC 2025","","Update Theme →","401 Unauthorized (invalid token)",""
"","1096","Applet Library tests → Applet is added to the library → Update Library item → 400 Bad Request (not unique name)","","Tue Sep 02 19:22:22 UTC 2025","passed","Tue Sep 02 19:22:23 UTC 2025","","Update Library item →","400 Bad Request (not unique name)",""
"","473","""Subjects"" endpoints CRUD tests → Delete subjects 200 OK: manager","","Tue Sep 02 19:33:50 UTC 2025","passed","Tue Sep 02 19:33:50 UTC 2025","","Delete subjects","200 OK: manager",""
"","250","Applet ""Transfer Ownership"" endpoints tests → Transfer Initiate → 404 Applet not found","","Tue Sep 02 19:27:16 UTC 2025","passed","Tue Sep 02 19:27:16 UTC 2025","","Transfer Initiate →","404 Applet not found",""
"","1470","Applet public access tests → Create anonymous answer 201 Created","","Tue Sep 02 19:26:04 UTC 2025","passed","Tue Sep 02 19:26:05 UTC 2025","","Create anonymous answer","201 Created",""
"","262","Shell account invitation scenario tests → Decline invitation by unregistered user → New user can't see the applet","","Tue Sep 02 19:31:35 UTC 2025","passed","Tue Sep 02 19:31:35 UTC 2025","","Decline invitation by unregistered user →","New user can't see the applet",""
"","388","Get User tests → 404 Not found (Get deleted user)","","Tue Sep 02 19:34:15 UTC 2025","passed","Tue Sep 02 19:34:15 UTC 2025","","Get User tests →","404 Not found (Get deleted user)",""
"","239","Activity Assessment & Review CRUD tests → Get Assessment & Review tests → Get Assessment tests → 404 Not Found (Get Assessment of not existing Applet)","","Tue Sep 02 19:20:53 UTC 2025","passed","Tue Sep 02 19:20:53 UTC 2025","","Get Assessment tests →","404 Not Found (Get Assessment of not existing Applet)",""
"","1667","Applet builder tests → Create applet → Positive tests → Single activity with 5 web-app available item types (Text, Slider, SingleSelect, MultiSelect, NumberSelection)","","Tue Sep 02 19:23:05 UTC 2025","passed","Tue Sep 02 19:23:06 UTC 2025","","Positive tests →","Single activity with 5 web-app available item types (Text, Slider, SingleSelect, MultiSelect, NumberSelection)",""
"","1101","Workspaces endpoints tests → Workspaces created → Get workspace Applets → Respondent gets collaborated applets","","Tue Sep 02 19:36:44 UTC 2025","passed","Tue Sep 02 19:36:45 UTC 2025","","Get workspace Applets →","Respondent gets collaborated applets",""
"","300","Shell account invitation scenario tests → Accept invitation by already registered user → Verify invitation in list of invitations","","Tue Sep 02 19:31:41 UTC 2025","passed","Tue Sep 02 19:31:41 UTC 2025","","Accept invitation by already registered user →","Verify invitation in list of invitations",""
"","972","Applet ""Transfer Ownership"" scenario tests → Transfer Accept → First receiver should become the owner → Verify transferred events","","Tue Sep 02 19:26:44 UTC 2025","passed","Tue Sep 02 19:26:44 UTC 2025","","First receiver should become the owner →","Verify transferred events",""
"","403","Activity Assessment & Review CRUD tests → Submit Assessment tests → 401 Not Found (Submit Assessment to not existing Answer)","","Tue Sep 02 19:20:57 UTC 2025","passed","Tue Sep 02 19:20:57 UTC 2025","","Submit Assessment tests →","401 Not Found (Submit Assessment to not existing Answer)",""
"","410","Administration tests → Applets tests → Update Applet in workspace of Applet owner tests → 403 Forbidden (Respondent can NOT update Applet)","","Tue Sep 02 19:32:52 UTC 2025","passed","Tue Sep 02 19:32:52 UTC 2025","","Update Applet in workspace of Applet owner tests →","403 Forbidden (Respondent can NOT update Applet)",""
"","235","Invitations scenario tests → Decline invitation positive flow → Invited user can retrieve invitation","","Tue Sep 02 19:29:50 UTC 2025","passed","Tue Sep 02 19:29:50 UTC 2025","","Decline invitation positive flow →","Invited user can retrieve invitation",""
"","349","Applet public access tests → Create anonymous answer 404 Not Found (invalid appletId)","","Tue Sep 02 19:26:04 UTC 2025","passed","Tue Sep 02 19:26:04 UTC 2025","","Create anonymous answer","404 Not Found (invalid appletId)",""
"","296","Get submit dates & exported Answers data tests → Get exported data & dates after answer submit → 200 OK: empty list (Get exported data by coordinator)","","Tue Sep 02 19:18:29 UTC 2025","passed","Tue Sep 02 19:18:29 UTC 2025","","Get exported data & dates after answer submit →","200 OK: empty list (Get exported data by coordinator)",""
"","154","Update User tests → 422 Unprocessable Entity Update user with missing lastName param","","Tue Sep 02 19:34:49 UTC 2025","passed","Tue Sep 02 19:34:49 UTC 2025","","422 Unprocessable Entity","Update user with missing lastName param",""
"","954","Shell account invitation scenario tests → Send shell account invitation to an existing respondent → Verify 2 or more shell accounts invitations can be sent to the same email","","Tue Sep 02 19:31:52 UTC 2025","passed","Tue Sep 02 19:31:52 UTC 2025","","Send shell account invitation to an existing respondent →","Verify 2 or more shell accounts invitations can be sent to the same email",""
