"DESCRIPTION","DURATION IN MS","NAME","PARENT SUITE","START TIME","STATUS","STOP TIME","SUB SUITE","SUITE","TEST CLASS","TEST METHOD"
"","11","Applets CRUD endpoints tests → Delete applet → 401 Unauthorized","","Wed Jan 15 23:18:39 GMT 2025","passed","Wed Jan 15 23:18:39 GMT 2025","","Delete applet →","401 Unauthorized",""
"","516","Workspaces endpoints tests → Workspaces created → Pin user (manager) on workspace → 200 OK","","Wed Jan 15 23:29:28 GMT 2025","passed","Wed Jan 15 23:29:28 GMT 2025","","Pin user (manager) on workspace →","200 OK",""
"","273","Workspaces endpoints tests → Workspaces created → Get workspace respondents → Test for filters (query params) → Search by secretUserId","","Wed Jan 15 23:29:18 GMT 2025","passed","Wed Jan 15 23:29:18 GMT 2025","","Test for filters (query params) →","Search by secretUserId",""
"","241","Applets ""unique_name"" endpoint tests → 200 OK: unique name","","Wed Jan 15 23:22:13 GMT 2025","passed","Wed Jan 15 23:22:13 GMT 2025","","Applets ""unique_name"" endpoint tests →","200 OK: unique name",""
"","625","Invitations scenario tests → Re-send invitation flow → Invitation is re-sent","","Wed Jan 15 23:23:42 GMT 2025","passed","Wed Jan 15 23:23:42 GMT 2025","","Re-send invitation flow →","Invitation is re-sent",""
"","196","Applet ""Transfer Ownership"" endpoints tests → Transfer Decline → 404 (invalid key)","","Wed Jan 15 23:22:05 GMT 2025","passed","Wed Jan 15 23:22:05 GMT 2025","","Transfer Decline →","404 (invalid key)",""
"","209","Applet versions endpoints tests → Update Applet → Add Activity → Remove Activity → Add Activity Flow → Remove Activity Flow → Add Activity Item → Remove Activity Item → Update Activity → Update Activity Item → Get applet versions","","Wed Jan 15 23:22:29 GMT 2025","passed","Wed Jan 15 23:22:29 GMT 2025","","Update Activity Item →","Get applet versions",""
"","202","Workspaces endpoints tests → Workspaces created → Get managers priority role → 200 OK (Reviewer gets role in first user's workspace)","","Wed Jan 15 23:29:25 GMT 2025","passed","Wed Jan 15 23:29:25 GMT 2025","","Get managers priority role →","200 OK (Reviewer gets role in first user's workspace)",""
"","240","Applet ""Transfer Ownership"" scenario tests → Transfer Decline → First receiver should not be able to accept request after declination","","Wed Jan 15 23:21:34 GMT 2025","passed","Wed Jan 15 23:21:34 GMT 2025","","Transfer Decline →","First receiver should not be able to accept request after declination",""
"","125","""Themes"" endpoints tests → Delete Theme → 404 Not Found (non-existent theme)","","Wed Jan 15 23:26:58 GMT 2025","passed","Wed Jan 15 23:26:58 GMT 2025","","Delete Theme →","404 Not Found (non-existent theme)",""
"","311","Invitations endpoints tests → Invite Shell account → 200 OK","","Wed Jan 15 23:24:25 GMT 2025","passed","Wed Jan 15 23:24:25 GMT 2025","","Invite Shell account →","200 OK",""
"","241","Applet versions endpoints tests → Get applet version by id → 200 OK (Initial Version)","","Wed Jan 15 23:22:19 GMT 2025","passed","Wed Jan 15 23:22:19 GMT 2025","","Get applet version by id →","200 OK (Initial Version)",""
"","2132","Update Password tests → 401 Unauthorized (User login with previous password)","","Wed Jan 15 23:27:26 GMT 2025","passed","Wed Jan 15 23:27:28 GMT 2025","","Update Password tests →","401 Unauthorized (User login with previous password)",""
"","103","Applet Events CRUD tests → Create Events tests → 422 Unprocessable Entity → Create Event with missing startTime (periodicity type: MONTHLY) param","","Wed Jan 15 23:19:48 GMT 2025","passed","Wed Jan 15 23:19:48 GMT 2025","","422 Unprocessable Entity →","Create Event with missing startTime (periodicity type: MONTHLY) param",""
"","213","Invitations endpoints tests → Invite Shell account → 403: Forbidden","","Wed Jan 15 23:24:25 GMT 2025","passed","Wed Jan 15 23:24:25 GMT 2025","","Invite Shell account →","403: Forbidden",""
"","395","Applet Events CRUD tests → Import Applet Events tests → 201 Import Events (general Always Available activity Event & general scheduled activity Event)","","Wed Jan 15 23:20:18 GMT 2025","passed","Wed Jan 15 23:20:18 GMT 2025","","Import Applet Events tests →","201 Import Events (general Always Available activity Event & general scheduled activity Event)",""
"","107","Invitations endpoints tests → Send invitation → Invitation Managers Send → 422 Missing attributes Missing email","","Wed Jan 15 23:24:21 GMT 2025","passed","Wed Jan 15 23:24:21 GMT 2025","","422 Missing attributes","Missing email",""
"","261","Activity Assessment & Review CRUD tests → Get Assessment & Review tests → Assessment has been submitted → 200 OK (Get submitted Assessment)","","Wed Jan 15 23:17:19 GMT 2025","passed","Wed Jan 15 23:17:19 GMT 2025","","Assessment has been submitted →","200 OK (Get submitted Assessment)",""
"","204","Answers CRUD tests → Answers handling after invitation acceptance by respondent → Check answer existence tests → 200 OK (exists = false, non-existent activity id)","","Wed Jan 15 23:16:50 GMT 2025","passed","Wed Jan 15 23:16:50 GMT 2025","","Check answer existence tests →","200 OK (exists = false, non-existent activity id)",""
"","262","Applet versions endpoints tests → Update Applet → Add Activity → Remove Activity → Add Activity Flow → Remove Activity Flow → Add Activity Item → Get applet version changes","","Wed Jan 15 23:22:25 GMT 2025","passed","Wed Jan 15 23:22:25 GMT 2025","","Add Activity Item →","Get applet version changes",""
"","515","User Events scenario tests → Reviewer & Manager should get general scheduled activity Event & general always available flow Events from the 1st Applet","","Wed Jan 15 23:27:42 GMT 2025","passed","Wed Jan 15 23:27:42 GMT 2025","","User Events scenario tests →","Reviewer & Manager should get general scheduled activity Event & general always available flow Events from the 1st Applet",""
"","12","Applet Events CRUD tests → Get general and individual Applet Events → 401 Unauthorized (Get Applet Events with invalid appletOwnerToken)","","Wed Jan 15 23:19:51 GMT 2025","passed","Wed Jan 15 23:19:51 GMT 2025","","Get general and individual Applet Events →","401 Unauthorized (Get Applet Events with invalid appletOwnerToken)",""
"","214","Workspaces endpoints tests → Workspaces created → Get workspace applet respondent by id → 404 not found (invalid applet id)","","Wed Jan 15 23:29:30 GMT 2025","passed","Wed Jan 15 23:29:30 GMT 2025","","Get workspace applet respondent by id →","404 not found (invalid applet id)",""
"","11","Applets CRUD endpoints tests → Get applet by id → 401 Unauthorized","","Wed Jan 15 23:18:35 GMT 2025","passed","Wed Jan 15 23:18:35 GMT 2025","","Get applet by id →","401 Unauthorized",""
"","21","Flow Versions & Identifiers tests → Get flow Versions tests → 401 Unauthorized (Get flow versions with not existing token)","","Wed Jan 15 23:17:25 GMT 2025","passed","Wed Jan 15 23:17:25 GMT 2025","","Get flow Versions tests →","401 Unauthorized (Get flow versions with not existing token)",""
"","679","Applet Events CRUD tests → Create Events tests → 201 Create general scheduled activity Event & general Always Available activity Event","","Wed Jan 15 23:19:47 GMT 2025","passed","Wed Jan 15 23:19:47 GMT 2025","","Create Events tests →","201 Create general scheduled activity Event & general Always Available activity Event",""
"","11","Files upload/download directly to S3 bucket tests → Generate presigned links EPs negative tests Logs URL 401 Unauthorized","","Wed Jan 15 23:23:30 GMT 2025","passed","Wed Jan 15 23:23:30 GMT 2025","","Logs URL","401 Unauthorized",""
"","353","Delete User tests → 401 Unauthorized (Delete User with not existing token)","","Wed Jan 15 23:27:04 GMT 2025","passed","Wed Jan 15 23:27:04 GMT 2025","","Delete User tests →","401 Unauthorized (Delete User with not existing token)",""
"","21","Applets ""setFolder"" endpoint tests → 401 Unauthorized","","Wed Jan 15 23:21:05 GMT 2025","passed","Wed Jan 15 23:21:05 GMT 2025","","Applets ""setFolder"" endpoint tests →","401 Unauthorized",""
"","121","Applet public access tests → Get public applet by key → 404: invalid key","","Wed Jan 15 23:20:58 GMT 2025","passed","Wed Jan 15 23:20:58 GMT 2025","","Get public applet by key →","404: invalid key",""
"","15529","Files upload/download directly to S3 bucket tests → Upload files with format conversion "".webm"" media file should be converted to .mp3","","Wed Jan 15 23:23:14 GMT 2025","passed","Wed Jan 15 23:23:29 GMT 2025","","Upload files with format conversion",""".webm"" media file should be converted to .mp3",""
"","11","Files upload/download tests → Upload/Download answers (applet files) → Check answer (file) uploaded → 401 Unauthorized","","Wed Jan 15 23:22:55 GMT 2025","passed","Wed Jan 15 23:22:55 GMT 2025","","Check answer (file) uploaded →","401 Unauthorized",""
"","13","Applet Events CRUD tests → Remove individual scheduled Applet Events negative tests → 401 Unauthorized (Remove scheduled Events of a particular user with not existing appletOwnerToken)","","Wed Jan 15 23:20:17 GMT 2025","passed","Wed Jan 15 23:20:17 GMT 2025","","Remove individual scheduled Applet Events negative tests →","401 Unauthorized (Remove scheduled Events of a particular user with not existing appletOwnerToken)",""
"","237","Administration tests → Respondents tests → View all respondents tests → 403 Forbidden (Respondent can NOT view all respondents)","","Wed Jan 15 23:26:02 GMT 2025","passed","Wed Jan 15 23:26:02 GMT 2025","","View all respondents tests →","403 Forbidden (Respondent can NOT view all respondents)",""
"","264","Workspaces endpoints tests → Workspaces created → Get workspace respondent applet access list → 200 empty (non-existent respondentId)","","Wed Jan 15 23:29:29 GMT 2025","passed","Wed Jan 15 23:29:29 GMT 2025","","Get workspace respondent applet access list →","200 empty (non-existent respondentId)",""
"","301","Shell account invitation scenario tests → Decline invitation by unregistered user → Shell account should be present in the list of respondents with ""not invited"" status before invitation is sent","","Wed Jan 15 23:25:03 GMT 2025","passed","Wed Jan 15 23:25:03 GMT 2025","","Decline invitation by unregistered user →","Shell account should be present in the list of respondents with ""not invited"" status before invitation is sent",""
"","300","Activity Versions & Identifiers tests → Get Identifiers tests → 200 OK (empty list of identifiers)","","Wed Jan 15 23:17:38 GMT 2025","passed","Wed Jan 15 23:17:38 GMT 2025","","Get Identifiers tests →","200 OK (empty list of identifiers)",""
"","606","Delete and remove individual Events scenario tests → Remove individual scheduled user Events scenario tests → Fourth respondent should have general Always Available activity/flow Events after removal of individual scheduled flow Event","","Wed Jan 15 23:19:42 GMT 2025","passed","Wed Jan 15 23:19:42 GMT 2025","","Remove individual scheduled user Events scenario tests →","Fourth respondent should have general Always Available activity/flow Events after removal of individual scheduled flow Event",""
"","239","Workspaces endpoints tests → Workspaces created → Get workspace Applets → Test for filters (query params) → Limit","","Wed Jan 15 23:29:14 GMT 2025","passed","Wed Jan 15 23:29:14 GMT 2025","","Test for filters (query params) →","Limit",""
"","112","Workspaces managers access tests → Set workspace managers applet access list → 422 Unprocessable entity (incorrect role)","","Wed Jan 15 23:28:35 GMT 2025","passed","Wed Jan 15 23:28:35 GMT 2025","","Set workspace managers applet access list →","422 Unprocessable entity (incorrect role)",""
"","390","Applet ""Transfer Ownership"" scenario tests → Transfer Accept → First receiver should become the owner → Verify transferred answers list","","Wed Jan 15 23:21:31 GMT 2025","passed","Wed Jan 15 23:21:31 GMT 2025","","First receiver should become the owner →","Verify transferred answers list",""
"","270","Shell account invitation scenario tests → Decline invitation by unregistered user → Verify shell account remains the same in the list of respondents","","Wed Jan 15 23:25:03 GMT 2025","passed","Wed Jan 15 23:25:03 GMT 2025","","Decline invitation by unregistered user →","Verify shell account remains the same in the list of respondents",""
"","233","Invitations scenario tests → Decline invitation positive flow → Invited user can't see invitation anymore","","Wed Jan 15 23:23:37 GMT 2025","passed","Wed Jan 15 23:23:37 GMT 2025","","Decline invitation positive flow →","Invited user can't see invitation anymore",""
"","241","Get submit dates & exported Answers data tests → Get exported data & dates after answer submit → 200 OK: empty list (Get exported data by reviewer with no assigned respondents)","","Wed Jan 15 23:15:31 GMT 2025","passed","Wed Jan 15 23:15:31 GMT 2025","","Get exported data & dates after answer submit →","200 OK: empty list (Get exported data by reviewer with no assigned respondents)",""
"","12","Invitations endpoints tests → Decline invitation → 401 Unauthorized (invalid token)","","Wed Jan 15 23:24:05 GMT 2025","passed","Wed Jan 15 23:24:05 GMT 2025","","Decline invitation →","401 Unauthorized (invalid token)",""
"","253","Workspaces managers access tests → Remove manager access → 403 Forbidden (try to remove access for respondent)","","Wed Jan 15 23:28:39 GMT 2025","passed","Wed Jan 15 23:28:39 GMT 2025","","Remove manager access →","403 Forbidden (try to remove access for respondent)",""
"","284","Applet Library tests → Share applet to the library 403 invalid applet id","","Wed Jan 15 23:18:13 GMT 2025","passed","Wed Jan 15 23:18:13 GMT 2025","","Share applet to the library","403 invalid applet id",""
"","234","Applet versions endpoints tests → Update Applet → Add Activity → Remove Activity → Add Activity Flow → Remove Activity Flow → Add Activity Item → Remove Activity Item → Update Activity → Update Activity Item → Get applet version changes","","Wed Jan 15 23:22:29 GMT 2025","passed","Wed Jan 15 23:22:29 GMT 2025","","Update Activity Item →","Get applet version changes",""
"","425","Applet Library tests → Applet is added to the library → Cart test → Clear cart","","Wed Jan 15 23:18:17 GMT 2025","passed","Wed Jan 15 23:18:17 GMT 2025","","Cart test →","Clear cart",""
"","257","Administration tests → Applets tests → Export & view data in workspace of Applet owner tests → Export data tests → 200 OK (Reviewer with no assigned respondents can export his own data)","","Wed Jan 15 23:26:16 GMT 2025","passed","Wed Jan 15 23:26:16 GMT 2025","","Export data tests →","200 OK (Reviewer with no assigned respondents can export his own data)",""
"","14","Access link tests → Delete Access link tests → 401 Unauthorized (Delete Access link with not existing token)","","Wed Jan 15 23:18:23 GMT 2025","passed","Wed Jan 15 23:18:23 GMT 2025","","Delete Access link tests →","401 Unauthorized (Delete Access link with not existing token)",""
"","907","Applet builder tests → Create applet → Positive tests → Multiple activity with multiple items and multiple flows","","Wed Jan 15 23:18:47 GMT 2025","failed","Wed Jan 15 23:18:47 GMT 2025","","Positive tests →","Multiple activity with multiple items and multiple flows",""
"","2242","Create Answers for different item types tests → Flanker performance task","","Wed Jan 15 23:15:37 GMT 2025","passed","Wed Jan 15 23:15:39 GMT 2025","","Create Answers for different item types tests →","Flanker performance task",""
"","20","Get submit dates & exported Answers data tests → Get exported data before Answer submit → 401 Unauthorized (Get exported data with not existing token)","","Wed Jan 15 23:15:30 GMT 2025","passed","Wed Jan 15 23:15:30 GMT 2025","","Get exported data before Answer submit →","401 Unauthorized (Get exported data with not existing token)",""
"","385","Invitations scenario tests → Decline invitation positive flow → Invitation is not available for invitor anymore","","Wed Jan 15 23:23:37 GMT 2025","passed","Wed Jan 15 23:23:37 GMT 2025","","Decline invitation positive flow →","Invitation is not available for invitor anymore",""
"","262","Administration tests → Organizers tests → View all organizers tests → 403 Forbidden (Editor can NOT view organizers)","","Wed Jan 15 23:25:56 GMT 2025","passed","Wed Jan 15 23:25:56 GMT 2025","","View all organizers tests →","403 Forbidden (Editor can NOT view organizers)",""
"","183","Answers CRUD tests → Answers handling after invitation acceptance by respondent → Get activity answers list & Answers of respondent tests → 404 Not Found (Get activity answers list of not existing Applet)","","Wed Jan 15 23:16:53 GMT 2025","passed","Wed Jan 15 23:16:53 GMT 2025","","Get activity answers list & Answers of respondent tests →","404 Not Found (Get activity answers list of not existing Applet)",""
"","229","Applet versions endpoints tests → Update Applet → Add Activity → Remove Activity → Add Activity Flow → Remove Activity Flow → Add Activity Item → Remove Activity Item → Get applet version changes","","Wed Jan 15 23:22:26 GMT 2025","passed","Wed Jan 15 23:22:26 GMT 2025","","Remove Activity Item →","Get applet version changes",""
"","593","Activity Assignments tests → Positive tests → Assign multiple activities to single full participant","","Wed Jan 15 23:14:43 GMT 2025","passed","Wed Jan 15 23:14:43 GMT 2025","","Positive tests →","Assign multiple activities to single full participant",""
"","11","""Authentication"" endpoints tests → Delete Token → 401 Unauthorized (non-existent token)","","Wed Jan 15 23:22:36 GMT 2025","passed","Wed Jan 15 23:22:36 GMT 2025","","Delete Token →","401 Unauthorized (non-existent token)",""
"","209","Applet versions endpoints tests → Update Applet → Add Activity → Remove Activity → Add Activity Flow → Remove Activity Flow → Add Activity Item → Get applet versions","","Wed Jan 15 23:22:25 GMT 2025","passed","Wed Jan 15 23:22:25 GMT 2025","","Add Activity Item →","Get applet versions",""
"","591","Administration tests → Applets tests → Update Applet in workspace of Applet owner tests → 200 OK (Editor can update Applet)","","Wed Jan 15 23:26:09 GMT 2025","passed","Wed Jan 15 23:26:09 GMT 2025","","Update Applet in workspace of Applet owner tests →","200 OK (Editor can update Applet)",""
"","300","Applets ""unique_name"" endpoint tests → 200 OK: not unique name with non-existent excludingAppletId","","Wed Jan 15 23:22:13 GMT 2025","passed","Wed Jan 15 23:22:13 GMT 2025","","Applets ""unique_name"" endpoint tests →","200 OK: not unique name with non-existent excludingAppletId",""
"","207","Applet ""Transfer Ownership"" endpoints tests → Transfer Decline → 204 OK","","Wed Jan 15 23:22:05 GMT 2025","passed","Wed Jan 15 23:22:05 GMT 2025","","Transfer Decline →","204 OK",""
"","233","Shell account invitation scenario tests → Accept invitation by already registered user → New user can access invitation by key","","Wed Jan 15 23:25:07 GMT 2025","passed","Wed Jan 15 23:25:07 GMT 2025","","Accept invitation by already registered user →","New user can access invitation by key",""
"","225","Applet versions endpoints tests → Update Applet → Add Activity → Remove Activity → Get applet version by id","","Wed Jan 15 23:22:21 GMT 2025","passed","Wed Jan 15 23:22:21 GMT 2025","","Remove Activity →","Get applet version by id",""
"","115","Applet Events CRUD tests → Create Events tests → 422 Unprocessable Entity → Create Event with missing accessBeforeSchedule (periodicity type: WEEKLY) param","","Wed Jan 15 23:19:48 GMT 2025","passed","Wed Jan 15 23:19:48 GMT 2025","","422 Unprocessable Entity →","Create Event with missing accessBeforeSchedule (periodicity type: WEEKLY) param",""
"","207","Get applet completed activities tests → 422 Unprocessable entity: invalid query params","","Wed Jan 15 23:15:02 GMT 2025","passed","Wed Jan 15 23:15:02 GMT 2025","","Get applet completed activities tests →","422 Unprocessable entity: invalid query params",""
"","111","Invitations endpoints tests → Create shell account → 422: Missing attribute","","Wed Jan 15 23:24:21 GMT 2025","passed","Wed Jan 15 23:24:21 GMT 2025","","Create shell account →","422: Missing attribute",""
"","2188","Create Answers for different item types tests → Multiselect item","","Wed Jan 15 23:15:37 GMT 2025","passed","Wed Jan 15 23:15:39 GMT 2025","","Create Answers for different item types tests →","Multiselect item",""
"","179","Get applet completed activities tests → 404 Not Found: invalid applet id","","Wed Jan 15 23:15:02 GMT 2025","passed","Wed Jan 15 23:15:02 GMT 2025","","Get applet completed activities tests →","404 Not Found: invalid applet id",""
"","0","Answers scenario tests → Activity, completed within the activity flow: get activity answers list & Answers of respondent tests → Get activity answers list with answer, created within the activity flow","","Wed Jan 15 23:16:33 GMT 2025","passed","Wed Jan 15 23:16:33 GMT 2025","","Activity, completed within the activity flow: get activity answers list & Answers of respondent tests →","Get activity answers list with answer, created within the activity flow",""
"","230","Answer Notes tests → Edit Note tests → 404 Not Found (Update not existing Note)","","Wed Jan 15 23:14:55 GMT 2025","passed","Wed Jan 15 23:14:55 GMT 2025","","Edit Note tests →","404 Not Found (Update not existing Note)",""
"","13","Activity Assignments tests → Negative tests → Create Assignments → 401 Unauthorised","","Wed Jan 15 23:14:46 GMT 2025","passed","Wed Jan 15 23:14:46 GMT 2025","","Create Assignments →","401 Unauthorised",""
"","260","Get applet completed activities tests → Respondent completes the 1st activity within default always available event → Respondent completes the 2nd activity within oneTimeCompletion Event → Respondent completes activities within the activity flow → 200 OK : activity flow completion should be present","","Wed Jan 15 23:15:11 GMT 2025","passed","Wed Jan 15 23:15:11 GMT 2025","","Respondent completes activities within the activity flow →","200 OK : activity flow completion should be present",""
"","16","Create User tests → 422 Unprocessable Entity Create user with missing password param","","Wed Jan 15 23:27:00 GMT 2025","passed","Wed Jan 15 23:27:00 GMT 2025","","422 Unprocessable Entity","Create user with missing password param",""
"","264","Workspaces endpoints tests → Workspaces created → Get workspace applet managers → Negative tests → 403 Forbidden (invalid applet id)","","Wed Jan 15 23:29:25 GMT 2025","passed","Wed Jan 15 23:29:25 GMT 2025","","Negative tests →","403 Forbidden (invalid applet id)",""
"","205","Answer Notes tests → Edit Note tests → 404 Not Found (Update Note of not existing Answer)","","Wed Jan 15 23:14:55 GMT 2025","passed","Wed Jan 15 23:14:55 GMT 2025","","Edit Note tests →","404 Not Found (Update Note of not existing Answer)",""
"","346","Administration tests → Organizers tests → View all organizers tests → 200 OK (Manager can view organizers)","","Wed Jan 15 23:25:56 GMT 2025","passed","Wed Jan 15 23:25:56 GMT 2025","","View all organizers tests →","200 OK (Manager can view organizers)",""
"","15","Invitations endpoints tests → Send invitation → Invitation Respondent Send → 401 Unauthorized (invalid token)","","Wed Jan 15 23:24:08 GMT 2025","passed","Wed Jan 15 23:24:08 GMT 2025","","Invitation Respondent Send →","401 Unauthorized (invalid token)",""
"","10","Workspaces endpoints tests → Workspaces created → Get workspace applet managers → Negative tests → 401 Unauthorized","","Wed Jan 15 23:29:25 GMT 2025","passed","Wed Jan 15 23:29:25 GMT 2025","","Negative tests →","401 Unauthorized",""
"","252","Activity Assessment & Review CRUD tests → Get Assessment & Review tests → Get Reviews tests → 403 Forbidden (Get Review by respondent)","","Wed Jan 15 23:17:18 GMT 2025","passed","Wed Jan 15 23:17:18 GMT 2025","","Get Reviews tests →","403 Forbidden (Get Review by respondent)",""
"","1495","Invitations scenario tests → Invite unregistered user flow → New user registers in the app","","Wed Jan 15 23:23:47 GMT 2025","passed","Wed Jan 15 23:23:48 GMT 2025","","Invite unregistered user flow →","New user registers in the app",""
"","1","Answers CRUD tests → Answers handling after invitation acceptance by respondent → Get flow submissions list & Flow answers of respondent tests → 200 OK (Get flow submissions list)","","Wed Jan 15 23:16:56 GMT 2025","passed","Wed Jan 15 23:16:56 GMT 2025","","Get flow submissions list & Flow answers of respondent tests →","200 OK (Get flow submissions list)",""
"","191","Access link tests → Create Access link tests → 404 Not Found (Create Access link with not existing applet)","","Wed Jan 15 23:18:21 GMT 2025","passed","Wed Jan 15 23:18:21 GMT 2025","","Create Access link tests →","404 Not Found (Create Access link with not existing applet)",""
"","121","""Subjects"" endpoints CRUD tests → Update subjects 422: Missing secretId","","Wed Jan 15 23:26:50 GMT 2025","passed","Wed Jan 15 23:26:50 GMT 2025","","Update subjects","422: Missing secretId",""
