"DESCRIPTION","DURATION IN MS","NAME","PARENT SUITE","START TIME","STATUS","STOP TIME","SUB SUITE","SUITE","TEST CLASS","TEST METHOD"
"","263","""Subjects"" endpoints CRUD tests → Get subjects 200 OK: shell account","","Wed Jan 15 23:26:49 GMT 2025","passed","Wed Jan 15 23:26:49 GMT 2025","","Get subjects","200 OK: shell account",""
"","212","Get User Device Information → 200 Get User Device","","Wed Jan 15 23:27:40 GMT 2025","passed","Wed Jan 15 23:27:40 GMT 2025","","Get User Device Information →","200 Get User Device",""
"","165","Applet Events CRUD tests → Create cross-day events tests → 422 (Cross-day Event with ONCE periodicity type and availability range: 15:30:00-15:30:00)","","Wed Jan 15 23:20:22 GMT 2025","passed","Wed Jan 15 23:20:22 GMT 2025","","Create cross-day events tests →","422 (Cross-day Event with ONCE periodicity type and availability range: 15:30:00-15:30:00)",""
"","292","Invitations scenario tests → Invite unregistered user flow → Send invitation to unregistered user","","Wed Jan 15 23:23:47 GMT 2025","passed","Wed Jan 15 23:23:47 GMT 2025","","Invite unregistered user flow →","Send invitation to unregistered user",""
"","113","Invitations endpoints tests → Send invitation → Invitation Respondent Send → 422 Missing attributes Missing firstName","","Wed Jan 15 23:24:11 GMT 2025","passed","Wed Jan 15 23:24:11 GMT 2025","","422 Missing attributes","Missing firstName",""
"","264","Applet Events CRUD tests → Remove individual scheduled Applet Events negative tests → 404 Not Found (Remove scheduled Events of a particular user with not existing Applet)","","Wed Jan 15 23:20:17 GMT 2025","passed","Wed Jan 15 23:20:17 GMT 2025","","Remove individual scheduled Applet Events negative tests →","404 Not Found (Remove scheduled Events of a particular user with not existing Applet)",""
"","800","Applet builder tests → Create applet → Positive tests → Single activity with rows item types (SliderRows, SingleSelectionRows, MultiSelectionRows)","","Wed Jan 15 23:18:47 GMT 2025","failed","Wed Jan 15 23:18:47 GMT 2025","","Positive tests →","Single activity with rows item types (SliderRows, SingleSelectionRows, MultiSelectionRows)",""
"","420","Administration tests → Respondents tests → Invite new respondent tests → 200 OK (Coordinator can invite new respondent)","","Wed Jan 15 23:26:00 GMT 2025","passed","Wed Jan 15 23:26:00 GMT 2025","","Invite new respondent tests →","200 OK (Coordinator can invite new respondent)",""
"","216","Workspaces endpoints tests → Workspaces created → Get workspace Folder Applets → 200 OK (non-empty list)","","Wed Jan 15 23:29:16 GMT 2025","passed","Wed Jan 15 23:29:16 GMT 2025","","Get workspace Folder Applets →","200 OK (non-empty list)",""
"","1939","Create Answers for different item types tests → A/B Mobile performance task","","Wed Jan 15 23:15:37 GMT 2025","passed","Wed Jan 15 23:15:38 GMT 2025","","Create Answers for different item types tests →","A/B Mobile performance task",""
"","534","Applet Library tests → Applet is added to the library → Update Library item → 400 Bad Request (not unique name)","","Wed Jan 15 23:18:16 GMT 2025","passed","Wed Jan 15 23:18:16 GMT 2025","","Update Library item →","400 Bad Request (not unique name)",""
"","595","Administration tests → Respondents tests → Invite new reviewer for a specific respondent tests → 200 OK (Coordinator can invite new reviewer for a specific respondent)","","Wed Jan 15 23:26:04 GMT 2025","passed","Wed Jan 15 23:26:04 GMT 2025","","Invite new reviewer for a specific respondent tests →","200 OK (Coordinator can invite new reviewer for a specific respondent)",""
"","248","Files upload/download tests → Upload/Download answers (applet files) → Check answer (file) uploaded → 200 OK (empty list)","","Wed Jan 15 23:22:55 GMT 2025","passed","Wed Jan 15 23:22:55 GMT 2025","","Check answer (file) uploaded →","200 OK (empty list)",""
"","129","Access link tests → Create Access link tests → 422 Unprocessable Entity (Create Access link without required param)","","Wed Jan 15 23:18:21 GMT 2025","passed","Wed Jan 15 23:18:21 GMT 2025","","Create Access link tests →","422 Unprocessable Entity (Create Access link without required param)",""
"","236","Applet ""Transfer Ownership"" endpoints tests → Transfer Accept → 404 (Accept same request again)","","Wed Jan 15 23:21:58 GMT 2025","passed","Wed Jan 15 23:21:58 GMT 2025","","Transfer Accept →","404 (Accept same request again)",""
"","216","Applet Events CRUD tests → Create Events tests → 400 Bad Request (Create general Always Available activity Event)","","Wed Jan 15 23:19:47 GMT 2025","passed","Wed Jan 15 23:19:47 GMT 2025","","Create Events tests →","400 Bad Request (Create general Always Available activity Event)",""
"","481","Workspaces endpoints tests → Workspaces created → Get workspace Applets → Reviewer gets collaborated applets","","Wed Jan 15 23:29:12 GMT 2025","passed","Wed Jan 15 23:29:12 GMT 2025","","Get workspace Applets →","Reviewer gets collaborated applets",""
"","13","Applet Events CRUD tests → Delete individual scheduled Applet Events negative tests → 401 Unauthorized (Delete scheduled Events of a particular user with not existing appletOwnerToken)","","Wed Jan 15 23:20:16 GMT 2025","passed","Wed Jan 15 23:20:16 GMT 2025","","Delete individual scheduled Applet Events negative tests →","401 Unauthorized (Delete scheduled Events of a particular user with not existing appletOwnerToken)",""
"","237","Workspaces endpoints tests → Workspaces created → Get user workspaces → Second applet owner","","Wed Jan 15 23:29:10 GMT 2025","passed","Wed Jan 15 23:29:10 GMT 2025","","Get user workspaces →","Second applet owner",""
"","96","Applet public access tests → Get public events by key → 404: invalid key","","Wed Jan 15 23:20:58 GMT 2025","passed","Wed Jan 15 23:20:58 GMT 2025","","Get public events by key →","404: invalid key",""
"","487","Workspaces managers access tests → Set workspace managers applet access list → 200 OK (grant reviewer's permissions for coordinator)","","Wed Jan 15 23:28:35 GMT 2025","passed","Wed Jan 15 23:28:35 GMT 2025","","Set workspace managers applet access list →","200 OK (grant reviewer's permissions for coordinator)",""
"","705","Files upload/download tests → Upload File → 200 OK","","Wed Jan 15 23:22:46 GMT 2025","passed","Wed Jan 15 23:22:46 GMT 2025","","Upload File →","200 OK",""
"","568","Invitations endpoints tests → Send invitation → Invitation Reviewer Send → 200 OK (send to unregistered user) With workspace prefix, language: fr","","Wed Jan 15 23:24:13 GMT 2025","passed","Wed Jan 15 23:24:13 GMT 2025","","200 OK (send to unregistered user)","With workspace prefix, language: fr",""
"","856","Applet Events CRUD tests → Get Applet Event by Id tests → 404 Not Found (Get individual deleted scheduled activity Event)","","Wed Jan 15 23:19:59 GMT 2025","passed","Wed Jan 15 23:19:59 GMT 2025","","Get Applet Event by Id tests →","404 Not Found (Get individual deleted scheduled activity Event)",""
"","272","Applet versions endpoints tests → Update Applet → Add Activity → Remove Activity → Add Activity Flow → Remove Activity Flow → Add Activity Item → Remove Activity Item → Update Activity → Update Activity Item → Get applet version by id","","Wed Jan 15 23:22:29 GMT 2025","passed","Wed Jan 15 23:22:29 GMT 2025","","Update Activity Item →","Get applet version by id",""
"","206","Administration tests → Transfer ownership of Applet tests → 403 Forbidden (Coordinator can not transfer ownership)","","Wed Jan 15 23:25:49 GMT 2025","passed","Wed Jan 15 23:25:49 GMT 2025","","Transfer ownership of Applet tests →","403 Forbidden (Coordinator can not transfer ownership)",""
"","225","""Workspace Folders"" endpoints tests → Workspace is created → Pin/Unpin Folder → Pin Folder → 200 OK","","Wed Jan 15 23:28:05 GMT 2025","passed","Wed Jan 15 23:28:05 GMT 2025","","Pin Folder →","200 OK",""
"","229","Workspaces endpoints tests → Workspaces created → Search workspace Applets → 200 OK (search by full applet name)","","Wed Jan 15 23:29:15 GMT 2025","passed","Wed Jan 15 23:29:15 GMT 2025","","Search workspace Applets →","200 OK (search by full applet name)",""
"","163","Applet Events CRUD tests → Update Applet Event tests → 422 Unprocessable Entity → Update Event with missing accessBeforeSchedule (periodicity type: WEEKDAYS) param","","Wed Jan 15 23:20:11 GMT 2025","passed","Wed Jan 15 23:20:11 GMT 2025","","422 Unprocessable Entity →","Update Event with missing accessBeforeSchedule (periodicity type: WEEKDAYS) param",""
"","521","Administration tests → Applets tests → Create Applet in workspace of Applet owner tests → 403 Forbidden (Respondent can NOT create Applet in workspace of Applet owner)","","Wed Jan 15 23:26:07 GMT 2025","passed","Wed Jan 15 23:26:07 GMT 2025","","Create Applet in workspace of Applet owner tests →","403 Forbidden (Respondent can NOT create Applet in workspace of Applet owner)",""
"","347","Get submit dates & exported Answers data tests → Get exported data & dates after answer submit → 200 OK (Get exported data by manager)","","Wed Jan 15 23:15:31 GMT 2025","passed","Wed Jan 15 23:15:31 GMT 2025","","Get exported data & dates after answer submit →","200 OK (Get exported data by manager)",""
"","639","Applet ""Transfer Ownership"" endpoints tests → Transfer Initiate → 200 OK","","Wed Jan 15 23:21:57 GMT 2025","passed","Wed Jan 15 23:21:57 GMT 2025","","Transfer Initiate →","200 OK",""
"","398","Administration tests → Applets tests → View General calendar in workspace of Applet owner tests → 403 Forbidden (Respondent can NOT view General calendar)","","Wed Jan 15 23:26:13 GMT 2025","passed","Wed Jan 15 23:26:13 GMT 2025","","View General calendar in workspace of Applet owner tests →","403 Forbidden (Respondent can NOT view General calendar)",""
"","210","Administration tests → Organizers tests → Change organizer roles/permissions tests → 403 Forbidden (Coordinator can NOT grant editor's permissions to respondent)","","Wed Jan 15 23:25:58 GMT 2025","passed","Wed Jan 15 23:25:58 GMT 2025","","Change organizer roles/permissions tests →","403 Forbidden (Coordinator can NOT grant editor's permissions to respondent)",""
"","163","Applet Events CRUD tests → Create Events tests → 422 Unprocessable Entity → Create Event with missing accessBeforeSchedule (periodicity type: WEEKDAYS) param","","Wed Jan 15 23:19:48 GMT 2025","passed","Wed Jan 15 23:19:48 GMT 2025","","422 Unprocessable Entity →","Create Event with missing accessBeforeSchedule (periodicity type: WEEKDAYS) param",""
"","138","Invitations endpoints tests → Send invitation → Invitation Reviewer Send → 422 Missing attributes Missing language","","Wed Jan 15 23:24:15 GMT 2025","passed","Wed Jan 15 23:24:15 GMT 2025","","422 Missing attributes","Missing language",""
"","267","Applet versions endpoints tests → Update Applet → Add Activity → Remove Activity → Add Activity Flow → Get applet version by id","","Wed Jan 15 23:22:22 GMT 2025","passed","Wed Jan 15 23:22:22 GMT 2025","","Add Activity Flow →","Get applet version by id",""
"","450","Get submit dates & exported Answers data tests → Get exported data & dates after answer submit → 200 OK (Get exported data by editor - should see only his own data)","","Wed Jan 15 23:15:31 GMT 2025","passed","Wed Jan 15 23:15:31 GMT 2025","","Get exported data & dates after answer submit →","200 OK (Get exported data by editor - should see only his own data)",""
"","132","Invitations endpoints tests → Send invitation → Invitation Managers Send → 422 Missing attributes Missing role","","Wed Jan 15 23:24:21 GMT 2025","passed","Wed Jan 15 23:24:21 GMT 2025","","422 Missing attributes","Missing role",""
"","119","Applet Events CRUD tests → Create Events tests → 422 Unprocessable Entity → Create Event with missing timer param (timer type: TIMER)","","Wed Jan 15 23:19:48 GMT 2025","passed","Wed Jan 15 23:19:48 GMT 2025","","422 Unprocessable Entity →","Create Event with missing timer param (timer type: TIMER)",""
"","109","Workspaces managers access tests → Remove manager access → 422 Missing attribute (userId)","","Wed Jan 15 23:28:39 GMT 2025","passed","Wed Jan 15 23:28:39 GMT 2025","","Remove manager access →","422 Missing attribute (userId)",""
"","452","Invitations scenario tests → Accept invitation positive flow → Invitation is not available for invitor anymore","","Wed Jan 15 23:23:32 GMT 2025","passed","Wed Jan 15 23:23:32 GMT 2025","","Accept invitation positive flow →","Invitation is not available for invitor anymore",""
"","262","Answers CRUD tests → Applet owner should not get any flows submissions before invitation acceptance by respondent","","Wed Jan 15 23:16:41 GMT 2025","passed","Wed Jan 15 23:16:41 GMT 2025","","Answers CRUD tests →","Applet owner should not get any flows submissions before invitation acceptance by respondent",""
"","1908","Workspaces endpoints tests → Workspaces created → Get workspace managers → First workspace managers","","Wed Jan 15 23:29:20 GMT 2025","passed","Wed Jan 15 23:29:21 GMT 2025","","Get workspace managers →","First workspace managers",""
"","1144","Applet ""Transfer Ownership"" scenario tests → Transfer Accept → First receiver should become the owner → Verify transferred events","","Wed Jan 15 23:21:31 GMT 2025","passed","Wed Jan 15 23:21:32 GMT 2025","","First receiver should become the owner →","Verify transferred events",""
"","1387","Applet builder tests → Create applet → Positive tests → Scores and reports configurations","","Wed Jan 15 23:18:47 GMT 2025","failed","Wed Jan 15 23:18:48 GMT 2025","","Positive tests →","Scores and reports configurations",""
"","2617","Create Answers for different item types tests → Touch performance task","","Wed Jan 15 23:15:37 GMT 2025","passed","Wed Jan 15 23:15:39 GMT 2025","","Create Answers for different item types tests →","Touch performance task",""
"","120","""Workspace Folders"" endpoints tests → Workspace is created → Update Folder → 404 Not Found (non-existent theme)","","Wed Jan 15 23:28:03 GMT 2025","passed","Wed Jan 15 23:28:03 GMT 2025","","Update Folder →","404 Not Found (non-existent theme)",""
"","324","Answers CRUD tests → Answers handling after invitation acceptance by respondent → Create Answer tests → 201 Create Answer","","Wed Jan 15 23:16:47 GMT 2025","passed","Wed Jan 15 23:16:47 GMT 2025","","Create Answer tests →","201 Create Answer",""
"","413","Files upload/download tests → Upload/Download answers (applet files) → Check answer (file) uploaded → 200 OK (multiple files, uploaded = false)","","Wed Jan 15 23:22:55 GMT 2025","passed","Wed Jan 15 23:22:55 GMT 2025","","Check answer (file) uploaded →","200 OK (multiple files, uploaded = false)",""
"","247","""Workspace Folders"" endpoints tests → Workspace is created → Update Folder → 200 OK","","Wed Jan 15 23:28:03 GMT 2025","passed","Wed Jan 15 23:28:03 GMT 2025","","Update Folder →","200 OK",""
"","347","Get submit dates & exported Answers data tests → Get exported data & dates after answer submit → 200 OK: empty list (Get exported data by coordinator)","","Wed Jan 15 23:15:31 GMT 2025","passed","Wed Jan 15 23:15:31 GMT 2025","","Get exported data & dates after answer submit →","200 OK: empty list (Get exported data by coordinator)",""
"","213","Applet versions endpoints tests → Get applet version changes → 404 (incorrect versionId)","","Wed Jan 15 23:22:19 GMT 2025","passed","Wed Jan 15 23:22:19 GMT 2025","","Get applet version changes →","404 (incorrect versionId)",""
"","198","Administration tests → Applets tests → Update Applet in workspace of Applet owner tests → 403 Forbidden (Reviewer can NOT update Applet)","","Wed Jan 15 23:26:09 GMT 2025","passed","Wed Jan 15 23:26:09 GMT 2025","","Update Applet in workspace of Applet owner tests →","403 Forbidden (Reviewer can NOT update Applet)",""
"","148","Applets CRUD endpoints tests → Update applet → 422 Unprocessable Entity (missing attribute) Missing ""activities""","","Wed Jan 15 23:18:39 GMT 2025","passed","Wed Jan 15 23:18:39 GMT 2025","","422 Unprocessable Entity (missing attribute)","Missing ""activities""",""
"","239","Invitations endpoints tests → Create shell account → 200 OK: shell account with nickname","","Wed Jan 15 23:24:21 GMT 2025","passed","Wed Jan 15 23:24:21 GMT 2025","","Create shell account →","200 OK: shell account with nickname",""
"","198","Workspace folder for different users tests → Manager is invited to the applet → Manager creates own folder in the same workspace Applet Owner and Manager add the same applet in their folders Applet Owner creates another folder Get folders (applet owner)","","Wed Jan 15 23:28:17 GMT 2025","passed","Wed Jan 15 23:28:17 GMT 2025","","Applet Owner creates another folder","Get folders (applet owner)",""
"","15","Applet Library tests → Share applet to the library 401 Unauthorized","","Wed Jan 15 23:18:13 GMT 2025","passed","Wed Jan 15 23:18:13 GMT 2025","","Share applet to the library","401 Unauthorized",""
"","10","""Workspace Folders"" endpoints tests → Workspace is created → Pin/Unpin Folder → Pin Folder → 401 Unauthorized (invalid token)","","Wed Jan 15 23:28:05 GMT 2025","passed","Wed Jan 15 23:28:05 GMT 2025","","Pin Folder →","401 Unauthorized (invalid token)",""
"","357","Administration tests → Applets tests → View General calendar in workspace of Applet owner tests → 200 OK (Manager can view General calendar)","","Wed Jan 15 23:26:13 GMT 2025","passed","Wed Jan 15 23:26:13 GMT 2025","","View General calendar in workspace of Applet owner tests →","200 OK (Manager can view General calendar)",""
"","251","Invitations endpoints tests → Get invitations → No Invitations created → Get invitation by key → 404 Not found (non-existent key)","","Wed Jan 15 23:24:00 GMT 2025","passed","Wed Jan 15 23:24:00 GMT 2025","","Get invitation by key →","404 Not found (non-existent key)",""
"","119","Applet public access tests → Invite link with { requireLogin: true } created → Get public applet events: 404 Not found","","Wed Jan 15 23:21:00 GMT 2025","passed","Wed Jan 15 23:21:00 GMT 2025","","Invite link with { requireLogin: true } created →","Get public applet events: 404 Not found",""
"","222","Applets CRUD endpoints tests → Get applets list → Test for filters (query params) → Search","","Wed Jan 15 23:18:30 GMT 2025","passed","Wed Jan 15 23:18:30 GMT 2025","","Test for filters (query params) →","Search",""
"","12","User Password tests → Password recovery approve tests → 422 Unprocessable Entity Approve user password recovery with missing key param","","Wed Jan 15 23:27:26 GMT 2025","passed","Wed Jan 15 23:27:26 GMT 2025","","422 Unprocessable Entity","Approve user password recovery with missing key param",""
"","205","Applets CRUD endpoints tests → Get applets list → 200 OK (empty list)","","Wed Jan 15 23:18:29 GMT 2025","passed","Wed Jan 15 23:18:29 GMT 2025","","Get applets list →","200 OK (empty list)",""
"","842","Applet builder tests → Create applet → Positive tests → Applet with subscale settings and scorable items","","Wed Jan 15 23:18:47 GMT 2025","failed","Wed Jan 15 23:18:47 GMT 2025","","Positive tests →","Applet with subscale settings and scorable items",""
"","188","""Workspace Folders"" endpoints tests → Workspace is created → Pin/Unpin Folder → Unpin Folder → 204 OK","","Wed Jan 15 23:28:06 GMT 2025","passed","Wed Jan 15 23:28:06 GMT 2025","","Unpin Folder →","204 OK",""
"","404","Applet Events CRUD tests → Create cross-day events tests → 201 Created (Cross-day Event with ONCE periodicity type and availability range: 23:59:00-23:58:00)","","Wed Jan 15 23:20:22 GMT 2025","passed","Wed Jan 15 23:20:22 GMT 2025","","Create cross-day events tests →","201 Created (Cross-day Event with ONCE periodicity type and availability range: 23:59:00-23:58:00)",""
"","107","Applet Events CRUD tests → Create Events tests → 422 Unprocessable Entity → Create Event with missing endTime (periodicity type: MONTHLY) param","","Wed Jan 15 23:19:48 GMT 2025","passed","Wed Jan 15 23:19:48 GMT 2025","","422 Unprocessable Entity →","Create Event with missing endTime (periodicity type: MONTHLY) param",""
"","337","Applet Events CRUD tests → Create cross-day events tests → 201 Created (Cross-day Event with MONTHLY periodicity type and availability range: 00:01:00-00:00:00)","","Wed Jan 15 23:20:22 GMT 2025","passed","Wed Jan 15 23:20:22 GMT 2025","","Create cross-day events tests →","201 Created (Cross-day Event with MONTHLY periodicity type and availability range: 00:01:00-00:00:00)",""
"","12","""Authentication"" endpoints tests → Get Token → 422 Unprocessable Entity (missing attribute)","","Wed Jan 15 23:22:34 GMT 2025","passed","Wed Jan 15 23:22:34 GMT 2025","","Get Token →","422 Unprocessable Entity (missing attribute)",""
"","201","""Subjects"" endpoints CRUD tests → Update subjects 200 OK: shell account","","Wed Jan 15 23:26:50 GMT 2025","passed","Wed Jan 15 23:26:50 GMT 2025","","Update subjects","200 OK: shell account",""
"","194","Applet Library tests → Applet is added to the library → Check Library item name → 400 Bad request: not unique name","","Wed Jan 15 23:18:15 GMT 2025","passed","Wed Jan 15 23:18:15 GMT 2025","","Check Library item name →","400 Bad request: not unique name",""
"","22","Applet Library tests → Applet is added to the library → Cart test → 401 Unauthorized","","Wed Jan 15 23:18:17 GMT 2025","passed","Wed Jan 15 23:18:17 GMT 2025","","Cart test →","401 Unauthorized",""
"","11","Applets CRUD endpoints tests → Update applet → 401 Unauthorized","","Wed Jan 15 23:18:37 GMT 2025","passed","Wed Jan 15 23:18:37 GMT 2025","","Update applet →","401 Unauthorized",""
"","132","Invitations endpoints tests → Decline invitation → 422 - invalid invitation key","","Wed Jan 15 23:24:05 GMT 2025","passed","Wed Jan 15 23:24:05 GMT 2025","","Decline invitation →","422 - invalid invitation key",""
"","547","Applets ""report configuration"" endpoint tests → 200 OK (w/o server configuration)","","Wed Jan 15 23:21:02 GMT 2025","passed","Wed Jan 15 23:21:02 GMT 2025","","Applets ""report configuration"" endpoint tests →","200 OK (w/o server configuration)",""
"","208","Invitations endpoints tests → Decline invitation → 200 OK","","Wed Jan 15 23:24:05 GMT 2025","passed","Wed Jan 15 23:24:05 GMT 2025","","Decline invitation →","200 OK",""
"","2985","Applet Events scenario tests → End-To-End scenario (Individual scheduled flow Event)","","Wed Jan 15 23:20:29 GMT 2025","passed","Wed Jan 15 23:20:31 GMT 2025","","Applet Events scenario tests →","End-To-End scenario (Individual scheduled flow Event)",""
"","516","Applets CRUD endpoints tests → Update applet → 200 OK","","Wed Jan 15 23:18:37 GMT 2025","passed","Wed Jan 15 23:18:37 GMT 2025","","Update applet →","200 OK",""
"","314","""Workspace Folders"" endpoints tests → Workspace is created → Get Folders → 200 OK (empty list)","","Wed Jan 15 23:28:02 GMT 2025","passed","Wed Jan 15 23:28:02 GMT 2025","","Get Folders →","200 OK (empty list)",""
"","125","""Themes"" endpoints tests → Update Theme → 404 Not Found (non-existent theme)","","Wed Jan 15 23:26:57 GMT 2025","passed","Wed Jan 15 23:26:57 GMT 2025","","Update Theme →","404 Not Found (non-existent theme)",""
"","206","""Themes"" endpoints tests → Create Theme → 201 Created","","Wed Jan 15 23:26:56 GMT 2025","passed","Wed Jan 15 23:26:56 GMT 2025","","Create Theme →","201 Created",""
"","179","Workspaces endpoints tests → Workspaces created → Get workspace applet details → 404 Not Found (non-existent appletId)","","Wed Jan 15 23:29:17 GMT 2025","passed","Wed Jan 15 23:29:17 GMT 2025","","Get workspace applet details →","404 Not Found (non-existent appletId)",""
"","322","Summary & Review activities tests → Get Summary and Review Activities (empty list) tests → Get Review Activities (empty list) →","","Wed Jan 15 23:17:55 GMT 2025","passed","Wed Jan 15 23:17:55 GMT 2025","","Get Summary and Review Activities (empty list) tests →","Get Review Activities (empty list) →",""
"","12","Summary & Review activities tests → Get Summary and Review Activities (non-empty list) tests → Get Review Activities list tests → 401 Unauthorized (Get Review Activities list with not existing token)","","Wed Jan 15 23:17:58 GMT 2025","passed","Wed Jan 15 23:17:58 GMT 2025","","Get Review Activities list tests →","401 Unauthorized (Get Review Activities list with not existing token)",""
"","681","Logs upload/download tests → Download Logs → 200 OK (empty list)","","Wed Jan 15 23:23:00 GMT 2025","passed","Wed Jan 15 23:23:00 GMT 2025","","Download Logs →","200 OK (empty list)",""
"","1270","Delete Subjects (remove applet access) tests → 200 OK: remove access to both applets for the 2nd respondent","","Wed Jan 15 23:26:25 GMT 2025","passed","Wed Jan 15 23:26:26 GMT 2025","","Delete Subjects (remove applet access) tests →","200 OK: remove access to both applets for the 2nd respondent",""
"","714","""Authentication"" endpoints tests → Get Token → 200 OK","","Wed Jan 15 23:22:34 GMT 2025","passed","Wed Jan 15 23:22:34 GMT 2025","","Get Token →","200 OK",""
"","199","Answers CRUD tests → Answers handling after invitation acceptance by respondent → Check answer existence tests → 200 OK (exists = true, check by applet owner with submitId)","","Wed Jan 15 23:16:50 GMT 2025","passed","Wed Jan 15 23:16:50 GMT 2025","","Check answer existence tests →","200 OK (exists = true, check by applet owner with submitId)",""
