"DESCRIPTION","DURATION IN MS","NAME","PARENT SUITE","START TIME","STATUS","STOP TIME","SUB SUITE","SUITE","TEST CLASS","TEST METHOD"
"","182","Applet versions endpoints tests → Get applet version changes → 404 (incorrect appletId)","","Wed Jan 15 23:22:19 GMT 2025","passed","Wed Jan 15 23:22:19 GMT 2025","","Get applet version changes →","404 (incorrect appletId)",""
"","897","Delete Subjects (remove applet access) tests → 200 OK: remove manager from respondents list and verify he remains in managers list","","Wed Jan 15 23:26:25 GMT 2025","passed","Wed Jan 15 23:26:25 GMT 2025","","Delete Subjects (remove applet access) tests →","200 OK: remove manager from respondents list and verify he remains in managers list",""
"","188","Summary & Review activities tests → Get Summary and Review Activities (non-empty list) tests → Get Review Activities list tests → 422 Unprocessable Entity (Get Review Activities list without createdDate query param)","","Wed Jan 15 23:17:58 GMT 2025","passed","Wed Jan 15 23:17:58 GMT 2025","","Get Review Activities list tests →","422 Unprocessable Entity (Get Review Activities list without createdDate query param)",""
"","1013","User Events scenario tests → User should be able to see events related to a specific Applet","","Wed Jan 15 23:27:42 GMT 2025","passed","Wed Jan 15 23:27:43 GMT 2025","","User Events scenario tests →","User should be able to see events related to a specific Applet",""
"","1083","Applet builder tests → Create applet → Positive tests → Applet multiple flows with maximum parameters","","Wed Jan 15 23:18:47 GMT 2025","failed","Wed Jan 15 23:18:48 GMT 2025","","Positive tests →","Applet multiple flows with maximum parameters",""
"","107","Applet Events CRUD tests → Update Applet Event tests → 422 Unprocessable Entity → Update Event with missing startTime (periodicity type: DAILY) param","","Wed Jan 15 23:20:11 GMT 2025","passed","Wed Jan 15 23:20:11 GMT 2025","","422 Unprocessable Entity →","Update Event with missing startTime (periodicity type: DAILY) param",""
"","176","Answers CRUD tests → Answers handling after invitation acceptance by respondent → Create Answer tests → 422 Unprocessable Entity → Create Answer with missing answer param","","Wed Jan 15 23:16:49 GMT 2025","passed","Wed Jan 15 23:16:49 GMT 2025","","422 Unprocessable Entity →","Create Answer with missing answer param",""
"","12","Applet Library tests → Applet is added to the library → Check Library item name → 401 Unauthorized","","Wed Jan 15 23:18:15 GMT 2025","passed","Wed Jan 15 23:18:15 GMT 2025","","Check Library item name →","401 Unauthorized",""
"","12","Invitations endpoints tests → Send invitation → Invitation Managers Send → 401 Unauthorized (invalid token)","","Wed Jan 15 23:24:16 GMT 2025","passed","Wed Jan 15 23:24:16 GMT 2025","","Invitation Managers Send →","401 Unauthorized (invalid token)",""
"","215","Workspaces endpoints tests → Workspaces created → Update workspace applet respondent → 404 Not Found (invalid applet id)","","Wed Jan 15 23:29:31 GMT 2025","passed","Wed Jan 15 23:29:31 GMT 2025","","Update workspace applet respondent →","404 Not Found (invalid applet id)",""
"","15","Invitations endpoints tests → Create shell account → 401: Unauthorized","","Wed Jan 15 23:24:21 GMT 2025","passed","Wed Jan 15 23:24:21 GMT 2025","","Create shell account →","401: Unauthorized",""
"","215","Activity Assessment & Review CRUD tests → Submit Assessment tests → 422 Unprocessable Entity → Create Assessment with missing reviewerPublicKey param","","Wed Jan 15 23:17:20 GMT 2025","passed","Wed Jan 15 23:17:20 GMT 2025","","422 Unprocessable Entity →","Create Assessment with missing reviewerPublicKey param",""
"","2052","Create Answers for different item types tests → All web-app items","","Wed Jan 15 23:15:37 GMT 2025","passed","Wed Jan 15 23:15:39 GMT 2025","","Create Answers for different item types tests →","All web-app items",""
"","2467","Administration tests → Organizers tests → Invite new organizer tests → 200 OK (Manager can invite manager, coordinator, editor, reviewer)","","Wed Jan 15 23:25:50 GMT 2025","passed","Wed Jan 15 23:25:52 GMT 2025","","Invite new organizer tests →","200 OK (Manager can invite manager, coordinator, editor, reviewer)",""
"","216","Applet versions endpoints tests → Update Applet → Add Activity → Remove Activity → Add Activity Flow → Remove Activity Flow → Add Activity Item → Remove Activity Item → Update Activity → Update Activity Item → Update Activity Flow → Update Applet description → Get applet version by id","","Wed Jan 15 23:22:32 GMT 2025","passed","Wed Jan 15 23:22:32 GMT 2025","","Update Applet description →","Get applet version by id",""
"","204","""Subjects"" endpoints CRUD tests → Delete subjects 404: Not Found","","Wed Jan 15 23:26:52 GMT 2025","passed","Wed Jan 15 23:26:52 GMT 2025","","Delete subjects","404: Not Found",""
"","270","Applets CRUD endpoints tests → Get applets list → Test for filters (query params) → Limit","","Wed Jan 15 23:18:30 GMT 2025","passed","Wed Jan 15 23:18:30 GMT 2025","","Test for filters (query params) →","Limit",""
"","803","Create User tests → 201 Create User","","Wed Jan 15 23:26:59 GMT 2025","passed","Wed Jan 15 23:26:59 GMT 2025","","Create User tests →","201 Create User",""
"","239","Administration tests → Applets tests → Update Applet in workspace of Applet owner tests → 403 Forbidden (Coordinator can NOT update Applet)","","Wed Jan 15 23:26:09 GMT 2025","passed","Wed Jan 15 23:26:09 GMT 2025","","Update Applet in workspace of Applet owner tests →","403 Forbidden (Coordinator can NOT update Applet)",""
"","596","Applet Events CRUD tests → Get general and individual Applet Events → 404 Not Found (Get Applet Events of deleted Applet)","","Wed Jan 15 23:19:51 GMT 2025","passed","Wed Jan 15 23:19:51 GMT 2025","","Get general and individual Applet Events →","404 Not Found (Get Applet Events of deleted Applet)",""
"","219","Activity Assessment & Review CRUD tests → Get Assessment & Review tests → Get Reviews tests → 200 OK (no Review data)","","Wed Jan 15 23:17:18 GMT 2025","passed","Wed Jan 15 23:17:18 GMT 2025","","Get Reviews tests →","200 OK (no Review data)",""
"","253","Workspaces endpoints tests → Workspaces created → Search workspace Applets → 200 OK (search by partial name)","","Wed Jan 15 23:29:15 GMT 2025","passed","Wed Jan 15 23:29:15 GMT 2025","","Search workspace Applets →","200 OK (search by partial name)",""
"","514","Applet ""Transfer Ownership"" scenario tests → Transfer Accept → First receiver should become the owner → Verify Pending Invitations & Public link","","Wed Jan 15 23:21:31 GMT 2025","passed","Wed Jan 15 23:21:31 GMT 2025","","First receiver should become the owner →","Verify Pending Invitations & Public link",""
"","11","Files upload/download tests → Upload/Download answers (applet files) → Download Answer → 401 Unauthorized","","Wed Jan 15 23:22:51 GMT 2025","passed","Wed Jan 15 23:22:51 GMT 2025","","Download Answer →","401 Unauthorized",""
"","109","Workspaces endpoints tests → Workspaces created → Update workspace applet respondent → 422 Missing Attribute (nickname)","","Wed Jan 15 23:29:31 GMT 2025","passed","Wed Jan 15 23:29:31 GMT 2025","","Update workspace applet respondent →","422 Missing Attribute (nickname)",""
"","243","Invitations endpoints tests → Send invitation → Invitation Reviewer Send → 400 - Incorrect respondents list","","Wed Jan 15 23:24:11 GMT 2025","passed","Wed Jan 15 23:24:11 GMT 2025","","Invitation Reviewer Send →","400 - Incorrect respondents list",""
"","313","Workspaces endpoints tests → Workspaces created → Get workspace managers → Test for filters (query params) → Limit","","Wed Jan 15 23:29:23 GMT 2025","passed","Wed Jan 15 23:29:23 GMT 2025","","Test for filters (query params) →","Limit",""
"","126","Applet Events CRUD tests → Create Events tests → 422 Unprocessable Entity → Create Event with missing timer param (timer type: IDLE)","","Wed Jan 15 23:19:48 GMT 2025","passed","Wed Jan 15 23:19:48 GMT 2025","","422 Unprocessable Entity →","Create Event with missing timer param (timer type: IDLE)",""
"","11","Applet versions endpoints tests → Get applet version changes → 401 Unauthorized","","Wed Jan 15 23:22:19 GMT 2025","passed","Wed Jan 15 23:22:19 GMT 2025","","Get applet version changes →","401 Unauthorized",""
"","245","Activity Assessment & Review CRUD tests → Get Assessment & Review tests → Get Assessment tests → 200 OK (no Assessment data)","","Wed Jan 15 23:17:17 GMT 2025","passed","Wed Jan 15 23:17:17 GMT 2025","","Get Assessment tests →","200 OK (no Assessment data)",""
"","111","Applet Events CRUD tests → Update Applet Event tests → 422 Unprocessable Entity → Update Event with missing endTime (periodicity type: WEEKDAYS) param","","Wed Jan 15 23:20:11 GMT 2025","passed","Wed Jan 15 23:20:11 GMT 2025","","422 Unprocessable Entity →","Update Event with missing endTime (periodicity type: WEEKDAYS) param",""
"","172","Applet Library tests → Applet is added to the library → Get Library items list 200 OK (search by name)","","Wed Jan 15 23:18:14 GMT 2025","passed","Wed Jan 15 23:18:14 GMT 2025","","Get Library items list","200 OK (search by name)",""
"","12","Activity Assessment & Review CRUD tests → Get Assessment & Review tests → Get Assessment tests → 401 Unauthorized (Get Assessment with not existing token)","","Wed Jan 15 23:17:17 GMT 2025","passed","Wed Jan 15 23:17:17 GMT 2025","","Get Assessment tests →","401 Unauthorized (Get Assessment with not existing token)",""
"","11","Logs upload/download tests → Check logs existence → 401 Unauthorized","","Wed Jan 15 23:23:04 GMT 2025","passed","Wed Jan 15 23:23:04 GMT 2025","","Check logs existence →","401 Unauthorized",""
"","206","Applet versions endpoints tests → Get applet version by id → 404 (incorrect versionId)","","Wed Jan 15 23:22:19 GMT 2025","passed","Wed Jan 15 23:22:19 GMT 2025","","Get applet version by id →","404 (incorrect versionId)",""
"","349","Answer Notes tests → Delete Note tests → 404 Not Found (Delete not existing Note)","","Wed Jan 15 23:14:58 GMT 2025","passed","Wed Jan 15 23:14:58 GMT 2025","","Delete Note tests →","404 Not Found (Delete not existing Note)",""
"","1146","Applet Events CRUD tests → Delete scheduled Applet Event by Id tests → 204 No Content (Delete created individual scheduled activity Event)","","Wed Jan 15 23:20:03 GMT 2025","passed","Wed Jan 15 23:20:04 GMT 2025","","Delete scheduled Applet Event by Id tests →","204 No Content (Delete created individual scheduled activity Event)",""
"","231","Workspaces endpoints tests → Workspaces created → Search workspace Applets → 200 OK (no result)","","Wed Jan 15 23:29:15 GMT 2025","passed","Wed Jan 15 23:29:15 GMT 2025","","Search workspace Applets →","200 OK (no result)",""
"","324","Applet Events CRUD tests → Import Applet Events tests → 201 Import Events (general scheduled activity Event & individual Always Available activity Event)","","Wed Jan 15 23:20:18 GMT 2025","passed","Wed Jan 15 23:20:18 GMT 2025","","Import Applet Events tests →","201 Import Events (general scheduled activity Event & individual Always Available activity Event)",""
"","112","Invitations endpoints tests → Accept invitation → 422 - invalid invitation key","","Wed Jan 15 23:24:02 GMT 2025","passed","Wed Jan 15 23:24:02 GMT 2025","","Accept invitation →","422 - invalid invitation key",""
"","1717","Applet public links tests → Accept Public invitation tests → 200 OK (any other user can also accept public link invitation)","","Wed Jan 15 23:24:30 GMT 2025","passed","Wed Jan 15 23:24:31 GMT 2025","","Accept Public invitation tests →","200 OK (any other user can also accept public link invitation)",""
"","337","Applet Events CRUD tests → Create cross-day events tests → 201 Created (Cross-day Event with MONTHLY periodicity type and availability range: 23:59:00-23:58:00)","","Wed Jan 15 23:20:22 GMT 2025","passed","Wed Jan 15 23:20:22 GMT 2025","","Create cross-day events tests →","201 Created (Cross-day Event with MONTHLY periodicity type and availability range: 23:59:00-23:58:00)",""
"","283","Invitations endpoints tests → Send invitation → Invitation Managers Send → 404 - Applet does not exist","","Wed Jan 15 23:24:16 GMT 2025","passed","Wed Jan 15 23:24:16 GMT 2025","","Invitation Managers Send →","404 - Applet does not exist",""
"","238","Activity Versions & Identifiers tests → Get Versions tests → Applet has been updated → 200 OK (Get versions after updating item type, applet name and adding new item)","","Wed Jan 15 23:17:36 GMT 2025","passed","Wed Jan 15 23:17:36 GMT 2025","","Applet has been updated →","200 OK (Get versions after updating item type, applet name and adding new item)",""
"","309","User Events scenario tests → The 2nd respondent should get in total 4 Events from the 1st and 2nd Applet","","Wed Jan 15 23:27:42 GMT 2025","passed","Wed Jan 15 23:27:42 GMT 2025","","User Events scenario tests →","The 2nd respondent should get in total 4 Events from the 1st and 2nd Applet",""
"","334","Administration tests → Perform activities tests → 200 OK (Applet owner can submit answers)","","Wed Jan 15 23:26:19 GMT 2025","passed","Wed Jan 15 23:26:19 GMT 2025","","Perform activities tests →","200 OK (Applet owner can submit answers)",""
"","12","Summary & Review activities tests → Get Summary and Review Activities (non-empty list) tests → Get Summary Activities list tests → 401 Unauthorized (Get Summary Activities list with not existing token)","","Wed Jan 15 23:17:58 GMT 2025","passed","Wed Jan 15 23:17:58 GMT 2025","","Get Summary Activities list tests →","401 Unauthorized (Get Summary Activities list with not existing token)",""
"","215","Applet Library tests → Applet is added to the library → Cart test → Get Cart items (empty cart)","","Wed Jan 15 23:18:17 GMT 2025","passed","Wed Jan 15 23:18:17 GMT 2025","","Cart test →","Get Cart items (empty cart)",""
"","295","Shell account invitation scenario tests → Accept invitation by unregistered user → New user can accept invitation after registration","","Wed Jan 15 23:24:54 GMT 2025","passed","Wed Jan 15 23:24:54 GMT 2025","","Accept invitation by unregistered user →","New user can accept invitation after registration",""
"","281","Answers CRUD tests → Answers handling after invitation acceptance by respondent → Get activity answers list & Answers of respondent tests → 404 Not Found (Get Answer with not existing answerId)","","Wed Jan 15 23:16:53 GMT 2025","passed","Wed Jan 15 23:16:53 GMT 2025","","Get activity answers list & Answers of respondent tests →","404 Not Found (Get Answer with not existing answerId)",""
"","246","Administration tests → Applets tests → Create Applet in workspace of Applet owner tests → 403 Forbidden (Reviewer can NOT create Applet in workspace of Applet owner)","","Wed Jan 15 23:26:07 GMT 2025","passed","Wed Jan 15 23:26:07 GMT 2025","","Create Applet in workspace of Applet owner tests →","403 Forbidden (Reviewer can NOT create Applet in workspace of Applet owner)",""
"","176","Invitations endpoints tests → Get invitations → No Invitations created → Get invitation by key → 422 Unprocessable entity (invalid key)","","Wed Jan 15 23:24:00 GMT 2025","passed","Wed Jan 15 23:24:00 GMT 2025","","Get invitation by key →","422 Unprocessable entity (invalid key)",""
"","859","Answers scenario tests → Applet owner should NOT be able to see Answers of respondent in the Applet duplicate","","Wed Jan 15 23:16:15 GMT 2025","passed","Wed Jan 15 23:16:15 GMT 2025","","Answers scenario tests →","Applet owner should NOT be able to see Answers of respondent in the Applet duplicate",""
"","13","Answers CRUD tests → Answers handling after invitation acceptance by respondent → Get activity answers list & Answers of respondent tests → 401 Unauthorized (Get Answer with not existing token)","","Wed Jan 15 23:16:53 GMT 2025","passed","Wed Jan 15 23:16:53 GMT 2025","","Get activity answers list & Answers of respondent tests →","401 Unauthorized (Get Answer with not existing token)",""
"","466","Invitations scenario tests → Accept invitation positive flow → Invitor can see invitation before it accepted","","Wed Jan 15 23:23:32 GMT 2025","passed","Wed Jan 15 23:23:32 GMT 2025","","Accept invitation positive flow →","Invitor can see invitation before it accepted",""
"","3350","Applet Events scenario tests → End-To-End scenario (General scheduled flow Event)","","Wed Jan 15 23:20:29 GMT 2025","passed","Wed Jan 15 23:20:32 GMT 2025","","Applet Events scenario tests →","End-To-End scenario (General scheduled flow Event)",""
"","349","Applet ""Transfer Ownership"" scenario tests → Transfer Ownership to unregistered user → New user can accept transfer request after registration","","Wed Jan 15 23:21:44 GMT 2025","passed","Wed Jan 15 23:21:44 GMT 2025","","Transfer Ownership to unregistered user →","New user can accept transfer request after registration",""
"","330","Workspaces endpoints tests → Workspaces created → Get workspace applet respondents → First workspace applet respondents","","Wed Jan 15 23:29:19 GMT 2025","passed","Wed Jan 15 23:29:19 GMT 2025","","Get workspace applet respondents →","First workspace applet respondents",""
"","10","Workspaces endpoints tests → Empty workspaces → Get workspace managers → 401 Unauthorized","","Wed Jan 15 23:28:57 GMT 2025","passed","Wed Jan 15 23:28:57 GMT 2025","","Get workspace managers →","401 Unauthorized",""
"","251","Administration tests → Applets tests → Export & view data in workspace of Applet owner tests → View respondent's data tests → 200 OK (Applet owner can view data)","","Wed Jan 15 23:26:17 GMT 2025","passed","Wed Jan 15 23:26:17 GMT 2025","","View respondent's data tests →","200 OK (Applet owner can view data)",""
"","2177","Create Answers for different item types tests → SingleSelect item","","Wed Jan 15 23:15:37 GMT 2025","passed","Wed Jan 15 23:15:39 GMT 2025","","Create Answers for different item types tests →","SingleSelect item",""
"","119","Applet Events CRUD tests → Create Events tests → 422 Unprocessable Entity → Create Event with missing endTime (periodicity type: WEEKLY) param","","Wed Jan 15 23:19:48 GMT 2025","passed","Wed Jan 15 23:19:48 GMT 2025","","422 Unprocessable Entity →","Create Event with missing endTime (periodicity type: WEEKLY) param",""
"","348","Applet Events CRUD tests → Import Applet Events tests → 200 OK (Get all created and imported Applet Events) 200 OK (Get all general Applet Events)","","Wed Jan 15 23:20:20 GMT 2025","passed","Wed Jan 15 23:20:20 GMT 2025","","200 OK (Get all created and imported Applet Events)","200 OK (Get all general Applet Events)",""
"","198","Workspace folder for different users tests → Manager is invited to the applet → Manager creates own folder in the same workspace Get folders (applet owner)","","Wed Jan 15 23:28:15 GMT 2025","passed","Wed Jan 15 23:28:15 GMT 2025","","Manager creates own folder in the same workspace","Get folders (applet owner)",""
"","362","Administration tests → Respondents tests → View all respondents tests → 200 OK (Manager can view all respondents)","","Wed Jan 15 23:26:02 GMT 2025","passed","Wed Jan 15 23:26:02 GMT 2025","","View all respondents tests →","200 OK (Manager can view all respondents)",""
"","144","Applet Events CRUD tests → Create cross-day events tests → 422 (Cross-day Event with ONCE periodicity type and availability range: 00:00:00-00:00:00)","","Wed Jan 15 23:20:22 GMT 2025","passed","Wed Jan 15 23:20:22 GMT 2025","","Create cross-day events tests →","422 (Cross-day Event with ONCE periodicity type and availability range: 00:00:00-00:00:00)",""
"","173","Applet Events CRUD tests → Count scheduled Applet Events tests → 404 Not Found (Count general scheduled Events of not existing Applet)","","Wed Jan 15 23:20:13 GMT 2025","passed","Wed Jan 15 23:20:13 GMT 2025","","Count scheduled Applet Events tests →","404 Not Found (Count general scheduled Events of not existing Applet)",""
"","10","Update Password tests → 401 Unauthorized (Update password with not existing token)","","Wed Jan 15 23:27:26 GMT 2025","passed","Wed Jan 15 23:27:26 GMT 2025","","Update Password tests →","401 Unauthorized (Update password with not existing token)",""
"","14","Flow Versions & Identifiers tests → Get flow Identifiers tests → 401 Unauthorized (Get flow identifiers with not existing token)","","Wed Jan 15 23:17:28 GMT 2025","passed","Wed Jan 15 23:17:28 GMT 2025","","Get flow Identifiers tests →","401 Unauthorized (Get flow identifiers with not existing token)",""
"","436","Files upload/download tests → Upload/Download answers (applet files) → Upload Answer → 200 OK","","Wed Jan 15 23:22:50 GMT 2025","passed","Wed Jan 15 23:22:50 GMT 2025","","Upload Answer →","200 OK",""
"","249","Activity Assessment & Review CRUD tests → Get Assessment & Review tests → Get Assessment tests → 403 Forbidden (Get Assessment by respondent)","","Wed Jan 15 23:17:17 GMT 2025","passed","Wed Jan 15 23:17:17 GMT 2025","","Get Assessment tests →","403 Forbidden (Get Assessment by respondent)",""
"","323","Workspaces endpoints tests → Workspaces created → Get workspace managers → Second workspace managers","","Wed Jan 15 23:29:20 GMT 2025","passed","Wed Jan 15 23:29:20 GMT 2025","","Get workspace managers →","Second workspace managers",""
"","220","Answer Notes tests → Edit Note tests → 422 Unprocessable Entity (Update Note without required param - note)","","Wed Jan 15 23:14:55 GMT 2025","passed","Wed Jan 15 23:14:55 GMT 2025","","Edit Note tests →","422 Unprocessable Entity (Update Note without required param - note)",""
"","336","Shell account invitation scenario tests → Accept invitation by already registered user → Verify shell account is in pending status in the list of respondents","","Wed Jan 15 23:25:07 GMT 2025","passed","Wed Jan 15 23:25:07 GMT 2025","","Accept invitation by already registered user →","Verify shell account is in pending status in the list of respondents",""
"","21","""Authentication"" endpoints tests → Refresh Token → 422 Unprocessable Entity (missing attribute)","","Wed Jan 15 23:22:35 GMT 2025","passed","Wed Jan 15 23:22:35 GMT 2025","","Refresh Token →","422 Unprocessable Entity (missing attribute)",""
"","17","Duplicate Applet endpoint tests → 401 Unauthorized","","Wed Jan 15 23:19:24 GMT 2025","passed","Wed Jan 15 23:19:24 GMT 2025","","Duplicate Applet endpoint tests →","401 Unauthorized",""
"","120","""Themes"" endpoints tests → Update Theme → 422 Unprocessable Entity (missing attribute)","","Wed Jan 15 23:26:57 GMT 2025","passed","Wed Jan 15 23:26:57 GMT 2025","","Update Theme →","422 Unprocessable Entity (missing attribute)",""
"","282","Answers CRUD tests → Answers handling after invitation acceptance by respondent → Create Answer tests → 201 (Answer can be created by Applet Owner)","","Wed Jan 15 23:16:47 GMT 2025","passed","Wed Jan 15 23:16:47 GMT 2025","","Create Answer tests →","201 (Answer can be created by Applet Owner)",""
"","254","Applet versions endpoints tests → Get applet version changes → 200 Ok (Initial version)","","Wed Jan 15 23:22:19 GMT 2025","passed","Wed Jan 15 23:22:19 GMT 2025","","Get applet version changes →","200 Ok (Initial version)",""
"","204","Activity Assessment & Review CRUD tests → Get Assessment & Review tests → Get Assessment tests → 404 Not Found (Get Assessment of not existing Answer)","","Wed Jan 15 23:17:17 GMT 2025","passed","Wed Jan 15 23:17:17 GMT 2025","","Get Assessment tests →","404 Not Found (Get Assessment of not existing Answer)",""
"","696","""Authentication"" endpoints tests → OpenAPI auth → 200 OK","","Wed Jan 15 23:22:40 GMT 2025","passed","Wed Jan 15 23:22:40 GMT 2025","","OpenAPI auth →","200 OK",""
"","579","Workspaces managers access tests → Set workspace managers applet access list → 200 OK (grant editor's permissions for respondent)","","Wed Jan 15 23:28:35 GMT 2025","passed","Wed Jan 15 23:28:35 GMT 2025","","Set workspace managers applet access list →","200 OK (grant editor's permissions for respondent)",""
"","211","Applets CRUD endpoints tests → Create applet → 422 Unprocessable Entity (missing attribute) Missing ""activities""","","Wed Jan 15 23:18:35 GMT 2025","passed","Wed Jan 15 23:18:35 GMT 2025","","422 Unprocessable Entity (missing attribute)","Missing ""activities""",""
"","189","Answer Notes tests → Get Notes list tests → Get Notes list (not empty) 404 Not Found (Get Note list of not existing Applet)","","Wed Jan 15 23:14:53 GMT 2025","passed","Wed Jan 15 23:14:53 GMT 2025","","Get Notes list (not empty)","404 Not Found (Get Note list of not existing Applet)",""
"","560","Answer Notes tests → Delete Note tests → 404 Not Found (Delete Note in not existing Applet)","","Wed Jan 15 23:14:58 GMT 2025","passed","Wed Jan 15 23:14:58 GMT 2025","","Delete Note tests →","404 Not Found (Delete Note in not existing Applet)",""
"","153","Applet Events CRUD tests → Create cross-day events tests → 422 (Cross-day Event with ONCE periodicity type and availability range: 23:59:00-23:59:00)","","Wed Jan 15 23:20:22 GMT 2025","passed","Wed Jan 15 23:20:22 GMT 2025","","Create cross-day events tests →","422 (Cross-day Event with ONCE periodicity type and availability range: 23:59:00-23:59:00)",""
