"DESCRIPTION","DURATION IN MS","NAME","PARENT SUITE","START TIME","STATUS","STOP TIME","SUB SUITE","SUITE","TEST CLASS","TEST METHOD"
"","266","Applet ""Transfer Ownership"" endpoints tests → Transfer Decline → 404 (invalid key)","","Wed Apr 30 13:56:26 GMT 2025","passed","Wed Apr 30 13:56:26 GMT 2025","","Transfer Decline →","404 (invalid key)",""
"","252","Applet Events CRUD tests → Update Applet Event tests → 404 Not Found (Update general scheduled activity Event with not existing id)","","Wed Apr 30 13:54:20 GMT 2025","passed","Wed Apr 30 13:54:20 GMT 2025","","Update Applet Event tests →","404 Not Found (Update general scheduled activity Event with not existing id)",""
"","264","Invitations endpoints tests → Create shell account → 200 OK: shell account with min required attributes","","Wed Apr 30 13:59:03 GMT 2025","passed","Wed Apr 30 13:59:03 GMT 2025","","Create shell account →","200 OK: shell account with min required attributes",""
"","1085","Invitations endpoints tests → Send invitation → Invitation Managers Send → 200 OK (send to unregistered user) With workspace prefix, language: fr","","Wed Apr 30 13:58:58 GMT 2025","passed","Wed Apr 30 13:58:59 GMT 2025","","200 OK (send to unregistered user)","With workspace prefix, language: fr",""
"","28","Create User tests → 422 Unprocessable Entity Create user with empty firstName param","","Wed Apr 30 14:02:03 GMT 2025","passed","Wed Apr 30 14:02:03 GMT 2025","","422 Unprocessable Entity","Create user with empty firstName param",""
"","511","Workspaces endpoints tests → Workspaces created → Get managers priority role → 200 OK (First applet owner gets role in second user's workspace with appletIds filter)","","Wed Apr 30 14:04:28 GMT 2025","passed","Wed Apr 30 14:04:28 GMT 2025","","Get managers priority role →","200 OK (First applet owner gets role in second user's workspace with appletIds filter)",""
"","311","Answers scenario tests → Review count in activity answers after submitting assessment by Applet owner and Reviewer Get review count by Reviewer","","Wed Apr 30 13:50:29 GMT 2025","passed","Wed Apr 30 13:50:29 GMT 2025","","Review count in activity answers after submitting assessment by Applet owner and Reviewer","Get review count by Reviewer",""
"","982","Administration tests → Organizers tests → Invite new organizer tests → 403 Forbidden (Respondent can NOT invite manager, coordinator, editor, reviewer)","","Wed Apr 30 14:00:35 GMT 2025","passed","Wed Apr 30 14:00:35 GMT 2025","","Invite new organizer tests →","403 Forbidden (Respondent can NOT invite manager, coordinator, editor, reviewer)",""
"","67","Applets CRUD endpoints tests → Delete applet → 401 Unauthorized","","Wed Apr 30 13:52:47 GMT 2025","passed","Wed Apr 30 13:52:47 GMT 2025","","Delete applet →","401 Unauthorized",""
"","71","Flow Versions & Identifiers tests → Get flow Versions tests → 401 Unauthorized (Get flow versions with not existing token)","","Wed Apr 30 13:51:26 GMT 2025","passed","Wed Apr 30 13:51:26 GMT 2025","","Get flow Versions tests →","401 Unauthorized (Get flow versions with not existing token)",""
"","29","Workspaces endpoints tests → Workspaces created → Get workspace by ownerId → 401 Unauthorized","","Wed Apr 30 14:04:14 GMT 2025","passed","Wed Apr 30 14:04:14 GMT 2025","","Get workspace by ownerId →","401 Unauthorized",""
"","152","Applet Library tests → Applet is added to the library → Get Library Applet by id → 404 Not found  (invalid applet item id)","","Wed Apr 30 13:52:19 GMT 2025","passed","Wed Apr 30 13:52:19 GMT 2025","","Get Library Applet by id →","404 Not found  (invalid applet item id)",""
"","85","""Themes"" endpoints tests → Update Theme → 401 Unauthorized (invalid token)","","Wed Apr 30 14:01:59 GMT 2025","passed","Wed Apr 30 14:01:59 GMT 2025","","Update Theme →","401 Unauthorized (invalid token)",""
"","605","Applet Events scenario tests → General Always Available activity & General Always Available flow Events should appear automatically after Applet creation","","Wed Apr 30 13:54:41 GMT 2025","passed","Wed Apr 30 13:54:41 GMT 2025","","Applet Events scenario tests →","General Always Available activity & General Always Available flow Events should appear automatically after Applet creation",""
"","280","Get applet completed activities tests → Respondent completes the 1st activity within default always available event → 200 OK : first activity completion should be present","","Wed Apr 30 13:48:39 GMT 2025","passed","Wed Apr 30 13:48:39 GMT 2025","","Respondent completes the 1st activity within default always available event →","200 OK : first activity completion should be present",""
"","30","""Authentication"" endpoints tests → Delete Token → 401 Unauthorized (non-existent token)","","Wed Apr 30 13:57:08 GMT 2025","passed","Wed Apr 30 13:57:08 GMT 2025","","Delete Token →","401 Unauthorized (non-existent token)",""
"","609","Administration tests → Applets tests → Duplicate Applet in workspace of Applet owner tests → 201 Created (Manager can duplicate Applet)","","Wed Apr 30 14:00:59 GMT 2025","passed","Wed Apr 30 14:00:59 GMT 2025","","Duplicate Applet in workspace of Applet owner tests →","201 Created (Manager can duplicate Applet)",""
"","29","User Password tests → Password recovery approve tests → 422 Unprocessable Entity Approve user password recovery with missing key param","","Wed Apr 30 14:02:28 GMT 2025","passed","Wed Apr 30 14:02:28 GMT 2025","","422 Unprocessable Entity","Approve user password recovery with missing key param",""
"","328","Administration tests → Applets tests → Export & view data in workspace of Applet owner tests → View respondent's data tests → 200 OK (Manager can view data)","","Wed Apr 30 14:01:05 GMT 2025","passed","Wed Apr 30 14:01:05 GMT 2025","","View respondent's data tests →","200 OK (Manager can view data)",""
"","202","Answer Notes tests → Create Notes tests → 404 Not Found (Create Note in not existing Applet)","","Wed Apr 30 13:48:25 GMT 2025","passed","Wed Apr 30 13:48:25 GMT 2025","","Create Notes tests →","404 Not Found (Create Note in not existing Applet)",""
"","385","Delete User tests → 404 Not found (Delete already deleted user)","","Wed Apr 30 14:02:06 GMT 2025","passed","Wed Apr 30 14:02:06 GMT 2025","","Delete User tests →","404 Not found (Delete already deleted user)",""
"","2418","Administration tests → Applets tests → Update Applet in workspace of Applet owner tests → 200 OK (Editor can update Applet)","","Wed Apr 30 14:00:54 GMT 2025","passed","Wed Apr 30 14:00:56 GMT 2025","","Update Applet in workspace of Applet owner tests →","200 OK (Editor can update Applet)",""
"","351","Applet versions endpoints tests → Get applet version by id → 200 OK (Initial Version)","","Wed Apr 30 13:56:41 GMT 2025","passed","Wed Apr 30 13:56:41 GMT 2025","","Get applet version by id →","200 OK (Initial Version)",""
"","30","Applet versions endpoints tests → Get applet version changes → 401 Unauthorized","","Wed Apr 30 13:56:42 GMT 2025","passed","Wed Apr 30 13:56:42 GMT 2025","","Get applet version changes →","401 Unauthorized",""
"","213","""Subjects"" endpoints CRUD tests → Delete subjects 404: Not Found","","Wed Apr 30 14:01:54 GMT 2025","passed","Wed Apr 30 14:01:54 GMT 2025","","Delete subjects","404: Not Found",""
"","222","""Subjects"" endpoints CRUD tests → Update subjects 404: Not Found","","Wed Apr 30 14:01:52 GMT 2025","passed","Wed Apr 30 14:01:52 GMT 2025","","Update subjects","404: Not Found",""
"","294","Administration tests → Applets tests → View General calendar in workspace of Applet owner tests → 200 OK (Manager can view General calendar)","","Wed Apr 30 14:01:01 GMT 2025","passed","Wed Apr 30 14:01:01 GMT 2025","","View General calendar in workspace of Applet owner tests →","200 OK (Manager can view General calendar)",""
"","253","Workspaces endpoints tests → Workspaces created → Get user workspaces → Respondent user","","Wed Apr 30 14:04:13 GMT 2025","passed","Wed Apr 30 14:04:13 GMT 2025","","Get user workspaces →","Respondent user",""
"","220","""Workspace Folders"" endpoints tests → Workspace is created → Pin/Unpin Folder → Unpin Folder → 400 (non-existent folder)","","Wed Apr 30 14:03:09 GMT 2025","passed","Wed Apr 30 14:03:09 GMT 2025","","Unpin Folder →","400 (non-existent folder)",""
"","30","Summary & Review activities tests → Get Summary and Review Activities (non-empty list) tests → Get Review Activities list tests → 401 Unauthorized (Get Review Activities list with not existing token)","","Wed Apr 30 13:52:04 GMT 2025","passed","Wed Apr 30 13:52:04 GMT 2025","","Get Review Activities list tests →","401 Unauthorized (Get Review Activities list with not existing token)",""
"","233","Summary & Review activity flow tests → Get Review activity flow tests → 422 Unprocessable Entity (Get Review activity flow list without targetSubjectId query param)","","Wed Apr 30 13:52:12 GMT 2025","passed","Wed Apr 30 13:52:12 GMT 2025","","Get Review activity flow tests →","422 Unprocessable Entity (Get Review activity flow list without targetSubjectId query param)",""
"","169","Activity Assignments tests → Negative tests → Create Assignments → 422 Unprocessable entity: missing attribute","","Wed Apr 30 13:48:16 GMT 2025","passed","Wed Apr 30 13:48:16 GMT 2025","","Create Assignments →","422 Unprocessable entity: missing attribute",""
"","28","Create User tests → 422 Unprocessable Entity Create user with missing firstName param","","Wed Apr 30 14:02:03 GMT 2025","passed","Wed Apr 30 14:02:03 GMT 2025","","422 Unprocessable Entity","Create user with missing firstName param",""
"","640","Applet Events CRUD tests → Get Applet Event by Id tests → 404 Not Found (Get individual deleted scheduled activity Event)","","Wed Apr 30 13:54:12 GMT 2025","passed","Wed Apr 30 13:54:12 GMT 2025","","Get Applet Event by Id tests →","404 Not Found (Get individual deleted scheduled activity Event)",""
"","250","Delete User tests → 401 Unauthorized (Delete User with not existing token)","","Wed Apr 30 14:02:06 GMT 2025","passed","Wed Apr 30 14:02:06 GMT 2025","","Delete User tests →","401 Unauthorized (Delete User with not existing token)",""
"","0","Answers scenario tests → Activity, completed within the activity flow: get activity answers list & Answers of respondent tests → Get activity answers list with answer, created within the activity flow","","Wed Apr 30 13:50:21 GMT 2025","passed","Wed Apr 30 13:50:21 GMT 2025","","Activity, completed within the activity flow: get activity answers list & Answers of respondent tests →","Get activity answers list with answer, created within the activity flow",""
"","30","Workspaces endpoints tests → Workspaces created → Pin user (manager) on workspace → 401 Unauthorized","","Wed Apr 30 14:04:31 GMT 2025","passed","Wed Apr 30 14:04:31 GMT 2025","","Pin user (manager) on workspace →","401 Unauthorized",""
"","2792","Create Answers for different item types tests → SingleSelect item","","Wed Apr 30 13:49:08 GMT 2025","passed","Wed Apr 30 13:49:10 GMT 2025","","Create Answers for different item types tests →","SingleSelect item",""
"","220","""Subjects"" endpoints CRUD tests → Delete subjects 422: Missing deleteAnswers flag","","Wed Apr 30 14:01:54 GMT 2025","passed","Wed Apr 30 14:01:54 GMT 2025","","Delete subjects","422: Missing deleteAnswers flag",""
"","174","Update Password tests → 422 Unprocessable Entity Update password with missing password param","","Wed Apr 30 14:02:36 GMT 2025","passed","Wed Apr 30 14:02:36 GMT 2025","","422 Unprocessable Entity","Update password with missing password param",""
"","88","Answer Notes tests → Edit Note tests → 401 Unauthorized (Update Note with not existing token)","","Wed Apr 30 13:48:27 GMT 2025","passed","Wed Apr 30 13:48:27 GMT 2025","","Edit Note tests →","401 Unauthorized (Update Note with not existing token)",""
"","68","Duplicate Applet endpoint tests → 401 Unauthorized","","Wed Apr 30 13:53:36 GMT 2025","passed","Wed Apr 30 13:53:36 GMT 2025","","Duplicate Applet endpoint tests →","401 Unauthorized",""
"","685","Invitations endpoints tests → Send invitation → Invitation Reviewer Send → 200 OK (send to unregistered user) All properties, language: en","","Wed Apr 30 13:58:53 GMT 2025","passed","Wed Apr 30 13:58:53 GMT 2025","","200 OK (send to unregistered user)","All properties, language: en",""
"","69","""Themes"" endpoints tests → Create Theme → 401 Unauthorized (invalid token)","","Wed Apr 30 14:01:58 GMT 2025","passed","Wed Apr 30 14:01:58 GMT 2025","","Create Theme →","401 Unauthorized (invalid token)",""
"","354","Invitations endpoints tests → Create shell account → 404: Not Found","","Wed Apr 30 13:59:03 GMT 2025","passed","Wed Apr 30 13:59:03 GMT 2025","","Create shell account →","404: Not Found",""
"","1414","User Events scenario tests → User should be able to see events related to a specific Applet","","Wed Apr 30 14:02:44 GMT 2025","passed","Wed Apr 30 14:02:45 GMT 2025","","User Events scenario tests →","User should be able to see events related to a specific Applet",""
"","328","Get Assessment & Review of updated activity tests → Switch to a new assessment version Get Assessment info after switching to a new assessment version","","Wed Apr 30 13:51:07 GMT 2025","failed","Wed Apr 30 13:51:07 GMT 2025","","Switch to a new assessment version","Get Assessment info after switching to a new assessment version",""
"","122","Applet public links tests → Accept Public invitation tests → 401 Unauthorized (Accept invitation with not existing token)","","Wed Apr 30 13:59:13 GMT 2025","passed","Wed Apr 30 13:59:13 GMT 2025","","Accept Public invitation tests →","401 Unauthorized (Accept invitation with not existing token)",""
"","31","Create User tests → 422 Unprocessable Entity (Create user with invalid email format)","","Wed Apr 30 14:02:02 GMT 2025","passed","Wed Apr 30 14:02:02 GMT 2025","","Create User tests →","422 Unprocessable Entity (Create user with invalid email format)",""
"","244","Multiinformant assessment validate tests → 200 OK: invalid activity or flow id","","Wed Apr 30 13:51:46 GMT 2025","passed","Wed Apr 30 13:51:46 GMT 2025","","Multiinformant assessment validate tests →","200 OK: invalid activity or flow id",""
"","293","Answer Notes tests → Get Notes list tests → Get Notes list (not empty) 404 Not Found (Get Note list for not existing Answer)","","Wed Apr 30 13:48:23 GMT 2025","passed","Wed Apr 30 13:48:23 GMT 2025","","Get Notes list (not empty)","404 Not Found (Get Note list for not existing Answer)",""
"","339","Shell account invitation scenario tests → Decline invitation by unregistered user → Verify shell account remains the same in the list of respondents","","Wed Apr 30 13:59:49 GMT 2025","passed","Wed Apr 30 13:59:49 GMT 2025","","Decline invitation by unregistered user →","Verify shell account remains the same in the list of respondents",""
"","2094","Shell account invitation scenario tests → Send shell account invitation to an existing respondent → Verify 2 or more shell accounts invitations can be sent to the same email","","Wed Apr 30 14:00:03 GMT 2025","passed","Wed Apr 30 14:00:05 GMT 2025","","Send shell account invitation to an existing respondent →","Verify 2 or more shell accounts invitations can be sent to the same email",""
"","95","Answer Notes tests → Get Notes list tests → Get Notes list (not empty) 401 Unauthorized (Get Note list with not existing token)","","Wed Apr 30 13:48:23 GMT 2025","passed","Wed Apr 30 13:48:23 GMT 2025","","Get Notes list (not empty)","401 Unauthorized (Get Note list with not existing token)",""
"","128","""Workspace Folders"" endpoints tests → Workspace is created → Create Folder → 422 Unprocessable Entity (missing attribute)","","Wed Apr 30 14:03:04 GMT 2025","passed","Wed Apr 30 14:03:04 GMT 2025","","Create Folder →","422 Unprocessable Entity (missing attribute)",""
"","274","Answer Notes tests → Edit Note tests → 422 Unprocessable Entity (Update Note without required param - note)","","Wed Apr 30 13:48:27 GMT 2025","passed","Wed Apr 30 13:48:27 GMT 2025","","Edit Note tests →","422 Unprocessable Entity (Update Note without required param - note)",""
"","313","User Password tests → Recover password tests → 404 Bad request (Recover password of deleted user)","","Wed Apr 30 14:02:15 GMT 2025","passed","Wed Apr 30 14:02:15 GMT 2025","","Recover password tests →","404 Bad request (Recover password of deleted user)",""
"","555","Invitations endpoints tests → Send invitation → Invitation Managers Send → 200 OK (send to unregistered user) Role = editor","","Wed Apr 30 13:58:58 GMT 2025","passed","Wed Apr 30 13:58:58 GMT 2025","","200 OK (send to unregistered user)","Role = editor",""
"","307","Get submit dates & exported Answers data tests → Get exported data & dates after answer submit → 200 OK (Get exported data by applet owner)","","Wed Apr 30 13:49:03 GMT 2025","passed","Wed Apr 30 13:49:03 GMT 2025","","Get exported data & dates after answer submit →","200 OK (Get exported data by applet owner)",""
"","584","Workspaces managers access tests → Set workspace managers applet access list → 200 OK (grant manager's permissions for reviewer)","","Wed Apr 30 14:03:37 GMT 2025","passed","Wed Apr 30 14:03:37 GMT 2025","","Set workspace managers applet access list →","200 OK (grant manager's permissions for reviewer)",""
"","181","Applet Events CRUD tests → Create cross-day events tests → 422 (Cross-day Event with DAILY periodicity type and availability range: 23:59:00-23:59:00)","","Wed Apr 30 13:54:33 GMT 2025","passed","Wed Apr 30 13:54:33 GMT 2025","","Create cross-day events tests →","422 (Cross-day Event with DAILY periodicity type and availability range: 23:59:00-23:59:00)",""
"","497","Administration tests → Applets tests → Create Applet in workspace of Applet owner tests → 201 Created (Editor can create Applet in workspace of Applet owner)","","Wed Apr 30 14:00:52 GMT 2025","passed","Wed Apr 30 14:00:52 GMT 2025","","Create Applet in workspace of Applet owner tests →","201 Created (Editor can create Applet in workspace of Applet owner)",""
"","334","Workspaces endpoints tests → Workspaces created → Get workspace applet respondents → Second workspace second applet respondents","","Wed Apr 30 14:04:23 GMT 2025","passed","Wed Apr 30 14:04:23 GMT 2025","","Get workspace applet respondents →","Second workspace second applet respondents",""
"","289","Applets CRUD endpoints tests → Get applets list → Test for filters (query params) → Limit","","Wed Apr 30 13:52:37 GMT 2025","passed","Wed Apr 30 13:52:37 GMT 2025","","Test for filters (query params) →","Limit",""
"","277","Activity Versions & Identifiers tests → Get Identifiers tests → Get identifiers after answer submitting → 200 OK (Get identifiers)","","Wed Apr 30 13:51:43 GMT 2025","passed","Wed Apr 30 13:51:43 GMT 2025","","Get identifiers after answer submitting →","200 OK (Get identifiers)",""
"","297","Applet ""Transfer Ownership"" endpoints tests → Transfer Accept → 403 Forbidden (for applet owner)","","Wed Apr 30 13:56:18 GMT 2025","passed","Wed Apr 30 13:56:18 GMT 2025","","Transfer Accept →","403 Forbidden (for applet owner)",""
"","398","Applet Events CRUD tests → Create cross-day events tests → 201 Created (Cross-day Event with DAILY periodicity type and availability range: 00:01:00-00:00:00)","","Wed Apr 30 13:54:33 GMT 2025","passed","Wed Apr 30 13:54:33 GMT 2025","","Create cross-day events tests →","201 Created (Cross-day Event with DAILY periodicity type and availability range: 00:01:00-00:00:00)",""
"","243","Invitations scenario tests → Re-send invitation flow → Invitor can see new invitation","","Wed Apr 30 13:58:21 GMT 2025","passed","Wed Apr 30 13:58:21 GMT 2025","","Re-send invitation flow →","Invitor can see new invitation",""
"","296","Applet versions endpoints tests → Update Applet → Add Activity → Remove Activity → Get applet version by id","","Wed Apr 30 13:56:44 GMT 2025","passed","Wed Apr 30 13:56:44 GMT 2025","","Remove Activity →","Get applet version by id",""
"","139","""Workspace Folders"" endpoints tests → Workspace is created → Update Folder → 404 Not Found (non-existent theme)","","Wed Apr 30 14:03:05 GMT 2025","passed","Wed Apr 30 14:03:05 GMT 2025","","Update Folder →","404 Not Found (non-existent theme)",""
"","810","Applets CRUD endpoints tests → Get applets list → 200 OK (not-empty list)","","Wed Apr 30 13:52:36 GMT 2025","passed","Wed Apr 30 13:52:36 GMT 2025","","Get applets list →","200 OK (not-empty list)",""
"","67","Get User Device Information → 401 Unathorized error","","Wed Apr 30 14:02:42 GMT 2025","passed","Wed Apr 30 14:02:42 GMT 2025","","Get User Device Information →","401 Unathorized error",""
"","53","Workspaces endpoints tests → Workspaces created → Get managers priority role → 401 Unauthorized","","Wed Apr 30 14:04:28 GMT 2025","passed","Wed Apr 30 14:04:28 GMT 2025","","Get managers priority role →","401 Unauthorized",""
"","335","Applet ""Transfer Ownership"" endpoints tests → Transfer Accept → 200 OK","","Wed Apr 30 13:56:18 GMT 2025","passed","Wed Apr 30 13:56:18 GMT 2025","","Transfer Accept →","200 OK",""
"","618","Workspaces endpoints tests → Workspaces created → Pin user (respondent) on workspace → 200 OK","","Wed Apr 30 14:04:30 GMT 2025","passed","Wed Apr 30 14:04:30 GMT 2025","","Pin user (respondent) on workspace →","200 OK",""
"","247","Get submit dates & exported Answers data tests → Get exported data & dates after answer submit → Get dates after Answer submit → 200 OK (Get all submit dates)","","Wed Apr 30 13:49:07 GMT 2025","passed","Wed Apr 30 13:49:07 GMT 2025","","Get dates after Answer submit →","200 OK (Get all submit dates)",""
"","319","Shell account invitation scenario tests → Accept invitation by already registered user → New user can see the applet","","Wed Apr 30 13:59:53 GMT 2025","passed","Wed Apr 30 13:59:53 GMT 2025","","Accept invitation by already registered user →","New user can see the applet",""
"","294","Administration tests → Applets tests → Update Applet in workspace of Applet owner tests → 403 Forbidden (Coordinator can NOT update Applet)","","Wed Apr 30 14:00:54 GMT 2025","passed","Wed Apr 30 14:00:54 GMT 2025","","Update Applet in workspace of Applet owner tests →","403 Forbidden (Coordinator can NOT update Applet)",""
"","261","Invitations endpoints tests → Create shell account → 200 OK: shell account with email","","Wed Apr 30 13:59:03 GMT 2025","passed","Wed Apr 30 13:59:03 GMT 2025","","Create shell account →","200 OK: shell account with email",""
"","476","Administration tests → Perform activities tests → 200 OK (Manager can submit answers)","","Wed Apr 30 14:01:07 GMT 2025","passed","Wed Apr 30 14:01:07 GMT 2025","","Perform activities tests →","200 OK (Manager can submit answers)",""
"","306","Summary & Review activities tests → Get Summary and Review Activities (non-empty list) tests → Get Review Activities list tests → 200 OK (non-empty list)","","Wed Apr 30 13:52:04 GMT 2025","passed","Wed Apr 30 13:52:04 GMT 2025","","Get Review Activities list tests →","200 OK (non-empty list)",""
"","37","Applet Events CRUD tests → Get general and individual Applet Events → 401 Unauthorized (Get Applet Events with invalid appletOwnerToken)","","Wed Apr 30 13:54:05 GMT 2025","passed","Wed Apr 30 13:54:05 GMT 2025","","Get general and individual Applet Events →","401 Unauthorized (Get Applet Events with invalid appletOwnerToken)",""
"","174","Applet Events CRUD tests → Count scheduled Applet Events tests → 404 Not Found (Count general scheduled Events of not existing Applet)","","Wed Apr 30 13:54:25 GMT 2025","passed","Wed Apr 30 13:54:25 GMT 2025","","Count scheduled Applet Events tests →","404 Not Found (Count general scheduled Events of not existing Applet)",""
"","114","Applet Events CRUD tests → Update Applet Event tests → 422 Unprocessable Entity → Update Event with missing accessBeforeSchedule (periodicity type: DAILY) param","","Wed Apr 30 13:54:22 GMT 2025","passed","Wed Apr 30 13:54:22 GMT 2025","","422 Unprocessable Entity →","Update Event with missing accessBeforeSchedule (periodicity type: DAILY) param",""
"","32","Access link tests → Create Access link tests → 401 Unauthorized (Create Access link with invalid token)","","Wed Apr 30 13:52:27 GMT 2025","passed","Wed Apr 30 13:52:27 GMT 2025","","Create Access link tests →","401 Unauthorized (Create Access link with invalid token)",""
"","362","Applet Events CRUD tests → Create cross-day events tests → 201 Created (Cross-day Event with MONTHLY periodicity type and availability range: 00:01:00-00:00:00)","","Wed Apr 30 13:54:33 GMT 2025","passed","Wed Apr 30 13:54:33 GMT 2025","","Create cross-day events tests →","201 Created (Cross-day Event with MONTHLY periodicity type and availability range: 00:01:00-00:00:00)",""
"","112","Applets CRUD endpoints tests → Update applet → 422 Unprocessable Entity (missing attribute) Missing ""encryption""","","Wed Apr 30 13:52:47 GMT 2025","passed","Wed Apr 30 13:52:47 GMT 2025","","422 Unprocessable Entity (missing attribute)","Missing ""encryption""",""
"","249","Invitations endpoints tests → Send invitation → Invitation Reviewer Send → 422 - Incorrect ""language"" value","","Wed Apr 30 13:58:51 GMT 2025","passed","Wed Apr 30 13:58:51 GMT 2025","","Invitation Reviewer Send →","422 - Incorrect ""language"" value",""
