"DESCRIPTION","DURATION IN MS","NAME","PARENT SUITE","START TIME","STATUS","STOP TIME","SUB SUITE","SUITE","TEST CLASS","TEST METHOD"
"","171","Activity Assignments tests → Negative tests → Create Assignments → 422 Unprocessable entity: missing attribute","","Wed Jan 22 15:57:41 GMT 2025","passed","Wed Jan 22 15:57:41 GMT 2025","","Create Assignments →","422 Unprocessable entity: missing attribute",""
"","164","Applet Events CRUD tests → Update Applet Event tests → 422 Unprocessable Entity → Update Event with missing selectedDate param (periodicity type: WEEKLY)","","Wed Jan 22 16:04:04 GMT 2025","passed","Wed Jan 22 16:04:04 GMT 2025","","422 Unprocessable Entity →","Update Event with missing selectedDate param (periodicity type: WEEKLY)",""
"","570","Applet Library tests → Applet is added to the library → Update Library item → 200 OK","","Wed Jan 22 16:01:49 GMT 2025","passed","Wed Jan 22 16:01:49 GMT 2025","","Update Library item →","200 OK",""
"","1960","Delete Subjects (remove applet access) tests → 200 OK: remove access to the 1st applet for the first respondent","","Wed Jan 22 16:11:18 GMT 2025","passed","Wed Jan 22 16:11:19 GMT 2025","","Delete Subjects (remove applet access) tests →","200 OK: remove access to the 1st applet for the first respondent",""
"","287","Applet versions endpoints tests → Update Applet → Add Activity → Remove Activity → Add Activity Flow → Remove Activity Flow → Add Activity Item → Remove Activity Item → Update Activity → Update Activity Item → Update Activity Flow → Update Applet description → Get applet versions","","Wed Jan 22 16:06:52 GMT 2025","passed","Wed Jan 22 16:06:52 GMT 2025","","Update Applet description →","Get applet versions",""
"","315","Activity Assessment & Review CRUD tests → Delete Assessment tests → 204 No Content (Delete submitted assessment)","","Wed Jan 22 16:00:45 GMT 2025","passed","Wed Jan 22 16:00:45 GMT 2025","","Delete Assessment tests →","204 No Content (Delete submitted assessment)",""
"","168","Update Password tests → 422 Unprocessable Entity Update password with missing prevPassword param","","Wed Jan 22 16:12:39 GMT 2025","passed","Wed Jan 22 16:12:39 GMT 2025","","422 Unprocessable Entity","Update password with missing prevPassword param",""
"","78","""Workspace Folders"" endpoints tests → Workspace is created → Create Folder → 401 Unauthorized (invalid token)","","Wed Jan 22 16:13:14 GMT 2025","passed","Wed Jan 22 16:13:14 GMT 2025","","Create Folder →","401 Unauthorized (invalid token)",""
"","408","Administration tests → Applets tests → View General calendar in workspace of Applet owner tests → 200 OK (Manager can view General calendar)","","Wed Jan 22 16:11:04 GMT 2025","passed","Wed Jan 22 16:11:04 GMT 2025","","View General calendar in workspace of Applet owner tests →","200 OK (Manager can view General calendar)",""
"","81","Access link tests → Get Access link tests → 401 Unauthorized (Get Access link with invalid token)","","Wed Jan 22 16:01:56 GMT 2025","passed","Wed Jan 22 16:01:56 GMT 2025","","Get Access link tests →","401 Unauthorized (Get Access link with invalid token)",""
"","77","Update Password tests → 401 Unauthorized (Update password with not existing token)","","Wed Jan 22 16:12:30 GMT 2025","passed","Wed Jan 22 16:12:30 GMT 2025","","Update Password tests →","401 Unauthorized (Update password with not existing token)",""
"","445","Applet Events CRUD tests → Create cross-day events tests → 201 Created (Cross-day Event with WEEKLY periodicity type and availability range: 23:59:00-23:58:00)","","Wed Jan 22 16:04:18 GMT 2025","passed","Wed Jan 22 16:04:18 GMT 2025","","Create cross-day events tests →","201 Created (Cross-day Event with WEEKLY periodicity type and availability range: 23:59:00-23:58:00)",""
"","220","Applet Events CRUD tests → Update Applet Event tests → 422 Unprocessable Entity → Update Event with missing accessBeforeSchedule (periodicity type: WEEKLY) param","","Wed Jan 22 16:04:04 GMT 2025","passed","Wed Jan 22 16:04:04 GMT 2025","","422 Unprocessable Entity →","Update Event with missing accessBeforeSchedule (periodicity type: WEEKLY) param",""
"","89","Workspaces endpoints tests → Workspaces created → Get workspace applet respondent by id → 401 Unauthorized","","Wed Jan 22 16:14:58 GMT 2025","passed","Wed Jan 22 16:14:58 GMT 2025","","Get workspace applet respondent by id →","401 Unauthorized",""
"","299","Applet versions endpoints tests → Update Applet → Add Activity → Remove Activity → Add Activity Flow → Remove Activity Flow → Add Activity Item → Remove Activity Item → Update Activity → Update Activity Item → Get applet versions","","Wed Jan 22 16:06:49 GMT 2025","passed","Wed Jan 22 16:06:49 GMT 2025","","Update Activity Item →","Get applet versions",""
"","978","Administration tests → Applets tests → Duplicate Applet in workspace of Applet owner tests → 201 Created (Manager can duplicate Applet)","","Wed Jan 22 16:11:01 GMT 2025","passed","Wed Jan 22 16:11:01 GMT 2025","","Duplicate Applet in workspace of Applet owner tests →","201 Created (Manager can duplicate Applet)",""
"","366","""Subjects"" endpoints CRUD tests → Delete subjects 404: Not Found","","Wed Jan 22 16:11:49 GMT 2025","passed","Wed Jan 22 16:11:49 GMT 2025","","Delete subjects","404: Not Found",""
"","333","Shell account invitation scenario tests → Send shell account invitation to an existing respondent → Verify shell account invitation can't be sent to the already invited respondent's email","","Wed Jan 22 16:10:03 GMT 2025","passed","Wed Jan 22 16:10:03 GMT 2025","","Send shell account invitation to an existing respondent →","Verify shell account invitation can't be sent to the already invited respondent's email",""
"","382","Applet Events CRUD tests → Get general and individual Applet Events → 200 OK (with respondentId in the query)","","Wed Jan 22 16:03:41 GMT 2025","passed","Wed Jan 22 16:03:41 GMT 2025","","Get general and individual Applet Events →","200 OK (with respondentId in the query)",""
"","357","Get submit dates & exported Answers data tests → Get exported data & dates after answer submit → 200 OK (Get exported data by respondent - should see only his own data)","","Wed Jan 22 15:58:34 GMT 2025","passed","Wed Jan 22 15:58:34 GMT 2025","","Get exported data & dates after answer submit →","200 OK (Get exported data by respondent - should see only his own data)",""
"","355","Applet versions endpoints tests → Update Applet → Add Activity → Remove Activity → Add Activity Flow → Remove Activity Flow → Add Activity Item → Remove Activity Item → Update Activity → Get applet version changes","","Wed Jan 22 16:06:47 GMT 2025","passed","Wed Jan 22 16:06:47 GMT 2025","","Update Activity →","Get applet version changes",""
"","317","""Subjects"" endpoints CRUD tests → Get subjects 200 OK: manager","","Wed Jan 22 16:11:45 GMT 2025","passed","Wed Jan 22 16:11:45 GMT 2025","","Get subjects","200 OK: manager",""
"","160","Invitations endpoints tests → Accept invitation → 422 - invalid invitation key","","Wed Jan 22 16:08:38 GMT 2025","passed","Wed Jan 22 16:08:38 GMT 2025","","Accept invitation →","422 - invalid invitation key",""
"","83","Answers CRUD tests → Answers handling after invitation acceptance by respondent → Get activity answers list & Answers of respondent tests → 401 Unauthorized (Get activity answers list with not existing token)","","Wed Jan 22 16:00:12 GMT 2025","passed","Wed Jan 22 16:00:12 GMT 2025","","Get activity answers list & Answers of respondent tests →","401 Unauthorized (Get activity answers list with not existing token)",""
"","1","Answers scenario tests → Activity, completed within the activity flow: get activity answers list & Answers of respondent tests → Get activity answers list with answer, created within the activity flow","","Wed Jan 22 15:59:44 GMT 2025","passed","Wed Jan 22 15:59:44 GMT 2025","","Activity, completed within the activity flow: get activity answers list & Answers of respondent tests →","Get activity answers list with answer, created within the activity flow",""
"","353","Workspaces endpoints tests → Workspaces created → Get workspace managers → First workspace managers","","Wed Jan 22 16:14:48 GMT 2025","passed","Wed Jan 22 16:14:48 GMT 2025","","Get workspace managers →","First workspace managers",""
"","343","Applet ""Transfer Ownership"" endpoints tests → Transfer Accept → 403 Forbidden (for applet owner)","","Wed Jan 22 16:06:12 GMT 2025","passed","Wed Jan 22 16:06:12 GMT 2025","","Transfer Accept →","403 Forbidden (for applet owner)",""
"","744","Invitations endpoints tests → Send invitation → Invitation Reviewer Send → 200 OK (send to unregistered user) With title","","Wed Jan 22 16:08:50 GMT 2025","passed","Wed Jan 22 16:08:50 GMT 2025","","200 OK (send to unregistered user)","With title",""
"","470","Applet Events CRUD tests → Update Applet Event tests → 404 Not Found (Update general scheduled activity Event with not existing id)","","Wed Jan 22 16:04:00 GMT 2025","passed","Wed Jan 22 16:04:00 GMT 2025","","Update Applet Event tests →","404 Not Found (Update general scheduled activity Event with not existing id)",""
"","79","Workspaces endpoints tests → Workspaces created → Search workspace Applets → 401 Unauthorized","","Wed Jan 22 16:14:40 GMT 2025","passed","Wed Jan 22 16:14:40 GMT 2025","","Search workspace Applets →","401 Unauthorized",""
"","359","""Subjects"" endpoints CRUD tests → Get subjects 200 OK: respondent","","Wed Jan 22 16:11:45 GMT 2025","failed","Wed Jan 22 16:11:45 GMT 2025","","Get subjects","200 OK: respondent",""
"","263","Applet versions endpoints tests → Get applet version changes → 404 (incorrect versionId)","","Wed Jan 22 16:06:36 GMT 2025","passed","Wed Jan 22 16:06:36 GMT 2025","","Get applet version changes →","404 (incorrect versionId)",""
"","171","Applet Library tests → Applet is added to the library → Update Library item → 422 missing attribute (name)","","Wed Jan 22 16:01:49 GMT 2025","passed","Wed Jan 22 16:01:49 GMT 2025","","Update Library item →","422 missing attribute (name)",""
"","260","""Workspace Folders"" endpoints tests → Workspace is created → Pin/Unpin Folder → Unpin Folder → 404 Not Found (non-existent applet)","","Wed Jan 22 16:13:20 GMT 2025","passed","Wed Jan 22 16:13:20 GMT 2025","","Unpin Folder →","404 Not Found (non-existent applet)",""
"","306","Activity Assessment & Review CRUD tests → Submit Assessment tests → 201 Submit Assessment","","Wed Jan 22 16:00:42 GMT 2025","passed","Wed Jan 22 16:00:42 GMT 2025","","Submit Assessment tests →","201 Submit Assessment",""
"","78","Applet Events CRUD tests → Remove individual scheduled Applet Events negative tests → 401 Unauthorized (Remove scheduled Events of a particular user with not existing appletOwnerToken)","","Wed Jan 22 16:04:13 GMT 2025","passed","Wed Jan 22 16:04:13 GMT 2025","","Remove individual scheduled Applet Events negative tests →","401 Unauthorized (Remove scheduled Events of a particular user with not existing appletOwnerToken)",""
"","292","Retrieve latest report negative tests → 404 Not Found (Get summary latest report with not existing Subject)","","Wed Jan 22 15:59:16 GMT 2025","passed","Wed Jan 22 15:59:16 GMT 2025","","Retrieve latest report negative tests →","404 Not Found (Get summary latest report with not existing Subject)",""
"","378","Applet Library tests → Share applet to the library 200 OK","","Wed Jan 22 16:01:45 GMT 2025","passed","Wed Jan 22 16:01:45 GMT 2025","","Share applet to the library","200 OK",""
"","756","Activity Assignments tests → Positive tests → Assign single activity to full participant","","Wed Jan 22 15:57:37 GMT 2025","passed","Wed Jan 22 15:57:37 GMT 2025","","Positive tests →","Assign single activity to full participant",""
"","650","Applets CRUD endpoints tests → Delete applet → 204 No Content","","Wed Jan 22 16:02:18 GMT 2025","passed","Wed Jan 22 16:02:18 GMT 2025","","Delete applet →","204 No Content",""
"","570","Access link tests → Delete Access link tests → 204 No Content (Delete created Access link)","","Wed Jan 22 16:02:00 GMT 2025","passed","Wed Jan 22 16:02:00 GMT 2025","","Delete Access link tests →","204 No Content (Delete created Access link)",""
"","311","Summary & Review activities tests → Get Summary and Review Activities (non-empty list) tests → Get Summary Activities list tests → 200 OK (non-empty list)","","Wed Jan 22 16:01:29 GMT 2025","passed","Wed Jan 22 16:01:29 GMT 2025","","Get Summary Activities list tests →","200 OK (non-empty list)",""
"","209","Applets GET ""base info"" endpoint tests → 404 Not Found: invalid applet id","","Wed Jan 22 16:02:20 GMT 2025","passed","Wed Jan 22 16:02:20 GMT 2025","","Applets GET ""base info"" endpoint tests →","404 Not Found: invalid applet id",""
"","79","Duplicate Applet endpoint tests → 401 Unauthorized","","Wed Jan 22 16:03:11 GMT 2025","passed","Wed Jan 22 16:03:11 GMT 2025","","Duplicate Applet endpoint tests →","401 Unauthorized",""
"","585","Answers scenario tests → Manager should be able to see Answers of respondent","","Wed Jan 22 15:59:23 GMT 2025","passed","Wed Jan 22 15:59:23 GMT 2025","","Answers scenario tests →","Manager should be able to see Answers of respondent",""
"","871","""Authentication"" endpoints tests → Get Token → 401 incorrect password","","Wed Jan 22 16:06:54 GMT 2025","passed","Wed Jan 22 16:06:54 GMT 2025","","Get Token →","401 incorrect password",""
"","296","Activity Versions & Identifiers tests → Get Identifiers tests → 404 Not Found (not existing activityId)","","Wed Jan 22 16:01:06 GMT 2025","passed","Wed Jan 22 16:01:06 GMT 2025","","Get Identifiers tests →","404 Not Found (not existing activityId)",""
"","326","Activity Assessment & Review CRUD tests → Submit Assessment tests → 401 Not Found (Submit Assessment to not existing Answer)","","Wed Jan 22 16:00:42 GMT 2025","passed","Wed Jan 22 16:00:42 GMT 2025","","Submit Assessment tests →","401 Not Found (Submit Assessment to not existing Answer)",""
"","77","Workspaces endpoints tests → Empty workspaces → Get workspace managers → 401 Unauthorized","","Wed Jan 22 16:14:18 GMT 2025","passed","Wed Jan 22 16:14:18 GMT 2025","","Get workspace managers →","401 Unauthorized",""
"","76","Invitations endpoints tests → Get invitations → No Invitations created → Get invitation by key → 401 Unauthorized (invalid token)","","Wed Jan 22 16:08:36 GMT 2025","passed","Wed Jan 22 16:08:36 GMT 2025","","Get invitation by key →","401 Unauthorized (invalid token)",""
"","946","Applet builder tests → Create applet → Positive tests → Applet with subscale settings and scorable items","","Wed Jan 22 16:02:27 GMT 2025","failed","Wed Jan 22 16:02:27 GMT 2025","","Positive tests →","Applet with subscale settings and scorable items",""
"","1257","Workspaces managers access tests → Change user's role (E2E scenario) → Change user's role from manager to reviewer","","Wed Jan 22 16:14:07 GMT 2025","passed","Wed Jan 22 16:14:08 GMT 2025","","Change user's role (E2E scenario) →","Change user's role from manager to reviewer",""
"","270","Workspaces endpoints tests → Empty workspaces → Get workspace managers → 404 Not Found (non-existent ownerId)","","Wed Jan 22 16:14:18 GMT 2025","passed","Wed Jan 22 16:14:18 GMT 2025","","Get workspace managers →","404 Not Found (non-existent ownerId)",""
"","327","Shell account invitation scenario tests → Accept invitation by already registered user → New user can see the applet","","Wed Jan 22 16:09:51 GMT 2025","passed","Wed Jan 22 16:09:51 GMT 2025","","Accept invitation by already registered user →","New user can see the applet",""
"","455","Applet Events CRUD tests → Create cross-day events tests → 422 (Cross-day Event with ONCE periodicity type and availability range: 15:30:00-15:30:00)","","Wed Jan 22 16:04:18 GMT 2025","passed","Wed Jan 22 16:04:18 GMT 2025","","Create cross-day events tests →","422 (Cross-day Event with ONCE periodicity type and availability range: 15:30:00-15:30:00)",""
"","300","Administration tests → Organizers tests → Change organizer roles/permissions tests → 403 Forbidden (Reviewer can NOT grant editor's permissions to respondent)","","Wed Jan 22 16:10:46 GMT 2025","passed","Wed Jan 22 16:10:46 GMT 2025","","Change organizer roles/permissions tests →","403 Forbidden (Reviewer can NOT grant editor's permissions to respondent)",""
"","307","Access link tests → Create Access link tests → 201 Created (Access link can successfully be created)","","Wed Jan 22 16:01:56 GMT 2025","passed","Wed Jan 22 16:01:56 GMT 2025","","Create Access link tests →","201 Created (Access link can successfully be created)",""
"","79","Workspaces managers access tests → Set workspace managers applet access list → 401 Unauthorized","","Wed Jan 22 16:13:50 GMT 2025","passed","Wed Jan 22 16:13:50 GMT 2025","","Set workspace managers applet access list →","401 Unauthorized",""
"","258","Applet Events CRUD tests → Update Applet Event tests → 422 Unprocessable Entity → Update Event with missing endTime (periodicity type: ONCE) param","","Wed Jan 22 16:04:04 GMT 2025","passed","Wed Jan 22 16:04:04 GMT 2025","","422 Unprocessable Entity →","Update Event with missing endTime (periodicity type: ONCE) param",""
"","78","""Authentication"" endpoints tests → Delete refresh Token → 401 Unauthorized (non-existent token)","","Wed Jan 22 16:06:59 GMT 2025","passed","Wed Jan 22 16:06:59 GMT 2025","","Delete refresh Token →","401 Unauthorized (non-existent token)",""
"","305","Activity Assessment & Review CRUD tests → Get Assessment & Review tests → Get Reviews tests → 200 OK (no Review data)","","Wed Jan 22 16:00:40 GMT 2025","passed","Wed Jan 22 16:00:40 GMT 2025","","Get Reviews tests →","200 OK (no Review data)",""
"","208","Applet Events CRUD tests → Update Applet Event tests → 422 Unprocessable Entity → Update Event with missing endTime (periodicity type: DAILY) param","","Wed Jan 22 16:04:04 GMT 2025","passed","Wed Jan 22 16:04:04 GMT 2025","","422 Unprocessable Entity →","Update Event with missing endTime (periodicity type: DAILY) param",""
"","283","Get applet completed activities tests → 404 Not Found: invalid applet id","","Wed Jan 22 15:57:59 GMT 2025","passed","Wed Jan 22 15:57:59 GMT 2025","","Get applet completed activities tests →","404 Not Found: invalid applet id",""
"","469","Administration tests → Respondents tests → Invite new respondent tests → 200 OK (Coordinator can invite new respondent)","","Wed Jan 22 16:10:48 GMT 2025","passed","Wed Jan 22 16:10:48 GMT 2025","","Invite new respondent tests →","200 OK (Coordinator can invite new respondent)",""
"","270","Answers CRUD tests → Answers handling after invitation acceptance by respondent → Check answer existence tests → 404 Not Found (applet id)","","Wed Jan 22 16:00:07 GMT 2025","passed","Wed Jan 22 16:00:07 GMT 2025","","Check answer existence tests →","404 Not Found (applet id)",""
"","193","Logs upload/download tests → Upload Logs → 422 Empty form data","","Wed Jan 22 16:07:27 GMT 2025","passed","Wed Jan 22 16:07:27 GMT 2025","","Upload Logs →","422 Empty form data",""
"","236","Applet Events CRUD tests → Delete all general scheduled Applet Events tests → 404 Not Found (Delete all general scheduled Events of not existing Applet)","","Wed Jan 22 16:03:47 GMT 2025","passed","Wed Jan 22 16:03:47 GMT 2025","","Delete all general scheduled Applet Events tests →","404 Not Found (Delete all general scheduled Events of not existing Applet)",""
"","238","Invitations endpoints tests → Decline invitation → 404 - non-existent invitation key","","Wed Jan 22 16:08:41 GMT 2025","passed","Wed Jan 22 16:08:41 GMT 2025","","Decline invitation →","404 - non-existent invitation key",""
"","354","Administration tests → Organizers tests → Change organizer roles/permissions tests → 403 Forbidden (Respondent can NOT grant manager's permissions to coordinator)","","Wed Jan 22 16:10:46 GMT 2025","passed","Wed Jan 22 16:10:46 GMT 2025","","Change organizer roles/permissions tests →","403 Forbidden (Respondent can NOT grant manager's permissions to coordinator)",""
"","82","Answers CRUD tests → Answers handling after invitation acceptance by respondent → Check answer existence tests → 401 Unauthorized (Get Answer with not existing token)","","Wed Jan 22 16:00:07 GMT 2025","passed","Wed Jan 22 16:00:07 GMT 2025","","Check answer existence tests →","401 Unauthorized (Get Answer with not existing token)",""
"","191","Applet Events CRUD tests → Create cross-day events tests → 422 (Cross-day Event with MONTHLY periodicity type and availability range: 15:30:00-15:30:00)","","Wed Jan 22 16:04:18 GMT 2025","passed","Wed Jan 22 16:04:18 GMT 2025","","Create cross-day events tests →","422 (Cross-day Event with MONTHLY periodicity type and availability range: 15:30:00-15:30:00)",""
"","379","Workspaces endpoints tests → Workspaces created → Get workspace Applets → Respondent gets own applets","","Wed Jan 22 16:14:36 GMT 2025","passed","Wed Jan 22 16:14:36 GMT 2025","","Get workspace Applets →","Respondent gets own applets",""
"","149","Applet Events CRUD tests → Update Applet Event tests → 422 Unprocessable Entity → Update Event with missing endTime (periodicity type: WEEKDAYS) param","","Wed Jan 22 16:04:04 GMT 2025","passed","Wed Jan 22 16:04:04 GMT 2025","","422 Unprocessable Entity →","Update Event with missing endTime (periodicity type: WEEKDAYS) param",""
"","232","Applets GET ""base info"" endpoint tests → 403 Forbidden","","Wed Jan 22 16:02:20 GMT 2025","passed","Wed Jan 22 16:02:20 GMT 2025","","Applets GET ""base info"" endpoint tests →","403 Forbidden",""
"","281","Applet versions endpoints tests → Update Applet → Add Activity → Remove Activity → Add Activity Flow → Remove Activity Flow → Add Activity Item → Remove Activity Item → Update Activity → Update Activity Item → Get applet version changes","","Wed Jan 22 16:06:49 GMT 2025","passed","Wed Jan 22 16:06:49 GMT 2025","","Update Activity Item →","Get applet version changes",""
"","313","Workspaces endpoints tests → Workspaces created → Get workspace Applets → Test for filters (query params) → Ordering","","Wed Jan 22 16:14:40 GMT 2025","passed","Wed Jan 22 16:14:40 GMT 2025","","Test for filters (query params) →","Ordering",""
"","76","Invitations endpoints tests → Accept invitation → 401 Unauthorized (invalid token)","","Wed Jan 22 16:08:38 GMT 2025","passed","Wed Jan 22 16:08:38 GMT 2025","","Accept invitation →","401 Unauthorized (invalid token)",""
"","353","Shell account invitation scenario tests → Decline invitation by unregistered user → Shell account should be present in the list of respondents with ""not invited"" status before invitation is sent","","Wed Jan 22 16:09:46 GMT 2025","failed","Wed Jan 22 16:09:46 GMT 2025","","Decline invitation by unregistered user →","Shell account should be present in the list of respondents with ""not invited"" status before invitation is sent",""
"","77","Applet public links tests → Accept Public invitation tests → 401 Unauthorized (Accept invitation with not existing token)","","Wed Jan 22 16:09:09 GMT 2025","passed","Wed Jan 22 16:09:09 GMT 2025","","Accept Public invitation tests →","401 Unauthorized (Accept invitation with not existing token)",""
"","235","""Workspace Folders"" endpoints tests → Workspace is created → Pin/Unpin Folder → Unpin Folder → 204 OK","","Wed Jan 22 16:13:20 GMT 2025","passed","Wed Jan 22 16:13:20 GMT 2025","","Unpin Folder →","204 OK",""
"","752","Logs upload/download tests → Download Logs → 200 OK (empty list)","","Wed Jan 22 16:07:28 GMT 2025","passed","Wed Jan 22 16:07:28 GMT 2025","","Download Logs →","200 OK (empty list)",""
"","459","Answers CRUD tests → Answers handling after invitation acceptance by respondent → Create Answer tests → 422 Unprocessable Entity → Create Answer with missing answer param","","Wed Jan 22 16:00:04 GMT 2025","passed","Wed Jan 22 16:00:04 GMT 2025","","422 Unprocessable Entity →","Create Answer with missing answer param",""
"","77","Applets CRUD endpoints tests → Create applet → 401 Unauthorized","","Wed Jan 22 16:02:10 GMT 2025","passed","Wed Jan 22 16:02:10 GMT 2025","","Create applet →","401 Unauthorized",""
"","206","""Themes"" endpoints tests → Delete Theme → 404 Not Found (non-existent theme)","","Wed Jan 22 16:11:56 GMT 2025","passed","Wed Jan 22 16:11:56 GMT 2025","","Delete Theme →","404 Not Found (non-existent theme)",""
"","429","Administration tests → Perform activities tests → 200 OK (Editor can submit answers)","","Wed Jan 22 16:11:13 GMT 2025","passed","Wed Jan 22 16:11:13 GMT 2025","","Perform activities tests →","200 OK (Editor can submit answers)",""
"","290","Applets ""unique_name"" endpoint tests → 200 OK: unique name","","Wed Jan 22 16:06:28 GMT 2025","passed","Wed Jan 22 16:06:28 GMT 2025","","Applets ""unique_name"" endpoint tests →","200 OK: unique name",""
"","252","Answers CRUD tests → Answers handling after invitation acceptance by respondent → Get activity answers list & Answers of respondent tests → 404 Not Found (Get Answer of not existing Applet)","","Wed Jan 22 16:00:12 GMT 2025","passed","Wed Jan 22 16:00:12 GMT 2025","","Get activity answers list & Answers of respondent tests →","404 Not Found (Get Answer of not existing Applet)",""
