"DESCRIPTION","DURATION IN MS","NAME","PARENT SUITE","START TIME","STATUS","STOP TIME","SUB SUITE","SUITE","TEST CLASS","TEST METHOD"
"","263","Summary & Review activity flow tests → Get Review activity flow tests → 422 Unprocessable Entity (Get Review activity flow list without targetSubjectId query param)","","Wed Jan 22 16:01:39 GMT 2025","passed","Wed Jan 22 16:01:39 GMT 2025","","Get Review activity flow tests →","422 Unprocessable Entity (Get Review activity flow list without targetSubjectId query param)",""
"","290","Summary & Review activities tests → Get Summary and Review Activities (empty list) tests → Get Review Activities (empty list) →","","Wed Jan 22 16:01:26 GMT 2025","passed","Wed Jan 22 16:01:26 GMT 2025","","Get Summary and Review Activities (empty list) tests →","Get Review Activities (empty list) →",""
"","327","Answer Notes tests → Get Notes list tests → Get Notes list (not empty) 404 Not Found (Get Note list for not existing activity)","","Wed Jan 22 15:57:48 GMT 2025","passed","Wed Jan 22 15:57:48 GMT 2025","","Get Notes list (not empty)","404 Not Found (Get Note list for not existing activity)",""
"","475","Get User tests → 404 Not found (Get deleted user)","","Wed Jan 22 16:12:13 GMT 2025","passed","Wed Jan 22 16:12:13 GMT 2025","","Get User tests →","404 Not found (Get deleted user)",""
"","183","Shell account invitation scenario tests → Accept invitation by unregistered user → Send invitation to the shell account","","Wed Jan 22 16:09:36 GMT 2025","failed","Wed Jan 22 16:09:36 GMT 2025","","Accept invitation by unregistered user →","Send invitation to the shell account",""
"","239","Applet versions endpoints tests → Get applet version by id → 404 (incorrect versionId)","","Wed Jan 22 16:06:35 GMT 2025","passed","Wed Jan 22 16:06:35 GMT 2025","","Get applet version by id →","404 (incorrect versionId)",""
"","288","""Subjects"" endpoints CRUD tests → Update subjects 404: Not Found","","Wed Jan 22 16:11:47 GMT 2025","passed","Wed Jan 22 16:11:47 GMT 2025","","Update subjects","404: Not Found",""
"","270","Flow Versions & Identifiers tests → Get flow Identifiers tests → 404 Not Found (Get flow identifiers of not existing Applet)","","Wed Jan 22 16:00:53 GMT 2025","passed","Wed Jan 22 16:00:53 GMT 2025","","Get flow Identifiers tests →","404 Not Found (Get flow identifiers of not existing Applet)",""
"","151","Applet Events CRUD tests → Update Applet Event tests → 422 Unprocessable Entity → Update Event with missing endTime (periodicity type: MONTHLY) param","","Wed Jan 22 16:04:04 GMT 2025","passed","Wed Jan 22 16:04:04 GMT 2025","","422 Unprocessable Entity →","Update Event with missing endTime (periodicity type: MONTHLY) param",""
"","158","Applet Events CRUD tests → Update Applet Event tests → 422 Unprocessable Entity → Update Event with missing accessBeforeSchedule (periodicity type: MONTHLY) param","","Wed Jan 22 16:04:04 GMT 2025","passed","Wed Jan 22 16:04:04 GMT 2025","","422 Unprocessable Entity →","Update Event with missing accessBeforeSchedule (periodicity type: MONTHLY) param",""
"","628","Workspaces managers access tests → Set workspace managers applet access list → 200 OK (grant manager's permissions for reviewer)","","Wed Jan 22 16:13:50 GMT 2025","passed","Wed Jan 22 16:13:50 GMT 2025","","Set workspace managers applet access list →","200 OK (grant manager's permissions for reviewer)",""
"","2980","Applet builder tests → Update applet → Add activity flow","","Wed Jan 22 16:02:48 GMT 2025","failed","Wed Jan 22 16:02:50 GMT 2025","","Update applet →","Add activity flow",""
"","258","Applet ""Transfer Ownership"" endpoints tests → Transfer Decline → 404 (Decline same request again)","","Wed Jan 22 16:06:20 GMT 2025","passed","Wed Jan 22 16:06:20 GMT 2025","","Transfer Decline →","404 (Decline same request again)",""
"","77","Applet Library tests → Share applet to the library 401 Unauthorized","","Wed Jan 22 16:01:45 GMT 2025","passed","Wed Jan 22 16:01:45 GMT 2025","","Share applet to the library","401 Unauthorized",""
"","78","Files upload/download tests → Upload/Download answers (applet files) → Download Answer → 401 Unauthorized","","Wed Jan 22 16:07:16 GMT 2025","passed","Wed Jan 22 16:07:16 GMT 2025","","Download Answer →","401 Unauthorized",""
"","404","Applet Library tests → Applet is added to the library → Get Library items list 200 OK (search by keywords)","","Wed Jan 22 16:01:47 GMT 2025","passed","Wed Jan 22 16:01:47 GMT 2025","","Get Library items list","200 OK (search by keywords)",""
"","703","Delete and remove individual Events scenario tests → Remove individual scheduled user Events scenario tests → Third respondent should have general Always Available activity/flow Events after removal of individual scheduled activity Event","","Wed Jan 22 16:03:30 GMT 2025","passed","Wed Jan 22 16:03:30 GMT 2025","","Remove individual scheduled user Events scenario tests →","Third respondent should have general Always Available activity/flow Events after removal of individual scheduled activity Event",""
"","453","Workspaces endpoints tests → Workspaces created → Update workspace applet respondent → 404 Not Found (invalid workspace id)","","Wed Jan 22 16:14:59 GMT 2025","passed","Wed Jan 22 16:14:59 GMT 2025","","Update workspace applet respondent →","404 Not Found (invalid workspace id)",""
"","265","""Authentication"" endpoints tests → Delete refresh Token → 200 OK","","Wed Jan 22 16:06:59 GMT 2025","passed","Wed Jan 22 16:06:59 GMT 2025","","Delete refresh Token →","200 OK",""
"","243","Workspaces endpoints tests → Workspaces created → Get workspace Folder Applets → 404 Not Found (not existing workspace)","","Wed Jan 22 16:14:42 GMT 2025","passed","Wed Jan 22 16:14:42 GMT 2025","","Get workspace Folder Applets →","404 Not Found (not existing workspace)",""
"","298","Workspaces endpoints tests → Workspaces created → Get workspace managers → Test for filters (query params) → Search → Search by firstName","","Wed Jan 22 16:14:50 GMT 2025","passed","Wed Jan 22 16:14:50 GMT 2025","","Search →","Search by firstName",""
"","330","Administration tests → Respondents tests → Invite new reviewer for a specific respondent tests → 403 Forbidden (Reviewer can NOT invite new reviewer for a specific respondent)","","Wed Jan 22 16:10:52 GMT 2025","passed","Wed Jan 22 16:10:52 GMT 2025","","Invite new reviewer for a specific respondent tests →","403 Forbidden (Reviewer can NOT invite new reviewer for a specific respondent)",""
"","219","Applet Events CRUD tests → Create cross-day events tests → 422 (Cross-day Event with WEEKDAYS periodicity type and availability range: 23:59:00-23:59:00)","","Wed Jan 22 16:04:18 GMT 2025","passed","Wed Jan 22 16:04:18 GMT 2025","","Create cross-day events tests →","422 (Cross-day Event with WEEKDAYS periodicity type and availability range: 23:59:00-23:59:00)",""
"","386","Administration tests → Respondents tests → View all respondents tests → 200 OK (Manager can view all respondents)","","Wed Jan 22 16:10:50 GMT 2025","passed","Wed Jan 22 16:10:50 GMT 2025","","View all respondents tests →","200 OK (Manager can view all respondents)",""
"","327","Flow Versions & Identifiers tests → Get flow Identifiers tests → 200 OK (empty list of flow identifiers)","","Wed Jan 22 16:00:53 GMT 2025","passed","Wed Jan 22 16:00:53 GMT 2025","","Get flow Identifiers tests →","200 OK (empty list of flow identifiers)",""
"","167","Answers CRUD tests → Answers handling after invitation acceptance by respondent → Check answer existence tests → 422 Unprocessable Entity (missing body params)","","Wed Jan 22 16:00:07 GMT 2025","passed","Wed Jan 22 16:00:07 GMT 2025","","Check answer existence tests →","422 Unprocessable Entity (missing body params)",""
"","77","Activity Assignments tests → Negative tests → Get Assignments list → 401 Unauthorised","","Wed Jan 22 15:57:42 GMT 2025","passed","Wed Jan 22 15:57:42 GMT 2025","","Get Assignments list →","401 Unauthorised",""
"","715","Applets CRUD endpoints tests → Get applets list → 200 OK (not-empty list)","","Wed Jan 22 16:02:07 GMT 2025","passed","Wed Jan 22 16:02:07 GMT 2025","","Get applets list →","200 OK (not-empty list)",""
"","294","Logs upload/download tests → Download Logs → 404 Not Found","","Wed Jan 22 16:07:28 GMT 2025","passed","Wed Jan 22 16:07:28 GMT 2025","","Download Logs →","404 Not Found",""
"","827","Workspaces endpoints tests → Workspaces created → Get workspace Applets → Respondent gets collaborated applets","","Wed Jan 22 16:14:36 GMT 2025","passed","Wed Jan 22 16:14:36 GMT 2025","","Get workspace Applets →","Respondent gets collaborated applets",""
"","737","User Events scenario tests → Reviewer & Manager should get general scheduled activity Event & general always available flow Events from the 1st Applet","","Wed Jan 22 16:12:48 GMT 2025","passed","Wed Jan 22 16:12:48 GMT 2025","","User Events scenario tests →","Reviewer & Manager should get general scheduled activity Event & general always available flow Events from the 1st Applet",""
"","339","Delete User tests → 401 Unauthorized (Delete User with not existing token)","","Wed Jan 22 16:12:05 GMT 2025","passed","Wed Jan 22 16:12:05 GMT 2025","","Delete User tests →","401 Unauthorized (Delete User with not existing token)",""
"","323","Workspaces managers access tests → Set workspace managers applet access list → 404 Not Found (incorrect appletId)","","Wed Jan 22 16:13:50 GMT 2025","passed","Wed Jan 22 16:13:50 GMT 2025","","Set workspace managers applet access list →","404 Not Found (incorrect appletId)",""
"","184","Duplicate Applet endpoint tests → 422 missing attribute (displayName)","","Wed Jan 22 16:03:11 GMT 2025","passed","Wed Jan 22 16:03:11 GMT 2025","","Duplicate Applet endpoint tests →","422 missing attribute (displayName)",""
"","1113","Applet builder tests → Create applet → Positive tests → Multiple activity with multiple items and multiple flows","","Wed Jan 22 16:02:27 GMT 2025","failed","Wed Jan 22 16:02:28 GMT 2025","","Positive tests →","Multiple activity with multiple items and multiple flows",""
"","77","Access link tests → Delete Access link tests → 401 Unauthorized (Delete Access link with not existing token)","","Wed Jan 22 16:02:00 GMT 2025","passed","Wed Jan 22 16:02:00 GMT 2025","","Delete Access link tests →","401 Unauthorized (Delete Access link with not existing token)",""
"","151","Applet Events CRUD tests → Update Applet Event tests → 422 Unprocessable Entity → Update Event with missing startTime (periodicity type: MONTHLY) param","","Wed Jan 22 16:04:04 GMT 2025","passed","Wed Jan 22 16:04:04 GMT 2025","","422 Unprocessable Entity →","Update Event with missing startTime (periodicity type: MONTHLY) param",""
"","77","Files upload/download directly to S3 bucket tests → Generate presigned links EPs negative tests Presign link 401 Unauthorized","","Wed Jan 22 16:08:03 GMT 2025","passed","Wed Jan 22 16:08:03 GMT 2025","","Presign link","401 Unauthorized",""
"","471","Files upload/download tests → Upload/Download answers (applet files) → Check answer (file) uploaded → 200 OK (uploaded = false)","","Wed Jan 22 16:07:21 GMT 2025","passed","Wed Jan 22 16:07:21 GMT 2025","","Check answer (file) uploaded →","200 OK (uploaded = false)",""
"","435","Applet public links tests → Accept Public invitation tests → Status of Public Invitation has not changed after its acceptance","","Wed Jan 22 16:09:09 GMT 2025","passed","Wed Jan 22 16:09:09 GMT 2025","","Accept Public invitation tests →","Status of Public Invitation has not changed after its acceptance",""
"","7054","Applet ""Transfer Ownership"" scenario tests → Transfer Accept → Send transfer request to two different users","","Wed Jan 22 16:05:26 GMT 2025","passed","Wed Jan 22 16:05:33 GMT 2025","","Transfer Accept →","Send transfer request to two different users",""
"","255","Activity Assessment & Review CRUD tests → Get Assessment & Review tests → Get Assessment tests → 404 Not Found (Get Assessment of not existing Answer)","","Wed Jan 22 16:00:38 GMT 2025","passed","Wed Jan 22 16:00:38 GMT 2025","","Get Assessment tests →","404 Not Found (Get Assessment of not existing Answer)",""
"","368","Administration tests → Applets tests → View General calendar in workspace of Applet owner tests → 403 Forbidden (Respondent can NOT view General calendar)","","Wed Jan 22 16:11:04 GMT 2025","passed","Wed Jan 22 16:11:04 GMT 2025","","View General calendar in workspace of Applet owner tests →","403 Forbidden (Respondent can NOT view General calendar)",""
"","222","Applet Events CRUD tests → Create Events tests → 422 Unprocessable Entity → Create Event with missing startTime (periodicity type: WEEKLY) param","","Wed Jan 22 16:03:37 GMT 2025","passed","Wed Jan 22 16:03:37 GMT 2025","","422 Unprocessable Entity →","Create Event with missing startTime (periodicity type: WEEKLY) param",""
"","469","Files upload/download tests → Upload/Download answers (applet files) → Check answer (file) uploaded → Files uploaded → 200 OK (2 files uploaded)","","Wed Jan 22 16:07:22 GMT 2025","passed","Wed Jan 22 16:07:22 GMT 2025","","Files uploaded →","200 OK (2 files uploaded)",""
"","5326","Invitations scenario tests → Invite unregistered user flow → New user should receive an e-mail with invitation","","Wed Jan 22 16:08:23 GMT 2025","passed","Wed Jan 22 16:08:28 GMT 2025","","Invite unregistered user flow →","New user should receive an e-mail with invitation",""
"","588","Answer Notes tests → Edit Note tests → 200 OK (Note can be updated successfully) & Applet owner retrieves Note list with update Note","","Wed Jan 22 15:57:52 GMT 2025","passed","Wed Jan 22 15:57:52 GMT 2025","","Edit Note tests →","200 OK (Note can be updated successfully) & Applet owner retrieves Note list with update Note",""
"","150","Applet Events CRUD tests → Create Events tests → 422 Unprocessable Entity → Create Event with missing accessBeforeSchedule (periodicity type: WEEKDAYS) param","","Wed Jan 22 16:03:37 GMT 2025","passed","Wed Jan 22 16:03:37 GMT 2025","","422 Unprocessable Entity →","Create Event with missing accessBeforeSchedule (periodicity type: WEEKDAYS) param",""
"","255","Administration tests → Respondents tests → View all respondents tests → 403 Forbidden (Editor can NOT view all respondents)","","Wed Jan 22 16:10:50 GMT 2025","passed","Wed Jan 22 16:10:50 GMT 2025","","View all respondents tests →","403 Forbidden (Editor can NOT view all respondents)",""
"","489","Answers CRUD tests → Answers handling after invitation acceptance by respondent → Create Answer tests → 400 Bad Request (not-unique submitId)","","Wed Jan 22 16:00:00 GMT 2025","passed","Wed Jan 22 16:00:00 GMT 2025","","Create Answer tests →","400 Bad Request (not-unique submitId)",""
"","229","Applet ""Transfer Ownership"" endpoints tests → Transfer Accept → 404 (Accept same request again)","","Wed Jan 22 16:06:12 GMT 2025","passed","Wed Jan 22 16:06:12 GMT 2025","","Transfer Accept →","404 (Accept same request again)",""
"","476","Applet Events CRUD tests → Create cross-day events tests → 201 Created (Cross-day Event with DAILY periodicity type and availability range: 00:01:00-00:00:00)","","Wed Jan 22 16:04:18 GMT 2025","passed","Wed Jan 22 16:04:18 GMT 2025","","Create cross-day events tests →","201 Created (Cross-day Event with DAILY periodicity type and availability range: 00:01:00-00:00:00)",""
"","247","Workspaces endpoints tests → Workspaces created → Get workspace applet details → 404 Not Found (non-existent appletId)","","Wed Jan 22 16:14:43 GMT 2025","passed","Wed Jan 22 16:14:43 GMT 2025","","Get workspace applet details →","404 Not Found (non-existent appletId)",""
"","272","Applet builder tests → Create applet → Negative tests → Duplicate Item name","","Wed Jan 22 16:02:47 GMT 2025","passed","Wed Jan 22 16:02:47 GMT 2025","","Negative tests →","Duplicate Item name",""
"","241","Administration tests → Transfer ownership of Applet tests → 403 Forbidden (Coordinator can not transfer ownership)","","Wed Jan 22 16:10:36 GMT 2025","passed","Wed Jan 22 16:10:36 GMT 2025","","Transfer ownership of Applet tests →","403 Forbidden (Coordinator can not transfer ownership)",""
"","1597","Applet builder tests → Update applet → Remove activity item(s)","","Wed Jan 22 16:02:48 GMT 2025","failed","Wed Jan 22 16:02:49 GMT 2025","","Update applet →","Remove activity item(s)",""
"","254","Applet Events CRUD tests → Create Events tests → 404 Not Found (Create general scheduled activity Event for not existing Applet)","","Wed Jan 22 16:03:35 GMT 2025","passed","Wed Jan 22 16:03:35 GMT 2025","","Create Events tests →","404 Not Found (Create general scheduled activity Event for not existing Applet)",""
"","298","Answer Notes tests → Delete Note tests → 404 Not Found (Delete not existing Note)","","Wed Jan 22 15:57:56 GMT 2025","passed","Wed Jan 22 15:57:56 GMT 2025","","Delete Note tests →","404 Not Found (Delete not existing Note)",""
"","298","Flow Versions & Identifiers tests → Get flow Versions tests → Flow has been updated → 200 OK (Get flow versions after adding new activity in flow)","","Wed Jan 22 16:00:52 GMT 2025","passed","Wed Jan 22 16:00:52 GMT 2025","","Flow has been updated →","200 OK (Get flow versions after adding new activity in flow)",""
"","235","Applet Library tests → Applet is added to the library → Get Library items list 200 OK (get the whole list)","","Wed Jan 22 16:01:47 GMT 2025","passed","Wed Jan 22 16:01:47 GMT 2025","","Get Library items list","200 OK (get the whole list)",""
"","296","Workspaces endpoints tests → Empty workspaces → Get workspace applets → 200 OK","","Wed Jan 22 16:14:16 GMT 2025","passed","Wed Jan 22 16:14:16 GMT 2025","","Get workspace applets →","200 OK",""
"","77","Applets ""retentions"" endpoint tests → 401 Unauthorized","","Wed Jan 22 16:03:06 GMT 2025","passed","Wed Jan 22 16:03:06 GMT 2025","","Applets ""retentions"" endpoint tests →","401 Unauthorized",""
"","1006","Applet ""Transfer Ownership"" scenario tests → Transfer Accept → Applet owner should remain the same before transfer request accepted by another user","","Wed Jan 22 16:05:26 GMT 2025","passed","Wed Jan 22 16:05:27 GMT 2025","","Transfer Accept →","Applet owner should remain the same before transfer request accepted by another user",""
"","270","Applet Library tests → Applet is added to the library → Get Library items list 200 OK (search by name)","","Wed Jan 22 16:01:47 GMT 2025","passed","Wed Jan 22 16:01:47 GMT 2025","","Get Library items list","200 OK (search by name)",""
"","77","Workspaces endpoints tests → Workspaces created → Get workspace Folder Applets → 401 Unauthorized","","Wed Jan 22 16:14:42 GMT 2025","passed","Wed Jan 22 16:14:42 GMT 2025","","Get workspace Folder Applets →","401 Unauthorized",""
"","2672","Administration tests → Organizers tests → Invite new organizer tests → 200 OK (Manager can invite manager, coordinator, editor, reviewer)","","Wed Jan 22 16:10:37 GMT 2025","passed","Wed Jan 22 16:10:39 GMT 2025","","Invite new organizer tests →","200 OK (Manager can invite manager, coordinator, editor, reviewer)",""
"","296","""Subjects"" endpoints CRUD tests → Get subjects 200 OK: shell account","","Wed Jan 22 16:11:45 GMT 2025","failed","Wed Jan 22 16:11:45 GMT 2025","","Get subjects","200 OK: shell account",""
"","159","Applet Events CRUD tests → Create Events tests → 422 Unprocessable Entity → Create Event with missing startTime (periodicity type: WEEKDAYS) param","","Wed Jan 22 16:03:37 GMT 2025","passed","Wed Jan 22 16:03:37 GMT 2025","","422 Unprocessable Entity →","Create Event with missing startTime (periodicity type: WEEKDAYS) param",""
"","173","Applet Events CRUD tests → Create Events tests → 422 Unprocessable Entity → Create Event with missing selectedDate param (periodicity type: ONCE)","","Wed Jan 22 16:03:37 GMT 2025","passed","Wed Jan 22 16:03:37 GMT 2025","","422 Unprocessable Entity →","Create Event with missing selectedDate param (periodicity type: ONCE)",""
"","186","Shell account invitation scenario tests → Accept invitation by unregistered user → New user can accept invitation after registration","","Wed Jan 22 16:09:36 GMT 2025","failed","Wed Jan 22 16:09:36 GMT 2025","","Accept invitation by unregistered user →","New user can accept invitation after registration",""
"","162","Invitations endpoints tests → Send invitation → Invitation Managers Send → 422 Missing attributes Missing role","","Wed Jan 22 16:08:59 GMT 2025","passed","Wed Jan 22 16:08:59 GMT 2025","","422 Missing attributes","Missing role",""
"","2879","Create Answers for different item types tests → Gyroscope performance task","","Wed Jan 22 15:58:38 GMT 2025","passed","Wed Jan 22 15:58:40 GMT 2025","","Create Answers for different item types tests →","Gyroscope performance task",""
"","318","Applet versions endpoints tests → Get applet versions → 200 Ok (single default version)","","Wed Jan 22 16:06:35 GMT 2025","passed","Wed Jan 22 16:06:35 GMT 2025","","Get applet versions →","200 Ok (single default version)",""
"","221","Invitations scenario tests → Decline invitation positive flow → Invited user declines invitation","","Wed Jan 22 16:08:10 GMT 2025","passed","Wed Jan 22 16:08:10 GMT 2025","","Decline invitation positive flow →","Invited user declines invitation",""
"","231","Invitations endpoints tests → Send invitation → Invitation Managers Send → 404 - Applet does not exist","","Wed Jan 22 16:08:53 GMT 2025","passed","Wed Jan 22 16:08:53 GMT 2025","","Invitation Managers Send →","404 - Applet does not exist",""
"","429","Invitations endpoints tests → Send invitation → Invitation Respondent Send → 200 OK (send to existing user)","","Wed Jan 22 16:08:44 GMT 2025","passed","Wed Jan 22 16:08:44 GMT 2025","","Invitation Respondent Send →","200 OK (send to existing user)",""
"","402","Invitations scenario tests → Invite unregistered user flow → Send invitation to unregistered user","","Wed Jan 22 16:08:23 GMT 2025","passed","Wed Jan 22 16:08:23 GMT 2025","","Invite unregistered user flow →","Send invitation to unregistered user",""
"","78","Answer Notes tests → Delete Note tests → 401 Unauthorized (Delete Note with not existing token)","","Wed Jan 22 15:57:56 GMT 2025","passed","Wed Jan 22 15:57:56 GMT 2025","","Delete Note tests →","401 Unauthorized (Delete Note with not existing token)",""
"","206","Applet Library tests → Applet is added to the library → Check Library item name → 422 missing attribute (name)","","Wed Jan 22 16:01:48 GMT 2025","passed","Wed Jan 22 16:01:48 GMT 2025","","Check Library item name →","422 missing attribute (name)",""
"","272","Answer Notes tests → Create Notes tests → 403 Forbidden (Create Note by respondent)","","Wed Jan 22 15:57:50 GMT 2025","passed","Wed Jan 22 15:57:50 GMT 2025","","Create Notes tests →","403 Forbidden (Create Note by respondent)",""
"","353","User Events scenario tests → The 1st respondent should get in total 4 Events from the 1st and 2nd Applet","","Wed Jan 22 16:12:48 GMT 2025","passed","Wed Jan 22 16:12:48 GMT 2025","","User Events scenario tests →","The 1st respondent should get in total 4 Events from the 1st and 2nd Applet",""
"","75","Applets CRUD endpoints tests → Get applet by id → 401 Unauthorized","","Wed Jan 22 16:02:13 GMT 2025","passed","Wed Jan 22 16:02:13 GMT 2025","","Get applet by id →","401 Unauthorized",""
"","235","Workspaces endpoints tests → Workspaces created → Get workspace respondent applet access list → 404 Not found (non-existent ownerId)","","Wed Jan 22 16:14:57 GMT 2025","passed","Wed Jan 22 16:14:57 GMT 2025","","Get workspace respondent applet access list →","404 Not found (non-existent ownerId)",""
"","423","Shell account invitation scenario tests → Accept invitation by already registered user → Send invitation to the shell account","","Wed Jan 22 16:09:51 GMT 2025","passed","Wed Jan 22 16:09:51 GMT 2025","","Accept invitation by already registered user →","Send invitation to the shell account",""
"","896","Workspaces endpoints tests → Workspaces created → Update workspace applet respondent → 200 OK","","Wed Jan 22 16:14:59 GMT 2025","failed","Wed Jan 22 16:14:59 GMT 2025","","Update workspace applet respondent →","200 OK",""
"","251","Workspace folder for different users tests → Manager is invited to the applet → Manager creates own folder in the same workspace Applet Owner and Manager add the same applet in their folders Applet Owner creates another folder Get folders (applet owner)","","Wed Jan 22 16:13:31 GMT 2025","passed","Wed Jan 22 16:13:31 GMT 2025","","Applet Owner creates another folder","Get folders (applet owner)",""
"","295","Applet versions endpoints tests → Update Applet → Add Activity → Remove Activity → Add Activity Flow → Remove Activity Flow → Add Activity Item → Remove Activity Item → Update Activity → Update Activity Item → Update Activity Flow → Update Applet description → Get applet version changes","","Wed Jan 22 16:06:52 GMT 2025","passed","Wed Jan 22 16:06:52 GMT 2025","","Update Applet description →","Get applet version changes",""
"","544","Applet ""Transfer Ownership"" scenario tests → Transfer Accept → First receiver should become the owner → Verify Pending Invitations & Public link","","Wed Jan 22 16:05:41 GMT 2025","passed","Wed Jan 22 16:05:41 GMT 2025","","First receiver should become the owner →","Verify Pending Invitations & Public link",""
