"DESCRIPTION","DURATION IN MS","NAME","PARENT SUITE","START TIME","STATUS","STOP TIME","SUB SUITE","SUITE","TEST CLASS","TEST METHOD"
"","1873","Applet builder tests → Update applet → Add activity flow","","Wed Nov 27 15:00:43 GMT 2024","passed","Wed Nov 27 15:00:44 GMT 2024","","Update applet →","Add activity flow",""
"","340","Administration tests → Applets tests → Export & view data in workspace of Applet owner tests → Export data tests → 200 OK (Editor can export his own data)","","Wed Nov 27 15:08:01 GMT 2024","passed","Wed Nov 27 15:08:01 GMT 2024","","Export data tests →","200 OK (Editor can export his own data)",""
"","159","""Workspace Folders"" endpoints tests → Workspace is created → Create Folder → 422 Unprocessable Entity (missing attribute)","","Wed Nov 27 15:09:48 GMT 2024","passed","Wed Nov 27 15:09:48 GMT 2024","","Create Folder →","422 Unprocessable Entity (missing attribute)",""
"","337","Applet ""Transfer Ownership"" scenario tests → Transfer Decline → Second receiver can accept transfer request","","Wed Nov 27 15:03:17 GMT 2024","passed","Wed Nov 27 15:03:17 GMT 2024","","Transfer Decline →","Second receiver can accept transfer request",""
"","207","Invitations endpoints tests → Create shell account → 200 OK: shell account with nickname","","Wed Nov 27 15:06:05 GMT 2024","passed","Wed Nov 27 15:06:05 GMT 2024","","Create shell account →","200 OK: shell account with nickname",""
"","134","Update User tests → 422 Unprocessable Entity Update user with missing firstName param","","Wed Nov 27 15:09:25 GMT 2024","passed","Wed Nov 27 15:09:25 GMT 2024","","422 Unprocessable Entity","Update user with missing firstName param",""
"","240","Files upload/download directly to S3 bucket tests → Upload media files directly to storage (S3 bucket) Upload media file directly to generated link","","Wed Nov 27 15:04:53 GMT 2024","passed","Wed Nov 27 15:04:53 GMT 2024","","Upload media files directly to storage (S3 bucket)","Upload media file directly to generated link",""
"","6463","Applet ""Transfer Ownership"" scenario tests → Transfer Decline → Send transfer request to two different users","","Wed Nov 27 15:03:17 GMT 2024","passed","Wed Nov 27 15:03:23 GMT 2024","","Transfer Decline →","Send transfer request to two different users",""
"","18","Workspaces managers access tests → Set workspace managers applet access list → 401 Unauthorized","","Wed Nov 27 15:10:23 GMT 2024","passed","Wed Nov 27 15:10:23 GMT 2024","","Set workspace managers applet access list →","401 Unauthorized",""
"","152","Applet public access tests → Create anonymous answer 422 Unprocessable entity (missing answer)","","Wed Nov 27 15:02:41 GMT 2024","passed","Wed Nov 27 15:02:41 GMT 2024","","Create anonymous answer","422 Unprocessable entity (missing answer)",""
"","337","Applets CRUD endpoints tests → Get applet by id → 404 Applet not found","","Wed Nov 27 15:00:02 GMT 2024","passed","Wed Nov 27 15:00:02 GMT 2024","","Get applet by id →","404 Applet not found",""
"","19","Invitations endpoints tests → Send invitation → Invitation Reviewer Send → 401 Unauthorized (invalid token)","","Wed Nov 27 15:05:53 GMT 2024","passed","Wed Nov 27 15:05:53 GMT 2024","","Invitation Reviewer Send →","401 Unauthorized (invalid token)",""
"","208","Workspace folder for different users tests → Get folders (applet owner)","","Wed Nov 27 15:09:54 GMT 2024","passed","Wed Nov 27 15:09:54 GMT 2024","","Workspace folder for different users tests →","Get folders (applet owner)",""
"","306","Applet versions endpoints tests → Update Applet → Add Activity → Remove Activity → Add Activity Flow → Remove Activity Flow → Add Activity Item → Remove Activity Item → Get applet version changes","","Wed Nov 27 15:04:11 GMT 2024","passed","Wed Nov 27 15:04:11 GMT 2024","","Remove Activity Item →","Get applet version changes",""
"","17","Applet Events CRUD tests → Delete individual scheduled Applet Events negative tests → 401 Unauthorized (Delete scheduled Events of a particular user with not existing appletOwnerToken)","","Wed Nov 27 15:01:57 GMT 2024","passed","Wed Nov 27 15:01:57 GMT 2024","","Delete individual scheduled Applet Events negative tests →","401 Unauthorized (Delete scheduled Events of a particular user with not existing appletOwnerToken)",""
"","192","Applet ""Transfer Ownership"" endpoints tests → Transfer Decline → 404 (invalid applet id)","","Wed Nov 27 15:03:48 GMT 2024","passed","Wed Nov 27 15:03:48 GMT 2024","","Transfer Decline →","404 (invalid applet id)",""
"","633","Activity Assignments tests → Positive tests → Assign multiple activities to single full participant","","Wed Nov 27 14:56:08 GMT 2024","passed","Wed Nov 27 14:56:08 GMT 2024","","Positive tests →","Assign multiple activities to single full participant",""
"","778","Applet ""Transfer Ownership"" scenario tests → Transfer Accept → Applet owner should remain the same before transfer request accepted by another user","","Wed Nov 27 15:02:58 GMT 2024","passed","Wed Nov 27 15:02:58 GMT 2024","","Transfer Accept →","Applet owner should remain the same before transfer request accepted by another user",""
"","324","Shell account invitation scenario tests → Accept invitation by already registered user → Verify invitation in list of invitations","","Wed Nov 27 15:06:52 GMT 2024","passed","Wed Nov 27 15:06:52 GMT 2024","","Accept invitation by already registered user →","Verify invitation in list of invitations",""
"","248","Get submit dates & exported Answers data tests → Get exported data before Answer submit → 200 OK (Get empty exported data)","","Wed Nov 27 14:56:55 GMT 2024","passed","Wed Nov 27 14:56:55 GMT 2024","","Get exported data before Answer submit →","200 OK (Get empty exported data)",""
"","163","Invitations endpoints tests → Send invitation → Invitation Managers Send → 422 - Incorrect ""language"" value","","Wed Nov 27 15:05:57 GMT 2024","passed","Wed Nov 27 15:05:57 GMT 2024","","Invitation Managers Send →","422 - Incorrect ""language"" value",""
"","244","Administration tests → Organizers tests → Change organizer roles/permissions tests → 403 Forbidden (Reviewer can NOT grant editor's permissions to respondent)","","Wed Nov 27 15:07:42 GMT 2024","passed","Wed Nov 27 15:07:42 GMT 2024","","Change organizer roles/permissions tests →","403 Forbidden (Reviewer can NOT grant editor's permissions to respondent)",""
"","227","Workspaces managers access tests → Set workspace managers applet access list → 404 Not Found (incorrect appletId)","","Wed Nov 27 15:10:23 GMT 2024","passed","Wed Nov 27 15:10:23 GMT 2024","","Set workspace managers applet access list →","404 Not Found (incorrect appletId)",""
"","332","Workspaces endpoints tests → Workspaces created → Get workspace Applets → Test for filters (query params) → Limit","","Wed Nov 27 15:11:04 GMT 2024","passed","Wed Nov 27 15:11:04 GMT 2024","","Test for filters (query params) →","Limit",""
"","5146","Shell account invitation scenario tests → Accept invitation by unregistered user → New user should receive an e-mail with invitation","","Wed Nov 27 15:06:39 GMT 2024","passed","Wed Nov 27 15:06:44 GMT 2024","","Accept invitation by unregistered user →","New user should receive an e-mail with invitation",""
"","40","""Subjects"" endpoints CRUD tests → Update subjects 401: Unauthorized","","Wed Nov 27 15:08:35 GMT 2024","passed","Wed Nov 27 15:08:35 GMT 2024","","Update subjects","401: Unauthorized",""
"","122","Applet Events CRUD tests → Create Events tests → 422 Unprocessable Entity → Create Event with missing startTime (periodicity type: ONCE) param","","Wed Nov 27 15:01:31 GMT 2024","passed","Wed Nov 27 15:01:31 GMT 2024","","422 Unprocessable Entity →","Create Event with missing startTime (periodicity type: ONCE) param",""
"","359","Activity Assignments tests → Negative tests → Create Assignments → 400 bad request: assign activity to limited account","","Wed Nov 27 14:56:11 GMT 2024","passed","Wed Nov 27 14:56:11 GMT 2024","","Create Assignments →","400 bad request: assign activity to limited account",""
"","164","Applets ""unique_name"" endpoint tests → 422 invalid attribute (excludingAppletId)","","Wed Nov 27 15:03:56 GMT 2024","passed","Wed Nov 27 15:03:56 GMT 2024","","Applets ""unique_name"" endpoint tests →","422 invalid attribute (excludingAppletId)",""
"","19","Workspaces endpoints tests → Workspaces created → Pin user (manager) on workspace → 401 Unauthorized","","Wed Nov 27 15:11:18 GMT 2024","passed","Wed Nov 27 15:11:18 GMT 2024","","Pin user (manager) on workspace →","401 Unauthorized",""
"","316","Applet versions endpoints tests → Update Applet → Add Activity → Get applet version by id","","Wed Nov 27 15:04:04 GMT 2024","passed","Wed Nov 27 15:04:04 GMT 2024","","Add Activity →","Get applet version by id",""
"","536","User Password tests → Recover password tests → 201 Recover password","","Wed Nov 27 15:08:58 GMT 2024","passed","Wed Nov 27 15:08:58 GMT 2024","","Recover password tests →","201 Recover password",""
"","362","Applet Events CRUD tests → Create cross-day events tests → 201 Created (Cross-day Event with WEEKLY periodicity type and availability range: 23:59:00-23:58:00)","","Wed Nov 27 15:02:04 GMT 2024","passed","Wed Nov 27 15:02:04 GMT 2024","","Create cross-day events tests →","201 Created (Cross-day Event with WEEKLY periodicity type and availability range: 23:59:00-23:58:00)",""
"","305","Applets ""retentions"" endpoint tests → 200 OK → 100 month","","Wed Nov 27 15:01:04 GMT 2024","passed","Wed Nov 27 15:01:04 GMT 2024","","200 OK →","100 month",""
"","2072","Update Password tests → 401 Unauthorized (User login with previous password)","","Wed Nov 27 15:09:11 GMT 2024","passed","Wed Nov 27 15:09:13 GMT 2024","","Update Password tests →","401 Unauthorized (User login with previous password)",""
"","18","Applet versions endpoints tests → Get applet version changes → 401 Unauthorized","","Wed Nov 27 15:04:04 GMT 2024","passed","Wed Nov 27 15:04:04 GMT 2024","","Get applet version changes →","401 Unauthorized",""
"","163","Invitations endpoints tests → Send invitation → Invitation Managers Send → 422 Missing attributes Missing role","","Wed Nov 27 15:06:04 GMT 2024","passed","Wed Nov 27 15:06:04 GMT 2024","","422 Missing attributes","Missing role",""
"","314","Applet Library tests → Applet is added to the library → Check Library item name → 400 Bad request: not unique name","","Wed Nov 27 14:59:41 GMT 2024","passed","Wed Nov 27 14:59:41 GMT 2024","","Check Library item name →","400 Bad request: not unique name",""
"","326","Workspaces endpoints tests → Workspaces created → Get workspace respondents → Test for filters (query params) → Search by nickname is not allowed","","Wed Nov 27 15:11:09 GMT 2024","passed","Wed Nov 27 15:11:09 GMT 2024","","Test for filters (query params) →","Search by nickname is not allowed",""
"","979","Applet ""Transfer Ownership"" scenario tests → Transfer Decline → Second receiver should become the owner","","Wed Nov 27 15:03:17 GMT 2024","passed","Wed Nov 27 15:03:17 GMT 2024","","Transfer Decline →","Second receiver should become the owner",""
"","231","Workspaces endpoints tests → Workspaces created → Pin user (manager) on workspace → 403 Forbidden (invalid manager_id)","","Wed Nov 27 15:11:18 GMT 2024","passed","Wed Nov 27 15:11:18 GMT 2024","","Pin user (manager) on workspace →","403 Forbidden (invalid manager_id)",""
"","330","Applet Events CRUD tests → Get general and individual Applet Events → 200 OK (without respondentId in the query)","","Wed Nov 27 15:01:33 GMT 2024","passed","Wed Nov 27 15:01:33 GMT 2024","","Get general and individual Applet Events →","200 OK (without respondentId in the query)",""
"","261","Invitations scenario tests → Re-send invitation flow → User accepts new invitation","","Wed Nov 27 15:05:25 GMT 2024","passed","Wed Nov 27 15:05:25 GMT 2024","","Re-send invitation flow →","User accepts new invitation",""
"","241","Workspaces endpoints tests → Workspaces created → Get workspace managers → Test for filters (query params) → Search → Search by lastName","","Wed Nov 27 15:11:12 GMT 2024","passed","Wed Nov 27 15:11:12 GMT 2024","","Search →","Search by lastName",""
"","233","Invitations endpoints tests → Create shell account → 200 OK: shell account with min required attributes","","Wed Nov 27 15:06:05 GMT 2024","passed","Wed Nov 27 15:06:05 GMT 2024","","Create shell account →","200 OK: shell account with min required attributes",""
"","112","Applet Events CRUD tests → Create Events tests → 422 Unprocessable Entity → Create Event with missing endTime (periodicity type: DAILY) param","","Wed Nov 27 15:01:31 GMT 2024","passed","Wed Nov 27 15:01:31 GMT 2024","","422 Unprocessable Entity →","Create Event with missing endTime (periodicity type: DAILY) param",""
"","4560","Applet Events scenario tests → End-To-End scenario (Individual activity Always Available Event)","","Wed Nov 27 15:02:11 GMT 2024","passed","Wed Nov 27 15:02:15 GMT 2024","","Applet Events scenario tests →","End-To-End scenario (Individual activity Always Available Event)",""
"","130","Applet public access tests → Get public events by key → 404: invalid key","","Wed Nov 27 15:02:41 GMT 2024","passed","Wed Nov 27 15:02:41 GMT 2024","","Get public events by key →","404: invalid key",""
"","37","""Themes"" endpoints tests → Delete Theme → 401 Unauthorized (invalid token)","","Wed Nov 27 15:08:43 GMT 2024","passed","Wed Nov 27 15:08:43 GMT 2024","","Delete Theme →","401 Unauthorized (invalid token)",""
"","18","Applet Events CRUD tests → Create Events tests → 401 Unauthorized (Create general scheduled activity Event with not existing appletOwnerToken)","","Wed Nov 27 15:01:28 GMT 2024","passed","Wed Nov 27 15:01:28 GMT 2024","","Create Events tests →","401 Unauthorized (Create general scheduled activity Event with not existing appletOwnerToken)",""
"","21","Applets CRUD endpoints tests → Get applet by id → 401 Unauthorized","","Wed Nov 27 15:00:02 GMT 2024","passed","Wed Nov 27 15:00:02 GMT 2024","","Get applet by id →","401 Unauthorized",""
"","268","Update User tests → 200 Update User","","Wed Nov 27 15:09:23 GMT 2024","passed","Wed Nov 27 15:09:23 GMT 2024","","Update User tests →","200 Update User",""
"","136","Invitations endpoints tests → Send invitation → Invitation Managers Send → 422 Missing attributes Missing lastName","","Wed Nov 27 15:06:04 GMT 2024","passed","Wed Nov 27 15:06:04 GMT 2024","","422 Missing attributes","Missing lastName",""
"","154","Duplicate Applet endpoint tests → 422 missing attribute (encryption)","","Wed Nov 27 15:01:06 GMT 2024","passed","Wed Nov 27 15:01:06 GMT 2024","","Duplicate Applet endpoint tests →","422 missing attribute (encryption)",""
"","220","Activity Versions & Identifiers tests → Get Versions tests → Applet has been updated → 200 OK (Get versions after updating item type, applet name and adding new item)","","Wed Nov 27 14:59:02 GMT 2024","passed","Wed Nov 27 14:59:02 GMT 2024","","Applet has been updated →","200 OK (Get versions after updating item type, applet name and adding new item)",""
"","32","Activity Assessment & Review CRUD tests → Delete Assessment tests → 401 Unauthorized (Delete submitted assessment with not existing token)","","Wed Nov 27 14:58:47 GMT 2024","passed","Wed Nov 27 14:58:47 GMT 2024","","Delete Assessment tests →","401 Unauthorized (Delete submitted assessment with not existing token)",""
"","123","""Subjects"" endpoints CRUD tests → Update subjects 422: Missing secretId","","Wed Nov 27 15:08:35 GMT 2024","passed","Wed Nov 27 15:08:35 GMT 2024","","Update subjects","422: Missing secretId",""
"","313","Shell account invitation scenario tests → Accept invitation by unregistered user → Shell account should be present in the list of respondents with ""not invited"" status before invitation is sent","","Wed Nov 27 15:06:39 GMT 2024","passed","Wed Nov 27 15:06:39 GMT 2024","","Accept invitation by unregistered user →","Shell account should be present in the list of respondents with ""not invited"" status before invitation is sent",""
"","423","Access link tests → Delete Access link tests → 404 (Delete already deleted Access link)","","Wed Nov 27 14:59:50 GMT 2024","passed","Wed Nov 27 14:59:50 GMT 2024","","Delete Access link tests →","404 (Delete already deleted Access link)",""
"","202","Activity Assessment & Review CRUD tests → Submit Assessment tests → 401 Not Found (Submit Assessment in not existing Applet)","","Wed Nov 27 14:58:45 GMT 2024","passed","Wed Nov 27 14:58:45 GMT 2024","","Submit Assessment tests →","401 Not Found (Submit Assessment in not existing Applet)",""
"","280","Activity Assignments tests → Negative tests → Create Assignments → 403 Forbidden","","Wed Nov 27 14:56:11 GMT 2024","passed","Wed Nov 27 14:56:11 GMT 2024","","Create Assignments →","403 Forbidden",""
"","276","Summary & Review activities tests → Get Summary and Review Activities (non-empty list) tests → Get Summary Activities list tests → 404 Not Found (Get Summary Activities list of not existing Applet)","","Wed Nov 27 14:59:25 GMT 2024","passed","Wed Nov 27 14:59:25 GMT 2024","","Get Summary Activities list tests →","404 Not Found (Get Summary Activities list of not existing Applet)",""
"","115","Applet public access tests → Get public applet base info by key → 404: invalid key","","Wed Nov 27 15:02:41 GMT 2024","passed","Wed Nov 27 15:02:41 GMT 2024","","Get public applet base info by key →","404: invalid key",""
"","18","Applet public links tests → Accept Public invitation tests → 401 Unauthorized (Accept invitation with not existing token)","","Wed Nov 27 15:06:13 GMT 2024","passed","Wed Nov 27 15:06:13 GMT 2024","","Accept Public invitation tests →","401 Unauthorized (Accept invitation with not existing token)",""
"","697","""Authentication"" endpoints tests → OpenAPI auth → 401 Unauthorized (incorrect password)","","Wed Nov 27 15:04:24 GMT 2024","passed","Wed Nov 27 15:04:24 GMT 2024","","OpenAPI auth →","401 Unauthorized (incorrect password)",""
"","138","Workspaces managers access tests → Remove manager access → 422 Missing attribute (appletIds)","","Wed Nov 27 15:10:27 GMT 2024","passed","Wed Nov 27 15:10:27 GMT 2024","","Remove manager access →","422 Missing attribute (appletIds)",""
"","142","""Themes"" endpoints tests → Create Theme → 422 Unprocessable Entity (missing attribute) Missing logo","","Wed Nov 27 15:08:42 GMT 2024","passed","Wed Nov 27 15:08:42 GMT 2024","","422 Unprocessable Entity (missing attribute)","Missing logo",""
"","230","""Themes"" endpoints tests → Delete Theme → 204 OK","","Wed Nov 27 15:08:43 GMT 2024","passed","Wed Nov 27 15:08:43 GMT 2024","","Delete Theme →","204 OK",""
"","147","Files upload/download tests → Upload/Download answers (applet files) → Upload Answer → 422 Empty form data","","Wed Nov 27 15:04:35 GMT 2024","passed","Wed Nov 27 15:04:35 GMT 2024","","Upload Answer →","422 Empty form data",""
"","139","Applets ""retentions"" endpoint tests → 400 / 422 Bad Request → 0 period","","Wed Nov 27 15:01:06 GMT 2024","passed","Wed Nov 27 15:01:06 GMT 2024","","400 / 422 Bad Request →","0 period",""
"","208","Answers CRUD tests → Answers handling after invitation acceptance by respondent → Check answer existence tests → 200 OK (exists = true, check by respondent)","","Wed Nov 27 14:58:19 GMT 2024","passed","Wed Nov 27 14:58:19 GMT 2024","","Check answer existence tests →","200 OK (exists = true, check by respondent)",""
"","281","Logs upload/download tests → Check logs existence → Logs uploaded → 200 OK (2 files uploaded)","","Wed Nov 27 15:04:49 GMT 2024","passed","Wed Nov 27 15:04:49 GMT 2024","","Logs uploaded →","200 OK (2 files uploaded)",""
"","125","Applet Events CRUD tests → Update Applet Event tests → 422 Unprocessable Entity → Update Event with missing accessBeforeSchedule (periodicity type: DAILY) param","","Wed Nov 27 15:01:51 GMT 2024","passed","Wed Nov 27 15:01:51 GMT 2024","","422 Unprocessable Entity →","Update Event with missing accessBeforeSchedule (periodicity type: DAILY) param",""
"","255","Workspaces endpoints tests → Workspaces created → Get workspace applet managers → Second workspace second applet managers","","Wed Nov 27 15:11:14 GMT 2024","passed","Wed Nov 27 15:11:14 GMT 2024","","Get workspace applet managers →","Second workspace second applet managers",""
"","2287","Create Answers for different item types tests → All web-app items","","Wed Nov 27 14:57:01 GMT 2024","passed","Wed Nov 27 14:57:03 GMT 2024","","Create Answers for different item types tests →","All web-app items",""
"","259","Administration tests → Transfer ownership of Applet tests → 403 Forbidden (Respondent can not transfer ownership)","","Wed Nov 27 15:07:32 GMT 2024","passed","Wed Nov 27 15:07:32 GMT 2024","","Transfer ownership of Applet tests →","403 Forbidden (Respondent can not transfer ownership)",""
"","220","Logs upload/download tests → Download Logs → 404 Not Found","","Wed Nov 27 15:04:44 GMT 2024","passed","Wed Nov 27 15:04:44 GMT 2024","","Download Logs →","404 Not Found",""
"","285","Applet ""Transfer Ownership"" endpoints tests → Transfer Accept → 403 Forbidden (for applet owner)","","Wed Nov 27 15:03:41 GMT 2024","passed","Wed Nov 27 15:03:41 GMT 2024","","Transfer Accept →","403 Forbidden (for applet owner)",""
"","276","Applet ""Transfer Ownership"" scenario tests → Transfer Decline → First receiver declines transfer request","","Wed Nov 27 15:03:17 GMT 2024","passed","Wed Nov 27 15:03:17 GMT 2024","","Transfer Decline →","First receiver declines transfer request",""
"","18","Applet Events CRUD tests → Delete scheduled Applet Event by Id tests → 401 Unauthorized (Delete individual scheduled activity Event with not existing appletOwnerToken)","","Wed Nov 27 15:01:45 GMT 2024","passed","Wed Nov 27 15:01:45 GMT 2024","","Delete scheduled Applet Event by Id tests →","401 Unauthorized (Delete individual scheduled activity Event with not existing appletOwnerToken)",""
"","212","Activity Assessment & Review CRUD tests → Submit Assessment tests → 422 Unprocessable Entity → Create Assessment with missing reviewerPublicKey param","","Wed Nov 27 14:58:46 GMT 2024","passed","Wed Nov 27 14:58:46 GMT 2024","","422 Unprocessable Entity →","Create Assessment with missing reviewerPublicKey param",""
"","300","Workspaces endpoints tests → Workspaces created → Get workspace applet respondent by id → 403 Forbidden","","Wed Nov 27 15:11:20 GMT 2024","passed","Wed Nov 27 15:11:20 GMT 2024","","Get workspace applet respondent by id →","403 Forbidden",""
"","274","Get Assessment & Review of updated activity tests → Switch to a new assessment version Get Review info after switching to a new assessment version","","Wed Nov 27 14:58:36 GMT 2024","passed","Wed Nov 27 14:58:36 GMT 2024","","Switch to a new assessment version","Get Review info after switching to a new assessment version",""
"","497","Invitations scenario tests → Accept invitation positive flow → Invitation is not available for invitor anymore","","Wed Nov 27 15:05:16 GMT 2024","passed","Wed Nov 27 15:05:16 GMT 2024","","Accept invitation positive flow →","Invitation is not available for invitor anymore",""
"","235","Answers CRUD tests → Answers handling after invitation acceptance by respondent → Get flow submissions list & Flow answers of respondent tests → 404 Not Found (Get flow submission with not existing activityFlowId)","","Wed Nov 27 14:58:25 GMT 2024","passed","Wed Nov 27 14:58:25 GMT 2024","","Get flow submissions list & Flow answers of respondent tests →","404 Not Found (Get flow submission with not existing activityFlowId)",""
"","136","Files upload/download directly to S3 bucket tests → Upload answer files directly to storage (S3 bucket) Verify answer is accessible by presigned link (can be downloaded)","","Wed Nov 27 15:04:57 GMT 2024","passed","Wed Nov 27 15:04:57 GMT 2024","","Upload answer files directly to storage (S3 bucket)","Verify answer is accessible by presigned link (can be downloaded)",""
"","114","Applet Events CRUD tests → Create Events tests → 422 Unprocessable Entity → Create Event with missing startTime (periodicity type: WEEKDAYS) param","","Wed Nov 27 15:01:31 GMT 2024","passed","Wed Nov 27 15:01:31 GMT 2024","","422 Unprocessable Entity →","Create Event with missing startTime (periodicity type: WEEKDAYS) param",""
"","211","Activity Assessment & Review CRUD tests → Delete Assessment tests → 204 No Content (Delete submitted assessment)","","Wed Nov 27 14:58:47 GMT 2024","passed","Wed Nov 27 14:58:47 GMT 2024","","Delete Assessment tests →","204 No Content (Delete submitted assessment)",""
"","18","Workspaces endpoints tests → Workspaces created → Get workspace respondent applet access list → 401 Unauthorized","","Wed Nov 27 15:11:19 GMT 2024","passed","Wed Nov 27 15:11:19 GMT 2024","","Get workspace respondent applet access list →","401 Unauthorized",""
"","20","Applets CRUD endpoints tests → Create applet → 401 Unauthorized","","Wed Nov 27 14:59:58 GMT 2024","passed","Wed Nov 27 14:59:58 GMT 2024","","Create applet →","401 Unauthorized",""
"","230","Answer Notes tests → Edit Note tests → 404 Not Found (Update not existing Note)","","Wed Nov 27 14:56:22 GMT 2024","passed","Wed Nov 27 14:56:22 GMT 2024","","Edit Note tests →","404 Not Found (Update not existing Note)",""
